8610, mummy, wreath flowers, ninja blue
8611, angry cute, piercings, bandana green
8612, sunglasses heart, bow, monk
8613, smirk, wreath, shirt yellow
8614, glasses, bucket hat white, shirt white
8615, sunglasses squad, beanie black, tshirt green
8616, unamused, cowboy black, epaulette white
8617, three eyes, headband blue, sweater pink
8618, owo, goggles seaweed, combat black
8619, pixel, flower red, hoodie red
8620, uwu, apple, bandana red
8621, uwu, sushi, labcoat
8622, zombie, hat white, shirt white
8623, angry, flower red, overalls blue
8624, mononoke, headband red, tanktop orange
8625, derp, beret green, tshirt metal
8626, sunglasses squad, admiral pink, monk
8627, double face, hat white, sweater orange
8628, hearts, hat visor yellow, overalls pink
8629, sunglasses heart, knight red, astro
8630, sunglasses cowboy, wreath, tshirt yellow
8631, ditto, hat white, tshirt red
8632, owo, headband red, buttondown tan
8633, wink, flower pink, punk
8634, happy cute, antlers, robe blue
8635, derp, crown black, tiger
8636, beard brown, mohawk red, chain
8637, tired, mohawk purple, gown white
8638, stunned, headband blue, mononoke
8639, derp, horns, viking navy
8640, owo, tvhead white, combat green
8641, sunglasses heart, candle, tshirt red
8642, sunglasses blue, hat white, astro orange
8643, beard pirate, halo, deepsea orange
8644, zombie, costume frog, combat black
8645, stunned, ninja blue, deepsea bronze
8646, pixel, hat white, tshirt yellow
8647, glasses funny, hat visor blue, overalls blue
8648, rich, helm army, overalls blue
8649, sunglasses heart, flower red, overalls flannel
8650, grin, flower pink, buttondown black flannel
8651, derp, goggles seaweed, lederhosen
8652, ditto, apple, shirt white
8653, dizzy, flower pink, toga
8654, three eyes, halo, tanktop orange
8655, hearts, tvhead white, work blue
8656, ninja red, bucket hat green, tanktop sailor blue
8657, unamused, pirate red, hoodie purple
8658, dizzy, beret green, sweater orange
8659, ninja black, admiral pink, hoodie black
8660, sunglasses squad, beret green, work blue
8661, unamused, beanie orange, bandana red
8662, sunglasses cool, hat visor yellow, viking brown
8663, ninja black, beanie orange, tanktop white
8664, angry scar, knight black, overalls red
8665, tired, hat visor yellow, buttondown green
8666, ninja black, cowboy brown, tshirt blue
8667, glasses, prince, bandana green
8668, sunglasses yellow, mohawk green, robe red
8669, rich, beret pink, baseball blue
8670, sunglasses cool, mohawk purple, labcoat
8671, smirk, beanie red, pirate red
8672, sunglasses blue, headband red, shirt white
8673, beard brown, apple, toga
8674, smirk, wreath, buttondown tan
8675, beard brown, hat visor yellow, buttondown blue flannel
8676, stunned, bow, tanktop pink
8677, dizzy, crown gold, ninja blue
8678, ditto, sunhat tan, hoodie purple
8679, ditto, beanie red, bandana red
8680, ninja red, helm army, tshirt white
8681, dizzy, hat black, buttondown blue flannel
8682, mummy, headband blue, bandana green
8683, zombie, sunhat black, sweater orange
8684, angry scar, wreath flowers, nurse
8685, double face, top hat, tshirt green
8686, mononoke, sunhat white, tanktop pink
8687, derp, bucket hat tan, robe red
8688, mummy, headband red, buttondown green
8689, three eyes, beanie red, bandana green
8690, angry, astro, punk
8691, grin, headband blue, toga
8692, mummy, candle, cowboy black
8693, zombie, flower blue, tshirt red
8694, glasses, apple, buttondown green
8695, wink, halo fire, costume hotdog
8696, zombie, sunhat tan, tiger
8697, sunglasses heart, knight blue, hoodie red
8698, three eyes, piercings, tshirt white
8699, sunglasses yellow, sunhat black, shirt yellow
8700, stunned, beanie orange, sweater pink
8701, sunglasses blue, knight red, gown purple
8702, rich, mullet blonde, sweater orange
8703, glossy, flower pink, overalls blue
8704, beard tan, mohawk red, knight
8705, sunglasses cool, beanie blue, tshirt white
8706, ninja black, helm bronze, tanktop white
8707, ninja red, sushi, gown black
8708, pixel, hat visor yellow, tshirt red
8709, hearts, hat visor yellow, buttondown black flannel
8710, tvface bobross, tvhead grey, sweater green chain
8711, mummy, antlers, sweater black
8712, sunglasses heart, hat black, tanktop orange
8713, dizzy, knight blue, viking brown
8714, sunglasses heart, antlers, tanktop sailor blue
8715, smirk, apple, buttondown black flannel
8716, ninja blue, flower blue, bandana green
8717, stunned, beanie blue, hoodie purple
8718, beard tan, beanie orange, tanktop orange
8719, unamused, sushi, chain
8720, angry cute, admiral, monk
8721, owo, cupcake, pirate black
8722, ditto, beanie blue, winter blue
8723, mummy, admiral pink, deepsea orange
8724, pixel, mohawk green, bandana purple
8725, mononoke, crown black, labcoat
8726, three eyes, bucket hat green, hoodie red
8727, ninja blue, piercings, robe blue
8728, double face, halo fire, costume hotdog
8729, double face, arrowhead, sweater green chain
8730, sunglasses heart, wreath, buttondown blue flannel
8731, sunglasses yellow, arrowhead, tanktop pink
8732, dizzy, arrowhead, overalls blue
8733, angry cute, piercings, buttondown black flannel
8734, beard pirate, afro brown, robe red
8735, sunglasses yellow, beret green, tshirt red
8736, three eyes, afro black, buttondown red flannel
8737, double face, deepsea orange, ninja black
8738, derp, antlers, overalls pink
8739, ninja blue, piercings, work blue
8740, ditto, nurse, work red
8741, owo, mohawk red, bandana red
8742, ninja red, visor green, deepsea bronze
8743, sunglasses cowboy, prince, buttondown blue flannel
8744, derp, wreath, bandana purple
8745, glossy, helm army, tanktop orange
8746, rich, flower red, shirt yellow
8747, pixel, flower blue, winter blue
8748, mononoke, beanie orange, winter blue
8749, sunglasses pixel, beret green, tshirt red
8750, rich, prince, overalls blue
8751, smirk, knight black, costume frog
8752, happy cute, bow, deepsea orange
8753, mononoke, crown gold, overalls red
8754, mummy, hat skull, overalls blue
8755, angry, hat visor blue, tshirt pink
8756, sunglasses blue, deepsea bronze, pirate black
8757, tired, prince, chain
8758, smirk, mohawk red, robe red
8759, rich, knight black, epaulette red
8760, sunglasses cowboy, pirate black, pirate red
8761, shocked, halo fire, knight
8762, mummy, cupcake, sweater pink
8763, sunglasses pixel, knight red, gown purple
8764, beard tan, cupcake, tanktop pink
8765, sunglasses yellow, flower blue, tanktop sailor black
8766, beard tan, mohawk purple, toga
8767, angry scar, bucket hat white, gown purple
8768, derp, hat visor yellow, tshirt metal
8769, rich, beanie red, labcoat
8770, grin, antlers, tshirt green
8771, beard brown, beanie red, costume hotdog
8772, ninja blue, costume dragon, combat green
8773, glossy, wreath, tanktop pink
8774, three eyes, wreath, shirt yellow
8775, ninja black, sunhat white, shirt yellow
8776, glasses funny, helm army, sweater orange
8777, ninja red, helm bronze, ninja black
8778, angry, helm bronze, sweater pink
8779, stunned, wreath flowers, toga
8780, angry, antlers, sweater pink
8781, glasses funny, antlers, chain
8782, beard brown, apple, tanktop white
8783, wink, candle, buttondown blue flannel
8784, three eyes, hat visor yellow, winter red
8785, pixel, beret green, buttondown blue flannel
8786, angry cute, piercings, sweater orange
8787, wink, beanie orange, tanktop white
8788, shocked, helm silver, bandana purple
8789, dizzy, hat skull, winter red
8790, mononoke, arrowhead, robe red
8791, smirk, wreath, sweater orange
8792, happy, beret red, overalls blue
8793, rich, goggles seaweed, astro
8794, tired, hat white, work red
8795, beard brown, ninja red, tanktop tattoo
8796, ninja red, candle, tshirt red
8797, glossy, mohawk green, labcoat
8798, sunglasses cool, hat visor yellow, robe blue
8799, ninja black, sunhat tan, shirt white
8800, sunglasses pixel, knight red, toga
8801, owo, sunhat tan, gown purple
8802, derp, beret pink, sweater pink
8803, sunglasses squad, mohawk green, wetsuit
8804, derp, astro cheeks, tshirt yellow
8805, face face, wreath, buttondown blue flannel
8806, angry scar, beret green, wetsuit
8807, angry, flower blue, sweater orange
8808, glossy, beret green, robe red
8809, ninja blue, helm army, sweater black
8810, happy, apple, shirt bowtie
8811, glasses funny, beret red, shirt yellow
8812, glasses, hat skull, tanktop sailor red
8813, uwu, cowboy black, shirt yellow
8814, mononoke, wreath, tshirt red
8815, tired, hat visor yellow, tshirt blue
8816, dizzy, mohawk purple, hoodie purple
8817, mummy, helm bronze, knight leather
8818, angry scar, unicorn horn, tshirt red
8819, beard tan, admiral, buttondown red flannel
8820, glossy, mohawk green, shirt yellow
8821, angry cute, beanie blue, tanktop sailor black
8822, pixel, bucket hat blue, astro
8823, sunglasses pixel, bucket hat blue, bandana red
8824, tired, beret red, buttondown black flannel
8825, sunglasses yellow, wreath, tanktop sailor red
8826, grin, astro cheeks, cowboy brown
8827, glasses, hat white, buttondown green
8828, happy, mohawk purple, buttondown green
8829, angry, hat visor yellow, epaulette red
8830, beard tan, hat visor blue, bandana purple
8831, wink, beret red, ninja blue
8832, hearts, beanie black, tshirt green
8833, sunglasses pixel, helm army, pirate black
8834, angry, knight blue, tanktop white
8835, pixel, afro black, tanktop orange
8836, derp, antlers, tshirt blue
8837, unamused, costume frog, astro black
8838, ninja blue, flower pink, bandana red
8839, mononoke, arrowhead, ninja red
8840, angry, cowboy black, buttondown red flannel
8841, beard brown, beret green, bandana green
8842, hearts, visor green, shirt white
8843, happy, hat black, work red
8844, sunglasses yellow, tvhead white, hoodie red
8845, angry, helm army, work red
8846, sunglasses yellow, ninja blue, tshirt yellow
8847, sunglasses squad, bucket hat blue, buttondown green
8848, ninja black, headband blue, tanktop tattoo
8849, ninja red, hat visor yellow, work blue
8850, happy cute, hat visor yellow, work red
8851, sunglasses heart, top hat, pirate red
8852, smirk, flower pink, tanktop sailor black
8853, beard pirate, wreath flowers, tanktop sailor red
8854, shocked, beanie blue, overalls pink
8855, beard pirate, pirate black, ninja black
8856, ninja black, cowboy brown, buttondown blue flannel
8857, rich, arrowhead, robe red
8858, angry cute, cupcake, pirate red
8859, pixel, afro brown, work blue
8860, ditto, halo fire, deepsea orange
8861, mummy, beret black, overalls blue
8862, uwu, headband blue, robe white
8863, double face, sunhat black, pirate black
8864, ditto, hat visor yellow, gown purple
8865, tired, cowboy brown, tshirt green
8866, beard brown, visor green, wetsuit
8867, happy, mohawk purple, work red
8868, tired, helm silver, gown purple
8869, beard brown, beret black, tshirt blue
8870, uwu, dutch, monk
8871, happy, mohawk purple, buttondown blue flannel
8872, smirk, crown gold, robe king
8873, owo, ninja blue, tanktop sailor blue
8874, stunned, beret black, ninja red
8875, uwu, sushi, shirt yellow
8876, beard tan, mohawk green, chain
8877, happy cute, astro fishbowl, tanktop tattoo
8878, mummy, mohawk purple, buttondown blue flannel
8879, stunned, hat black, tshirt yellow
8880, sunglasses squad, goggles seaweed, punk
8881, happy, bucket hat white, tshirt blue
8882, sunglasses heart, bow, costume hotdog
8883, sunglasses cowboy, prince, tanktop sailor black
8884, angry cute, hat skull, sweater black
8885, sunglasses cool, mohawk green, bandana green
8886, hearts, beanie orange, overalls flannel
8887, mononoke, bucket hat tan, work red
8888, tired, bucket hat green, buttondown tan
8889, face face, crown black, viking brown
8890, wink, cowboy brown, robe red
8891, sunglasses pixel, hat white, tshirt blue
8892, pixel, hat skull, shirt bowtie
8893, beard pirate, hat white, punk
8894, three eyes, hat visor yellow, shirt white
8895, pixel, sunhat black, hoodie purple
8896, mummy, beret red, overalls red
8897, ditto, costume gorilla, deepsea orange
8898, face face, headband red, bandana purple
8899, grin, pirate red, tanktop pink
8900, glasses funny, afro rainbow unicorn, lederhosen
8901, zombie, beanie red, shirt white
8902, glasses funny, helm army, labcoat
8903, wink, wreath, sweater orange
8904, angry cute, beret black, astro black
8905, wink, hat skull, deepsea orange
8906, sunglasses heart, bow, costume dragon
8907, beard pirate, ninja black, costume hotdog
8908, happy, hat visor yellow, tanktop sailor red
8909, stunned, costume dragon, costume gorilla
8910, tired, beanie black, robe red
8911, sunglasses heart, flower blue, buttondown green
8912, sunglasses cowboy, beanie red, tanktop orange
8913, zombie, pirate red, knight black
8914, grin, afro rainbow unicorn, tshirt metal
8915, happy cute, hat white, buttondown tan
8916, angry scar, sunhat tan, tshirt red
8917, stunned, candle, tshirt pink
8918, dizzy, flower pink, tiger
8919, happy cute, flower pink, work blue
8920, sunglasses heart, mullet blonde, ninja black
8921, glossy, sushi, hoodie red
8922, face face, pirate red, robe white
8923, shocked, mohawk red, tanktop pink
8924, mummy, piercings, tshirt blue
8925, three eyes, top hat, gown purple
8926, tvface bobross, tvhead grey, labcoat
8927, glasses funny, beret green, tshirt white
8928, shocked, hat white, work red
8929, ninja red, bucket hat green, bandana red
8930, ditto, bucket hat green, sweater orange
8931, dizzy, tvhead white, epaulette red
8932, owo, bucket hat green, winter blue
8933, glossy, hat black, tshirt white
8934, happy cute, afro rainbow unicorn, robe king
8935, face face, flower blue, chain
8936, tvface xp, tvhead grey, overalls blue
8937, owo, hat visor yellow, viking brown
8938, mononoke, beanie orange, buttondown green
8939, wink, beret black, punk
8940, sunglasses heart, prince, cowboy brown
8941, glasses, costume gorilla, costume hotdog
8942, grin, costume gorilla, knight
8943, sunglasses heart, candle, bandana red
8944, sunglasses cool, piercings, winter blue
8945, three eyes, hat visor yellow, tshirt green
8946, hearts, dutch, winter red
8947, three eyes, crown fire, costume gorilla
8948, shocked, headband blue, tanktop sailor black
8949, glasses, cowboy black, buttondown green
8950, sunglasses yellow, pirate black, sweater green chain
8951, ditto, goggles seaweed, viking navy
8952, tired, mohawk red, work blue
8953, sunglasses cool, flower red, tiger
8954, grin, unicorn horn, tanktop sailor red
8955, three eyes, visor purple, tshirt white
8956, sunglasses pixel, headband blue, sweater pink
8957, wink, goggles seaweed, ninja red
8958, sunglasses yellow, mohawk green, cowboy brown
8959, beard brown, hat visor yellow, buttondown red flannel
8960, smirk, flower red, tanktop orange
8961, happy, cupcake, tanktop pink
8962, grin, bucket hat tan, tshirt pink
8963, ninja blue, helm bronze, winter blue
8964, derp, beret green, chain
8965, angry scar, bow, tshirt green
8966, double face, beanie orange, shirt yellow
8967, three eyes, hat skull, deepsea bronze
8968, tired, wreath flowers, tanktop tattoo
8969, sunglasses heart, cowboy brown, ninja red
8970, glasses, flower blue, tshirt pink
8971, angry, beret green, ninja red
8972, face face, antlers, buttondown black flannel
8973, beard pirate, visor green, ninja blue
8974, sunglasses pixel, mohawk green, bandana purple
8975, ninja blue, bucket hat tan, buttondown tan
8976, glossy, headband blue, buttondown blue flannel
8977, ninja blue, hat skull, buttondown green
8978, beard tan, headband blue, tshirt red
8979, ninja red, wreath, buttondown tan
8980, beard brown, beanie red, tshirt pink
8981, shocked, flower blue, bandana red
8982, mononoke, headband red, tshirt green
8983, ninja red, headband blue, tshirt red
8984, sunglasses pixel, bucket hat tan, shirt white
8985, dizzy, bucket hat green, baseball blue
8986, sunglasses pixel, flower pink, overalls yellow
8987, angry, antlers, buttondown green
8988, happy, sunhat white, work blue
8989, ninja black, candle, robe red
8990, sunglasses heart, afro black, viking navy
8991, glasses funny, headband blue, chain
8992, pixel, admiral pink, epaulette red
8993, beard pirate, mullet blonde, monk
8994, beard tan, afro brown, hoodie black
8995, wink, arrowhead, robe blue
8996, uwu, deepsea bronze, epaulette red
8997, unamused, flower blue, bandana red
8998, sunglasses pixel, hat skull, tshirt metal
8999, sunglasses yellow, headband blue, buttondown blue flannel
