id, face, hat, clothes
8000, double face, knight red, overalls pink
8001, angry cute, knight blue, gown purple
8002, sunglasses pixel, beanie red, buttondown blue flannel
8003, beard brown, beret red, tanktop orange
8004, rich, wreath, tshirt red
8005, face face, headband red, winter red
8006, double face, afro black, sweater green chain
8007, derp, crown fire, baseball red
8008, tired, flower red, tanktop sailor blue
8009, dizzy, flower pink, bandana purple
8010, uwu, helm biker, sweater orange
8011, ditto, sushi, hoodie purple
8012, owo, beret green, robe red
8013, tired, ninja black, tanktop tattoo
8014, tired, hat white, viking navy
8015, sunglasses cool, mohawk purple, tshirt yellow
8016, beard tan, bucket hat green, tshirt metal
8017, hearts, sushi, tshirt yellow
8018, happy, mohawk purple, pirate black
8019, happy, piercings, tanktop sailor red
8020, beard pirate, visor green, shirt yellow
8021, unamused, crown black, viking brown
8022, mummy, bucket hat white, gown black
8023, ninja red, sushi, robe blue
8024, ditto, headband blue, tshirt green
8025, derp, beret red, tshirt green
8026, rich, visor purple, toga
8027, angry scar, cowboy black, pirate black
8028, angry scar, mohawk red, sweater green chain
8029, rich, beret red, work blue
8030, stunned, flower red, gown purple
8031, beard tan, deepsea bronze, labcoat
8032, sunglasses squad, knight blue, ninja blue
8033, unamused, flower blue, tshirt white
8034, face face, costume gorilla, costume gorilla
8035, ninja red, mohawk green, tanktop pink
8036, pixel, headband blue, tshirt yellow
8037, hearts, bucket hat tan, hoodie black
8038, uwu, sunhat white, astro black
8039, face face, headband blue, baseball red
8040, happy cute, astro, ninja red
8041, happy, admiral, ninja blue
8042, sunglasses blue, apple, labcoat
8043, stunned, candle, overalls red
8044, angry, cupcake, baseball blue
8045, ditto, headband red, buttondown green
8046, uwu, mohawk purple, buttondown tan
8047, hearts, costume frog, tshirt red
8048, angry, hat white, buttondown green
8049, happy cute, hat visor yellow, bandana red
8050, stunned, visor green, tanktop sailor blue
8051, rich, cowboy brown, shirt white
8052, happy, wreath, hoodie purple
8053, stunned, beret pink, robe blue
8054, unamused, helm army, toga
8055, sunglasses heart, prince, tanktop sailor blue
8056, mummy, antlers, winter red
8057, ditto, knight blue, tshirt green
8058, uwu, antlers, robe blue
8059, unamused, flower pink, labcoat
8060, angry scar, admiral pink, epaulette white
8061, zombie, astro fishbowl, mononoke
8062, ninja blue, horns, baseball red
8063, rich, bucket hat tan, labcoat
8064, wink, mohawk red, bandana red
8065, three eyes, ninja black, ninja red
8066, unamused, afro black, tanktop sailor blue
8067, grin, ninja red, overalls flannel
8068, sunglasses blue, mohawk purple, gown purple
8069, happy, bucket hat green, sweater orange
8070, angry, astro, tanktop white
8071, glasses, beret green, robe blue
8072, beard pirate, visor green, robe white
8073, glasses, flower pink, hoodie purple
8074, ninja red, beanie black, epaulette white
8075, sunglasses squad, knight blue, tanktop sailor red
8076, happy cute, afro black, winter blue
8077, sunglasses pixel, mullet brown, cowboy black
8078, ditto, goggles seaweed, sweater black
8079, beard pirate, beret green, buttondown black flannel
8080, beard pirate, helm army, buttondown red flannel
8081, sunglasses cowboy, beret black, viking brown
8082, angry, cowboy brown, tshirt blue
8083, ninja blue, ninja red, cowboy black
8084, sunglasses cool, ninja blue, labcoat
8085, sunglasses squad, candle, baseball red
8086, grin, bucket hat tan, buttondown red flannel
8087, sunglasses cool, pirate red, shirt white
8088, ninja red, hat skull, chain
8089, glasses funny, sunhat tan, tshirt red
8090, beard brown, bucket hat green, knight
8091, sunglasses cool, halo, overalls pink
8092, tvface xp, tvhead grey, overalls red
8093, rich, beret black, sweater pink
8094, hearts, ninja red, astro orange
8095, unamused, ninja black, gown white
8096, sunglasses cool, hat black, tshirt blue
8097, hearts, hat white, buttondown green
8098, beard pirate, apple, tanktop pink
8099, mononoke, hat visor yellow, buttondown black flannel
8100, hearts, pirate red, tanktop sailor black
8101, dizzy, flower red, costume hotdog
8102, ditto, beret green, hoodie purple
8103, ninja black, beanie orange, nurse
8104, angry cute, goggles seaweed, monk
8105, angry scar, wreath, shirt white
8106, beard pirate, hat visor yellow, sweater orange
8107, glasses funny, antlers, gown purple
8108, angry scar, sunhat white, deepsea bronze
8109, ninja blue, hat white, ninja red
8110, mummy, bucket hat white, knight
8111, unamused, ninja black, tshirt red
8112, grin, piercings, bandana green
8113, sunglasses pixel, cupcake, lederhosen
8114, beard pirate, knight red, hoodie purple
8115, happy, astro cheeks, tanktop orange
8116, grin, mullet brown, ninja blue
8117, angry, astro fishbowl, nurse
8118, sunglasses squad, wreath, tanktop sailor black
8119, happy cute, arrowhead, work blue
8120, sunglasses blue, beret green, robe white
8121, owo, bow, work red
8122, sunglasses squad, wreath flowers, tshirt green
8123, stunned, ninja blue, tanktop white
8124, dizzy, mullet brown, tshirt metal
8125, shocked, costume frog, tiger
8126, three eyes, visor purple, baseball red
8127, sunglasses cowboy, dutch, shirt white
8128, glasses, beret red, work blue
8129, unamused, mullet brown, robe blue
8130, face face, antlers, winter red
8131, glossy, costume frog, tanktop sailor black
8132, pixel, beanie black, work blue
8133, face face, arrowhead, overalls pink
8134, beard tan, flower blue, bandana green
8135, derp, admiral, gown purple
8136, owo, antlers, sweater pink
8137, angry scar, bucket hat white, overalls pink
8138, pixel, antlers, robe king
8139, happy, sunhat black, sweater green chain
8140, tired, flower pink, chain
8141, sunglasses pixel, crown gold, knight leather
8142, uwu, arrowhead, toga
8143, mononoke, hat skull, bandana red
8144, sunglasses yellow, mohawk red, sweater pink
8145, glossy, flower blue, bandana red
8146, glasses, astro, hoodie purple
8147, dizzy, piercings, knight black
8148, ninja black, goggles seaweed, tanktop pink
8149, ninja blue, cowboy brown, buttondown green
8150, sunglasses heart, hat visor blue, knight
8151, sunglasses heart, helm bronze, monk
8152, angry cute, mohawk green, bandana red
8153, glossy, hat visor blue, chain
8154, ninja blue, costume frog, monk
8155, rich, bucket hat green, work blue
8156, ninja black, beanie black, buttondown blue flannel
8157, ninja red, beanie red, mononoke
8158, glasses, mohawk green, epaulette red
8159, sunglasses heart, astro, epaulette white
8160, derp, hat white, bandana red
8161, mononoke, candle, pirate red
8162, sunglasses squad, sushi, bandana red
8163, grin, visor purple, pirate black
8164, angry cute, wreath, tanktop tattoo
8165, derp, flower blue, overalls yellow
8166, angry scar, sunhat black, tanktop tattoo
8167, sunglasses cool, astro, overalls flannel
8168, double face, beanie black, overalls pink
8169, uwu, cupcake, robe white
8170, unamused, beret red, tanktop white
8171, beard brown, nurse, bandana red
8172, angry, beret red, shirt white
8173, uwu, bucket hat blue, lederhosen
8174, sunglasses cowboy, admiral pink, cowboy brown
8175, sunglasses blue, mohawk purple, tanktop orange
8176, ninja red, helm bronze, overalls yellow
8177, zombie, beret red, hoodie purple
8178, happy, cowboy black, astro
8179, ninja red, afro rainbow unicorn, tanktop sailor black
8180, rich, knight blue, gown purple
8181, derp, piercings, tanktop pink
8182, pixel, costume dragon, buttondown red flannel
8183, dizzy, antlers, buttondown tan
8184, shocked, hat skull, robe red
8185, owo, beanie orange, tanktop white
8186, angry cute, beanie blue, baseball red
8187, hearts, unicorn horn, mononoke
8188, beard tan, mohawk green, labcoat
8189, sunglasses squad, costume gorilla, gown purple
8190, beard brown, crown gold, deepsea orange
8191, tired, piercings, sweater pink
8192, beard pirate, antlers, tshirt green
8193, rich, sushi, robe white
8194, double face, headband red, robe white
8195, ninja red, headband blue, tshirt yellow
8196, sunglasses cowboy, antlers, baseball red
8197, mononoke, hat white, tanktop orange
8198, beard pirate, mullet blonde, astro black
8199, dizzy, arrowhead, tanktop sailor black
8200, sunglasses cool, sushi, shirt yellow
8201, mummy, sunhat black, buttondown black flannel
8202, sunglasses yellow, bucket hat green, bandana red
8203, sunglasses cowboy, antlers, tshirt green
8204, hearts, candle, bandana green
8205, unamused, sunhat black, tanktop orange
8206, three eyes, visor purple, pirate black
8207, hearts, antlers, sweater orange
8208, sunglasses squad, mullet blonde, cowboy brown
8209, happy cute, flower pink, work red
8210, sunglasses cowboy, tvhead grey, monk
8211, beard brown, beret green, toga
8212, sunglasses cool, crown gold, costume hotdog
8213, dizzy, beret green, work red
8214, rich, admiral, epaulette black
8215, beard brown, hat white, sweater black
8216, sunglasses cool, flower pink, buttondown tan
8217, sunglasses cowboy, beret black, ninja red
8218, sunglasses blue, beanie red, bandana green
8219, pixel, candle, buttondown black flannel
8220, tired, sushi, buttondown black flannel
8221, wink, wreath, tanktop orange
8222, hearts, bucket hat green, gown white
8223, owo, apple, tshirt yellow
8224, angry scar, visor green, costume hotdog
8225, happy cute, antlers, bandana green
8226, three eyes, halo, overalls yellow
8227, angry cute, sushi, tanktop sailor red
8228, happy cute, beanie orange, shirt white
8229, grin, arrowhead, buttondown green
8230, beard brown, sunhat white, toga
8231, smirk, hat white, tshirt yellow
8232, rich, admiral pink, deepsea orange
8233, face face, ninja red, bandana green
8234, angry cute, flower blue, tshirt metal
8235, angry scar, pirate red, sweater black
8236, sunglasses blue, admiral, buttondown red flannel
8237, sunglasses blue, flower blue, tshirt metal
8238, happy, hat visor yellow, tanktop orange
8239, angry cute, beret red, shirt yellow
8240, rich, mohawk green, work red
8241, face face, headband blue, bandana red
8242, smirk, mullet brown, tshirt white
8243, beard brown, horns, gown white
8244, shocked, nurse, buttondown green
8245, angry, afro brown, tanktop sailor red
8246, happy, nurse, knight leather
8247, angry scar, sushi, buttondown green
8248, ninja red, piercings, bandana purple
8249, mononoke, apple, baseball red
8250, ninja black, arrowhead, chain
8251, glasses funny, bucket hat green, epaulette black
8252, mummy, prince, cowboy black
8253, sunglasses cool, knight red, astro orange
8254, ninja blue, headband blue, tshirt yellow
8255, grin, candle, robe red
8256, sunglasses cowboy, hat white, tshirt metal
8257, stunned, pirate red, buttondown blue flannel
8258, sunglasses pixel, hat visor yellow, gown white
8259, tired, beret red, robe blue
8260, tvface nosignal, tvhead white, mononoke
8261, glossy, bucket hat green, buttondown red flannel
8262, angry, beanie orange, shirt yellow
8263, tired, flower red, tshirt pink
8264, angry scar, astro, tanktop orange
8265, glasses funny, beret red, buttondown green
8266, beard tan, mohawk green, overalls pink
8267, derp, mohawk green, shirt yellow
8268, shocked, beret green, tanktop sailor red
8269, glasses funny, deepsea bronze, lederhosen
8270, angry scar, headband red, overalls blue
8271, sunglasses cool, bucket hat tan, tanktop pink
8272, ninja red, flower pink, tanktop orange
8273, glasses funny, bucket hat white, tshirt red
8274, owo, visor purple, overalls pink
8275, mummy, afro rainbow unicorn, costume gorilla
8276, beard brown, mohawk red, shirt yellow
8277, rich, apple, astro
8278, ninja blue, flower pink, hoodie purple
8279, glasses funny, mullet blonde, robe red
8280, sunglasses blue, beret green, robe red
8281, tired, hat visor blue, bandana red
8282, mononoke, headband red, robe white
8283, sunglasses heart, wreath flowers, tanktop sailor red
8284, tired, beret black, ninja black
8285, sunglasses cool, helm silver, shirt bowtie
8286, smirk, flower red, robe white
8287, angry scar, astro cheeks, shirt bowtie
8288, derp, goggles seaweed, bandana red
8289, three eyes, astro, knight
8290, ditto, beanie red, wetsuit
8291, face face, hat visor yellow, shirt white
8292, three eyes, knight blue, winter blue
8293, ninja red, cowboy brown, tanktop white
8294, glasses funny, beanie blue, knight black
8295, mononoke, prince, buttondown green
8296, unamused, helm biker, gown white
8297, sunglasses cowboy, hat skull, epaulette black
8298, mononoke, hat visor yellow, hoodie black
8299, pixel, hat white, buttondown red flannel
8300, beard pirate, crown black, ninja blue
8301, double face, wreath flowers, epaulette red
8302, stunned, mohawk purple, overalls blue
8303, happy cute, tvhead grey, cowboy brown
8304, pixel, helm bronze, tanktop tattoo
8305, hearts, flower blue, buttondown blue flannel
8306, derp, flower red, winter red
8307, beard tan, candle, bandana red
8308, grin, flower pink, tshirt red
8309, three eyes, flower red, shirt yellow
8310, tvface nosignal, tvhead white, wetsuit
8311, hearts, visor green, bandana green
8312, shocked, apple, baseball red
8313, glasses, mullet brown, gown white
8314, glasses, candle, tanktop white
8315, zombie, helm biker, tanktop sailor blue
8316, angry scar, astro, shirt yellow
8317, owo, afro rainbow unicorn, tshirt pink
8318, grin, prince, tshirt white
8319, derp, crown gold, epaulette white
8320, ditto, flower red, sweater orange
8321, happy, flower pink, viking brown
8322, derp, dutch, pirate black
8323, face face, bucket hat green, buttondown tan
8324, sunglasses blue, mullet blonde, bandana green
8325, happy, sunhat black, punk
8326, unamused, mullet blonde, shirt bowtie
8327, glasses funny, knight blue, combat black
8328, derp, arrowhead, shirt white
8329, uwu, candle, tshirt blue
8330, wink, costume gorilla, tshirt metal
8331, unamused, costume dragon, robe red
8332, happy, candle, tanktop sailor black
8333, grin, mohawk green, bandana green
8334, angry cute, apple, tiger
8335, grin, candle, bandana red
8336, ninja red, deepsea orange, deepsea bronze
8337, sunglasses blue, hat black, winter red
8338, happy cute, bucket hat green, ninja blue
8339, sunglasses pixel, beret green, bandana green
8340, uwu, helm biker, knight
8341, sunglasses blue, antlers, shirt white
8342, angry cute, visor green, shirt yellow
8343, dizzy, crown fire, deepsea orange
8344, uwu, bucket hat white, tanktop sailor black
8345, grin, sunhat white, combat green
8346, three eyes, antlers, bandana purple
8347, ninja blue, bucket hat blue, lederhosen
8348, angry cute, astro fishbowl, ninja red
8349, sunglasses cool, arrowhead, tshirt yellow
8350, derp, beret red, overalls flannel
8351, grin, sunhat black, buttondown green
8352, glossy, beanie orange, overalls yellow
8353, zombie, headband red, tshirt pink
8354, sunglasses squad, knight blue, work blue
8355, owo, bucket hat tan, robe white
8356, tvface 404, tvhead purple, epaulette red
8357, happy cute, costume gorilla, deepsea bronze
8358, angry, bucket hat white, nurse
8359, pixel, pirate black, sweater green chain
8360, pixel, astro, wetsuit
8361, mummy, hat visor blue, hoodie black
8362, ninja red, flower blue, tanktop sailor red
8363, beard tan, hat skull, baseball blue
8364, sunglasses squad, dutch, sweater black
8365, glasses funny, candle, lederhosen
8366, mummy, mohawk green, tanktop sailor red
8367, sunglasses blue, flower pink, bandana red
8368, double face, beret pink, cowboy brown
8369, angry cute, wreath, buttondown green
8370, sunglasses cool, mullet brown, tanktop sailor black
8371, stunned, mohawk purple, tanktop sailor red
8372, sunglasses heart, wreath, tshirt green
8373, derp, piercings, viking brown
8374, glossy, piercings, baseball blue
8375, sunglasses pixel, mullet blonde, winter red
8376, happy, sushi, tanktop sailor black
8377, rich, halo, astro
8378, angry, cowboy black, tanktop sailor black
8379, angry cute, bow, ninja blue
8380, tired, halo, bandana green
8381, three eyes, mohawk purple, ninja blue
8382, tired, hat white, tshirt green
8383, happy, cowboy brown, tshirt yellow
8384, owo, hat white, shirt yellow
8385, tired, hat visor yellow, overalls blue
8386, uwu, tvhead white, epaulette black
8387, sunglasses cowboy, headband red, tshirt pink
8388, pixel, flower blue, overalls blue
8389, sunglasses blue, ninja blue, robe blue
8390, smirk, headband red, buttondown blue flannel
8391, sunglasses heart, sushi, robe blue
8392, grin, bucket hat tan, overalls flannel
8393, owo, astro fishbowl, gown black
8394, tired, flower pink, tanktop orange
8395, face face, bucket hat tan, buttondown tan
8396, ditto, beanie red, epaulette black
8397, dizzy, afro brown, tanktop pink
8398, sunglasses pixel, horns, tiger
8399, glossy, wreath, buttondown green
8400, shocked, antlers, shirt yellow
8401, happy, headband blue, tanktop sailor blue
8402, ninja black, sunhat tan, tanktop sailor black
8403, sunglasses cool, wreath, ninja blue
8404, sunglasses pixel, mohawk green, pirate black
8405, glasses funny, beret pink, tanktop white
8406, beard tan, wreath flowers, knight black
8407, mononoke, piercings, bandana green
8408, sunglasses cowboy, sunhat black, buttondown red flannel
8409, glasses funny, flower red, bandana green
8410, beard brown, bucket hat blue, astro
8411, ninja black, crown black, buttondown green
8412, happy cute, helm army, tshirt yellow
8413, sunglasses pixel, beanie orange, tanktop pink
8414, ninja black, deepsea orange, combat green
8415, grin, hat visor yellow, winter red
8416, happy, pirate red, monk
8417, zombie, piercings, tanktop orange
8418, mummy, costume gorilla, tiger
8419, beard tan, bucket hat green, bandana red
8420, pixel, candle, work red
8421, sunglasses heart, hat visor yellow, bandana green
8422, beard pirate, helm army, work blue
8423, unamused, afro brown, tanktop sailor red
8424, shocked, hat white, buttondown black flannel
8425, sunglasses squad, helm bronze, ninja red
8426, smirk, candle, tanktop pink
8427, ninja red, antlers, work red
8428, beard pirate, flower pink, knight leather
8429, glasses funny, hat visor yellow, overalls blue
8430, zombie, sushi, overalls flannel
8431, sunglasses cowboy, headband red, robe blue
8432, sunglasses heart, beanie black, baseball red
8433, beard pirate, beanie black, tshirt white
8434, grin, piercings, costume gorilla
8435, angry scar, antlers, tshirt green
8436, face face, astro cheeks, gown purple
8437, uwu, hat skull, winter red
8438, zombie, bucket hat blue, knight black
8439, angry cute, helm silver, nurse
8440, sunglasses cool, sunhat white, buttondown green
8441, unamused, mohawk green, monk
8442, ninja blue, piercings, toga
8443, three eyes, knight red, hoodie black
8444, ditto, pirate red, lederhosen
8445, smirk, hat black, tanktop sailor red
8446, ditto, piercings, bandana green
8447, glasses, hat skull, tanktop white
8448, face face, bucket hat tan, tshirt green
8449, tired, bucket hat green, buttondown green
8450, hearts, hat visor yellow, tanktop pink
8451, sunglasses heart, cowboy brown, knight leather
8452, angry cute, hat visor yellow, tanktop tattoo
8453, glasses, sunhat white, ninja blue
8454, beard pirate, ninja red, viking brown
8455, sunglasses yellow, unicorn horn, pirate red
8456, unamused, piercings, work red
8457, glossy, afro black, hoodie black
8458, wink, hat white, buttondown green
8459, mummy, sushi, tanktop sailor black
8460, ninja red, beanie red, buttondown blue flannel
8461, ninja red, cowboy black, nurse
8462, glasses funny, hat skull, overalls red
8463, sunglasses blue, hat white, robe blue
8464, sunglasses squad, dutch, tiger
8465, three eyes, cowboy black, punk
8466, shocked, bow, pirate red
8467, ninja red, piercings, robe red
8468, dizzy, costume frog, bandana red
8469, beard tan, crown black, tanktop sailor red
8470, face face, unicorn horn, work red
8471, double face, headband blue, sweater orange
8472, three eyes, antlers, overalls blue
8473, shocked, mohawk purple, bandana purple
8474, shocked, halo fire, buttondown black flannel
8475, dizzy, flower blue, astro black
8476, beard brown, mohawk purple, bandana purple
8477, sunglasses yellow, hat white, bandana green
8478, angry, beanie orange, buttondown blue flannel
8479, ditto, ninja red, ninja blue
8480, angry cute, halo fire, robe king
8481, ninja red, pirate black, knight black
8482, grin, mohawk red, hoodie purple
8483, sunglasses squad, hat visor yellow, bandana green
8484, three eyes, hat black, work blue
8485, angry cute, visor green, bandana red
8486, sunglasses yellow, hat white, sweater orange
8487, double face, unicorn horn, tanktop pink
8488, sunglasses heart, bucket hat green, tanktop pink
8489, grin, sunhat black, tshirt metal
8490, sunglasses cool, mohawk red, buttondown blue flannel
8491, ninja black, headband red, tshirt pink
8492, glasses funny, hat visor yellow, work blue
8493, glasses funny, hat visor yellow, sweater orange
8494, ninja black, apple, overalls flannel
8495, sunglasses pixel, hat visor yellow, ninja red
8496, ninja black, arrowhead, bandana purple
8497, ninja blue, beanie orange, tanktop pink
8498, uwu, nurse, gown white
8499, sunglasses cool, wreath flowers, robe blue
8500, beard brown, headband red, pirate red
8501, angry cute, halo fire, punk
8502, unamused, mullet blonde, tanktop sailor red
8503, beard pirate, mullet brown, tshirt pink
8504, wink, bucket hat tan, buttondown tan
8505, zombie, bucket hat green, buttondown blue flannel
8506, three eyes, flower pink, tshirt pink
8507, double face, mohawk purple, epaulette black
8508, wink, beret red, tanktop white
8509, angry scar, costume dragon, gown white
8510, angry, candle, work blue
8511, sunglasses cool, beanie red, lederhosen
8512, happy, visor purple, pirate red
8513, angry scar, helm silver, viking brown
8514, dizzy, bucket hat blue, robe red
8515, glasses funny, bucket hat white, tanktop sailor red
8516, mononoke, bucket hat green, tshirt pink
8517, hearts, flower red, tanktop sailor blue
8518, mummy, costume gorilla, overalls pink
8519, beard pirate, helm biker, ninja red
8520, happy, helm army, tanktop tattoo
8521, happy cute, mohawk purple, hoodie purple
8522, three eyes, nurse, viking brown
8523, beard tan, costume gorilla, knight black
8524, rich, beanie blue, ninja red
8525, zombie, mohawk purple, shirt yellow
8526, mummy, sunhat white, gown purple
8527, sunglasses cool, afro black, shirt yellow
8528, smirk, flower blue, work blue
8529, angry scar, top hat, sweater green chain
8530, double face, prince, punk
8531, glossy, top hat, tshirt blue
8532, face face, beret green, tiger
8533, face face, beret pink, tshirt white
8534, ninja red, ninja red, overalls flannel
8535, sunglasses squad, nurse, astro orange
8536, beard pirate, visor green, costume hotdog
8537, angry, deepsea bronze, bandana purple
8538, beard brown, arrowhead, robe blue
8539, sunglasses squad, ninja red, overalls flannel
8540, happy, unicorn horn, shirt white
8541, beard pirate, arrowhead, robe red
8542, sunglasses cool, beret red, buttondown tan
8543, uwu, beanie black, buttondown black flannel
8544, smirk, hat white, tshirt green
8545, sunglasses pixel, wreath flowers, overalls red
8546, wink, bucket hat green, buttondown green
8547, sunglasses pixel, costume gorilla, hoodie black
8548, tired, bucket hat blue, tshirt pink
8549, angry cute, arrowhead, tanktop pink
8550, glasses, hat skull, overalls yellow
8551, beard tan, hat visor yellow, tshirt yellow
8552, glasses funny, nurse, costume gorilla
8553, smirk, beanie blue, sweater green chain
8554, ditto, wreath, work blue
8555, happy, apple, overalls yellow
8556, wink, visor green, costume frog
8557, shocked, bucket hat white, work blue
8558, angry scar, prince, pirate red
8559, grin, sushi, buttondown blue flannel
8560, stunned, mohawk green, tanktop orange
8561, uwu, antlers, work blue
8562, derp, beanie orange, work red
8563, sunglasses cool, beanie orange, tanktop white
8564, glasses, hat visor blue, baseball red
8565, face face, beanie red, work red
8566, beard pirate, astro, gown white
8567, pixel, headband blue, bandana red
8568, ninja red, visor purple, deepsea orange
8569, stunned, beret pink, shirt yellow
8570, zombie, ninja black, knight
8571, angry scar, headband red, tanktop orange
8572, sunglasses cowboy, sunhat black, pirate red
8573, sunglasses cool, afro brown, tanktop tattoo
8574, grin, nurse, cowboy black
8575, derp, sunhat white, gown black
8576, derp, antlers, hoodie red
8577, dizzy, piercings, tshirt red
8578, sunglasses cowboy, hat white, costume frog
8579, derp, hat white, tshirt red
8580, angry cute, flower red, buttondown blue flannel
8581, sunglasses blue, antlers, tshirt pink
8582, three eyes, flower blue, work red
8583, smirk, beanie orange, tshirt yellow
8584, sunglasses yellow, helm biker, gown purple
8585, rich, wreath flowers, robe blue
8586, angry, hat white, mononoke
8587, double face, piercings, ninja blue
8588, three eyes, hat white, bandana green
8589, three eyes, candle, sweater green chain
8590, sunglasses blue, headband blue, sweater pink
8591, sunglasses yellow, hat skull, gown purple
8592, unamused, flower red, tshirt green
8593, three eyes, beret red, ninja red
8594, ninja black, headband red, bandana purple
8595, sunglasses pixel, flower blue, work blue
8596, pixel, halo, deepsea bronze
8597, rich, hat white, work blue
8598, beard brown, piercings, tshirt red
8599, sunglasses squad, crown fire, sweater black
8600, uwu, bucket hat tan, toga
8601, dizzy, ninja black, tanktop white
8602, glasses funny, beanie blue, robe blue
8603, double face, sushi, costume frog
8604, sunglasses heart, crown gold, knight
8605, dizzy, afro brown, tshirt yellow
8606, double face, cowboy brown, tanktop sailor blue
8607, glasses funny, sunhat white, bandana purple
8608, stunned, cowboy black, overalls red
8609, glasses, flower red, baseball red
