id, face, hat, clothes
9000, sunglasses blue, costume dragon, gown purple
9001, mummy, beret green, work blue
9002, happy, headband blue, work blue
9003, dizzy, cupcake, buttondown green
9004, derp, candle, sweater orange
9005, derp, ninja blue, viking brown
9006, sunglasses pixel, halo, knight leather
9007, glossy, pirate red, robe king
9008, mononoke, flower blue, ninja blue
9009, beard brown, mohawk purple, hoodie red
9010, hearts, prince, tanktop orange
9011, sunglasses squad, ninja black, tshirt pink
9012, hearts, astro fishbowl, baseball blue
9013, ninja blue, beret pink, gown purple
9014, smirk, nurse, robe red
9015, ninja black, arrowhead, sweater pink
9016, mummy, beret green, hoodie purple
9017, dizzy, horns, knight leather
9018, owo, hat visor yellow, tshirt red
9019, uwu, antlers, buttondown red flannel
9020, ninja black, helm biker, robe white
9021, glossy, tvhead purple, costume dragon
9022, tvface bobross, tvhead purple, costume frog
9023, beard brown, hat visor yellow, bandana green
9024, sunglasses cool, beanie blue, sweater pink
9025, sunglasses cool, beanie orange, winter red
9026, sunglasses yellow, mullet brown, winter blue
9027, beard brown, bucket hat tan, tanktop white
9028, tired, costume gorilla, shirt bowtie
9029, sunglasses cool, beret green, sweater orange
9030, uwu, beanie orange, overalls blue
9031, wink, antlers, shirt yellow
9032, sunglasses blue, hat white, sweater orange
9033, ditto, bucket hat white, costume dragon
9034, owo, hat black, costume gorilla
9035, happy, horns, bandana purple
9036, ninja black, afro black, combat black
9037, ditto, hat skull, bandana green
9038, ninja black, crown fire, work red
9039, mummy, headband blue, hoodie purple
9040, derp, headband red, robe blue
9041, sunglasses yellow, beret black, buttondown tan
9042, happy, beret red, buttondown black flannel
9043, zombie, beret green, bandana red
9044, beard pirate, beanie orange, tanktop pink
9045, grin, beanie red, work blue
9046, beard tan, arrowhead, bandana purple
9047, happy cute, ninja black, overalls pink
9048, mononoke, knight blue, overalls blue
9049, owo, crown black, costume gorilla
9050, double face, helm biker, wetsuit
9051, happy, pirate red, sweater pink
9052, smirk, candle, winter red
9053, derp, tvhead purple, hoodie purple
9054, owo, deepsea bronze, costume hotdog
9055, ninja black, headband red, deepsea orange
9056, ninja black, hat white, shirt yellow
9057, zombie, candle, tanktop orange
9058, rich, candle, overalls pink
9059, mononoke, candle, gown purple
9060, sunglasses blue, headband red, robe red
9061, angry, flower red, overalls pink
9062, happy cute, beret black, buttondown blue flannel
9063, sunglasses cowboy, bucket hat green, robe red
9064, tired, crown fire, tshirt red
9065, beard tan, unicorn horn, robe red
9066, grin, flower blue, winter red
9067, rich, antlers, buttondown blue flannel
9068, pixel, beanie red, wetsuit
9069, owo, cowboy black, hoodie red
9070, wink, ninja blue, deepsea bronze
9071, hearts, beret black, lederhosen
9072, grin, mohawk purple, overalls flannel
9073, sunglasses blue, bucket hat green, tanktop pink
9074, double face, candle, baseball red
9075, derp, cupcake, robe blue
9076, zombie, ninja black, cowboy brown
9077, zombie, deepsea bronze, deepsea bronze
9078, owo, beret red, ninja red
9079, three eyes, bucket hat blue, bandana red
9080, beard brown, bucket hat blue, shirt white
9081, shocked, bucket hat tan, winter red
9082, sunglasses squad, bucket hat green, labcoat
9083, hearts, wreath, ninja red
9084, glossy, prince, sweater green chain
9085, angry cute, helm bronze, hoodie red
9086, happy cute, beret green, work red
9087, ninja red, halo, cowboy black
9088, ninja red, beanie blue, buttondown blue flannel
9089, ninja blue, ninja red, tanktop pink
9090, derp, sunhat white, overalls blue
9091, happy, sunhat tan, nurse
9092, dizzy, bucket hat tan, hoodie purple
9093, face face, beanie red, tanktop pink
9094, ninja black, beanie black, bandana green
9095, happy, costume dragon, costume frog
9096, zombie, apple, tshirt red
9097, happy cute, candle, knight
9098, beard brown, costume gorilla, baseball blue
9099, tired, afro black, tshirt blue
9100, angry cute, cupcake, buttondown black flannel
9101, ninja red, nurse, gown white
9102, tired, afro black, tanktop pink
9103, sunglasses squad, sunhat white, wetsuit
9104, smirk, bucket hat tan, robe blue
9105, zombie, cupcake, wetsuit
9106, uwu, deepsea bronze, knight leather
9107, tired, visor green, combat green
9108, beard tan, sunhat tan, winter blue
9109, rich, beanie orange, work blue
9110, mummy, bow, ninja blue
9111, uwu, unicorn horn, tshirt metal
9112, stunned, tvhead purple, overalls pink
9113, sunglasses blue, flower red, robe blue
9114, sunglasses squad, beret black, lederhosen
9115, glasses, afro black, epaulette black
9116, double face, sunhat white, hoodie purple
9117, zombie, knight red, epaulette black
9118, pixel, mohawk green, robe blue
9119, zombie, beret green, tanktop white
9120, sunglasses cowboy, beanie red, work red
9121, angry cute, sunhat tan, tshirt green
9122, glasses funny, beret black, gown white
9123, owo, astro cheeks, bandana purple
9124, angry, mohawk green, tanktop pink
9125, angry scar, bow, knight black
9126, ninja black, beret pink, tshirt blue
9127, mononoke, bucket hat tan, sweater orange
9128, sunglasses squad, beret green, astro
9129, owo, headband red, shirt white
9130, ninja black, halo fire, astro black
9131, zombie, ninja black, sweater green chain
9132, beard pirate, ninja black, tanktop sailor black
9133, tired, mohawk green, buttondown tan
9134, dizzy, sushi, robe blue
9135, sunglasses heart, mullet brown, toga
9136, sunglasses yellow, headband blue, tshirt blue
9137, tvface 404, tvhead grey, deepsea orange
9138, beard brown, beret red, work red
9139, mononoke, mullet blonde, shirt yellow
9140, owo, sunhat tan, sweater black
9141, stunned, headband blue, buttondown green
9142, tired, hat visor yellow, tshirt pink
9143, glasses, bucket hat green, bandana green
9144, angry, costume gorilla, toga
9145, angry cute, top hat, overalls red
9146, double face, afro brown, robe blue
9147, dizzy, tvhead purple, sweater pink
9148, sunglasses squad, pirate black, deepsea bronze
9149, sunglasses cool, mohawk purple, robe white
9150, angry scar, knight red, overalls yellow
9151, ditto, cowboy brown, buttondown red flannel
9152, sunglasses pixel, candle, buttondown black flannel
9153, rich, hat visor blue, epaulette red
9154, mummy, piercings, buttondown blue flannel
9155, beard brown, halo fire, punk
9156, glasses funny, apple, bandana green
9157, beard tan, mohawk purple, sweater orange
9158, angry cute, cowboy brown, robe red
9159, derp, flower blue, tshirt metal
9160, happy cute, beanie orange, buttondown black flannel
9161, owo, mohawk red, sweater pink
9162, ditto, bucket hat green, robe blue
9163, pixel, mohawk green, tshirt green
9164, glasses, beret pink, tanktop sailor black
9165, mononoke, deepsea orange, costume gorilla
9166, angry scar, arrowhead, tshirt pink
9167, hearts, wreath, tshirt green
9168, unamused, cupcake, robe blue
9169, beard brown, bucket hat tan, bandana purple
9170, smirk, hat visor yellow, tshirt pink
9171, sunglasses cool, unicorn horn, tanktop pink
9172, ninja blue, beanie orange, toga
9173, glasses funny, piercings, tanktop sailor red
9174, smirk, visor green, shirt bowtie
9175, angry cute, bucket hat green, tshirt metal
9176, smirk, headband blue, robe blue
9177, happy cute, admiral pink, robe king
9178, glasses funny, crown black, tshirt white
9179, sunglasses blue, hat white, tshirt pink
9180, angry scar, ninja blue, buttondown green
9181, happy, headband red, tanktop sailor blue
9182, sunglasses squad, goggles seaweed, gown black
9183, shocked, sunhat white, labcoat
9184, beard brown, pirate red, robe white
9185, grin, flower blue, tshirt yellow
9186, mononoke, wreath, overalls pink
9187, beard brown, piercings, baseball blue
9188, uwu, helm biker, bandana purple
9189, glasses, deepsea orange, costume frog
9190, glasses funny, beret red, tshirt pink
9191, mummy, beret black, nurse
9192, mononoke, sunhat tan, tanktop tattoo
9193, sunglasses blue, beret red, work blue
9194, glasses funny, helm biker, epaulette white
9195, angry, hat visor yellow, shirt white
9196, ninja blue, candle, epaulette red
9197, happy, beret green, pirate black
9198, sunglasses pixel, mohawk purple, buttondown green
9199, sunglasses cowboy, bucket hat tan, buttondown red flannel
9200, ninja black, crown gold, overalls flannel
9201, glossy, bucket hat green, shirt white
9202, pixel, candle, work blue
9203, happy, hat visor yellow, sweater orange
9204, sunglasses cool, antlers, tshirt metal
9205, unamused, flower blue, costume hotdog
9206, stunned, candle, buttondown green
9207, unamused, pirate red, buttondown blue flannel
9208, sunglasses heart, knight blue, knight leather
9209, derp, hat skull, bandana green
9210, angry cute, apple, shirt yellow
9211, face face, piercings, work red
9212, rich, flower red, astro
9213, stunned, crown fire, ninja blue
9214, stunned, beanie blue, winter blue
9215, sunglasses pixel, apple, hoodie purple
9216, mummy, flower pink, bandana red
9217, rich, flower blue, lederhosen
9218, sunglasses blue, helm biker, nurse
9219, shocked, beret green, tanktop white
9220, mummy, astro cheeks, gown black
9221, ninja blue, costume frog, tanktop sailor red
9222, glasses, afro black, overalls red
9223, glasses, nurse, deepsea orange
9224, uwu, costume dragon, tanktop white
9225, glasses, arrowhead, mononoke
9226, angry, sunhat black, tanktop tattoo
9227, derp, hat white, shirt yellow
9228, sunglasses heart, piercings, overalls blue
9229, beard tan, beret red, overalls pink
9230, angry scar, afro black, bandana green
9231, sunglasses heart, afro brown, buttondown green
9232, mononoke, hat black, overalls pink
9233, beard brown, unicorn horn, work red
9234, sunglasses blue, afro brown, overalls pink
9235, owo, mohawk green, bandana green
9236, glossy, hat white, work red
9237, rich, crown black, cowboy black
9238, sunglasses squad, ninja black, sweater orange
9239, three eyes, top hat, overalls yellow
9240, shocked, hat visor blue, ninja black
9241, happy, beret green, shirt yellow
9242, sunglasses squad, crown fire, cowboy black
9243, pixel, tvhead grey, pirate black
9244, sunglasses blue, tvhead purple, combat green
9245, hearts, beret red, tshirt pink
9246, glasses, bucket hat white, overalls blue
9247, mononoke, afro rainbow unicorn, shirt bowtie
9248, angry cute, cowboy black, toga
9249, derp, antlers, sweater pink
9250, mummy, sunhat white, deepsea bronze
9251, ninja black, candle, lederhosen
9252, angry cute, hat white, tanktop white
9253, happy, apple, tanktop pink
9254, grin, headband blue, buttondown tan
9255, uwu, beret green, nurse
9256, wink, mullet blonde, shirt yellow
9257, sunglasses cool, headband blue, tanktop pink
9258, glossy, piercings, tanktop orange
9259, unamused, flower pink, work blue
9260, stunned, afro rainbow unicorn, labcoat
9261, dizzy, cowboy brown, bandana red
9262, zombie, pirate red, tshirt blue
9263, sunglasses cowboy, hat visor yellow, bandana green
9264, angry cute, beanie orange, tanktop sailor blue
9265, beard brown, prince, punk
9266, happy cute, deepsea bronze, costume dragon
9267, beard tan, beanie red, costume dragon
9268, glasses, crown black, sweater green chain
9269, ninja red, hat skull, tanktop sailor black
9270, glasses, hat white, tanktop sailor red
9271, sunglasses cool, beanie red, shirt yellow
9272, wink, crown fire, shirt bowtie
9273, face face, flower red, gown white
9274, derp, beret green, buttondown green
9275, derp, wreath, shirt yellow
9276, beard brown, flower blue, shirt yellow
9277, ditto, headband red, gown purple
9278, happy cute, beret red, shirt white
9279, glossy, headband red, overalls yellow
9280, shocked, flower pink, robe blue
9281, sunglasses pixel, sunhat black, shirt white
9282, derp, knight black, bandana purple
9283, smirk, beanie red, knight leather
9284, angry cute, hat white, buttondown tan
9285, ninja red, beanie red, work red
9286, ninja black, flower pink, pirate black
9287, unamused, beret black, toga
9288, face face, hat black, robe red
9289, unamused, beret pink, tanktop orange
9290, happy, mullet blonde, shirt yellow
9291, stunned, prince, tanktop sailor black
9292, owo, mohawk red, buttondown black flannel
9293, double face, mohawk green, hoodie purple
9294, zombie, bucket hat white, ninja black
9295, ninja blue, visor purple, buttondown tan
9296, happy cute, headband blue, robe red
9297, glossy, cowboy brown, overalls blue
9298, owo, arrowhead, overalls flannel
9299, dizzy, bucket hat tan, buttondown blue flannel
9300, rich, hat skull, astro orange
9301, angry, bucket hat tan, buttondown blue flannel
9302, sunglasses heart, bucket hat blue, cowboy brown
9303, pixel, antlers, work red
9304, mononoke, knight black, winter blue
9305, happy, mohawk red, tanktop pink
9306, sunglasses cowboy, flower blue, buttondown green
9307, glossy, helm bronze, astro
9308, sunglasses squad, sunhat tan, deepsea bronze
9309, sunglasses cool, sushi, baseball blue
9310, unamused, flower pink, buttondown blue flannel
9311, grin, afro brown, shirt bowtie
9312, tvface bobross, tvhead white, gown purple
9313, derp, cupcake, winter blue
9314, glasses funny, crown black, baseball red
9315, shocked, unicorn horn, shirt bowtie
9316, glossy, bucket hat tan, robe red
9317, angry, costume dragon, astro orange
9318, happy cute, mohawk purple, tshirt yellow
9319, angry, nurse, tanktop sailor blue
9320, sunglasses pixel, sunhat white, buttondown tan
9321, hearts, hat skull, astro orange
9322, mummy, sunhat black, tanktop white
9323, sunglasses cowboy, cowboy black, tanktop sailor blue
9324, sunglasses blue, cowboy brown, tshirt blue
9325, angry, sushi, combat green
9326, ninja blue, beanie orange, winter red
9327, face face, afro black, sweater black
9328, angry scar, afro brown, tanktop white
9329, ninja red, beret black, winter red
9330, double face, admiral, astro black
9331, sunglasses yellow, beret green, sweater green chain
9332, derp, headband blue, robe blue
9333, wink, piercings, shirt yellow
9334, wink, bucket hat white, hoodie black
9335, zombie, knight black, epaulette red
9336, derp, tvhead grey, hoodie red
9337, tired, mohawk purple, buttondown blue flannel
9338, sunglasses yellow, sushi, tshirt yellow
9339, ditto, beret green, buttondown green
9340, derp, helm biker, ninja blue
9341, ditto, horns, costume gorilla
9342, mummy, goggles seaweed, viking brown
9343, sunglasses yellow, pirate red, combat green
9344, sunglasses yellow, flower blue, buttondown green
9345, ditto, beanie red, robe red
9346, rich, visor green, tanktop sailor blue
9347, pixel, cupcake, tshirt metal
9348, glossy, visor green, knight
9349, beard pirate, costume gorilla, robe king
9350, wink, visor green, overalls blue
9351, pixel, hat visor yellow, buttondown red flannel
9352, ninja blue, admiral, hoodie black
9353, glossy, horns, shirt yellow
9354, sunglasses cowboy, crown fire, toga
9355, ditto, apple, tshirt yellow
9356, glasses, bucket hat green, bandana red
9357, wink, flower pink, sweater orange
9358, ninja blue, mohawk red, hoodie black
9359, angry, candle, viking brown
9360, happy cute, candle, buttondown green
9361, glasses, mohawk purple, overalls flannel
9362, dizzy, cowboy brown, baseball blue
9363, beard pirate, mohawk purple, buttondown black flannel
9364, zombie, bucket hat tan, buttondown green
9365, owo, goggles seaweed, gown purple
9366, ditto, apple, tshirt pink
9367, tired, ninja red, cowboy black
9368, owo, hat black, tiger
9369, zombie, nurse, epaulette white
9370, double face, bucket hat blue, buttondown red flannel
9371, three eyes, top hat, shirt bowtie
9372, owo, bucket hat white, sweater black
9373, sunglasses squad, piercings, tanktop white
9374, three eyes, mullet blonde, work blue
9375, sunglasses cowboy, beret pink, tshirt blue
9376, three eyes, apple, gown purple
9377, face face, mohawk purple, tshirt white
9378, ninja red, cowboy black, astro black
9379, sunglasses yellow, tvhead grey, tiger
9380, glasses funny, bucket hat tan, work blue
9381, shocked, ninja blue, work blue
9382, wink, sunhat tan, overalls yellow
9383, three eyes, arrowhead, tshirt yellow
9384, hearts, arrowhead, costume hotdog
9385, double face, halo fire, winter blue
9386, dizzy, beret red, buttondown blue flannel
9387, angry, beanie orange, work red
9388, angry scar, mohawk red, sweater orange
9389, hearts, deepsea bronze, knight black
9390, beard brown, sushi, costume frog
9391, uwu, hat visor blue, gown black
9392, unamused, beret red, shirt yellow
9393, glossy, beanie orange, cowboy black
9394, grin, hat visor blue, bandana purple
9395, mummy, apple, robe blue
9396, sunglasses squad, astro fishbowl, baseball blue
9397, happy cute, beanie orange, tshirt yellow
9398, glasses funny, cowboy black, wetsuit
9399, unamused, afro black, labcoat
9400, sunglasses cool, arrowhead, shirt white
9401, sunglasses heart, beret black, lederhosen
9402, angry scar, mullet brown, ninja blue
9403, derp, cowboy brown, punk
9404, face face, hat white, tshirt red
9405, derp, astro, bandana purple
9406, owo, tvhead grey, overalls blue
9407, ninja black, hat white, work blue
9408, three eyes, horns, tshirt yellow
9409, rich, apple, punk
9410, uwu, mohawk purple, overalls flannel
9411, ditto, hat visor blue, buttondown blue flannel
9412, mononoke, sunhat tan, robe white
9413, smirk, helm bronze, shirt bowtie
9414, derp, cupcake, shirt white
9415, beard tan, knight red, buttondown green
9416, sunglasses pixel, mohawk green, sweater black
9417, sunglasses cowboy, afro black, tshirt yellow
9418, ditto, sunhat white, buttondown blue flannel
9419, owo, astro fishbowl, monk
9420, ditto, hat black, tanktop tattoo
9421, sunglasses heart, wreath, labcoat
9422, double face, knight black, winter blue
9423, sunglasses pixel, bow, ninja black
9424, angry, apple, baseball blue
9425, beard pirate, beanie red, pirate black
9426, beard pirate, bucket hat tan, bandana green
9427, happy, mohawk purple, hoodie purple
9428, sunglasses blue, mohawk green, sweater pink
9429, tired, piercings, gown white
9430, ninja black, bucket hat blue, overalls yellow
9431, glasses funny, beret red, buttondown red flannel
9432, sunglasses heart, cupcake, tanktop pink
9433, sunglasses heart, mohawk purple, shirt yellow
9434, sunglasses pixel, bucket hat green, bandana purple
9435, dizzy, headband blue, shirt yellow
9436, unamused, visor purple, costume hotdog
9437, ditto, sunhat tan, robe red
9438, zombie, headband blue, tanktop orange
9439, sunglasses squad, piercings, sweater pink
9440, sunglasses pixel, mullet blonde, knight
9441, ninja blue, admiral, tanktop orange
9442, mummy, candle, tanktop pink
9443, angry, beret red, ninja blue
9444, angry, beret pink, tshirt white
9445, glasses funny, cowboy black, tanktop tattoo
9446, sunglasses cowboy, beret red, tanktop pink
9447, sunglasses heart, piercings, tanktop orange
9448, ninja black, flower blue, tanktop white
9449, zombie, beret green, baseball red
9450, zombie, crown gold, viking brown
9451, happy cute, hat white, buttondown green
9452, beard pirate, beret green, bandana red
9453, glasses, flower blue, buttondown black flannel
9454, pixel, astro fishbowl, costume frog
9455, owo, apple, tanktop white
9456, beard tan, headband red, work red
9457, grin, admiral, tanktop white
9458, angry scar, headband blue, buttondown green
9459, wink, knight blue, tshirt red
9460, ninja red, bucket hat tan, work red
9461, rich, afro black, toga
9462, beard brown, sunhat black, buttondown green
9463, three eyes, antlers, buttondown black flannel
9464, ninja blue, beret pink, astro orange
9465, beard pirate, visor purple, astro orange
9466, zombie, headband red, buttondown black flannel
9467, ninja blue, bucket hat green, bandana green
9468, beard pirate, hat white, robe blue
9469, sunglasses heart, arrowhead, tshirt red
9470, pixel, helm army, tshirt pink
9471, glasses funny, mohawk red, deepsea bronze
9472, ditto, piercings, buttondown black flannel
9473, angry scar, astro, overalls yellow
9474, glasses funny, candle, robe red
9475, hearts, cupcake, robe blue
9476, tired, antlers, tshirt red
9477, smirk, flower red, tshirt red
9478, glasses funny, antlers, sweater green chain
9479, tvface xp, tvhead white, hoodie red
9480, happy cute, piercings, robe red
9481, zombie, bucket hat green, tanktop sailor black
9482, mummy, pirate red, overalls blue
9483, beard tan, sunhat white, tanktop pink
9484, sunglasses heart, halo, robe red
9485, shocked, cupcake, tshirt metal
9486, zombie, beanie red, buttondown green
9487, angry, headband red, tshirt blue
9488, glasses funny, flower pink, tshirt white
9489, wink, bucket hat tan, overalls flannel
9490, happy cute, mohawk purple, bandana purple
9491, sunglasses cowboy, headband blue, combat green
9492, glossy, admiral, buttondown black flannel
9493, ninja black, piercings, bandana purple
9494, ditto, ninja blue, overalls flannel
9495, beard tan, hat visor yellow, buttondown tan
9496, stunned, beret red, work red
9497, glasses, mullet brown, robe blue
9498, hearts, mohawk green, buttondown black flannel
9499, sunglasses pixel, bucket hat green, robe red
9500, smirk, beanie orange, bandana green
9501, sunglasses pixel, bucket hat green, tshirt red
9502, smirk, wreath, gown black
9503, uwu, hat visor yellow, tanktop white
9504, ninja blue, beanie blue, hoodie purple
9505, uwu, bucket hat green, overalls yellow
9506, sunglasses blue, bucket hat green, ninja red
9507, grin, crown black, astro orange
9508, hearts, goggles seaweed, astro
9509, stunned, helm silver, tshirt red
9510, hearts, wreath, work red
9511, sunglasses squad, wreath, buttondown green
9512, sunglasses squad, deepsea orange, deepsea orange
9513, sunglasses squad, beret red, ninja red
9514, stunned, headband blue, sweater black
9515, mummy, wreath, tanktop white
9516, rich, bucket hat green, buttondown blue flannel
9517, sunglasses cool, mohawk purple, tanktop sailor blue
9518, tired, bucket hat tan, buttondown green
9519, beard pirate, horns, combat green
9520, angry scar, unicorn horn, tshirt blue
9521, pixel, costume dragon, tshirt blue
9522, ninja blue, beret green, work blue
9523, mummy, nurse, hoodie red
9524, sunglasses heart, arrowhead, tanktop white
9525, ninja black, horns, overalls red
9526, ninja blue, candle, toga
9527, glossy, piercings, tshirt yellow
9528, mummy, beret green, labcoat
9529, three eyes, halo fire, tshirt white
9530, angry, knight blue, combat green
9531, zombie, candle, sweater black
9532, sunglasses cowboy, candle, overalls yellow
9533, beard tan, admiral pink, pirate black
9534, sunglasses blue, helm silver, buttondown green
9535, pixel, flower red, hoodie purple
9536, sunglasses blue, wreath, bandana green
9537, tired, beret red, sweater green chain
9538, owo, afro black, robe red
9539, grin, bucket hat white, winter red
9540, sunglasses yellow, flower pink, tanktop pink
9541, mononoke, beret pink, bandana red
9542, ninja red, wreath, tshirt yellow
9543, three eyes, apple, tanktop white
9544, ditto, astro cheeks, winter red
9545, sunglasses yellow, beanie red, knight
9546, unamused, costume frog, bandana red
9547, sunglasses cool, goggles seaweed, tanktop sailor blue
9548, sunglasses yellow, sunhat black, winter red
9549, sunglasses yellow, mohawk purple, nurse
9550, beard tan, helm army, tshirt white
9551, glasses, antlers, tshirt green
9552, wink, sunhat tan, gown purple
9553, rich, beanie orange, buttondown green
9554, glasses funny, deepsea bronze, overalls pink
9555, shocked, pirate red, tshirt pink
9556, angry cute, mohawk green, sweater orange
9557, smirk, astro, overalls yellow
9558, sunglasses squad, afro brown, sweater orange
9559, ninja red, beret green, tanktop tattoo
9560, three eyes, beanie orange, tanktop sailor black
9561, rich, bucket hat tan, buttondown blue flannel
9562, angry, dutch, epaulette black
9563, zombie, arrowhead, bandana green
9564, sunglasses pixel, flower pink, tshirt green
9565, ninja blue, mohawk red, cowboy black
9566, beard tan, antlers, buttondown green
9567, angry, candle, buttondown black flannel
9568, hearts, sunhat black, work blue
9569, stunned, hat white, shirt white
9570, beard pirate, visor purple, viking navy
9571, happy cute, beanie red, tanktop tattoo
9572, mononoke, hat black, baseball blue
9573, smirk, sushi, hoodie purple
9574, glossy, mohawk purple, baseball red
9575, face face, cowboy brown, epaulette red
9576, glossy, sushi, labcoat
9577, stunned, bucket hat green, buttondown black flannel
9578, sunglasses cool, flower blue, nurse
9579, ninja blue, wreath, work blue
9580, stunned, mohawk purple, work red
9581, wink, cowboy black, sweater orange
9582, happy, bucket hat green, tanktop sailor blue
9583, pixel, mullet blonde, costume dragon
9584, sunglasses pixel, beret green, bandana purple
9585, happy, mohawk green, buttondown red flannel
9586, grin, candle, tanktop pink
9587, double face, helm army, overalls red
9588, beard brown, beanie red, sweater black
9589, glasses funny, mohawk green, tshirt pink
9590, pixel, halo, astro orange
9591, derp, arrowhead, tanktop sailor blue
9592, uwu, beanie orange, wetsuit
9593, owo, bow, costume frog
9594, pixel, helm biker, cowboy brown
9595, sunglasses yellow, flower red, sweater orange
9596, smirk, beanie black, tanktop tattoo
9597, sunglasses cool, hat white, hoodie purple
9598, sunglasses yellow, deepsea bronze, wetsuit
9599, hearts, astro cheeks, astro orange
9600, double face, ninja blue, robe white
9601, glasses, helm army, epaulette red
9602, angry scar, knight red, work red
9603, glasses funny, beret pink, tshirt red
9604, glasses funny, nurse, tshirt blue
9605, dizzy, apple, sweater pink
9606, uwu, beanie orange, shirt white
9607, rich, ninja blue, costume hotdog
9608, sunglasses squad, hat white, buttondown tan
9609, face face, bucket hat white, ninja red
