9610, smirk, halo, labcoat
9611, ninja blue, candle, buttondown blue flannel
9612, mononoke, hat white, overalls blue
9613, uwu, flower red, toga
9614, derp, astro cheeks, epaulette red
9615, grin, ninja black, tshirt metal
9616, shocked, sushi, robe red
9617, sunglasses blue, crown black, knight
9618, sunglasses blue, deepsea bronze, tanktop sailor black
9619, wink, prince, viking brown
9620, wink, knight black, sweater black
9621, dizzy, afro black, hoodie black
9622, glasses, cowboy brown, tshirt red
9623, owo, mohawk green, overalls blue
9624, uwu, visor green, epaulette white
9625, happy, flower red, bandana red
9626, tired, crown gold, buttondown green
9627, glossy, bucket hat tan, robe blue
9628, zombie, antlers, ninja blue
9629, sunglasses pixel, astro cheeks, tanktop sailor red
9630, happy, wreath, robe blue
9631, beard tan, wreath, baseball red
9632, sunglasses blue, flower red, tshirt red
9633, glasses funny, astro, robe blue
9634, rich, sunhat tan, shirt bowtie
9635, sunglasses yellow, beret pink, monk
9636, hearts, visor green, cowboy black
9637, ninja black, beanie orange, shirt white
9638, rich, candle, tanktop orange
9639, pixel, bucket hat green, bandana red
9640, glasses, arrowhead, gown purple
9641, sunglasses cool, mullet blonde, buttondown red flannel
9642, double face, beanie blue, hoodie purple
9643, glasses, hat black, baseball blue
9644, mummy, hat visor yellow, astro
9645, happy, flower blue, tanktop white
9646, glasses, halo, baseball blue
9647, double face, candle, robe blue
9648, shocked, ninja red, hoodie red
9649, glasses funny, mullet blonde, knight black
9650, uwu, flower red, overalls blue
9651, owo, beanie orange, epaulette white
9652, beard tan, hat white, tanktop pink
9653, glasses, wreath, overalls pink
9654, glasses, tvhead white, tanktop sailor black
9655, beard pirate, mullet blonde, knight black
9656, owo, goggles seaweed, gown white
9657, face face, astro, astro
9658, glossy, beret red, tshirt blue
9659, dizzy, pirate red, baseball blue
9660, stunned, flower pink, buttondown tan
9661, derp, flower blue, overalls blue
9662, uwu, sunhat tan, chain
9663, unamused, flower blue, robe red
9664, glasses funny, bucket hat white, ninja red
9665, sunglasses pixel, antlers, hoodie purple
9666, glasses, headband red, nurse
9667, zombie, beanie black, shirt white
9668, sunglasses cowboy, bucket hat blue, bandana green
9669, sunglasses yellow, headband blue, bandana purple
9670, tired, afro brown, buttondown black flannel
9671, mononoke, astro, robe red
9672, ninja black, hat white, tshirt blue
9673, glossy, beret red, toga
9674, wink, sunhat white, winter blue
9675, beard tan, flower blue, sweater orange
9676, dizzy, sunhat tan, buttondown green
9677, unamused, mohawk green, robe blue
9678, hearts, astro cheeks, cowboy brown
9679, ninja red, halo fire, pirate red
9680, double face, hat skull, tshirt metal
9681, angry, flower blue, tshirt yellow
9682, zombie, visor purple, tshirt white
9683, beard brown, mullet brown, tiger
9684, stunned, beanie black, sweater orange
9685, sunglasses yellow, headband blue, tanktop orange
9686, beard tan, headband blue, robe red
9687, tired, sunhat tan, tshirt pink
9688, ninja black, candle, robe white
9689, double face, beanie blue, shirt bowtie
9690, wink, knight red, epaulette red
9691, happy cute, wreath flowers, bandana red
9692, beard brown, pirate black, pirate black
9693, sunglasses pixel, beanie blue, tshirt blue
9694, derp, sunhat black, epaulette black
9695, owo, apple, hoodie purple
9696, beard tan, flower pink, buttondown tan
9697, shocked, knight black, knight
9698, unamused, mohawk green, shirt white
9699, angry cute, flower red, hoodie purple
9700, mummy, sunhat tan, ninja black
9701, angry cute, headband red, hoodie black
9702, tvface bobross, tvhead grey, tshirt metal
9703, glasses funny, flower pink, buttondown black flannel
9704, angry cute, mohawk purple, bandana green
9705, grin, hat white, viking brown
9706, sunglasses cool, pirate black, epaulette white
9707, glossy, bucket hat green, hoodie red
9708, mononoke, afro brown, tanktop tattoo
9709, sunglasses heart, beanie black, tanktop orange
9710, grin, piercings, overalls yellow
9711, ninja red, mohawk red, hoodie purple
9712, beard pirate, ninja blue, deepsea orange
9713, uwu, flower pink, shirt bowtie
9714, sunglasses blue, mullet blonde, buttondown black flannel
9715, sunglasses pixel, beret pink, buttondown green
9716, glasses, prince, gown white
9717, angry, wreath flowers, hoodie red
9718, happy, beret green, tanktop white
9719, beard pirate, beret pink, hoodie red
9720, sunglasses heart, costume dragon, cowboy brown
9721, sunglasses blue, beanie black, hoodie black
9722, derp, prince, bandana red
9723, happy, knight blue, shirt yellow
9724, angry scar, sunhat tan, overalls flannel
9725, ninja red, mullet brown, sweater pink
9726, sunglasses cowboy, halo, viking navy
9727, happy, flower blue, robe blue
9728, sunglasses blue, hat visor yellow, bandana purple
9729, face face, visor green, tanktop white
9730, mononoke, apple, robe blue
9731, angry, candle, ninja black
9732, owo, mullet blonde, chain
9733, ninja black, mohawk red, shirt bowtie
9734, beard tan, cupcake, buttondown tan
9735, shocked, beanie blue, bandana red
9736, tvface nosignal, tvhead grey, sweater pink
9737, sunglasses heart, flower blue, shirt yellow
9738, grin, deepsea bronze, gown white
9739, sunglasses squad, afro brown, toga
9740, tvface bobross, tvhead grey, viking brown
9741, grin, hat white, monk
9742, sunglasses yellow, knight red, wetsuit
9743, double face, sushi, bandana green
9744, shocked, flower red, buttondown blue flannel
9745, glasses, beret red, tshirt red
9746, three eyes, cupcake, ninja red
9747, three eyes, bucket hat tan, tanktop pink
9748, angry scar, flower blue, tanktop tattoo
9749, uwu, tvhead purple, cowboy brown
9750, beard brown, astro cheeks, overalls flannel
9751, ditto, headband red, overalls blue
9752, grin, antlers, buttondown black flannel
9753, happy, pirate red, buttondown tan
9754, sunglasses cool, arrowhead, combat black
9755, glasses, unicorn horn, baseball red
9756, beard brown, apple, sweater pink
9757, mononoke, pirate red, robe red
9758, glossy, visor purple, bandana green
9759, grin, beret pink, ninja red
9760, sunglasses blue, beanie orange, work red
9761, ninja blue, beanie orange, buttondown black flannel
9762, angry scar, piercings, tanktop orange
9763, double face, crown fire, sweater pink
9764, ditto, knight red, astro
9765, mummy, sunhat black, robe king
9766, rich, nurse, sweater pink
9767, dizzy, cupcake, work red
9768, happy cute, flower blue, robe red
9769, mummy, hat black, tshirt red
9770, unamused, hat visor yellow, tshirt pink
9771, sunglasses pixel, hat visor yellow, bandana red
9772, ditto, helm army, work blue
9773, glasses funny, antlers, shirt yellow
9774, mummy, antlers, lederhosen
9775, three eyes, beanie orange, astro
9776, ninja black, helm army, bandana red
9777, sunglasses blue, sushi, costume gorilla
9778, tired, sunhat tan, work red
9779, unamused, piercings, work blue
9780, three eyes, hat visor yellow, bandana red
9781, angry cute, hat skull, tanktop white
9782, unamused, bucket hat white, robe red
9783, sunglasses cowboy, hat visor blue, tshirt red
9784, owo, candle, robe blue
9785, beard brown, antlers, bandana red
9786, angry cute, unicorn horn, bandana red
9787, pixel, antlers, bandana purple
9788, owo, beret green, shirt yellow
9789, smirk, deepsea bronze, tshirt green
9790, happy, beret red, overalls flannel
9791, mummy, apple, tanktop orange
9792, sunglasses blue, piercings, gown white
9793, shocked, cowboy black, astro black
9794, beard pirate, flower red, tshirt red
9795, unamused, bucket hat green, shirt white
9796, ninja blue, candle, winter blue
9797, beard pirate, halo fire, combat green
9798, mononoke, beanie orange, work red
9799, sunglasses cowboy, tvhead white, hoodie red
9800, glasses funny, mullet brown, hoodie red
9801, glasses, candle, tshirt pink
9802, tired, mullet brown, sweater pink
9803, angry scar, apple, sweater orange
9804, pixel, cowboy brown, tanktop orange
9805, double face, bow, bandana green
9806, shocked, admiral, epaulette red
9807, grin, beret pink, hoodie purple
9808, angry, wreath flowers, pirate black
9809, beard pirate, beret green, buttondown blue flannel
9810, sunglasses pixel, pirate red, robe king
9811, ninja black, beanie orange, hoodie purple
9812, unamused, bucket hat tan, buttondown blue flannel
9813, angry scar, mohawk green, buttondown blue flannel
9814, glasses funny, beret red, tshirt red
9815, unamused, apple, tanktop sailor black
9816, grin, bucket hat green, tanktop sailor black
9817, sunglasses blue, candle, baseball blue
9818, sunglasses cool, bow, tshirt pink
9819, shocked, beret black, chain
9820, zombie, helm army, sweater pink
9821, tvface nosignal, tvhead grey, astro
9822, stunned, tvhead purple, robe king
9823, sunglasses yellow, wreath flowers, tanktop sailor blue
9824, beard pirate, astro, robe white
9825, glasses funny, headband red, ninja red
9826, ninja blue, hat white, buttondown black flannel
9827, ninja black, arrowhead, buttondown black flannel
9828, mononoke, beret green, labcoat
9829, mummy, astro cheeks, toga
9830, unamused, mohawk green, tshirt red
9831, ninja red, flower red, hoodie red
9832, hearts, mohawk purple, sweater black
9833, zombie, visor green, ninja red
9834, unamused, apple, tshirt pink
9835, glossy, sunhat tan, shirt yellow
9836, angry, beret red, costume dragon
9837, dizzy, bucket hat green, shirt yellow
9838, three eyes, beanie red, overalls yellow
9839, uwu, afro black, baseball blue
9840, glasses funny, antlers, robe blue
9841, ninja black, bucket hat blue, hoodie black
9842, happy cute, mullet brown, hoodie red
9843, glossy, flower blue, buttondown tan
9844, double face, visor green, viking brown
9845, stunned, flower blue, shirt white
9846, beard brown, costume frog, buttondown green
9847, zombie, visor purple, combat green
9848, glossy, tvhead purple, costume frog
9849, grin, dutch, wetsuit
9850, mummy, hat visor blue, tshirt green
9851, grin, flower pink, tanktop sailor blue
9852, hearts, headband blue, robe blue
9853, shocked, beanie orange, sweater orange
9854, sunglasses blue, mohawk purple, winter red
9855, beard pirate, headband blue, tshirt pink
9856, derp, flower blue, sweater orange
9857, ninja black, hat black, pirate black
9858, sunglasses pixel, cowboy brown, tanktop orange
9859, sunglasses squad, candle, shirt yellow
9860, ditto, mohawk purple, robe red
9861, ninja blue, beanie black, tshirt red
9862, zombie, headband red, viking navy
9863, hearts, candle, work blue
9864, happy cute, beanie blue, labcoat
9865, angry, bucket hat tan, tanktop pink
9866, face face, sunhat white, winter red
9867, sunglasses pixel, unicorn horn, gown black
9868, sunglasses cool, flower blue, overalls yellow
9869, angry scar, candle, tanktop pink
9870, glossy, deepsea bronze, monk
9871, double face, unicorn horn, astro
9872, smirk, cowboy black, buttondown green
9873, mononoke, halo fire, costume hotdog
9874, angry scar, bucket hat green, hoodie purple
9875, uwu, headband red, shirt white
9876, angry cute, piercings, overalls blue
9877, ninja red, mullet blonde, hoodie black
9878, glasses funny, apple, shirt yellow
9879, angry cute, tvhead purple, bandana purple
9880, ditto, deepsea bronze, costume gorilla
9881, dizzy, beanie blue, monk
9882, beard pirate, ninja blue, cowboy brown
9883, rich, antlers, tshirt green
9884, smirk, mohawk red, ninja blue
9885, sunglasses squad, sunhat black, tshirt pink
9886, ninja red, hat visor blue, overalls blue
9887, happy, pirate red, overalls red
9888, rich, pirate black, baseball blue
9889, three eyes, top hat, knight
9890, sunglasses blue, flower red, buttondown black flannel
9891, double face, hat visor yellow, buttondown black flannel
9892, glossy, candle, shirt white
9893, rich, horns, pirate black
9894, hearts, hat white, tanktop orange
9895, sunglasses cool, flower red, sweater green chain
9896, dizzy, ninja blue, bandana green
9897, ninja blue, bucket hat green, tanktop white
9898, mummy, ninja red, sweater green chain
9899, smirk, sunhat black, costume gorilla
