id, body, eyes, mouth, hat, clothes, earring
0, Black, Round Glasses, Buck Teeth, Hat 1, Ay Sailor, 
1, Beige, Dontsee, What, Rabbit, , Silver 2
2, Woke From Dead, Pressure, Whatever, Service, Ymca, 
3, Checkered, Notfunny, Say Aah, , Moon, Silver 2
4, Brown, Undead, Whatever, Have Fun 1, , 
5, Holo Rainbow, Multilevel, What, , , 
6, Brown, Pirate, Dangerous Smoke 3, Trendy 1, Blank, 
7, Light Brown, Nothappy Longer, Argh, Whereiswhale, Vest, 
8, Lady, Pressure, Whatever, Catch Robbers, , 
9, Light Brown, Reality, Meh, , Onthesea, 
10, Black, Money, Now, Whalehunter 1, Rappers, 
11, Bloodbath, Notfunny, Meh, Manbun, Robinson, 
12, Dark Brown, Nothappy Longer, Scowl, , Nowar, 
13, Light Brown, Nothappy, Meh, Whereiswhale, Preshistoric, 
14, Black, Love, Say Aah, Whalehunter 2, Cuba, Silver 2
15, Lady, Dontsee, Whatever, Fetish, Fishnet Top, 
16, Africa Animal, Dead, What, , Nowar, 
17, Brown, Devourer, Now, Service, Praetexta, 
18, Black, Dontsee, Meh, Trendy 1, Robinson, Silver 2
19, Light Brown, Notfunny, Sounds, Whereiswhale, , 
20, Nature, Round Glasses, What, Small Child, , Silver 2
21, Beige, Puppy Dog, Meh Dangerous Smoke 1, Headset, Weapon Belt, 
22, Dark Brown, Money, Say Aah, Have Fun 1, Ymca, 
23, Bloodbath, Undead, Argh, Prison, , 
24, Grey, Nothappy Longer, Whatever, Hat 3, Blank, 
25, Light Brown, Notfunny, Meh, Have Fun 1, , 
26, Black, Nothappy Longer, Dangerous Smoke 2, Prison, Overalls, 
27, Gotsun, Notfunny, Moo, Warhat 2, Wifeshirt 1, 
28, Candy Cane, Love, Meh Dangerous Smoke 2, Jesus Alive, Nofire, Silver 1
29, Bloodbath, See Stuff, Dangerous Smoke 2, Hat 3, , 
30, Machine, Nothappy, Whatever, Winter Hat, Alcatraz, Gold 1
31, Dark Brown, Money, What, Headset, Honololu, 
32, Brown, Notfunny, Meh Sounds, Comrade, Vest, 
33, Black, Reality, Say Aah, , Piercings, Silver 1
34, Holo Rainbow, Nothappy, Dangerous Smoke 2, Leprechaun, Overalls, 
35, Africa Animal, Pressure, Meh Sounds, Cat Ears, Piercings, Gold 1
36, Black, Future, Meh, Warhat 1, Honololu, 
37, Candy Cane, Money, Say Aah, , Fashion Accesory, Gold 1
38, Beige, Bed, Funny, , Hipster Shirt, 
39, Lady, Blocksun, What, , Not A Suit, 
40, Machine, Dontlook, Argh, Prison, Make Fire, 
41, Beige, Love, Meh, Whalehunter 2, Piercings, 
42, Nature, Pressure, Dangerous Smoke 2, Devil, Nofire, Silver 2
43, Light Brown, See Stuff, Yesplease, , Wifeshirt 2, 
44, Vector, Multilevel, Dangerous Smoke 2, Visor Hat, Broken, Silver 1
45, Grey, Pirate, Meh Dangerous Smoke 1, Prison, Make Fire, 
46, Light Brown, Reality, What, , Hipsterneck, 
47, Black, Puppy Dog, Whatever, Whalehunter 2, Nowar, 
48, Lady, Not Nice, Moo, Prison, , 
49, Brown, Notfunny, Sounds, Punk Short, Blank, Gold 2
50, Africa Animal, Multilevel, Dangerous Smoke 1, Whalehunter 1, Cycle, 
51, Blue, Pressure, Nofeelingwell, Hat 2, Great T-Shirt, 
52, Dark Brown, Undead, Whatever, Warhat 1, Robinson, 
53, Beige, Notfunny, Rainbow, , , 
54, Gotsun, See Stuff, Meh, Prison, Overalls, 
55, Machine, Dontsee, Rainbow, , Sweet Jacket, Silver 2
56, Color Dots, Notfunny, Whatever, Whalehunter 1, Honololu, Gold 1
57, Light Brown, Reality, What, Prison, Hippy, Silver 1
58, Dark Brown, Round Glasses, Whatever, Fetish, Rappers, Silver 2
59, Candy Cane, Bed, Meh, , , Stretched
60, Light Brown, See Stuff, Argh, Whereiswhale, Ymca, 
61, Black, Pressure, Dangerous Smoke 1, Prison, Knight Armor, 
62, Grey, Bed, Meh, Cook, Ymca, Silver 1
63, Brown, Round Glasses, What, Whereiswhale, Overalls, Silver 2
64, Light Brown, See Stuff, Whatever, Whereisgiraffe, Lingerie, 
65, Lady, Nothappy, Say Aah, , Vest, Silver 1
66, Woke From Dead, Money, What, Punk Short, Multicolor, 
67, Bloodbath, Bed, Meh Food, , , 
68, Albino, Notfunny, Whatever, Warhat 1, Preshistoric, Ear Cuff
69, Brown, Machine, Moo, Warhat 2, Ymca, 
70, Black, Bed, Meh Blow Bubble, , Cycle, 
71, Acid, Notfunny, Whatever, Prison, Trash, 
72, Africa Animal, Multilevel, Nofeelingwell, , Wifeshirt 2, 
73, Dark Brown, Notfunny, No Teeth, Comrade, Moon, 
74, Lady, Monocle, Whatever, Have Fun 2, Gentleman, 
75, Grey, Pressure, Higschool, Service, , 
76, Checkered, See Stuff, Moo, Hidehairs, Weapon Belt, 
77, Albino, Dead, Nofeelingwell, , Hoodie Red, 
78, Grey, Machine, Meh Dangerous Smoke 2, , Overalls, 
79, Beige, Blocksun, Scowl, Prison, Blazer Black, 
80, Machine, Pirate, Rainbow, Have Fun 2, Hipsterneck, Multiple
81, Black, Future, Meh, Whereiswhale, Hipster Shirt, 
82, Woke From Dead, Bed, What, Trendy 1, Preshistoric, Silver 1
83, Brown, Monocle, Whatever, Side Shave, Trash, 
84, Beige, Round Glasses, Moo, Prison, , 
85, Machine, Nothappy, Meh, Whalehunter 1, Multicolor, Ear Cuff
86, Light Brown, Blocksun, Whatever, Whereiswhale, Not A Suit, 
87, Bloodbath, See Stuff, Meh Blow Bubble, Whereisgiraffe, , 
88, Brown, Dontlook, Moo, Whalehunter 2, Ay Sailor, Silver 2
89, Checkered, Nothappy, Whatever, Manbun, Nowar, 
90, Grey, Notfunny, Meh, Rabbit, Ay Sailor, 
91, Beige, Bed, Whatever, Small Child, Praetexta, 
92, Dark Brown, Future, Meh Sounds, Warhat 2, , 
93, Africa Animal, Bed, Whatever, Trendy W 2, Blank, 
94, No Signal, Nothappy Longer, Moo, Punk Short, Cycle, 
95, Dark Brown, Bed, Meh, Warhat 1, Not A Suit, 
96, Lady, Pressure, Nofeelingwell, Prison, Fashion Accesory, Gold 2
97, Beige, Future, Meh, Hiiya, Overalls, Multiple
98, Brown, Notfunny, Dangerous Smoke 2, , Ymca, 
99, Machine, Not Nice, Moo, , , Gold 2
100, Red, Pressure, Funny, Whalehunter 2, Hippy, 
101, Bloodbath, Notfunny, Rainbow, Side Shave, Honololu, 
102, Black, Round Glasses, Now, Whereiswhale, Lingerie, Gold 2
103, Neon Glow, Devourer, Whatever, Hiiya, Ymca, 
104, Red, Round Glasses, Nofeelingwell, Rabbit, Rappers, 
105, Grey, Blocksun, Whatever, Leprechaun, Moon, 
106, Brown, Notfunny, Meh Dangerous Smoke 2, , Hirewomen, 
107, Holo Rainbow, Pressure, Meh, , , 
108, Dark Brown, Nothappy Longer, Whatever, Prison, Alcatraz, 
109, Black, Pirate, Food, Trendy W 2, Trench, 
110, Africa Animal, Puppy Dog, Meh, Whereiswhale, Fashion Accesory, 
111, Dark Brown, Bed, Whatever, Manbun, Piercings, 
112, Beige, Notfunny, Dangerous Smoke 1, Whalehunter 1, Praetexta, 
113, Checkered, Nothappy, Meh Dangerous Smoke 3, Punk Short, Vest, Silver 2
114, Light Brown, See Stuff, Whatever, , Knight Armor, 
115, Albino, Not Nice, Yesplease, , Preshistoric, 
116, Brown, Pressure, Food, Punk Short, Cool T-Shirt, 
117, Lady, Dontsee, Higschool, Leprechaun, Ay Sailor, 
118, Dark Brown, Dead, Yesplease, , Praetexta, Ear Cuff
119, Lady, Money, Meh Dangerous Smoke 1, Mafia, Overalls, Silver 1
120, Neon Glow, Monocle, Meh Blow Bubble, , Nowar, Ear Cuff
121, Red, Dead, Dangerous Smoke 2, Mafia, Hipsterneck, 
122, Dark Brown, Future, Whatever, Antique, Costume Old, Silver 1
123, Grey, Notfunny, What, , Ay Sailor, Gold 1
124, Blue, Pew, Argh, Whereiswhale, Wifeshirt 2, 
125, Black, Bed, Say Aah, Cat Ears, Vest, 
126, Light Brown, Undead, Whatever, Comrade, Piercings, 
127, Black, Money, No Teeth, War Helmet, Onthesea, Silver 2
128, Holo Rainbow, Pressure, Meh Dangerous Smoke 2, Visor Hat, Trash, 
129, Machine, Nothappy, Moo, Jesus Alive, Ok, 
130, Vector, Not Nice, Meh, , Overalls, 
131, Red, See Stuff, Meh Dangerous Smoke 2, Prison, Cycle, 
132, Candy Cane, Pressure, Meh, , , Silver 1
133, Brown, Not Nice, Dangerous Smoke 3, , Overalls, Stretched
134, Color Dots, Machine, Meh, Whalehunter 1, Not A Suit, 
135, Beige, Pirate, Whatever, , Trench, Gold 1
136, Albino, Reality, Dangerous Smoke 2, Whereisgiraffe, Ay Sailor, 
137, Beige, Notfunny, Bling, Mafia, Poncho, 
138, Dark Brown, Pressure, Scowl, Leprechaun, Robinson, Jesus
139, Red, Multilevel, Meh, , Overalls, 
140, Dark Brown, Undead, Nofeelingwell, Winter Hat, Vest, Silver 1
141, Black, Notfunny, Whatever, Jesus Alive, Trash, 
142, Woke From Dead, Dead, Moo, Punk Short, , 
143, Gotsun, Pressure, Whatever, , Ok, 
144, Red, Notfunny, Gold Bling, Rabbit, , Gold 2
145, Woke From Dead, Pressure, Whatever, Hiiya, Gentleman, Multiple
146, Gotsun, Round Glasses, What, Whalehunter 2, Hipsterneck, 
147, Africa Animal, Puppy Dog, Moo, Catch Robbers, Rock, 
148, Beige, Pressure, What, Service, Praetexta, 
149, Dark Brown, Dontlook, Moo, Hippy Hat, , Jesus
150, Gotsun, Notfunny, What, Comrade, Hipsterneck, 
151, Stars And Stripes, Machine, Argh, Whalehunter 1, , Gold 2
152, Lady, Blocksun, Meh, Hiiya, Nowar, 
153, Dark Brown, Money, Whatever, , Blazer Black, Silver 1
154, Albino, Multilevel, Argh, Punk Short, Hirewomen, 
155, Gotsun, Bed, Meh Dangerous Smoke 2, Comrade, Piercings, Gold 2
156, Brown, Pirate, Moo, , Preshistoric, 
157, Dark Brown, Notfunny, Meh, Trendy 1, Trench, 
158, Beige, Love, Moo, Cat Ears, Rock, 
159, Black, Notfunny, Whatever, , , 
160, Dark Brown, Blocksun, Hipster Stache, Comrade, , 
161, Red, Nothappy Longer, Whatever, Whalehunter 2, Hipsterneck, Gold 1
162, Light Brown, Pressure, Meh, Rabbit, Cuba, 
163, Beige, Machine, Whatever, , Gentleman, Multiple
164, Machine, Dontsee, Now, Hiiya, Hipsterneck, 
165, Dark Brown, Notfunny, Scowl, Trick Hat, Wifeshirt 2, 
166, Woke From Dead, Multilevel, Whatever, Fetish, Lingerie, Silver 1
167, Brown, Money, Rainbow, Hiiya, Bang Bang, 
168, Light Brown, Undead, Moo, Hat 2, Honololu, 
169, Red, Nothappy, Whatever, Whereiswhale, Cycle, 
170, Black, Pressure, Meh, Visor Hat, , 
171, Easter Egg, Multilevel, Moo, Prison, Hipster Shirt, 
172, Dark Brown, Notfunny, Nofeelingwell, , , Silver 2
173, Black, Pressure, Whatever, Side Shave, Not A Suit, 
174, Grey, Multilevel, Argh, Have Fun 2, , 
175, Gotsun, Notfunny, Meh, , Hippy, 
176, Black, Pressure, Whatever, Whalehunter 2, Sweet Jacket, 
177, Machine, Dead, Yesplease, Mafia, Trench, Gold 1
178, Black, Nothappy Longer, Dangerous Smoke 2, Notsmart, Piercings, 
179, Brown, Bed, Bling, Punk Short, Ay Sailor, 
180, Grey, See Stuff, Yesplease, , Rappers, 
181, Dark Brown, Not Nice, Whatever, Whereiswhale, Trash, 
182, Grey, Pressure, Dangerous Smoke 2, Trick Hat, , Silver 2
183, Woke From Dead, Notfunny, Moo, Leprechaun, Moon, 
184, Light Brown, Pressure, Whatever, Service, Cycle, Silver 1
185, Candy Cane, See Stuff, Moo, , , Jesus
186, Black, Bed, Whatever, Catch Robbers, Broken, 
187, Africa Animal, Dontsee, Hipster Stache, Trick Hat, Hipsterneck, 
188, Red, See Stuff, Dangerous Smoke 2, Jesus Alive, Blank, Gold 2
189, Albino, Blocksun, Funny, Whalehunter 2, , 
190, Black, Pressure, What, Fetish, Rock, 
191, Light Brown, Notfunny, Moo, Whalehunter 2, Nowar, Silver 2
192, Candy Cane, See Stuff, Say Aah, Leprechaun, Cool T-Shirt, 
193, Light Brown, Puppy Dog, Dangerous Smoke 1, Prison, Bang Bang, Silver 2
194, Brown, Nothappy, Meh, Service, Bringcash, 
195, Black, Multilevel, Argh, Whalehunter 1, Vest, Silver 1
196, Gotsun, Dontsee, Whatever, Hat 2, , 
197, Color Dots, Round Glasses, Dangerous Smoke 2, Small Child, Praetexta, Gold 1
198, Black, Dead, Argh, Hat 1, Poncho, 
199, Brown, Bed, Funny, Prison, , 
200, Nature, Notfunny, Scowl, Trendy 1, Gentleman, 
201, Beige, Pressure, Say Aah, Mafia, Onthesea, 
202, Stars And Stripes, Not Nice, Scowl, Devil, , 
203, Lady, Multilevel, Meh, Whereiswhale, Broken, 
204, Bloodbath, Devourer, Blow Bubble, Rabbit, , Silver 1
205, Gotsun, Pressure, Meh, , Preshistoric, 
206, Black, Dead, Argh, Service, , 
207, Candy Cane, Snake, Whatever, Trendy 1, Hipster Shirt, 
208, Black, Multilevel, Dangerous Smoke 2, Trick Hat, Praetexta, 
209, Red, Dontlook, Whatever, Service, Cycle, Ear Cuff
210, Black, Notfunny, Meh, Visor Hat, Ay Sailor, 
211, Grey, Monocle, Now, Punk Short, , 
212, Brown, Devourer, Meh, Antique, , 
213, Black, Money, Blow Bubble, Whalehunter 2, Gentleman, 
214, Beige, Multilevel, Whatever, Trendy 2, Hippy, 
215, Brown, Pressure, Meh, Whereiswhale, Robinson, Gold 1
216, Dark Brown, Dead, Now, Punk Short, Honololu, 
217, Blue, Nothappy, Moo, Trendy 1, Rappers, 
218, Black, Dontlook, Meh, , Costume Old, 
219, Lady, Pirate, Meh Dangerous Smoke 2, Small Child, Nowar, 
220, Holo Rainbow, Puppy Dog, Meh Sounds, , Wifeshirt 1, 
221, Brown, Nothappy Longer, Meh, , Ay Sailor, 
222, Holo Rainbow, Bed, Whatever, Trendy W 2, Praetexta, 
223, Lady, Pressure, Now, Service, Piercings, 
224, Brown, Multilevel, Whatever, Headset, , 
225, Void, Pressure, Scowl, , Not A Suit, 
226, Red, Puppy Dog, Dangerous Smoke 2, Devil, Trash, Gold 2
227, Dark Brown, Notfunny, Meh, Service, Honololu, 
228, Machine, Pressure, Rainbow, Whalehunter 2, Hipsterneck, 
229, Dark Brown, Nothappy, Whatever, Have Fun 1, Hoodie Red, Multiple
230, Light Brown, Reality, Now, Whalehunter 1, Cuba, Ear Cuff
231, Lady, See Stuff, Meh, Leprechaun, Bringcash, 
232, Brown, Not Nice, Meh Dangerous Smoke 2, Devil, Ay Sailor, 
233, Light Brown, See Stuff, Say Aah, Good Idea, Blazer Black, 
234, Blue, Puppy Dog, Meh, Whalehunter 1, , Ear Cuff
235, Africa Animal, Notfunny, Whatever, Have Fun 2, Make Fire, 
236, Brown, Money, Dangerous Smoke 2, Whalehunter 1, Ymca, 
237, Blue, Dontlook, Meh Blow Bubble, Have Fun 2, Robinson, Silver 1
238, Candy Cane, Pressure, Meh Dangerous Smoke 2, Whalehunter 2, Vest, 
239, Light Brown, Undead, What, Comrade, Hipsterneck, 
240, Brown, Notfunny, Blow Bubble, Rabbit, , 
241, Candy Cane, Multilevel, Scowl, , Praetexta, Gold 2
242, Easter Egg, Notfunny, Whatever, , Ok, 
243, Woke From Dead, Pirate, Meh, Hiiya, Fishnet Top, 
244, Blue, Notfunny, Knife, Trendy 1, Great T-Shirt, Gold 2
245, Light Brown, See Stuff, Meh, Whereiswhale, Vest, Silver 1
246, Red, Nothappy, What, , Rappers, 
247, Gotsun, Money, Yesplease, Prison, Not A Suit, 
248, Brown, Blocksun, Nofeelingwell, Jesus Alive, Fashion Accesory, 
249, Black, Dontlook, Dangerous Smoke 2, , Hirewomen, 
250, Grey, Nothappy Longer, Whatever, Devil, Cycle, Silver 1
251, Gotsun, Pressure, Meh, Winter Hat, Praetexta, Ear Cuff
252, Light Brown, Money, Moo, Punk Short, Ymca, 
253, Void, Bed, Meh, , , Gold 1
254, Lady, Reality, Rainbow, Hidehairs, Overalls, 
255, Holo Rainbow, Bed, Meh Dangerous Smoke 2, Punk Short, Rappers, Silver 1
256, Dark Brown, Notfunny, Funny, Cat Ears, Ay Sailor, 
257, Light Brown, Bed, Meh, , Moon, Silver 1
258, Bad Machine, Machine, Whatever, Trick Hat, Wifeshirt 2, 
259, Color Dots, Nothappy Longer, Nofeelingwell, Whalehunter 2, Trash, Silver 2
260, Blue, Notfunny, Whatever, Prison, , 
261, Beige, See Stuff, Dangerous Smoke 2, Hippy Hat, Nowar, 
262, Grey, Multilevel, Whatever, Whalehunter 2, Cycle, Ear Cuff
263, Void, Round Glasses, Scowl, , , Multiple
264, Beige, Love, Now, Devil, Gentleman, Silver 2
265, Dark Brown, Bed, No Teeth, , Overalls, 
266, Albino, Notfunny, Dangerous Smoke 2, Jesus Alive, Wifeshirt 2, 
267, Gotsun, Blocksun, Meh, Whereisgiraffe, , Gold 2
268, Light Brown, Pirate, Meh Dangerous Smoke 2, Whalehunter 2, Nowar, Multiple
269, Albino, Puppy Dog, Yesplease, Trendy 1, , Gold 1
270, Black, Love, Moo, Cat Ears, Blank, 
271, Brown, See Stuff, Dangerous Smoke 2, Cook, , Silver 1
272, Light Brown, Pressure, Whatever, Have Fun 1, Weapon Belt, 
273, Acid, Reality, Moo, , , 
274, Light Brown, Monocle, Scowl, , Poncho, Ear Cuff
275, Easter Egg, Devourer, Whatever, Hat 3, , 
276, Vector, Notfunny, Moo, , Piercings, 
277, Light Brown, Not Nice, Now, Trendy 1, Chemist, 
278, Dark Brown, Money, What, Hiiya, , Multiple
279, Brown, Notfunny, Whatever, Trendy 1, Trash, 
280, Red, Love, Meh Dangerous Smoke 2, Jesus Alive, Vegas Dancer, 
281, No Signal, Bed, Whatever, Notsmart, , 
282, Brown, Notfunny, No Teeth, Fetish, Hippy, Silver 2
283, Beige, Pirate, Whatever, , Trash, 
284, Light Brown, Notfunny, Buck Teeth, Prison, Nofire, 
285, Beige, Dead, Whatever, , Trash, 
286, Light Brown, Bed, Meh, Whalehunter 1, Alcatraz, 
287, Woke From Dead, Not Nice, Whatever, Headset, Rock, 
288, Candy Cane, Notfunny, Scowl, Hat 3, Cuba, 
289, Black, Bed, Whatever, , Robinson, 
290, Brown, Dontsee, No Teeth, Notsmart, Hipsterneck, 
291, No Signal, Bed, Gold Bling, Whalehunter 2, , 
292, Red, Dontsee, Meh, Winter Hat, Hipster Shirt, 
293, Blue, See Stuff, Dangerous Smoke 3, Whereisgiraffe, Blank, Multiple
294, Albino, Money, Gold Bling, War Helmet, Onthesea, 
295, Brown, See Stuff, Moo, Whalehunter 1, Sweet Jacket, 
296, Grey, Blocksun, Higschool, , , Silver 2
297, Bloodbath, Multilevel, Nofeelingwell, Trendy W 1, , 
298, Machine, Notfunny, Meh, , , 
299, Dark Brown, Bed, Whatever, Prison, Make Fire, 
300, Woke From Dead, Pirate, Moo, Rule All, , 
301, Blue, Nothappy Longer, Dangerous Smoke 2, Winter Hat, , 
302, Light Brown, Blocksun, Scowl, , , 
303, Dark Brown, Round Glasses, Whatever, Catch Robbers, Hipsterneck, 
304, Brown, Reality, Say Aah, Jesus Alive, Cycle, 
305, Light Brown, Nothappy Longer, Whatever, Cook, Poncho, 
306, Beige, Notfunny, Meh Dangerous Smoke 3, Mafia, Wifeshirt 2, 
307, Grey, Pressure, Meh, , Poncho, 
308, Brown, See Stuff, Moo, Trendy 1, Wifeshirt 2, 
309, Light Brown, Notfunny, Meh, Prison, Sweet 16, 
310, Gotsun, See Stuff, Scowl, Trendy W 2, Wifeshirt 1, Jesus
311, Dark Brown, Notfunny, Moo, Headset, Nowar, 
312, Beige, Monocle, Argh, , Honololu, Silver 1
313, No Signal, Money, Whatever, Rule All, , 
314, Brown, Dontsee, Dangerous Smoke 1, , Cycle, 
315, Gotsun, Blocksun, Whatever, Whereiswhale, Preshistoric, Silver 2
316, Dark Brown, Notfunny, Say Aah, War Helmet, , 
317, Checkered, Pressure, Whatever, Mafia, Fashion Accesory, 
318, Bloodbath, Pirate, Say Aah, , , Silver 1
319, Africa Animal, Nothappy Longer, Funny, Jesus Alive, Cycle, 
320, Black, Not Nice, Dangerous Smoke 2, , Bringcash, 
321, Africa Animal, See Stuff, What, Comrade, Alcatraz, 
322, Dark Brown, Puppy Dog, Argh, Whereiswhale, Wifeshirt 2, 
323, Brown, Monocle, Moo, Trick Hat, , 
324, Woke From Dead, Bed, Say Aah, Leprechaun, Chemist, 
325, Gotsun, Notfunny, Meh Dangerous Smoke 2, Whereiswhale, Great T-Shirt, 
326, Dark Brown, Money, Dangerous Smoke 2, Cook, Gentleman, 
327, Brown, Pirate, Knife, Hiiya, Blank, 
328, Beige, Bed, Gold Bling, Headset, Not A Suit, 
329, Light Brown, Notfunny, Whatever, Jesus Alive, Hipster Shirt, Gold 1
330, Bloodbath, Nothappy Longer, Argh, Side Shave, , Silver 2
331, Black, Snake, Meh, Devil, Poncho, 
332, Neon Glow, Notfunny, Dangerous Smoke 2, , Wifeshirt 2, 
333, Beige, Blocksun, Meh Dangerous Smoke 3, Hippy Hat, , Silver 2
334, Gotsun, Money, Meh Dangerous Smoke 2, Hiiya, Blank, 
335, Brown, Notfunny, Say Aah, Trendy W 1, Chemist, 
336, Nature, Puppy Dog, Buck Teeth, Good Idea, Hipsterneck, 
337, Light Brown, Love, Argh, Winter Hat, Poncho, Silver 1
338, No Signal, Multilevel, Meh, Hat 2, , 
339, Light Brown, Puppy Dog, Whatever, Prison, , 
340, Albino, See Stuff, Yesplease, , Onthesea, Silver 2
341, Brown, Bed, Say Aah, Whereisgiraffe, Bringcash, 
342, Gotsun, Money, Whatever, Comrade, Ymca, 
343, Acid, Notfunny, Say Aah, Winter Hat, , 
344, Checkered, Nothappy, Meh, Hiiya, , Multiple
345, Gotsun, Monocle, Yesplease, Trendy 1, Broken, 
346, Brown, Notfunny, Whatever, Prison, Make Fire, 
347, Void, Round Glasses, Meh, Jesus Alive, Rock, 
348, Lady, Monocle, Argh, Visor Hat, Alcatraz, 
349, Black, See Stuff, Moo, Winter Hat, Hoodie Red, Silver 2
350, Light Brown, Pressure, Meh, , Trench, Silver 1
351, Red, Devourer, Scowl, Service, Weapon Belt, 
352, Beige, Blocksun, Whatever, Rabbit, Piercings, 
353, Dark Brown, Notfunny, Moo, Hiiya, Wifeshirt 1, 
354, Black, Devourer, Meh, Whereisgiraffe, Sweet 16, Multiple
355, Blue, Reality, Dangerous Smoke 2, Whalehunter 1, Weapon Belt, 
356, Black, Money, Moo, Service, Fishnet Top, Multiple
357, Beige, Nothappy, Whatever, Comrade, Hipsterneck, Silver 2
358, Lady, Notfunny, Nofeelingwell, , Shirt Of Flames, 
359, Africa Animal, Pressure, Say Aah, Trendy 1, Sweet Jacket, 
360, Dark Brown, Nothappy Longer, What, Leprechaun, Hoodie Red, Silver 1
361, Easter Egg, Bed, Bling, , , 
362, Color Dots, Dontsee, Say Aah, Hidehairs, Praetexta, Silver 1
363, Albino, Notfunny, Funny, Catch Robbers, Trash, 
364, Beige, Bed, Meh, , Rappers, Silver 1
365, Blue, Nothappy, Moo, Cook, Wifeshirt 2, 
366, Light Brown, Puppy Dog, Whatever, Trendy 1, Ymca, 
367, Grey, See Stuff, Dangerous Smoke 2, Visor Hat, Bang Bang, 
368, Color Dots, Undead, Bling, Leprechaun, , Silver 1
369, Machine, Round Glasses, Meh, Small Child, Great T-Shirt, Silver 2
370, Black, Blocksun, Whatever, Antique, Bringcash, Multiple
371, Neon Glow, Machine, Meh, Punk Short, Rappers, Silver 1
372, Grey, Money, Moo, , , 
373, Void, Bed, Scowl, , , 
374, Red, Blocksun, Meh, Trendy W 2, Hipsterneck, 
375, Light Brown, See Stuff, Scowl, Visor Hat, , 
376, Woke From Dead, Pressure, Whatever, Hidehairs, Fishnet Top, 
377, Brown, Reality, What, , Vegas Dancer, 
378, Beige, Future, Meh, , Blank, 
379, Nature, Bed, Whatever, Hat 2, , Silver 1
380, Red, Dontsee, Dangerous Smoke 3, Comrade, Praetexta, 
381, Color Dots, Notfunny, Whatever, , Fashion Accesory, 
382, Brown, See Stuff, Moo, Devil, Not A Suit, Ear Cuff
383, Neon Glow, Pirate, What, Leprechaun, Sweet Jacket, 
384, Light Brown, Not Nice, Meh, Hiiya, Broken, 
385, Beige, Dontsee, Whatever, Leprechaun, Lingerie, Ear Cuff
386, Africa Animal, Pirate, Meh Dangerous Smoke 2, Devil, Robinson, 
387, Neon Glow, Lazer, Dangerous Smoke 1, , Overalls, Gold 2
388, Grey, Notfunny, Scowl, Whereisgiraffe, Vegas Dancer, 
389, Au, See Stuff, Hipster Stache, , Ay Sailor, 
390, Light Brown, Dontsee, Meh, Trendy 2, , 
391, Dark Brown, See Stuff, Meh Dangerous Smoke 2, Jesus Alive, Weapon Belt, 
392, Checkered, Dontsee, Meh, , Fashion Accesory, Multiple
393, Blue, Bed, What, Small Child, , Gold 2
394, Brown, Devourer, Meh, Trendy W 2, Onthesea, 
395, Dark Brown, Dontsee, Now, , Nowar, 
396, Easter Egg, Machine, Whatever, Hiiya, Chemist, Silver 2
397, Dark Brown, Pressure, Now, Rabbit, Rock, Jesus
398, Brown, Snake, Moo, , , 
399, Black, See Stuff, Dangerous Smoke 3, Fetish, , Silver 2
400, Dark Brown, Pressure, Meh Dangerous Smoke 2, Cat Ears, Bringcash, 
401, Grey, Love, Dangerous Smoke 2, Trendy 1, Nofire, 
402, Albino, Nothappy, Moo, , Hipsterneck, 
403, Brown, Multilevel, Meh, Punk Short, , 
404, Dark Brown, See Stuff, Dangerous Smoke 2, Mafia, Blank, 
405, Blue, Notfunny, Food, Have Fun 1, Cycle, 
406, Beige, Multilevel, Dangerous Smoke 3, Hat 3, Blank, Multiple
407, Dark Brown, Love, Moo, Trendy W 1, Alcatraz, 
408, Grey, Nothappy Longer, Dangerous Smoke 2, Trick Hat, Preshistoric, 
409, Gotsun, Nothappy, Argh, Prison, Lingerie, Ear Cuff
410, Dark Brown, Notfunny, No Teeth, , Onthesea, 
411, Candy Cane, Nothappy, What, Hat 3, , Silver 2
412, Grey, Monocle, Whatever, Small Child, Ay Sailor, 
413, Black, Notfunny, Argh, Hippy Hat, Trench, 
414, Vector, Pressure, Gold Bling, Whalehunter 1, Gentleman, Ear Cuff
415, Albino, Bed, What, , Shirt Of Flames, 
416, Light Brown, Undead, Meh, Trendy 2, , 
417, Brown, Dead, Blow Bubble, Service, Blank, 
418, Bloodbath, Love, Yesplease, , , 
419, Light Brown, Future, Say Aah, , Great T-Shirt, Ear Cuff
420, Albino, Dontsee, Bling, Jesus Alive, Bringcash, 
421, Color Dots, Lazer, What, , Nofire, 
422, Albino, Pirate, Yesplease, Trendy W 1, Trench, Gold 1
423, Beige, Notfunny, Dangerous Smoke 1, Trendy W 2, Nofire, 
424, Black, Multilevel, Say Aah, , Cuba, Silver 1
425, Blue, Money, Meh Dangerous Smoke 3, , Ymca, 
426, Brown, Notfunny, Yesplease, Antique, Great T-Shirt, 
427, Black, Nothappy, Dangerous Smoke 2, , Sweet Jacket, 
428, Blue, Notfunny, Meh, , Make Fire, 
429, Light Brown, Undead, Whatever, , Ymca, 
430, Neon Glow, Round Glasses, Argh, , Hipster Shirt, Multiple
431, Light Brown, Notfunny, Bling, , Bringcash, Silver 2
432, Brown, Puppy Dog, Meh Dangerous Smoke 2, Hiiya, Weapon Belt, 
433, Candy Cane, Bed, Meh, Have Fun 1, , Multiple
434, Machine, Love, Dangerous Smoke 2, , Wifeshirt 2, Silver 1
435, Woke From Dead, Undead, Meh, War Helmet, , Gold 1
436, Bloodbath, Reality, Hipster Stache, Hiiya, , Silver 2
437, Brown, Nothappy Longer, Moo, Trendy 1, Not A Suit, 
438, Black, Pressure, Meh, , Honololu, 
439, Light Brown, Machine, Dangerous Smoke 2, Cat Ears, , Ear Cuff
440, Gotsun, Pressure, Moo, Trendy 1, Vegas Dancer, 
441, Grey, Machine, Dangerous Smoke 1, Punk Short, Chemist, Silver 2
442, Black, Reality, What, , Hoodie Red, Gold 1
443, Dark Brown, Bed, Dangerous Smoke 1, Trendy 1, , 
444, Easter Egg, Machine, Meh Dangerous Smoke 1, Warhat 2, Make Fire, 
445, Woke From Dead, Pressure, Whatever, Cook, Honololu, 
446, Light Brown, Puppy Dog, Bling, Visor Hat, Make Fire, 
447, Brown, Nothappy, Meh, , Vest, 
448, Red, Monocle, Dangerous Smoke 3, War Helmet, Blazer Black, 
449, Grey, Undead, Whatever, , Rappers, 
450, Bloodbath, Future, Hipster Stache, Prison, , 
451, Dark Brown, Nothappy Longer, Meh Blow Bubble, Service, Multicolor, Gold 2
452, Black, Dontsee, Now, Hidehairs, Piercings, Silver 2
453, Blue, Devourer, Meh Dangerous Smoke 2, , Poncho, 
454, Woke From Dead, Notfunny, Say Aah, , Fashion Accesory, 
455, Beige, Devourer, Whatever, Prison, , Silver 2
456, Gotsun, Multilevel, Meh Dangerous Smoke 2, Warhat 1, Vest, 
457, Brown, Dontlook, Meh, Hat 1, , 
458, Gotsun, Nothappy Longer, Yesplease, Have Fun 1, Praetexta, 
459, Red, Bed, Funny, Cat Ears, , 
460, Albino, Pew, Meh, Service, Trash, 
461, Machine, Snake, Whatever, Cook, Cuba, 
462, Blue, Notfunny, Moo, , Vegas Dancer, 
463, Checkered, Undead, Argh, , Sweet Jacket, 
464, Machine, Puppy Dog, Whatever, , Honololu, 
465, Holo Rainbow, Dontsee, Meh Dangerous Smoke 2, , Wifeshirt 2, 
466, Color Dots, Machine, Meh, , , 
467, Dark Brown, Notfunny, Whatever, Trendy 1, Ay Sailor, Silver 2
468, Machine, Money, Meh, Cat Ears, Piercings, 
469, Albino, Nothappy, No Teeth, , Fashion Accesory, 
470, Neon Glow, Notfunny, Meh, Prison, Wifeshirt 2, 
471, Brown, Round Glasses, Whatever, , Hipster Shirt, 
472, Light Brown, Dontlook, Now, , Rappers, Silver 2
473, Albino, Multilevel, Meh, Notsmart, , 
474, Woke From Dead, Puppy Dog, Dangerous Smoke 3, Comrade, Preshistoric, Ear Cuff
475, Africa Animal, Notfunny, Buck Teeth, Whereiswhale, Hoodie Red, Silver 1
476, Brown, Bed, Moo, Hat 3, Poncho, 
477, Beige, Notfunny, Say Aah, , , 
478, Void, Dontlook, Moo, , Not A Suit, 
479, Checkered, Round Glasses, Meh, Hat 1, Nowar, 
