962, Dark Brown, Money, Dangerous Smoke 2, , Broken, Silver 1
963, Easter Egg, Pressure, Scowl, Hiiya, Ay Sailor, Silver 2
964, Black, Nothappy Longer, Whatever, Prison, Vegas Dancer, 
965, Woke From Dead, Dontsee, Meh, Whereisgiraffe, Bringcash, 
966, Easter Egg, Pressure, Yesplease, , , 
967, Black, Nothappy, Whatever, Leprechaun, Bringcash, 
968, Gotsun, Blocksun, Say Aah, , , 
969, Brown, Multilevel, Dangerous Smoke 2, Service, Fashion Accesory, 
970, Gotsun, Notfunny, Meh, Hat 3, Rappers, Silver 1
971, Grey, Money, Meh Dangerous Smoke 2, Jesus Alive, Piercings, 
972, Nature, Pew, Meh Knife, Prison, , 
973, Black, Machine, Dangerous Smoke 2, Jesus Alive, Knight Armor, 
974, Dark Brown, See Stuff, Funny, Whalehunter 1, Cuba, Silver 2
975, Black, Dontlook, Dangerous Smoke 3, Prison, Not A Suit, 
976, Brown, Multilevel, Meh Dangerous Smoke 2, Leprechaun, Alcatraz, 
977, Easter Egg, Nothappy, Funny, Jesus Alive, Cycle, 
978, Light Brown, Monocle, Dangerous Smoke 2, , Gentleman, Ear Cuff
979, Vector, Blocksun, Higschool, Leprechaun, Hipsterneck, 
980, Brown, Nothappy Longer, Funny, Hat 3, Preshistoric, Jesus
981, Easter Egg, Notfunny, Whatever, Whereiswhale, Cuba, 
982, Bad Machine, Pressure, Rainbow, Small Child, Bang Bang, Silver 2
983, Brown, Bed, Meh Dangerous Smoke 2, , Bringcash, 
984, Dark Brown, Notfunny, Now, , Iced Tee, 
985, Woke From Dead, Pressure, Nofeelingwell, Whalehunter 2, Ay Sailor, 
986, Beige, Bed, Say Aah, Cat Ears, Weapon Belt, 
987, Light Brown, Notfunny, Meh, , Vest, 
988, Red, Multilevel, Funny, Whereiswhale, Ay Sailor, 
989, Black, Round Glasses, Higschool, Devil, , 
990, Brown, Devourer, Whatever, Antique, Great T-Shirt, Gold 2
991, Light Brown, Round Glasses, Dangerous Smoke 1, , Wifeshirt 1, 
992, Gotsun, Nothappy Longer, Meh Dangerous Smoke 2, Punk Short, Ymca, 
993, Nature, Undead, Whatever, Hiiya, Ay Sailor, 
994, Checkered, Multilevel, Moo, , , 
995, Machine, Dead, Meh Blow Bubble, Hiiya, Ay Sailor, 
996, Woke From Dead, See Stuff, Dangerous Smoke 3, Whalehunter 1, Broken, 
997, Easter Egg, Love, Whatever, Winter Hat, Overalls, 
998, Beige, Nothappy Longer, Yesplease, Leprechaun, Wifeshirt 2, 
999, Machine, Notfunny, Meh Dangerous Smoke 2, Service, Onthesea, 
