480, Light Brown, Love, Whatever, Trendy 1, Multicolor, 
481, Brown, Pirate, Dangerous Smoke 3, Whereisgiraffe, Blank, Jesus
482, Black, Pressure, Rainbow, Mafia, Honololu, 
483, Lady, Bed, Meh, Jesus Alive, , Silver 2
484, No Signal, Machine, What, , , 
485, Red, Future, Meh Dangerous Smoke 2, , Nofire, Gold 1
486, Beige, Machine, Dangerous Smoke 2, Comrade, , 
487, Light Brown, Nothappy Longer, Yesplease, , Multicolor, Silver 2
488, Dark Brown, Monocle, Dangerous Smoke 3, , Onthesea, 
489, Black, Pressure, Nofeelingwell, Whalehunter 1, Hipsterneck, 
490, Red, Dontsee, Moo, Hippy Hat, Bringcash, 
491, Light Brown, Love, Dangerous Smoke 2, , Multicolor, Multiple
492, Gotsun, Not Nice, Sounds, Trendy 1, Wifeshirt 2, Silver 2
493, Albino, See Stuff, Scowl, , , 
494, Black, Bed, Meh, Winter Hat, Robinson, 
495, Holo Rainbow, Round Glasses, Whatever, , Fishnet Top, 
496, Brown, Blocksun, Moo, Service, Alcatraz, 
497, Black, Love, Now, , , 
498, Dark Brown, Notfunny, Whatever, , Rappers, 
499, Neon Glow, Pressure, Meh, Prison, , 
500, Africa Animal, Reality, Scowl, Whereiswhale, Hirewomen, 
501, Dark Brown, Dontlook, Whatever, Trendy 1, Overalls, 
502, Woke From Dead, Devourer, Meh, Hiiya, Praetexta, 
503, Candy Cane, Snake, Whatever, , , Gold 1
504, Lady, Blocksun, Say Aah, , Cool T-Shirt, 
505, Black, Pirate, Whatever, Trick Hat, Ymca, 
506, Brown, Monocle, Meh, Hat 3, Blank, 
507, Dark Brown, See Stuff, Whatever, Whalehunter 1, Cuba, Gold 1
508, Black, Dontsee, Meh, Prison, Hippy, Silver 1
509, Brown, Pressure, Scowl, Trendy 1, Vegas Dancer, 
510, Gotsun, Reality, Meh, Hiiya, Trash, 
511, Black, Not Nice, Moo, Trick Hat, Blank, 
512, Grey, Dontsee, Food, Comrade, , Silver 1
513, Beige, Notfunny, Meh, , Hippy, 
514, Machine, Dontsee, Say Aah, Hat 3, Fashion Accesory, 
515, Black, Bed, Argh, Jesus Alive, Lingerie, 
516, No Signal, Nothappy Longer, Moo, , , 
517, Gotsun, Love, Meh, , , Silver 1
518, Light Brown, Bed, Moo, Whalehunter 2, Alcatraz, 
519, Black, Pressure, Whatever, Warhat 2, Ay Sailor, 
520, Machine, Bed, Say Aah, , Hipsterneck, 
521, Gotsun, Nothappy Longer, Meh, , Onthesea, 
522, Brown, Bed, Now, Visor Hat, Honololu, Ear Cuff
523, Bad Machine, Pirate, Gold Bling, Trendy 1, Trash, 
524, Brown, Nothappy Longer, What, , Cuba, Silver 1
525, Grey, Dontsee, Meh, Punk Short, Hirewomen, 
526, Africa Animal, Devourer, Meh Dangerous Smoke 2, Whalehunter 2, Wifeshirt 1, Gold 1
527, Dark Brown, Undead, Buck Teeth, Winter Hat, Cycle, 
528, Lady, Dontsee, Meh Dangerous Smoke 2, Devil, , Gold 2
529, Black, Undead, Whatever, Prison, , Silver 2
530, Brown, Machine, Meh Higschool, Mafia, Great T-Shirt, 
531, Blue, Notfunny, Scowl, Whereiswhale, Sweet Jacket, Multiple
532, Dark Brown, Pressure, Meh Dangerous Smoke 3, Comrade, Overalls, 
533, Black, Devourer, Funny, , Trash, 
534, Red, Money, Meh Blow Bubble, Cook, Wifeshirt 1, 
535, Brown, Puppy Dog, Whatever, Notsmart, , 
536, Beige, Dontsee, Food, Small Child, , 
537, Black, Notfunny, Whatever, , Onthesea, 
538, Woke From Dead, Future, Moo, , Honololu, 
539, Neon Glow, Not Nice, Buck Teeth, , Nowar, 
540, Candy Cane, Dontsee, Meh Blow Bubble, Whereiswhale, , Silver 1
541, Light Brown, Notfunny, Meh Dangerous Smoke 1, Punk Short, , 
542, Brown, Multilevel, Argh, Hiiya, Gentleman, 
543, Light Brown, Monocle, Funny, Hat 1, Onthesea, Silver 1
544, Lady, Notfunny, Whatever, Mafia, Chemist, 
545, Africa Animal, Dontsee, Dangerous Smoke 2, Notsmart, Iced Tee, 
546, Dark Brown, Notfunny, Scowl, Trendy 1, Honololu, Ear Cuff
547, Black, Pressure, Meh Dangerous Smoke 3, Punk Short, Chemist, 
548, No Signal, Snake, Whatever, Hat 2, Blank, 
549, Color Dots, Nothappy Longer, Say Aah, Hat 1, Onthesea, Silver 2
550, Light Brown, Devourer, Whatever, Warhat 2, Vest, 
551, Black, Multilevel, Meh Dangerous Smoke 3, Hat 3, Sweet Jacket, 
552, Easter Egg, Monocle, Funny, Devil, Costume Old, 
553, Lady, Notfunny, Meh, , Sweet Jacket, 
554, Red, See Stuff, Moo, Jesus Alive, Blazer Black, 
555, Neon Glow, Reality, Meh, Devil, Preshistoric, 
556, Black, Nothappy Longer, Moo, Jesus Alive, Chemist, Gold 2
557, Grey, See Stuff, Say Aah, , Onthesea, 
558, Light Brown, Multilevel, Higschool, Hat 1, Hipster Shirt, 
559, Vector, Love, Scowl, Service, Multicolor, Silver 2
560, Beige, Pressure, Meh, Visor Hat, Fashion Accesory, 
561, Grey, Nothappy Longer, Argh, Prison, Blank, Silver 2
562, No Signal, Notfunny, Moo, Whereiswhale, , 
563, Black, Money, Funny, Cat Ears, , 
564, Brown, Notfunny, Whatever, Notsmart, Bringcash, 
565, No Signal, Pressure, Moo, , , Gold 2
566, Vector, Dontsee, Whatever, Hat 2, Rappers, 
567, Bad Machine, Notfunny, Scowl, , , 
568, Light Brown, Pressure, Meh, Trendy W 1, Make Fire, 
569, Dark Brown, Monocle, Dangerous Smoke 1, Mafia, Sweet Jacket, 
570, Checkered, Bed, Whatever, Hiiya, Vest, 
571, Beige, Round Glasses, Moo, Visor Hat, Wifeshirt 1, Ear Cuff
572, Lady, Pressure, Meh, Trick Hat, Make Fire, 
573, Red, Nothappy, Argh, Whereiswhale, Preshistoric, Multiple
574, Black, Dontsee, Whatever, Visor Hat, Blank, 
575, Light Brown, Round Glasses, Meh Dangerous Smoke 2, , Sweet Jacket, Silver 2
576, Africa Animal, Bed, Moo, , Moon, 
577, Woke From Dead, Machine, Meh, Good Idea, Cycle, 
578, Red, See Stuff, Moo, Prison, Blank, Silver 2
579, Beige, Pressure, Whatever, Antique, Wifeshirt 2, Silver 1
580, No Signal, Bed, Meh, , , Jesus
581, Dark Brown, Dontsee, Rainbow, Service, Poncho, 
582, Blue, Machine, Dangerous Smoke 2, Whalehunter 1, Wifeshirt 2, 
583, Brown, Monocle, Argh, Side Shave, Bringcash, 
584, Africa Animal, Puppy Dog, Whatever, Service, Hipster Shirt, 
585, Lady, Multilevel, Moo, , Onthesea, 
586, Grey, Pressure, Dangerous Smoke 2, Hiiya, Alcatraz, 
587, Neon Glow, Nothappy, Whatever, Whereisgiraffe, Overalls, 
588, Candy Cane, Notfunny, Meh Dangerous Smoke 2, Trendy W 1, Cycle, 
589, Light Brown, Machine, Argh, Hiiya, Cool T-Shirt, 
590, Lady, Nothappy Longer, Meh, Fetish, Trench, 
591, Easter Egg, Multilevel, Whatever, Warhat 1, Rock, 
592, Dark Brown, See Stuff, Yesplease, Rabbit, Vest, 
593, Color Dots, Nothappy Longer, Meh, Have Fun 1, Blank, 
594, Nature, Dontsee, What, , Not A Suit, 
595, Color Dots, Nothappy Longer, Whatever, , Blazer Black, 
596, Red, Notfunny, Food, Prison, , 
597, Grey, Bed, Moo, Winter Hat, Trash, 
598, Neon Glow, Puppy Dog, Meh, , , 
599, Woke From Dead, Dontsee, Blow Bubble, Punk Short, Great T-Shirt, 
600, Africa Animal, Pirate, Say Aah, War Helmet, Hippy, 
601, Neon Glow, Notfunny, Meh, Trendy 1, Blank, 
602, Bloodbath, Pressure, Whatever, Winter Hat, , Silver 1
603, Beige, Future, Argh, Whalehunter 2, Sweet Jacket, 
604, Brown, Bed, Whatever, , Hipsterneck, 
605, Dark Brown, Notfunny, Dangerous Smoke 2, Comrade, Sweet Jacket, 
606, Gotsun, Monocle, What, Prison, Onthesea, Silver 2
607, Lady, Multilevel, Whatever, Winter Hat, Piercings, 
608, Grey, Puppy Dog, Meh Higschool, Hidehairs, Onthesea, 
609, Checkered, Notfunny, Meh, Cook, , 
610, Lady, Reality, Meh Dangerous Smoke 2, Cat Ears, Multicolor, Silver 1
611, Grey, Notfunny, Whatever, , Knight Armor, Silver 2
612, Bloodbath, Machine, Meh, Jesus Alive, , Ear Cuff
613, Machine, Not Nice, Argh, Mafia, Cuba, 
614, Grey, Multilevel, Meh, Service, Broken, Gold 1
615, Neon Glow, Blocksun, Dangerous Smoke 2, Devil, Chemist, 
616, Lady, Puppy Dog, Meh, Rule All, Robinson, 
617, Void, Money, Moo, , , 
618, Light Brown, Notfunny, Meh Dangerous Smoke 2, Have Fun 2, Cycle, 
619, Brown, Pressure, Whatever, Prison, Wifeshirt 2, 
620, Bad Machine, Undead, Yesplease, Devil, , Gold 1
621, Red, Notfunny, Nofeelingwell, , Not A Suit, 
622, Checkered, Undead, Whatever, , Multicolor, 
623, Brown, Machine, Bling, Whereiswhale, Praetexta, 
624, Black, Notfunny, Whatever, Comrade, Broken, 
625, Gotsun, Pressure, Argh, Small Child, Wifeshirt 1, Gold 2
626, Beige, Devourer, Dangerous Smoke 2, , Blank, 
627, Grey, Dontsee, Meh, , Robinson, Silver 1
628, Dark Brown, Nothappy Longer, Whatever, Have Fun 2, Fishnet Top, 
629, Grey, Notfunny, Dangerous Smoke 2, Winter Hat, Bang Bang, 
630, Black, Dead, Nofeelingwell, Service, , 
631, Light Brown, Bed, Meh, , Wifeshirt 2, 
632, Easter Egg, Monocle, Say Aah, Trendy 2, Fishnet Top, Multiple
633, Black, Pressure, Meh, , Preshistoric, Jesus
634, Grey, Undead, Whatever, , Iced Tee, 
635, Dark Brown, Machine, Meh Dangerous Smoke 2, , Poncho, 
636, Gotsun, Monocle, No Teeth, Prison, Honololu, 
637, Brown, Round Glasses, Meh Dangerous Smoke 1, Visor Hat, Ay Sailor, 
638, Black, Undead, Scowl, Prison, Vest, Silver 2
639, Void, Snake, What, Mafia, Hipsterneck, 
640, Candy Cane, Puppy Dog, Meh, Punk Short, , 
641, Neon Glow, Dead, Whatever, , , 
642, Beige, Nothappy Longer, No Teeth, Cat Ears, Nofire, 
643, Dark Brown, Bed, Higschool, Whereisgiraffe, Chemist, Multiple
644, Grey, Pressure, Funny, Notsmart, Alcatraz, Silver 1
645, Black, Monocle, Dangerous Smoke 2, War Helmet, Sweet Jacket, 
646, Brown, Snake, Meh, Whereiswhale, , 
647, Machine, Pressure, Argh, Antique, Ay Sailor, 
648, Color Dots, Notfunny, Meh Dangerous Smoke 2, Cook, Trash, 
649, Light Brown, Not Nice, Meh, Hat 2, Costume Old, 
650, Neon Glow, Puppy Dog, Meh Dangerous Smoke 2, Comrade, Nofire, Silver 2
651, Color Dots, Devourer, What, Leprechaun, Onthesea, 
652, Dark Brown, Nothappy Longer, Meh, Whalehunter 2, Preshistoric, Silver 2
653, Brown, Dead, Whatever, , Chemist, 
654, Blue, Money, Meh, , Overalls, 
655, Lady, Love, Dangerous Smoke 2, Hiiya, Cuba, Jesus
656, Black, Monocle, Argh, , , 
657, Beige, Pirate, Moo, , Ay Sailor, Gold 1
658, Brown, Money, Meh, , Overalls, 
659, Black, Notfunny, Rainbow, Catch Robbers, Nowar, 
660, Light Brown, Love, Meh Dangerous Smoke 2, Leprechaun, Vest, Silver 2
661, Woke From Dead, Dontsee, Say Aah, Have Fun 2, Cool T-Shirt, 
662, Beige, Bed, No Teeth, , Robinson, 
663, Neon Glow, Pirate, What, Have Fun 1, Cycle, 
664, Machine, Nothappy, Meh, Trendy 1, Sweet 16, 
665, Light Brown, Dontlook, Scowl, Punk Short, , Gold 2
666, Gotsun, Nothappy Longer, What, , Wifeshirt 2, 
667, No Signal, Dead, Meh, Side Shave, , 
668, Dark Brown, Reality, What, , , 
669, Brown, Notfunny, Argh, Devil, Bang Bang, 
670, Black, Blocksun, Say Aah, Comrade, Bringcash, 
671, Easter Egg, Pressure, Argh, Hiiya, Preshistoric, 
672, Brown, Snake, No Teeth, Hat 3, Honololu, 
673, Grey, Not Nice, Moo, Mafia, Wifeshirt 2, 
674, Brown, Nothappy Longer, Blow Bubble, Whalehunter 1, Preshistoric, 
675, Light Brown, Money, Whatever, Whalehunter 2, Hipsterneck, Silver 1
676, Gotsun, Undead, Moo, , , Gold 1
677, Holo Rainbow, Multilevel, Argh, Cook, , Silver 1
678, Grey, Dead, Meh, Whalehunter 1, Cycle, Gold 2
679, Black, Future, Dangerous Smoke 1, , Wifeshirt 1, 
680, Albino, Pressure, Yesplease, , , 
681, Vector, Pew, Meh, , Piercings, Silver 1
682, Candy Cane, Pressure, Meh Dangerous Smoke 3, Cook, , 
683, Void, Notfunny, Dangerous Smoke 2, , , 
684, Holo Rainbow, Not Nice, Whatever, Whereiswhale, Ay Sailor, 
685, Neon Glow, Notfunny, Funny, Cook, Nofire, Silver 1
686, Dark Brown, Devourer, Meh, Visor Hat, Ay Sailor, Gold 1
687, Vector, Notfunny, No Teeth, Cat Ears, Hipster Shirt, 
688, Beige, Nothappy Longer, Argh, Warhat 1, Honololu, 
689, Brown, Nothappy, Say Aah, , Hoodie Black, 
690, Blue, Dontsee, Yesplease, , Wifeshirt 2, 
691, Au, Love, Whatever, Hiiya, , Silver 2
692, Gotsun, Puppy Dog, Rainbow, , Wifeshirt 1, 
693, Red, See Stuff, Yesplease, Antique, Rappers, Gold 2
694, Grey, Notfunny, Whatever, Jesus Alive, , 
695, Beige, Pressure, Meh, Prison, , 
696, Gotsun, Multilevel, Argh, Whereiswhale, Multicolor, 
697, Albino, Bed, Moo, Fetish, Robinson, Silver 1
698, Dark Brown, Dontsee, Dangerous Smoke 3, , Preshistoric, 
699, Machine, Nothappy Longer, Yesplease, Trendy 1, Bang Bang, Gold 2
700, Black, Reality, Meh Blow Bubble, Leprechaun, Hipsterneck, 
701, Neon Glow, Money, Nofeelingwell, War Helmet, Praetexta, 
702, Gotsun, Pirate, Blow Bubble, Notsmart, Robinson, 
703, Dark Brown, Notfunny, Moo, Warhat 1, Vest, 
704, Light Brown, Puppy Dog, Argh, Hat 2, Gentleman, 
705, Albino, Dead, Say Aah, , Great T-Shirt, Multiple
706, Black, Dontsee, Meh, Prison, Blazer Black, 
707, Dark Brown, Notfunny, Moo, Warhat 2, Cool T-Shirt, 
708, Blue, Nothappy, Whatever, , Onthesea, Silver 1
709, Albino, Nothappy Longer, Nofeelingwell, , Chemist, Silver 2
710, Dark Brown, Round Glasses, Meh, Hiiya, Sweet Jacket, 
711, Machine, Nothappy, Higschool, Prison, Blank, 
712, Albino, Pressure, What, Hat 3, Fashion Accesory, Silver 2
713, Woke From Dead, Future, Whatever, Rabbit, Blank, 
714, Light Brown, Dontlook, Argh, Punk Short, Broken, Multiple
715, Beige, Dontsee, Dangerous Smoke 2, Hat 2, Preshistoric, 
716, Black, Multilevel, Whatever, Side Shave, Hipster Shirt, 
717, Red, Blocksun, Moo, , Honololu, 
718, Dark Brown, Nothappy Longer, Blow Bubble, , Chemist, 
719, Color Dots, Notfunny, Knife, Rabbit, Not A Suit, 
720, Dark Brown, Pressure, Whatever, Punk Short, Chemist, Multiple
721, Gotsun, See Stuff, Funny, Prison, Fashion Accesory, 
722, Africa Animal, Multilevel, Moo, Mafia, Hippy, Silver 1
723, Gotsun, Dead, Nofeelingwell, Visor Hat, Preshistoric, 
724, Blue, Pirate, Blow Bubble, Cat Ears, Rock, Silver 2
725, Nature, Blocksun, Meh, Comrade, Cycle, 
726, Bad Machine, See Stuff, Knife, Hat 2, Cool T-Shirt, 
727, Brown, Notfunny, Dangerous Smoke 1, , Alcatraz, 
728, Red, Dontsee, Meh, Comrade, Not A Suit, 
729, Stars And Stripes, Money, What, Fetish, , 
730, Dark Brown, Bed, Sounds, Have Fun 1, Overalls, 
731, Light Brown, Pirate, What, Rule All, Wifeshirt 1, 
732, Neon Glow, Round Glasses, Say Aah, Notsmart, Fashion Accesory, 
733, Grey, Dontsee, What, Hiiya, Blank, Jesus
734, Bloodbath, See Stuff, Meh Dangerous Smoke 2, Leprechaun, Piercings, 
735, Lady, Notfunny, Whatever, , Robinson, Silver 1
736, Beige, Pressure, Blow Bubble, Headset, , 
737, Black, Dontlook, Meh, , Preshistoric, Silver 2
738, Light Brown, Pirate, Argh, Winter Hat, Cuba, 
739, Red, Bed, Meh, Whereiswhale, Blank, 
740, Brown, Pirate, Blow Bubble, Whalehunter 2, Ay Sailor, 
741, Light Brown, Notfunny, Whatever, Rabbit, Hippy, 
742, Vector, Pressure, Bling, Mafia, Bang Bang, Gold 1
743, Africa Animal, Notfunny, Argh, , Gentleman, Multiple
744, Beige, Multilevel, Meh, , Vest, Silver 1
745, Albino, Dead, What, Whalehunter 2, Hipsterneck, 
746, Dark Brown, Dontsee, Moo, Visor Hat, Chemist, 
747, Neon Glow, Pressure, Argh, Small Child, Blank, 
748, Machine, Notfunny, Whatever, , Rappers, Silver 1
749, Red, Nothappy, Scowl, Cat Ears, Vest, 
750, Dark Brown, Money, Meh, Prison, Preshistoric, 
751, Nature, Blocksun, Dangerous Smoke 2, Warhat 1, Cool T-Shirt, Jesus
752, Machine, Nothappy Longer, Yesplease, Prison, Rappers, 
753, Beige, Dontsee, Meh, Jesus Alive, Nofire, Silver 1
754, Light Brown, Pressure, Argh, , Knight Armor, 
755, Candy Cane, Notfunny, Blow Bubble, , , 
756, Light Brown, Pressure, Say Aah, , , Ear Cuff
757, Easter Egg, Notfunny, Meh Blow Bubble, Warhat 1, , 
758, Blue, Not Nice, Meh, Prison, Wifeshirt 2, 
759, Woke From Dead, Pressure, Whatever, Hat 1, Sweet Jacket, 
760, Albino, Dontsee, Say Aah, Whereisgiraffe, Vest, 
761, Blue, Pirate, Meh Dangerous Smoke 2, , Wifeshirt 2, Silver 1
762, Light Brown, Money, Argh, Hidehairs, Lingerie, 
763, Candy Cane, See Stuff, Whatever, Cook, , 
764, Dark Brown, Not Nice, Meh Dangerous Smoke 3, , Robinson, 
765, Black, Machine, Whatever, Trick Hat, , 
766, Beige, Bed, Meh Food, , Hippy, 
767, Bloodbath, Devourer, Dangerous Smoke 2, , , 
768, Gotsun, Dontlook, Whatever, Jesus Alive, Iced Tee, 
769, Light Brown, Pirate, Dangerous Smoke 2, Warhat 2, Ymca, 
770, Black, Round Glasses, Say Aah, , Knight Armor, 
771, Light Brown, Money, Dangerous Smoke 2, Hat 3, , Ear Cuff
772, Black, Notfunny, Say Aah, , , Gold 1
773, No Signal, Money, Dangerous Smoke 3, Hat 1, , 
774, Dark Brown, Pirate, Meh, Prison, Nowar, Multiple
775, Checkered, Dead, Now, Whalehunter 1, Fishnet Top, 
776, Black, Notfunny, Say Aah, Devil, , Silver 2
777, Woke From Dead, See Stuff, Meh Knife, , Cool T-Shirt, 
778, Lady, Notfunny, Meh Dangerous Smoke 2, , Nowar, 
779, Albino, Nothappy, Moo, , Moon, Silver 2
780, Blue, Notfunny, Dangerous Smoke 1, Fetish, Preshistoric, Silver 1
781, Albino, Dontlook, Argh, Trendy 2, , Silver 2
782, Brown, Notfunny, Say Aah, Prison, Piercings, 
783, Dark Brown, Pressure, Moo, , Preshistoric, 
784, Africa Animal, Machine, Say Aah, Warhat 1, , 
785, Dark Brown, Notfunny, Dangerous Smoke 2, Whalehunter 2, Broken, 
786, Black, Blocksun, Nofeelingwell, Trendy 1, Hipster Shirt, Silver 1
787, Gotsun, Nothappy Longer, Meh, Hat 2, Bang Bang, 
788, Light Brown, Devourer, Argh, Hiiya, Vest, 
789, Vector, Reality, Whatever, Leprechaun, Preshistoric, 
790, Dark Brown, Pressure, Dangerous Smoke 2, Winter Hat, Vest, 
791, Brown, Notfunny, Moo, , Ymca, 
792, Machine, Dontsee, What, Cat Ears, Ay Sailor, Gold 1
793, Vector, Pressure, Say Aah, Leprechaun, Hippy, 
794, Black, Bed, Meh Dangerous Smoke 1, Prison, Rock, 
795, Easter Egg, Dontlook, Blow Bubble, Small Child, Ay Sailor, 
796, Bad Machine, Pirate, Meh, Headset, Weapon Belt, 
797, Lady, Nothappy Longer, Say Aah, Punk Short, Cycle, 
798, Red, Pressure, Nofeelingwell, , Cool T-Shirt, 
799, Gotsun, Nothappy, What, Jesus Alive, Cuba, Gold 2
800, Lady, Pirate, Argh, , Preshistoric, 
801, Red, Pressure, Whatever, Hiiya, Knight Armor, 
802, Brown, Money, Hipster Stache, Rabbit, Multicolor, 
803, Checkered, Multilevel, Meh Dangerous Smoke 3, , Broken, 
804, Lady, Undead, Argh, Rabbit, , 
805, Africa Animal, Nothappy, Meh, , Nowar, Silver 1
806, Lady, Puppy Dog, Dangerous Smoke 1, Side Shave, Preshistoric, 
807, Black, Notfunny, Whatever, Trendy 1, Lingerie, 
808, Woke From Dead, Dontsee, Now, Headset, Hipsterneck, 
809, Holo Rainbow, Nothappy Longer, Dangerous Smoke 3, , Rock, 
810, Red, Notfunny, Meh, , Nofire, 
811, Dark Brown, Dontsee, Now, Rabbit, Wifeshirt 2, 
812, Lady, Dontlook, Whatever, , Multicolor, Gold 1
813, Holo Rainbow, Nothappy Longer, Now, , Hipsterneck, Silver 1
814, Checkered, Puppy Dog, Whatever, Trendy 1, Trash, 
815, Machine, Pew, Moo, Whalehunter 1, Knight Armor, 
816, Beige, Money, What, , Not A Suit, Multiple
817, Light Brown, Not Nice, Now, Winter Hat, Trench, Silver 1
818, Black, See Stuff, Whatever, Trendy W 2, Wifeshirt 1, 
819, Woke From Dead, Multilevel, What, Trendy 2, Gentleman, 
820, Neon Glow, Dontsee, Moo, Whereiswhale, Cuba, 
821, Stars And Stripes, Multilevel, What, , , 
822, Machine, Nothappy, Meh Higschool, , Cool T-Shirt, 
823, Dark Brown, Round Glasses, Moo, , Hippy, 
824, Lady, Bed, Argh, , Lingerie, 
825, Grey, Notfunny, Say Aah, Rabbit, Rappers, 
826, Brown, Pressure, Moo, Small Child, Trash, 
827, Dark Brown, Dontsee, Say Aah, Good Idea, Poncho, Silver 1
828, Black, Dead, Whatever, Hiiya, Broken, 
829, Light Brown, Money, Meh, Have Fun 1, Nofire, 
830, Bloodbath, Pressure, Knife, Winter Hat, , 
831, Beige, Blocksun, Say Aah, Hiiya, Not A Suit, Ear Cuff
832, Light Brown, See Stuff, What, Small Child, Overalls, 
833, Dark Brown, Bed, Dangerous Smoke 2, , Wifeshirt 1, Silver 1
834, Light Brown, Notfunny, Rainbow, , , 
835, Gotsun, Puppy Dog, Whatever, Jesus Alive, Vegas Dancer, Gold 1
836, Dark Brown, Devourer, What, War Helmet, Multicolor, Gold 2
837, Gotsun, Multilevel, Meh, Trendy W 2, Nofire, 
838, Beige, Nothappy, Argh, Winter Hat, Poncho, 
839, Brown, Pirate, What, Trendy 2, Hipsterneck, Silver 2
840, Gotsun, Dontsee, Whatever, Antique, Overalls, 
841, Beige, Multilevel, Meh Dangerous Smoke 2, , Hippy, 
842, Blue, Bed, Dangerous Smoke 2, Prison, Trash, 
843, Brown, Undead, Meh, Whalehunter 2, Not A Suit, 
844, Black, Bed, Dangerous Smoke 2, Trendy 1, Ay Sailor, Silver 1
845, Machine, See Stuff, Argh, Leprechaun, , 
846, Albino, Bed, Meh, , Make Fire, 
847, Checkered, Dontsee, Whatever, Whereiswhale, Cuba, 
848, Color Dots, Puppy Dog, Meh Dangerous Smoke 3, Hidehairs, Cool T-Shirt, Silver 1
849, Lady, Multilevel, Say Aah, , Ok, 
850, Light Brown, Bed, Scowl, Cook, , 
851, Black, Love, Whatever, Trick Hat, Cool T-Shirt, 
852, Albino, Nothappy, Argh, Notsmart, Blank, 
853, Beige, Nothappy Longer, Say Aah, , Poncho, 
854, Holo Rainbow, Snake, Now, , , Stretched
855, Checkered, Blocksun, Argh, , Preshistoric, 
856, Red, Pressure, Whatever, , Blank, Silver 2
857, Dark Brown, Multilevel, Meh, Whalehunter 1, Ymca, Silver 1
858, Brown, Snake, Dangerous Smoke 2, , Knight Armor, 
859, Africa Animal, Notfunny, Rainbow, , Onthesea, Silver 1
860, Beige, See Stuff, Argh, , Preshistoric, 
861, Bloodbath, Pressure, Meh, Hat 1, Not A Suit, 
862, Gotsun, Machine, Whatever, Trendy 1, Nowar, 
863, Blue, Dontsee, Blow Bubble, , , 
864, Lady, Love, Scowl, Rule All, Cuba, 
865, Woke From Dead, Round Glasses, Dangerous Smoke 2, Cat Ears, Alcatraz, 
866, Black, Nothappy Longer, Meh, Service, Praetexta, Silver 1
867, Candy Cane, Nothappy, Say Aah, Whalehunter 2, , Multiple
868, Red, Pressure, Dangerous Smoke 2, Hat 2, Costume Old, 
869, Africa Animal, Machine, Whatever, Hidehairs, Make Fire, Gold 2
870, Dark Brown, Future, Dangerous Smoke 2, , Knight Armor, 
871, Beige, Puppy Dog, Now, , Cycle, 
872, Brown, Bed, Whatever, , Rappers, 
873, Gotsun, Monocle, Dangerous Smoke 2, Manbun, Trash, 
874, Acid, Nothappy Longer, Blow Bubble, , , 
875, Light Brown, Puppy Dog, Buck Teeth, Prison, Rock, Silver 2
876, Grey, Dontsee, Dangerous Smoke 1, Whalehunter 1, Preshistoric, 
877, Red, Notfunny, Yesplease, Punk Short, Make Fire, Silver 2
878, Holo Rainbow, Pressure, Moo, , Bang Bang, 
879, Woke From Dead, Dontlook, Whatever, Whalehunter 1, Vest, Gold 1
880, Black, Dead, Rainbow, Hiiya, Wifeshirt 2, 
881, Gotsun, See Stuff, Say Aah, , , 
882, Neon Glow, Nothappy Longer, Meh Dangerous Smoke 1, Have Fun 1, Broken, 
883, Void, Machine, Dangerous Smoke 2, Cat Ears, Honololu, 
884, Brown, Blocksun, What, Visor Hat, Praetexta, Silver 1
885, Beige, Pressure, Moo, Prison, Overalls, 
886, Vector, Pirate, Whatever, Whalehunter 1, Rock, 
887, Light Brown, Monocle, Argh, Side Shave, , Multiple
888, Gotsun, Bed, Meh, Winter Hat, Gentleman, 
889, No Signal, Love, Rainbow, Whalehunter 1, , 
890, Lady, Notfunny, Bling, , , 
891, Woke From Dead, Pirate, Say Aah, , Blank, 
892, Holo Rainbow, Undead, Whatever, Fetish, Onthesea, 
893, Stars And Stripes, Puppy Dog, Meh Dangerous Smoke 3, Hiiya, , 
894, Albino, Pressure, Gold Bling, Hat 3, Alcatraz, Silver 1
895, Blue, Money, Blow Bubble, Punk Short, Preshistoric, 
896, Lady, See Stuff, Meh, Mafia, Cool T-Shirt, 
897, Light Brown, Dead, Say Aah, Headset, Wifeshirt 1, 
898, Gotsun, Machine, Dangerous Smoke 2, Hiiya, , Silver 1
899, Checkered, Notfunny, Rainbow, , Nowar, 
900, Gotsun, Pirate, Whatever, Fetish, Not A Suit, 
901, Albino, Dontlook, Say Aah, , Multicolor, Multiple
902, Dark Brown, Devourer, Whatever, Catch Robbers, Hippy, 
903, Beige, Snake, Meh, , Fishnet Top, Gold 1
904, Brown, Notfunny, Whatever, , Ok, 
905, Bloodbath, Monocle, Yesplease, Winter Hat, , 
906, Albino, Snake, Whatever, Good Idea, Hipsterneck, 
907, Grey, Notfunny, Now, Hat 3, Trash, 
908, Candy Cane, Future, Whatever, Whereisgiraffe, Honololu, 
909, Light Brown, Pew, Buck Teeth, Trick Hat, Blank, 
910, Africa Animal, See Stuff, Meh Dangerous Smoke 3, , Hirewomen, Silver 1
911, Dark Brown, Nothappy, Meh, Headset, Onthesea, 
912, Light Brown, Notfunny, Now, Trendy 2, Alcatraz, Gold 2
913, Checkered, Love, Gold Bling, , , 
914, Beige, Round Glasses, Meh Dangerous Smoke 3, , Preshistoric, 
915, Bloodbath, Monocle, Say Aah, , , Gold 1
916, Black, Notfunny, Whatever, Whereiswhale, Moon, 
917, Blue, Nothappy, Scowl, Jesus Alive, Trash, Jesus
918, Albino, Round Glasses, Meh, Have Fun 1, , 
919, Dark Brown, Future, Whatever, Warhat 2, Cuba, 
920, Black, Notfunny, Now, Hat 1, Hipsterneck, Silver 2
921, Lady, Pirate, Gold Bling, Punk Short, Vest, 
922, Grey, Dontsee, Scowl, Trendy 2, Onthesea, 
923, Checkered, Pressure, Dangerous Smoke 2, Trendy 1, Sweet Jacket, 
924, Dark Brown, Pew, Dangerous Smoke 3, War Helmet, Overalls, 
925, Albino, Multilevel, Whatever, Prison, Hippy, 
926, Black, Blocksun, Argh, Whereisgiraffe, Ay Sailor, 
927, Light Brown, Money, Nofeelingwell, Cat Ears, Wifeshirt 2, 
928, Africa Animal, Dead, Meh Blow Bubble, Whalehunter 2, Praetexta, 
929, Vector, Dontsee, Funny, Whereiswhale, Wifeshirt 2, 
930, Neon Glow, Notfunny, Say Aah, Warhat 1, , 
931, Nature, Pressure, Whatever, Whereisgiraffe, Hipsterneck, Gold 2
932, Brown, Nothappy, Dangerous Smoke 2, , Lingerie, 
933, Blue, See Stuff, Now, Winter Hat, Robinson, 
934, Candy Cane, Not Nice, Gold Bling, , , 
935, Gotsun, Notfunny, Meh, Warhat 1, Alcatraz, 
936, Lady, Not Nice, Funny, , Make Fire, 
937, Bad Machine, Round Glasses, Dangerous Smoke 3, , Nowar, 
938, Light Brown, Pressure, Meh, Catch Robbers, Alcatraz, 
939, Brown, Reality, Whatever, Trick Hat, , 
940, Blue, Money, Yesplease, Hat 3, Trash, Silver 1
941, Vector, Notfunny, Meh Dangerous Smoke 2, Notsmart, Alcatraz, 
942, Red, Bed, Whatever, , Robinson, Silver 2
943, Black, Notfunny, Meh, Whalehunter 1, Piercings, 
944, Light Brown, Puppy Dog, Argh, Prison, Onthesea, 
945, Albino, Pressure, Meh, Hippy Hat, Sweet 16, Jesus
946, Woke From Dead, Machine, Dangerous Smoke 2, Mafia, Iced Tee, Silver 2
947, Black, Monocle, Whatever, Trendy 1, Weapon Belt, 
948, Beige, Pressure, Meh Dangerous Smoke 2, Mafia, Sweet Jacket, Silver 2
949, Holo Rainbow, Bed, What, Trendy W 2, Rock, 
950, Black, Notfunny, Dangerous Smoke 1, Visor Hat, Multicolor, 
951, Brown, Money, Say Aah, Hat 3, Overalls, 
952, Dark Brown, Dontsee, Food, Trendy 1, Multicolor, 
953, Gotsun, Nothappy Longer, Moo, , Not A Suit, Silver 1
954, Beige, Blocksun, Whatever, Trendy W 1, , 
955, Black, Bed, Dangerous Smoke 2, Warhat 1, Nofire, 
956, Albino, Nothappy, Argh, Fetish, Robinson, 
957, Vector, Love, Gold Bling, Trendy W 2, Costume Old, 
958, Beige, Pressure, What, Whereiswhale, Wifeshirt 2, 
959, Color Dots, Round Glasses, Now, , Multicolor, 
960, Albino, Monocle, Whatever, Headset, Wifeshirt 1, 
961, Brown, Dontsee, Funny, Hat 2, Bang Bang, 
