id, body, eyes, mouth, hat, clothes, earring
1000, Dark Brown, Pressure, Meh, Hiiya, Hirewomen, Silver 2
1001, Red, Monocle, Dangerous Smoke 2, Hidehairs, Wifeshirt 2, 
1002, Grey, Undead, Meh, Trendy 1, Honololu, Gold 1
1003, Brown, Bed, Nofeelingwell, Trick Hat, , 
1004, Blue, Machine, Moo, Trendy 2, Bringcash, 
1005, Grey, Puppy Dog, Whatever, Winter Hat, Ay Sailor, 
1006, Lady, Dontsee, Meh, Cat Ears, , 
1007, Brown, Money, Whatever, Jesus Alive, Overalls, 
1008, Light Brown, Pressure, Meh, Whereisgiraffe, Ymca, 
1009, Black, Nothappy, Whatever, Have Fun 2, Sweet Jacket, 
1010, Dark Brown, Notfunny, Meh, Winter Hat, Preshistoric, 
1011, Grey, Dead, Say Aah, Hiiya, Poncho, Silver 1
1012, Brown, Multilevel, Dangerous Smoke 3, Whereiswhale, Trash, 
1013, Dark Brown, Puppy Dog, Sounds, Trendy W 2, Hipsterneck, Gold 1
1014, Blue, See Stuff, Now, , Onthesea, 
1015, Africa Animal, Dontsee, Scowl, Hat 3, Hirewomen, 
1016, Brown, Notfunny, Buck Teeth, Whereisgiraffe, Not A Suit, Gold 1
1017, Red, Nothappy, Funny, , Ymca, 
1018, Grey, Monocle, Meh, , Cycle, 
1019, Candy Cane, Pirate, Whatever, Warhat 2, Vest, 
1020, Albino, Notfunny, Meh, Hat 2, , 
1021, Brown, Pressure, Whatever, Whereiswhale, Cuba, 
1022, Lady, Reality, What, Punk Short, , 
1023, Brown, Pressure, Meh Sounds, Hiiya, Trash, 
1024, Light Brown, Bed, Whatever, Fetish, Great T-Shirt, 
1025, Black, Notfunny, Meh Dangerous Smoke 2, Hat 1, Gentleman, 
1026, No Signal, Devourer, Rainbow, Hat 3, , 
1027, Grey, Dontsee, Moo, Manbun, Honololu, 
1028, Dark Brown, Dead, Whatever, , Ay Sailor, 
1029, Light Brown, Monocle, Meh, Winter Hat, Piercings, 
1030, Dark Brown, Bed, Whatever, , Moon, 
1031, Beige, Round Glasses, Argh, , Praetexta, 
1032, Red, Pressure, Whatever, , Overalls, Jesus
1033, Brown, Notfunny, Dangerous Smoke 2, Whereiswhale, Cool T-Shirt, 
1034, Gotsun, Love, Rainbow, Small Child, Hipster Shirt, 
1035, Light Brown, Dontsee, What, Trendy W 1, Sweet Jacket, 
1036, Gotsun, Machine, Meh, Punk Short, Hirewomen, Silver 2
1037, Albino, Pressure, Argh, , Chemist, 
1038, Dark Brown, See Stuff, What, , Cuba, Gold 1
1039, Blue, Notfunny, Meh Dangerous Smoke 3, Whalehunter 1, Rappers, Silver 1
1040, Gotsun, Nothappy Longer, Dangerous Smoke 2, , Multicolor, Gold 2
1041, Blue, See Stuff, Meh Dangerous Smoke 2, Whereiswhale, Onthesea, 
1042, Beige, Pressure, Moo, , , 
1043, Lady, Nothappy Longer, Whatever, , Weapon Belt, 
1044, Black, See Stuff, Meh, , Wifeshirt 2, Stretched
1045, Dark Brown, Pressure, Meh Dangerous Smoke 3, Trendy 2, , 
1046, No Signal, Nothappy, Meh Blow Bubble, , , 
1047, Lady, Notfunny, Scowl, , , 
1048, Africa Animal, Love, Meh Dangerous Smoke 2, Notsmart, , 
1049, Red, Machine, Moo, Rabbit, Wifeshirt 2, 
1050, Vector, Future, Whatever, Whereisgiraffe, Overalls, 
1051, Beige, Money, Blow Bubble, Whalehunter 1, Nofire, 
1052, Black, Nothappy Longer, Meh, Have Fun 2, Sweet Jacket, 
1053, Lady, Blocksun, Meh Dangerous Smoke 2, Have Fun 1, Sweet 16, 
1054, Dark Brown, Nothappy, What, , , 
1055, Africa Animal, Bed, Funny, Whereiswhale, Honololu, 
1056, Brown, Snake, Whatever, , Fashion Accesory, 
1057, Beige, Pressure, Yesplease, Service, Poncho, Silver 1
1058, Black, Blocksun, Say Aah, Comrade, , 
1059, Checkered, Bed, Whatever, , , 
1060, Light Brown, Money, Sounds, Have Fun 2, Hippy, 
1061, Woke From Dead, Future, Argh, Jesus Alive, Hipster Shirt, 
1062, Albino, Dontsee, Meh, Prison, Sweet Jacket, Silver 1
1063, Au, Pirate, Gold Bling, Punk Short, , 
1064, Neon Glow, Round Glasses, What, , , 
1065, Bad Machine, Future, Funny, Hippy Hat, Vest, Ear Cuff
1066, Light Brown, Dontsee, Scowl, , Wifeshirt 1, 
1067, Brown, Notfunny, Argh, Jesus Alive, Not A Suit, 
1068, Light Brown, Dead, Dangerous Smoke 2, Antique, , 
1069, Dark Brown, Puppy Dog, Higschool, , Fishnet Top, 
1070, Africa Animal, See Stuff, Meh, Hat 2, , 
1071, Bloodbath, Dontsee, Whatever, Hat 3, , Gold 1
1072, Red, Notfunny, Meh, , Cuba, 
1073, Gotsun, Not Nice, Moo, Trendy W 2, , 
1074, Brown, See Stuff, Whatever, Hiiya, Not A Suit, 
1075, Dark Brown, Notfunny, Dangerous Smoke 2, , Broken, Silver 1
1076, Brown, Snake, Whatever, Hat 3, , 
1077, Color Dots, Nothappy Longer, Say Aah, Trendy 1, Weapon Belt, 
1078, Checkered, Dontsee, Meh Dangerous Smoke 1, Leprechaun, Onthesea, Silver 2
1079, Dark Brown, Bed, Yesplease, Prison, Preshistoric, Jesus
1080, Vector, Love, Meh Dangerous Smoke 2, , Great T-Shirt, 
1081, Black, Notfunny, Dangerous Smoke 2, , Chemist, 
1082, Gotsun, Pressure, Meh, Devil, Great T-Shirt, Silver 2
1083, Dark Brown, Nothappy, Whatever, Cook, Make Fire, Silver 1
1084, Light Brown, Monocle, What, , Piercings, 
1085, Red, Pirate, Argh, Devil, Shirt Of Flames, 
1086, Black, Dontlook, Whatever, Manbun, Hipsterneck, 
1087, Gotsun, Machine, What, , , 
1088, Albino, Nothappy, Now, Leprechaun, , Gold 1
1089, Candy Cane, Future, Whatever, Whereiswhale, , Silver 1
1090, Beige, Pressure, Dangerous Smoke 2, , , Silver 2
1091, Black, Devourer, Say Aah, , Bringcash, Silver 1
1092, Dark Brown, Not Nice, Whatever, Rabbit, , 
1093, Lady, Bed, Dangerous Smoke 2, , Bringcash, Gold 1
1094, Neon Glow, Money, Blow Bubble, Mafia, Robinson, Multiple
1095, Color Dots, Bed, Whatever, , Cuba, Gold 1
1096, Black, Machine, Meh Dangerous Smoke 2, Notsmart, , 
1097, Bloodbath, Bed, Say Aah, Prison, , Multiple
1098, Au, Pressure, Argh, , , 
1099, Gotsun, Love, Gold Bling, Headset, Wifeshirt 1, 
1100, Neon Glow, See Stuff, Whatever, Trendy W 2, , Silver 2
1101, Nature, Dontsee, No Teeth, , Nowar, 
1102, Candy Cane, See Stuff, Scowl, Hat 1, , 
1103, Black, Devourer, Whatever, Hat 3, Onthesea, 
1104, Neon Glow, Blocksun, Meh Food, Good Idea, Honololu, 
1105, Black, Money, Whatever, Jesus Alive, Gentleman, 
1106, Lady, Pirate, Moo, Comrade, Make Fire, Silver 2
1107, Beige, Devourer, Funny, , Wifeshirt 1, 
1108, Color Dots, Notfunny, Scowl, Cook, Fishnet Top, 
1109, Brown, Dontsee, Whatever, , Vegas Dancer, 
1110, Light Brown, Bed, Meh, Catch Robbers, Fashion Accesory, 
1111, Beige, Devourer, Say Aah, Headset, , 
1112, Black, See Stuff, Meh, , Vest, 
1113, Bloodbath, Notfunny, Funny, , , 
1114, Blue, Bed, Dangerous Smoke 3, Whereiswhale, Nowar, Silver 1
1115, Machine, Machine, Meh Dangerous Smoke 2, War Helmet, Poncho, Silver 2
1116, Brown, Pressure, Meh, Comrade, Piercings, Silver 1
1117, Black, Notfunny, Moo, , Hippy, 
1118, Blue, Dontsee, Scowl, Notsmart, Broken, 
1119, Checkered, Multilevel, Meh, Leprechaun, Honololu, 
1120, Light Brown, Reality, Rainbow, Whalehunter 1, Overalls, Gold 2
1121, Brown, Money, Meh Dangerous Smoke 1, , Knight Armor, 
1122, Black, Undead, Whatever, Trendy W 2, Multicolor, 
1123, Brown, Notfunny, Nofeelingwell, , Nowar, 
1124, Woke From Dead, Bed, Whatever, Warhat 2, Broken, 
1125, Brown, Notfunny, Meh, , Fishnet Top, Silver 2
1126, Red, Pressure, Dangerous Smoke 2, Punk Short, Wifeshirt 1, 
1127, Black, Lazer, Moo, , Not A Suit, 
1128, Holo Rainbow, See Stuff, Dangerous Smoke 2, Visor Hat, , 
1129, Beige, Bed, Scowl, Small Child, Overalls, 
1130, Light Brown, Money, Meh, Trendy W 2, Ay Sailor, 
1131, Dark Brown, Undead, Now, Comrade, Sweet Jacket, 
1132, Woke From Dead, Dontsee, Yesplease, Prison, Knight Armor, 
1133, Red, Blocksun, Argh, Jesus Alive, , 
1134, Black, Dontsee, Scowl, Whalehunter 1, Cycle, 
1135, Light Brown, Notfunny, Funny, Rabbit, Hipsterneck, Gold 1
1136, Albino, Pressure, Say Aah, Hat 2, Ok, 
1137, Black, Dead, Whatever, , Alcatraz, 
1138, Lady, Pressure, Nofeelingwell, Trick Hat, Sweet Jacket, Gold 1
1139, Black, Bed, Whatever, Punk Short, Nowar, 
1140, Lady, Notfunny, Argh, Small Child, Overalls, 
1141, Blue, Round Glasses, Say Aah, Devil, Vest, 
1142, Dark Brown, Pressure, Argh, , Hippy, 
1143, Blue, Bed, Gold Bling, Mafia, Overalls, 
1144, Dark Brown, Puppy Dog, Argh, Winter Hat, Gentleman, 
1145, Black, Multilevel, Whatever, Whereiswhale, Nofire, 
1146, Checkered, Bed, Blow Bubble, , Alcatraz, 
1147, Brown, Devourer, Moo, , , 
1148, Black, Love, Whatever, Trendy W 1, Preshistoric, Silver 2
1149, Africa Animal, Notfunny, Meh, War Helmet, Robinson, 
1150, Candy Cane, Dontsee, Dangerous Smoke 2, Punk Short, Cycle, Silver 1
1151, Red, Devourer, Meh, Hat 2, Multicolor, 
1152, Neon Glow, Nothappy, Whatever, Small Child, , Silver 2
1153, Albino, Notfunny, Meh, Winter Hat, Cool T-Shirt, 
1154, Easter Egg, Love, Meh Dangerous Smoke 1, Trick Hat, Trash, 
1155, Brown, Bed, Argh, Service, Fashion Accesory, 
1156, Beige, Nothappy Longer, Meh Dangerous Smoke 3, Have Fun 1, , 
1157, Bloodbath, Not Nice, Now, Hat 2, , Silver 1
1158, Nature, Money, Meh Dangerous Smoke 2, Whalehunter 1, Sweet Jacket, 
1159, Light Brown, See Stuff, Now, Leprechaun, Honololu, 
1160, Black, Devourer, Meh, , Trash, Silver 2
1161, Blue, Nothappy Longer, Blow Bubble, Fetish, Onthesea, 
1162, Grey, Nothappy, Moo, Punk Short, Praetexta, 
1163, Gotsun, Devourer, Dangerous Smoke 2, Warhat 2, Knight Armor, 
1164, Grey, Pirate, Meh Blow Bubble, Rabbit, Rock, 
1165, Bad Machine, Nothappy Longer, Meh, Leprechaun, Sweet Jacket, 
1166, Dark Brown, Pressure, Say Aah, Hat 3, Blank, Gold 1
1167, Brown, Puppy Dog, Funny, , Overalls, 
1168, Beige, See Stuff, Whatever, Mafia, Trash, 
1169, Black, Dontsee, Knife, Whalehunter 2, Preshistoric, Silver 1
1170, Brown, Pressure, Dangerous Smoke 2, Devil, Cool T-Shirt, Multiple
1171, Beige, Money, Argh, Jesus Alive, Make Fire, Jesus
1172, Red, Nothappy, Whatever, , Shirt Of Flames, Silver 2
1173, Gotsun, Love, Now, Punk Short, , Silver 1
1174, Light Brown, See Stuff, Higschool, , Sweet Jacket, 
1175, Albino, Dontsee, What, Manbun, , Multiple
1176, Lady, Multilevel, Meh, Service, Wifeshirt 2, 
1177, Dark Brown, Snake, Say Aah, , Moon, 
1178, Lady, Notfunny, Argh, , Knight Armor, 
1179, Brown, Blocksun, Blow Bubble, , Cycle, 
1180, Blue, Nothappy, Yesplease, , Trash, 
1181, Albino, Pirate, Moo, , Rappers, 
1182, Black, Reality, Funny, Cook, Trash, 
1183, Bloodbath, Money, Meh, , , 
1184, Grey, Pew, Dangerous Smoke 2, Prison, Rock, 
1185, Black, Nothappy, Yesplease, Comrade, Bang Bang, 
1186, Light Brown, Machine, Dangerous Smoke 3, Whereiswhale, Cycle, 
1187, Bad Machine, Not Nice, Dangerous Smoke 2, , Broken, 
1188, Light Brown, Nothappy, Meh, Warhat 1, Moon, 
1189, Beige, Not Nice, Scowl, War Helmet, , 
1190, Black, Machine, Meh, , , 
1191, Beige, Nothappy, Scowl, Prison, Preshistoric, Gold 1
1192, Albino, Puppy Dog, Meh Blow Bubble, , Nowar, Ear Cuff
1193, Black, Dontsee, Meh, Jesus Alive, Cycle, Silver 1
1194, Brown, Devourer, Whatever, Catch Robbers, Not A Suit, 
1195, Light Brown, Pressure, Meh, Hiiya, Vest, Silver 2
1196, Red, Dontsee, Dangerous Smoke 3, Mafia, Cycle, 
1197, Vector, Pressure, Scowl, Warhat 2, Vest, 
1198, Blue, Dontsee, Meh Dangerous Smoke 2, Catch Robbers, Blank, 
1199, Holo Rainbow, Pressure, Dangerous Smoke 2, Rabbit, Honololu, 
1200, No Signal, Multilevel, Yesplease, , , 
1201, Holo Rainbow, Notfunny, Dangerous Smoke 2, Comrade, Hipsterneck, 
1202, Gotsun, Pressure, Rainbow, Hat 1, Preshistoric, 
1203, Bloodbath, Notfunny, Argh, Fetish, Ymca, Silver 1
1204, Red, Multilevel, Dangerous Smoke 2, Whereiswhale, Cool T-Shirt, Silver 2
1205, Black, Pressure, Now, Jesus Alive, Great T-Shirt, Gold 2
1206, Acid, Dontsee, Higschool, , Hoodie Red, 
1207, Lady, Love, Dangerous Smoke 2, , Onthesea, 
1208, Light Brown, Blocksun, Argh, Trendy 1, Hipsterneck, 
1209, Red, Reality, Moo, Prison, , 
1210, Black, Pirate, Dangerous Smoke 1, , Wifeshirt 2, 
1211, Candy Cane, Dontsee, Moo, Headset, Cuba, 
1212, Lady, Love, Meh, Trendy 1, Hirewomen, Gold 1
1213, Woke From Dead, Not Nice, Say Aah, , Gentleman, 
1214, Machine, Dontsee, Meh, Whereisgiraffe, Wifeshirt 2, 
1215, Albino, Reality, No Teeth, Hiiya, Trash, 
1216, Machine, Notfunny, Gold Bling, Whalehunter 2, , 
1217, Africa Animal, Round Glasses, Whatever, War Helmet, Ay Sailor, 
1218, Brown, Notfunny, Scowl, , Preshistoric, 
1219, Bad Machine, Love, Whatever, Good Idea, Hoodie Red, Silver 2
1220, Holo Rainbow, Nothappy Longer, Argh, Whalehunter 1, Ymca, 
1221, Dark Brown, Pressure, Meh, Hat 1, Ay Sailor, Gold 2
1222, Woke From Dead, Blocksun, No Teeth, Visor Hat, Knight Armor, 
1223, Bloodbath, Round Glasses, Say Aah, , Honololu, 
1224, Bad Machine, Reality, Meh Blow Bubble, , Hippy, 
1225, Black, Notfunny, Dangerous Smoke 2, Punk Short, Ay Sailor, 
1226, Brown, Nothappy, Meh, Small Child, , 
1227, Beige, Notfunny, Moo, Jesus Alive, Ay Sailor, 
1228, Dark Brown, Multilevel, Whatever, Have Fun 1, Trash, 
1229, Red, See Stuff, Funny, , , 
1230, Gotsun, Notfunny, Now, Trendy 1, Onthesea, Silver 1
1231, Blue, Blocksun, Meh, Prison, Vegas Dancer, 
1232, Lady, Dead, Moo, Visor Hat, Fashion Accesory, 
1233, Light Brown, Multilevel, Meh, Whalehunter 1, Lingerie, 
1234, Woke From Dead, Pressure, Whatever, Leprechaun, Weapon Belt, Ear Cuff
1235, Blue, Bed, Scowl, Cat Ears, Ymca, Gold 2
1236, Beige, Pressure, Now, Visor Hat, , 
1237, Light Brown, See Stuff, Dangerous Smoke 2, Whalehunter 2, Alcatraz, 
1238, Grey, Nothappy, Meh, , Gentleman, 
1239, Beige, Notfunny, What, Trendy 1, Knight Armor, 
1240, Black, Money, Moo, Devil, Multicolor, Gold 2
1241, Light Brown, Pirate, Meh, Whalehunter 2, , 
1242, Bad Machine, Multilevel, Whatever, Jesus Alive, Cool T-Shirt, 
1243, Easter Egg, Dontlook, Meh, , , 
1244, Beige, Pressure, Whatever, Have Fun 1, Poncho, 
1245, Dark Brown, Notfunny, Meh Blow Bubble, Notsmart, Honololu, 
1246, Acid, Reality, Meh, , , Gold 1
1247, Neon Glow, Multilevel, Meh Dangerous Smoke 2, , Overalls, 
1248, Black, Pressure, No Teeth, Hiiya, Hipsterneck, 
1249, Lady, Pirate, Scowl, Trick Hat, Cool T-Shirt, 
1250, Candy Cane, See Stuff, No Teeth, Hippy Hat, , 
1251, Lady, Nothappy, Whatever, Good Idea, , Ear Cuff
1252, Brown, Round Glasses, Meh, Comrade, Knight Armor, 
1253, Light Brown, Notfunny, Funny, , Ymca, 
1254, Dark Brown, Undead, Whatever, Whalehunter 2, Rappers, 
1255, Blue, Notfunny, Argh, Prison, Trench, Gold 1
1256, Brown, Multilevel, Say Aah, Rabbit, Onthesea, 
1257, Africa Animal, See Stuff, Whatever, Trendy 2, Hipsterneck, 
1258, Brown, Blocksun, Scowl, Manbun, Piercings, 
1259, Bad Machine, See Stuff, Whatever, Warhat 2, Multicolor, 
1260, Red, Notfunny, Moo, Trendy 1, , Silver 1
1261, Gotsun, See Stuff, Say Aah, Devil, Rock, 
1262, Beige, Pressure, Meh, , Moon, Silver 2
1263, Checkered, See Stuff, Moo, Trendy 1, Nowar, 
1264, Grey, Money, Sounds, Hat 3, Overalls, 
1265, Beige, Notfunny, Whatever, Service, Hipster Shirt, Silver 2
1266, Light Brown, Dontsee, Say Aah, Hat 3, , 
1267, Brown, See Stuff, Moo, Have Fun 2, Gentleman, Silver 1
1268, Machine, Monocle, What, Rabbit, Trash, 
1269, Blue, Nothappy, Meh Knife, Whereiswhale, Cuba, 
1270, Black, Pirate, Meh, Whereisgiraffe, , 
1271, Brown, See Stuff, Moo, Headset, Sweet Jacket, 
1272, Bloodbath, Bed, Argh, Prison, , 
1273, No Signal, Multilevel, What, , , Stretched
1274, Red, Money, Nofeelingwell, Hat 3, Cycle, Silver 2
1275, Beige, Nothappy, Whatever, , Cool T-Shirt, Gold 2
1276, Light Brown, See Stuff, Meh, Prison, Robinson, 
1277, Acid, Not Nice, Whatever, , Poncho, 
1278, Blue, Devourer, Sounds, Small Child, Hirewomen, 
1279, Red, Notfunny, Now, , Cycle, 
1280, Dark Brown, Dontsee, Say Aah, Hat 1, Rappers, 
1281, No Signal, Blocksun, What, , , 
1282, Neon Glow, Love, Dangerous Smoke 2, Fetish, Hippy, 
1283, Black, Pressure, Meh Dangerous Smoke 2, , Onthesea, 
1284, Dark Brown, Notfunny, What, Warhat 1, , Gold 2
1285, Lady, Dontsee, Funny, Prison, Praetexta, 
1286, Africa Animal, Pirate, Whatever, Whereiswhale, Cool T-Shirt, 
1287, Dark Brown, Round Glasses, Bling, Rabbit, Bang Bang, 
1288, Black, Notfunny, Meh, Comrade, Chemist, 
1289, Dark Brown, Dontsee, Funny, Hat 1, Sweet 16, Silver 2
1290, Brown, Pressure, Meh, , Rappers, 
1291, Beige, Notfunny, Now, , Knight Armor, 
1292, Machine, See Stuff, Meh, Hat 2, Preshistoric, 
1293, Albino, Machine, Blow Bubble, , Onthesea, 
1294, Red, Pirate, Meh, Notsmart, , Silver 1
1295, Dark Brown, Dead, Yesplease, Warhat 1, Cycle, Gold 2
1296, Albino, Dontsee, Dangerous Smoke 1, , Not A Suit, 
1297, Lady, Undead, Meh, , Shirt Of Flames, 
1298, Dark Brown, Pressure, Say Aah, Cat Ears, Hipster Shirt, 
1299, Holo Rainbow, Not Nice, Whatever, Warhat 2, Piercings, 
1300, Easter Egg, Love, Meh, Trendy 1, Cool T-Shirt, Silver 2
1301, Brown, Pressure, Yesplease, Small Child, Fishnet Top, 
1302, Neon Glow, Love, Meh, Punk Short, Blank, Silver 1
1303, Beige, Bed, Argh, Small Child, Onthesea, Jesus
1304, Blue, Machine, Meh Dangerous Smoke 2, Trendy 1, Honololu, 
1305, Gotsun, Dead, Dangerous Smoke 2, Whalehunter 1, Wifeshirt 2, Silver 2
1306, Holo Rainbow, Bed, Whatever, Whereisgiraffe, Poncho, Multiple
1307, Black, Love, Meh, Jesus Alive, Weapon Belt, 
1308, No Signal, Notfunny, Say Aah, Winter Hat, , 
1309, Blue, Puppy Dog, Hipster Stache, , , 
1310, No Signal, Nothappy Longer, Whatever, Manbun, , 
1311, Light Brown, Bed, What, Cat Ears, , Silver 1
1312, Black, Notfunny, Higschool, Jesus Alive, Nowar, 
1313, Brown, Bed, Moo, Hiiya, Hippy, 
1314, Bloodbath, Notfunny, Knife, , Weapon Belt, Gold 1
1315, Brown, Devourer, Funny, , Wifeshirt 2, 
1316, Africa Animal, Not Nice, Meh Higschool, , Vegas Dancer, 
1317, Machine, Machine, Meh, Mafia, Cool T-Shirt, Silver 2
1318, Checkered, Money, Argh, Notsmart, Not A Suit, 
1319, Lady, Devourer, Nofeelingwell, Hat 3, Nofire, 
1320, Machine, Dontlook, Argh, Prison, Broken, 
1321, Woke From Dead, Undead, Moo, Whereiswhale, , 
1322, Light Brown, Bed, Buck Teeth, Notsmart, Hirewomen, 
1323, Gotsun, Undead, Scowl, Service, Hoodie Black, 
1324, Color Dots, Reality, Meh Dangerous Smoke 2, , Hipsterneck, Gold 1
1325, Beige, Pressure, Meh Dangerous Smoke 3, Mafia, Fashion Accesory, 
1326, No Signal, Notfunny, Higschool, Rabbit, , Silver 2
1327, Dark Brown, Round Glasses, Nofeelingwell, , Preshistoric, Gold 1
1328, Nature, Notfunny, Argh, , Cycle, 
1329, Black, Blocksun, Dangerous Smoke 2, Punk Short, Cuba, 
1330, Africa Animal, Devourer, Meh Dangerous Smoke 3, Leprechaun, Not A Suit, 
1331, Bloodbath, Money, What, Mafia, , 
1332, Brown, Undead, Whatever, Small Child, Ay Sailor, 
1333, Holo Rainbow, Pressure, What, , Hipster Shirt, Gold 2
1334, Gotsun, See Stuff, Meh, War Helmet, Weapon Belt, Silver 1
1335, Albino, Notfunny, Whatever, Service, Hirewomen, 
1336, Dark Brown, Multilevel, Food, Warhat 2, Praetexta, 
1337, Lady, Pressure, Say Aah, Service, Blank, 
1338, Red, Round Glasses, Meh, , Lingerie, Silver 2
1339, Brown, Devourer, Rainbow, Have Fun 1, Ay Sailor, 
1340, Nature, Dontlook, Dangerous Smoke 2, War Helmet, Poncho, Gold 1
1341, Light Brown, See Stuff, Whatever, Antique, Broken, 
1342, Black, Love, Moo, Warhat 2, Rock, 
1343, Albino, Undead, No Teeth, Jesus Alive, Gentleman, Gold 2
1344, Woke From Dead, Dontsee, Meh Dangerous Smoke 2, Devil, Broken, Silver 1
1345, Gotsun, Bed, Dangerous Smoke 2, Trendy 1, , Gold 2
1346, Light Brown, Monocle, Whatever, , Ay Sailor, 
1347, Brown, Notfunny, Say Aah, , Trash, 
1348, Bloodbath, See Stuff, Funny, Service, , 
1349, Dark Brown, Notfunny, Meh, Prison, Not A Suit, Gold 1
1350, Checkered, Undead, Dangerous Smoke 2, Comrade, Praetexta, 
1351, Red, Reality, Now, Whalehunter 1, Nowar, 
1352, Color Dots, Notfunny, Whatever, Whalehunter 2, Great T-Shirt, 
1353, Brown, Undead, Yesplease, , Not A Suit, 
1354, Beige, Nothappy, Meh, , Nowar, Multiple
1355, Brown, Dontsee, Meh Dangerous Smoke 1, Leprechaun, Fashion Accesory, Silver 1
1356, Black, Pressure, Now, Have Fun 1, Rock, Ear Cuff
1357, Brown, Reality, Meh Dangerous Smoke 2, Hat 3, Hipsterneck, Silver 1
1358, Vector, Notfunny, Whatever, , Ay Sailor, Silver 2
1359, Beige, Snake, Meh Dangerous Smoke 2, Manbun, Blank, 
1360, Checkered, Not Nice, What, , Bang Bang, 
1361, Black, Notfunny, Whatever, Service, Rock, Silver 1
1362, Bloodbath, Undead, Funny, Devil, Cuba, 
1363, Albino, Notfunny, Meh, Trendy 2, Praetexta, 
1364, Blue, Bed, Yesplease, Trendy 1, Gentleman, Silver 2
1365, Dark Brown, Dontlook, What, Punk Short, Onthesea, 
1366, Lady, Nothappy, Whatever, Devil, Trash, 
1367, Grey, Love, Meh, Service, Wifeshirt 2, 
1368, Lady, Puppy Dog, Now, Prison, Shirt Of Flames, 
1369, Red, Reality, Whatever, Winter Hat, Preshistoric, 
1370, Black, Notfunny, No Teeth, Trendy 1, Fashion Accesory, 
1371, Albino, Bed, Whatever, Comrade, Praetexta, 
1372, Blue, Multilevel, Funny, Cat Ears, , 
1373, Dark Brown, Not Nice, Whatever, Service, Multicolor, 
1374, Blue, Puppy Dog, Dangerous Smoke 2, , Vegas Dancer, 
1375, Black, Nothappy, Yesplease, Whereiswhale, Wifeshirt 1, 
1376, Beige, Bed, Meh, Trendy W 2, Fishnet Top, Gold 2
1377, Checkered, Multilevel, Dangerous Smoke 2, Warhat 1, Cuba, Ear Cuff
1378, Brown, Pressure, Now, Trendy 1, Nofire, Silver 2
1379, Black, Bed, Meh, , Weapon Belt, 
1380, Acid, Notfunny, Scowl, , , 
1381, Brown, Nothappy, Meh, Prison, Praetexta, 
1382, Bloodbath, Pressure, Argh, Hat 1, , 
1383, Grey, Notfunny, Say Aah, Rabbit, Nowar, Gold 1
1384, Light Brown, Nothappy, Whatever, Manbun, Knight Armor, 
1385, Candy Cane, Pressure, Argh, , , 
1386, Neon Glow, Notfunny, Whatever, Mafia, Cycle, Ear Cuff
1387, Red, Love, Bling, Trendy 2, Vegas Dancer, 
1388, Africa Animal, Devourer, Meh, Small Child, Honololu, 
1389, Dark Brown, See Stuff, Whatever, , Cycle, 
1390, Red, Money, Moo, , Piercings, 
1391, Machine, Puppy Dog, Gold Bling, Whalehunter 1, Nowar, Multiple
1392, Beige, Nothappy, Nofeelingwell, , Hoodie Red, Silver 2
1393, Albino, Machine, Meh Dangerous Smoke 2, Notsmart, Broken, 
1394, Brown, Pirate, Meh, Cat Ears, Cuba, 
1395, Neon Glow, Money, Meh Dangerous Smoke 2, , Fishnet Top, Multiple
1396, Beige, Pirate, Sounds, , Ymca, 
1397, Gotsun, Dontlook, Whatever, , , 
1398, Machine, Multilevel, Moo, Hat 3, Moon, Gold 1
1399, Gotsun, Blocksun, Whatever, Prison, Honololu, 
1400, Acid, Round Glasses, Yesplease, Whereisgiraffe, , 
1401, Dark Brown, Notfunny, Moo, Notsmart, Overalls, Gold 2
1402, Nature, Bed, Say Aah, , , 
1403, Brown, Not Nice, Sounds, Warhat 2, Nowar, 
1404, Black, Nothappy Longer, Scowl, , Great T-Shirt, 
1405, Dark Brown, Bed, Dangerous Smoke 3, Small Child, Hoodie Black, 
1406, Blue, Pressure, Scowl, Prison, Nofire, 
1407, Nature, Nothappy Longer, Whatever, Fetish, Preshistoric, Silver 1
1408, Black, Dontsee, Buck Teeth, , , 
1409, Machine, Bed, Whatever, , Broken, 
1410, Blue, See Stuff, Moo, Hiiya, Fashion Accesory, Gold 1
1411, Vector, Nothappy, Whatever, Catch Robbers, Hipster Shirt, 
1412, Bad Machine, Pressure, Dangerous Smoke 2, Whereiswhale, Nowar, 
1413, Void, Nothappy, Yesplease, Leprechaun, , 
1414, Brown, Bed, Dangerous Smoke 2, Hat 3, Poncho, Silver 2
1415, Light Brown, Snake, Say Aah, Punk Short, , Silver 1
1416, Dark Brown, Nothappy, Meh, Winter Hat, Trash, 
1417, Black, See Stuff, Rainbow, Devil, Praetexta, 
1418, Beige, Nothappy Longer, Whatever, , Fashion Accesory, Silver 1
1419, Africa Animal, Bed, Meh, , Nowar, 
1420, Holo Rainbow, Round Glasses, Meh Dangerous Smoke 1, Whereisgiraffe, Trash, Multiple
1421, Brown, Money, Dangerous Smoke 1, Cat Ears, Fishnet Top, 
1422, Bloodbath, See Stuff, Dangerous Smoke 2, Have Fun 1, , 
1423, Grey, Bed, Higschool, , Hippy, 
1424, Blue, Dontsee, Meh, Comrade, , Silver 2
1425, Stars And Stripes, Nothappy Longer, Whatever, , , 
1426, Lady, Notfunny, Meh Dangerous Smoke 1, Jesus Alive, Ymca, 
1427, Bad Machine, Bed, No Teeth, , , Silver 1
1428, Gotsun, Nothappy Longer, Say Aah, Leprechaun, Sweet 16, 
1429, Neon Glow, Nothappy, Meh, , Blank, 
1430, Beige, Notfunny, Argh, Service, Honololu, 
1431, Stars And Stripes, Not Nice, Hipster Stache, Devil, , 
1432, Beige, Round Glasses, Knife, Whalehunter 2, , 
1433, Gotsun, Dontsee, Meh, Trick Hat, Hoodie Black, 
1434, Blue, Notfunny, Rainbow, Trendy 1, Ymca, 
1435, Red, Dead, Meh Blow Bubble, Mafia, Cycle, 
1436, Brown, Pressure, Say Aah, Whalehunter 1, Vegas Dancer, Silver 1
1437, Void, Nothappy, Food, Hiiya, , 
1438, Vector, Notfunny, Yesplease, Fetish, , Silver 1
1439, Red, Pressure, Say Aah, Leprechaun, Moon, 
1440, Lady, Notfunny, Moo, Trendy 1, , Silver 2
1441, Red, Pirate, Food, Mafia, Sweet Jacket, Silver 1
1442, Dark Brown, Notfunny, Meh, Punk Short, Rock, 
1443, Light Brown, Monocle, Meh Knife, Mafia, Multicolor, 
1444, Holo Rainbow, Notfunny, Meh Dangerous Smoke 3, , Nofire, 
1445, Easter Egg, Machine, Nofeelingwell, , Weapon Belt, 
1446, Black, Bed, Meh, , , 
1447, Machine, Round Glasses, Whatever, Have Fun 1, Chemist, Multiple
1448, Bad Machine, Machine, Meh, Warhat 1, Alcatraz, 
1449, Brown, Money, Say Aah, Hiiya, Preshistoric, Gold 2
1450, Woke From Dead, Notfunny, Meh Dangerous Smoke 1, Leprechaun, Hipster Shirt, Gold 1
1451, Nature, Snake, Argh, Fetish, Multicolor, 
1452, Lady, Nothappy Longer, Scowl, Prison, Honololu, 
1453, Beige, Money, Yesplease, Cat Ears, Sweet Jacket, 
1454, Holo Rainbow, Nothappy Longer, Meh, Cook, Cuba, 
1455, Nature, Undead, Whatever, Trendy 1, Nowar, 
1456, Bad Machine, Puppy Dog, Moo, Service, Fishnet Top, 
1457, Brown, Notfunny, Argh, Hidehairs, , 
1458, Black, Money, Meh, , Poncho, Multiple
1459, Brown, Pressure, Whatever, Punk Short, Hipsterneck, 
1460, Vector, Blocksun, Dangerous Smoke 2, Whalehunter 2, , 
1461, Blue, Devourer, Meh Sounds, War Helmet, Cycle, 
1462, Brown, Pressure, Whatever, Mafia, Wifeshirt 1, Multiple
1463, Blue, Dead, Moo, Punk Short, Multicolor, 
1464, Red, Undead, Dangerous Smoke 2, Cat Ears, Chemist, 
1465, Brown, See Stuff, Argh, Cook, Blank, 
1466, Neon Glow, Notfunny, Whatever, Whalehunter 1, Hipster Shirt, Silver 1
1467, Vector, Dontsee, Gold Bling, Prison, Bringcash, 
1468, Bloodbath, Nothappy Longer, Argh, Cook, , Silver 2
1469, Stars And Stripes, See Stuff, Meh Dangerous Smoke 2, Comrade, , 
1470, Blue, Love, Meh, Whalehunter 1, Rock, 
1471, Grey, Pressure, Whatever, , Trash, 
1472, Brown, Machine, Argh, Punk Short, Weapon Belt, 
1473, Africa Animal, Pew, Scowl, Cat Ears, Hipster Shirt, Ear Cuff
1474, Albino, Reality, Blow Bubble, Whalehunter 1, Preshistoric, 
1475, Beige, Notfunny, Moo, Comrade, Hipsterneck, 
1476, Lady, Devourer, Dangerous Smoke 2, , Cycle, 
