1477, Brown, Pirate, Yesplease, , Nofire, Silver 2
1478, Black, Multilevel, Whatever, Devil, Blank, Silver 1
1479, Color Dots, Pew, Rainbow, Hippy Hat, Multicolor, 
1480, Beige, Dontsee, Moo, Hiiya, Hippy, 
1481, Bloodbath, Pressure, Whatever, Comrade, , 
1482, Albino, Notfunny, Dangerous Smoke 2, Whalehunter 1, Nofire, 
1483, Black, Devourer, Whatever, Cook, Rock, 
1484, Grey, Nothappy, Dangerous Smoke 2, Jesus Alive, , 
1485, Light Brown, See Stuff, Whatever, Whereiswhale, Knight Armor, 
1486, Lady, Love, Say Aah, Hiiya, Poncho, 
1487, Dark Brown, Nothappy Longer, Dangerous Smoke 2, Warhat 2, , 
1488, Red, Notfunny, Whatever, , Blank, 
1489, Dark Brown, See Stuff, Yesplease, Small Child, Ymca, 
1490, Grey, Not Nice, Meh, Trendy 2, Robinson, 
1491, Albino, See Stuff, Whatever, , Not A Suit, Gold 2
1492, Woke From Dead, Dontsee, Meh Dangerous Smoke 2, Service, Cuba, Silver 1
1493, Dark Brown, Notfunny, Say Aah, Trendy W 2, Blank, 
1494, Woke From Dead, Dontsee, Whatever, Whalehunter 2, Cuba, 
1495, Albino, Bed, Moo, Prison, Ay Sailor, 
1496, Brown, Multilevel, Meh, Trendy W 2, Hipsterneck, Silver 2
1497, Red, Dontsee, Now, Rabbit, Preshistoric, Gold 2
1498, Brown, Nothappy Longer, Meh, Devil, Nofire, 
1499, Bloodbath, Round Glasses, Whatever, Hiiya, Trench, Jesus
1500, Dark Brown, Money, Scowl, , Ymca, 
1501, Easter Egg, Lazer, Blow Bubble, , Sweet Jacket, 
1502, Bad Machine, Monocle, Whatever, War Helmet, Knight Armor, 
1503, Bloodbath, Undead, Dangerous Smoke 2, Comrade, , 
1504, Dark Brown, Multilevel, Whatever, , Fashion Accesory, 
1505, Blue, Dontsee, Argh, Hippy Hat, Cycle, 
1506, Dark Brown, Round Glasses, Meh Dangerous Smoke 2, Manbun, Onthesea, Silver 2
1507, Africa Animal, Notfunny, Moo, , Alcatraz, 
1508, Stars And Stripes, Pressure, Nofeelingwell, , , 
1509, Black, Money, Whatever, Devil, Preshistoric, 
1510, Grey, Machine, Meh Dangerous Smoke 3, Hiiya, Onthesea, 
1511, Bloodbath, Dontsee, Dangerous Smoke 3, Hat 3, Cuba, 
1512, Stars And Stripes, Notfunny, Dangerous Smoke 2, Trendy 2, Chemist, 
1513, Beige, Dontsee, Moo, Notsmart, Ay Sailor, Silver 2
1514, Black, Round Glasses, Meh Dangerous Smoke 2, Hiiya, Rock, 
1515, Africa Animal, Undead, Moo, Comrade, , 
1516, Grey, Money, Meh, Service, Great T-Shirt, 
1517, Black, See Stuff, Dangerous Smoke 1, Punk Short, Multicolor, 
1518, Light Brown, Bed, Nofeelingwell, Good Idea, Chemist, 
1519, Lady, Puppy Dog, Meh Dangerous Smoke 1, Catch Robbers, Vegas Dancer, 
1520, Light Brown, See Stuff, Blow Bubble, Small Child, Poncho, 
1521, Bad Machine, Not Nice, Whatever, Jesus Alive, Cuba, 
1522, Dark Brown, Machine, Meh, Trendy 2, Fashion Accesory, 
1523, Lady, Bed, Dangerous Smoke 2, Whalehunter 1, Blazer Black, Silver 1
1524, Brown, See Stuff, Moo, Trendy W 2, Hipster Shirt, Silver 2
1525, Gotsun, Money, Dangerous Smoke 1, Whalehunter 1, , 
1526, Vector, Nothappy, Blow Bubble, Punk Short, Multicolor, 
1527, Bad Machine, See Stuff, Dangerous Smoke 2, , Fashion Accesory, Silver 2
1528, Albino, Monocle, Whatever, Jesus Alive, Nowar, 
1529, Bad Machine, Machine, Meh, Hat 3, Honololu, 
1530, No Signal, Dontsee, Nofeelingwell, Small Child, , 
1531, Brown, Nothappy Longer, Gold Bling, Hat 3, Fishnet Top, 
1532, Africa Animal, Pressure, Argh, , Rappers, Gold 2
1533, Grey, Love, What, Have Fun 2, Hipsterneck, 
1534, Albino, Puppy Dog, Food, , Onthesea, 
1535, Lady, Pressure, Whatever, Devil, Piercings, Multiple
1536, Bad Machine, Nothappy, Dangerous Smoke 2, Hat 1, Hippy, 
1537, Woke From Dead, Bed, Whatever, Comrade, Wifeshirt 2, 
1538, Black, Notfunny, What, Hiiya, , 
1539, Blue, Money, Yesplease, Trendy 1, , 
1540, Black, Pressure, Whatever, Have Fun 2, Lingerie, Silver 2
1541, Brown, Nothappy, Gold Bling, Notsmart, Preshistoric, Gold 1
1542, Light Brown, Pressure, Knife, Hidehairs, Moon, 
1543, Africa Animal, Round Glasses, Meh, , Fashion Accesory, 
1544, Light Brown, Nothappy Longer, Moo, , Blank, 
1545, Dark Brown, Blocksun, Now, Hat 2, Hipster Shirt, Silver 1
1546, Light Brown, See Stuff, Dangerous Smoke 2, , , Gold 1
1547, Dark Brown, Money, Argh, Hiiya, Ay Sailor, 
1548, Easter Egg, Dead, Whatever, Warhat 1, Vegas Dancer, Gold 1
1549, Dark Brown, Notfunny, Argh, Hat 1, Great T-Shirt, 
1550, Woke From Dead, Bed, Whatever, Trendy 1, Hipster Shirt, Gold 1
1551, Beige, Nothappy Longer, Blow Bubble, Leprechaun, Preshistoric, 
1552, Candy Cane, Nothappy, Meh Blow Bubble, Warhat 1, , Silver 1
1553, Black, Love, Meh, Notsmart, Nofire, Jesus
1554, Light Brown, Nothappy Longer, Now, Visor Hat, , Gold 1
1555, Gotsun, Pressure, Meh, Trick Hat, Overalls, Silver 1
1556, Dark Brown, Puppy Dog, Moo, , Wifeshirt 1, 
1557, Candy Cane, Notfunny, Meh, , , 
1558, Black, Love, Hipster Stache, Small Child, Sweet 16, Silver 1
1559, Brown, Pressure, Moo, Prison, Ay Sailor, Silver 2
1560, Light Brown, Bed, Meh Dangerous Smoke 2, Jesus Alive, Onthesea, Silver 1
1561, Dark Brown, Notfunny, Dangerous Smoke 2, Rule All, Gentleman, Gold 2
1562, Holo Rainbow, Pew, Argh, Cat Ears, Robinson, Gold 1
1563, Blue, Love, Meh Dangerous Smoke 2, Devil, Bringcash, 
1564, Dark Brown, Undead, Gold Bling, Trendy W 1, Honololu, 
1565, Nature, Nothappy Longer, Whatever, Prison, Onthesea, 
1566, Black, Dontsee, Meh, Visor Hat, Bringcash, 
1567, Checkered, Round Glasses, Higschool, Whereiswhale, Hipsterneck, 
1568, Blue, Nothappy Longer, Whatever, Jesus Alive, Cool T-Shirt, 
1569, Black, See Stuff, Moo, Winter Hat, Rock, 
1570, Blue, Multilevel, Whatever, , Nofire, 
1571, Machine, Devourer, Argh, War Helmet, Nowar, 
1572, Checkered, Multilevel, Blow Bubble, Hiiya, Cool T-Shirt, 
1573, Candy Cane, Blocksun, Whatever, , Wifeshirt 1, 
1574, Dark Brown, Nothappy, Moo, Winter Hat, Trash, 
1575, Albino, Notfunny, Whatever, Whalehunter 2, , 
1576, Beige, Dead, Scowl, Hat 2, Rock, 
1577, Blue, Notfunny, Argh, Jesus Alive, Sweet Jacket, 
1578, Black, Monocle, Now, , Moon, 
1579, No Signal, Multilevel, Whatever, Service, , 
1580, Holo Rainbow, Round Glasses, Meh, Notsmart, , 
1581, Grey, Dontsee, Whatever, Service, , 
1582, Bad Machine, Pressure, Meh, Hiiya, , 
1583, Vector, Nothappy Longer, Whatever, Whalehunter 2, Ymca, Silver 1
1584, Grey, Multilevel, Food, Whalehunter 1, Ay Sailor, 
1585, Bloodbath, Love, Whatever, , , 
1586, Easter Egg, Pressure, Meh, War Helmet, , 
1587, Beige, Pirate, Whatever, Prison, Shirt Of Flames, 
1588, Brown, See Stuff, Funny, Winter Hat, Vest, 
1589, Candy Cane, Money, Meh, Leprechaun, , 
1590, Light Brown, Dead, Gold Bling, Hat 1, Onthesea, 
1591, Brown, Dontsee, Whatever, Hat 3, Poncho, Silver 1
1592, Checkered, Notfunny, Dangerous Smoke 1, Punk Short, Piercings, 
1593, Brown, Round Glasses, Meh, Trendy W 2, Weapon Belt, 
1594, Light Brown, Multilevel, Say Aah, Trendy 1, Ok, 
1595, Albino, Nothappy, Whatever, Trendy W 2, Alcatraz, 
1596, Bloodbath, Nothappy Longer, Meh, Winter Hat, , 
1597, Beige, Multilevel, Rainbow, Trendy W 1, Ok, Gold 2
1598, Light Brown, Notfunny, Meh, Comrade, Poncho, 
1599, Holo Rainbow, Bed, Moo, Whalehunter 1, Cool T-Shirt, Silver 2
1600, Black, Reality, Scowl, , Bang Bang, 
1601, Red, Dontsee, Dangerous Smoke 2, , Vest, Gold 1
1602, Color Dots, Bed, Knife, Whalehunter 2, Hipsterneck, 
1603, Neon Glow, Puppy Dog, Dangerous Smoke 2, , , 
1604, Brown, Dontlook, Blow Bubble, Cat Ears, Bringcash, 
1605, Black, Notfunny, Yesplease, Jesus Alive, Cuba, Silver 2
1606, Gotsun, Love, Meh, Trendy 2, Multicolor, 
1607, Beige, Dontsee, Meh Dangerous Smoke 2, Prison, Overalls, 
1608, Dark Brown, Notfunny, Whatever, , , Gold 1
1609, Machine, Love, Nofeelingwell, Mafia, Wifeshirt 2, 
1610, Brown, See Stuff, Meh, Antique, Onthesea, Silver 2
1611, Dark Brown, Love, Nofeelingwell, , Trench, 
1612, Brown, Dontsee, Moo, , , Multiple
1613, Holo Rainbow, Notfunny, What, Whereiswhale, Blank, 
1614, Brown, Dontlook, Dangerous Smoke 2, Hiiya, Cycle, 
1615, Light Brown, Multilevel, Moo, Cat Ears, Ymca, 
1616, Bloodbath, See Stuff, Whatever, Headset, , 
1617, Gotsun, Multilevel, What, Whalehunter 2, Overalls, Ear Cuff
1618, Brown, Pirate, Buck Teeth, , Wifeshirt 1, 
1619, Dark Brown, Undead, Meh Food, , , Gold 2
1620, Brown, Notfunny, Moo, Whereiswhale, Great T-Shirt, 
1621, Easter Egg, Money, Dangerous Smoke 1, Warhat 1, Trench, 
1622, Bad Machine, Undead, Say Aah, Prison, Trash, Silver 2
1623, Light Brown, Pressure, Nofeelingwell, Have Fun 1, Costume Old, 
1624, Woke From Dead, Pirate, Meh, Small Child, Hippy, 
1625, Light Brown, Dontsee, Meh Dangerous Smoke 2, Visor Hat, , Silver 2
1626, Albino, Pirate, Meh, Fetish, Ymca, Silver 1
1627, Blue, Undead, Argh, Hidehairs, Hipsterneck, 
1628, Dark Brown, Notfunny, What, , Preshistoric, 
1629, Light Brown, Dontlook, Gold Bling, , Rock, 
1630, Candy Cane, Notfunny, Meh, Whereiswhale, , Gold 2
1631, Gotsun, Pirate, Whatever, Prison, Blank, 
1632, Lady, Nothappy Longer, Nofeelingwell, , Vegas Dancer, Silver 1
1633, Dark Brown, Multilevel, Moo, Prison, Rock, Multiple
1634, Brown, Pirate, Whatever, Whereiswhale, Hirewomen, Jesus
1635, Red, Dead, Meh, , Chemist, Silver 1
1636, Brown, Round Glasses, Yesplease, Hiiya, , 
1637, Woke From Dead, Dontlook, What, Notsmart, Not A Suit, 
1638, Dark Brown, Not Nice, Meh, Trendy W 2, Make Fire, 
1639, Red, Blocksun, Argh, Visor Hat, Preshistoric, Gold 2
1640, Light Brown, Bed, Knife, Whalehunter 2, Nofire, 
1641, Blue, See Stuff, Yesplease, , Trash, 
1642, Color Dots, Bed, Meh Dangerous Smoke 2, War Helmet, Preshistoric, Silver 2
1643, Black, Blocksun, Yesplease, , Multicolor, 
1644, Beige, Nothappy Longer, Dangerous Smoke 2, Prison, Nofire, Silver 2
1645, Blue, Nothappy, Scowl, , Moon, 
1646, Light Brown, See Stuff, What, , Blank, 
1647, Brown, Dead, Moo, Prison, , 
1648, Black, Notfunny, Whatever, Whereiswhale, Nowar, Ear Cuff
1649, Beige, Multilevel, What, Devil, Cycle, 
1650, Dark Brown, Round Glasses, Nofeelingwell, , Trench, Gold 1
1651, Lady, Undead, Whatever, Cook, Not A Suit, 
1652, Beige, Pressure, What, Notsmart, Wifeshirt 1, 
1653, Color Dots, Notfunny, Meh Dangerous Smoke 2, Comrade, Knight Armor, 
1654, Black, Blocksun, Whatever, Whalehunter 2, Hippy, 
1655, Dark Brown, Multilevel, Meh, , Praetexta, 
1656, Blue, Blocksun, Moo, Whereisgiraffe, Great T-Shirt, 
1657, Candy Cane, Future, Whatever, Jesus Alive, , 
1658, Albino, Bed, Dangerous Smoke 3, , Cool T-Shirt, 
1659, Machine, Dontsee, Meh, Rabbit, Nofire, 
1660, No Signal, Love, Say Aah, Notsmart, , 
1661, Brown, Dead, Meh, Cook, Sweet 16, Gold 2
1662, Black, Dontlook, Moo, Hat 3, Piercings, 
1663, Albino, Pressure, Meh Dangerous Smoke 2, Hat 2, , 
1664, Gotsun, Notfunny, Meh, Punk Short, Moon, 
1665, Nature, Machine, Whatever, Whalehunter 2, Overalls, 
1666, Beige, Not Nice, Rainbow, Whalehunter 1, Blank, 
1667, Blue, Devourer, Meh, , , 
1668, Light Brown, Pirate, Dangerous Smoke 2, Trendy 1, , 
1669, Black, Pressure, Whatever, Trendy 2, Hipsterneck, Gold 1
1670, Woke From Dead, Pirate, Nofeelingwell, Hat 2, Ay Sailor, 
1671, Gotsun, Undead, Meh, Rabbit, Rock, 
1672, Brown, Notfunny, Moo, Warhat 1, Great T-Shirt, Ear Cuff
1673, Dark Brown, Blocksun, Argh, Hat 2, Blank, 
1674, Light Brown, Notfunny, Meh, Prison, Rappers, Silver 2
1675, Neon Glow, See Stuff, Yesplease, Catch Robbers, Gentleman, 
1676, Bad Machine, Bed, Whatever, Hiiya, Multicolor, 
1677, Bloodbath, Undead, Meh Dangerous Smoke 3, Headset, , 
1678, Dark Brown, Blocksun, Argh, Mafia, Ay Sailor, 
1679, Beige, Round Glasses, Whatever, Trendy 1, Shirt Of Flames, Gold 1
1680, Dark Brown, Dontsee, Meh Dangerous Smoke 2, Hippy Hat, Overalls, 
1681, Light Brown, Nothappy Longer, Moo, Devil, Preshistoric, 
1682, Africa Animal, Dontlook, Meh, Jesus Alive, , Silver 1
1683, Black, Notfunny, Meh Dangerous Smoke 3, Rabbit, Hirewomen, Silver 2
1684, Red, Nothappy Longer, Meh, , Overalls, 
1685, Light Brown, Blocksun, Argh, , Sweet Jacket, 
1686, Brown, Dontsee, Meh, , Ay Sailor, Silver 2
1687, Black, Nothappy Longer, Whatever, , Nowar, 
1688, Light Brown, Blocksun, Yesplease, Jesus Alive, Wifeshirt 2, 
1689, Blue, Notfunny, Dangerous Smoke 3, Punk Short, Vest, Gold 1
1690, Red, Bed, What, , Onthesea, Jesus
1691, Blue, Dontsee, Whatever, Good Idea, Ay Sailor, 
1692, Color Dots, Puppy Dog, Now, Rule All, , 
1693, Dark Brown, Pressure, Dangerous Smoke 2, , Bringcash, 
1694, Bloodbath, Bed, Whatever, , , 
1695, Gotsun, Pressure, Dangerous Smoke 2, , Hippy, 
1696, Machine, Devourer, Moo, Whalehunter 2, Knight Armor, Gold 2
1697, Light Brown, Pew, Meh, Trendy 1, Honololu, 
1698, Holo Rainbow, Dead, Dangerous Smoke 3, Hat 3, Poncho, Multiple
1699, Light Brown, Notfunny, Meh, , Hipsterneck, Silver 2
1700, Grey, Blocksun, Meh Dangerous Smoke 2, , Nofire, 
1701, Blue, Dontlook, Meh, Warhat 1, Multicolor, 
1702, Brown, Nothappy Longer, Argh, Hiiya, Wifeshirt 1, 
1703, Bloodbath, See Stuff, Yesplease, , , 
1704, Dark Brown, Machine, Moo, Hat 3, Trash, 
1705, Africa Animal, Money, Gold Bling, Whalehunter 2, Cuba, 
1706, Dark Brown, Blocksun, Moo, Warhat 1, Ay Sailor, 
1707, Albino, Money, Meh, Trendy W 1, Vegas Dancer, 
1708, Black, Devourer, Yesplease, Headset, Iced Tee, 
1709, Machine, Round Glasses, Dangerous Smoke 1, Hiiya, Wifeshirt 1, 
1710, Albino, Puppy Dog, Whatever, Service, Make Fire, 
1711, Neon Glow, Notfunny, Dangerous Smoke 2, , Broken, 
1712, Gotsun, Multilevel, Whatever, Comrade, Honololu, Gold 1
1713, Acid, See Stuff, Rainbow, , , 
1714, Machine, Pressure, Whatever, Trendy 2, , 
1715, Dark Brown, Bed, Knife, Trendy W 2, Ay Sailor, Silver 1
1716, Black, Money, Yesplease, , Cycle, 
1717, Red, See Stuff, Higschool, Mafia, Hoodie Black, 
1718, Dark Brown, Bed, Whatever, Comrade, Honololu, 
1719, Brown, Snake, Dangerous Smoke 2, , Vest, 
1720, Light Brown, Money, Meh Dangerous Smoke 2, , Hipster Shirt, 
1721, Black, Dontsee, Meh, Rabbit, Poncho, 
1722, Checkered, Nothappy Longer, Scowl, , Piercings, 
1723, Dark Brown, Notfunny, Knife, Hiiya, Fashion Accesory, Ear Cuff
1724, Black, Nothappy Longer, Whatever, , Cuba, 
1725, Candy Cane, Notfunny, Say Aah, , , 
1726, Gotsun, Dead, Whatever, Whereisgiraffe, Nofire, Silver 2
1727, Red, Machine, Hipster Stache, , Weapon Belt, 
1728, Albino, Round Glasses, Whatever, Hat 1, Fishnet Top, 
1729, Black, Nothappy, Yesplease, Jesus Alive, Costume Old, 
1730, Brown, Future, Now, Catch Robbers, Alcatraz, 
1731, Vector, Love, Meh, , Not A Suit, 
1732, Black, Multilevel, Moo, Hiiya, Nofire, 
1733, Blue, Nothappy, Meh, Trendy 1, Fashion Accesory, 
1734, Dark Brown, Notfunny, Say Aah, , Overalls, Gold 2
1735, Brown, Blocksun, Whatever, Whalehunter 2, Ay Sailor, 
1736, Blue, Snake, What, Hat 2, Nofire, 
1737, Neon Glow, See Stuff, Meh, Have Fun 1, Wifeshirt 1, Gold 1
1738, Africa Animal, Notfunny, What, Rabbit, Bringcash, 
1739, Woke From Dead, Pirate, Meh, Small Child, , 
1740, Lady, Devourer, Moo, Trendy 1, Cycle, 
1741, Blue, Not Nice, What, Have Fun 1, Bringcash, 
1742, Brown, Multilevel, Whatever, , Trench, 
1743, Gotsun, Monocle, Say Aah, Winter Hat, Wifeshirt 2, 
1744, Dark Brown, Notfunny, Dangerous Smoke 2, Trick Hat, Honololu, 
1745, Woke From Dead, Dontlook, Argh, Whereisgiraffe, , 
1746, Dark Brown, Snake, Yesplease, Leprechaun, Honololu, Multiple
1747, Brown, See Stuff, Moo, Service, , 
1748, Black, Undead, Meh Blow Bubble, Notsmart, Poncho, 
1749, Albino, Money, Whatever, Cook, Trench, 
1750, Light Brown, Pirate, Meh, Trendy 1, , 
1751, Woke From Dead, Money, Argh, , Wifeshirt 1, 
1752, Holo Rainbow, Notfunny, Dangerous Smoke 2, Antique, Hippy, 
1753, Beige, Monocle, Whatever, Manbun, Make Fire, Gold 1
1754, Candy Cane, Bed, Yesplease, , , 
1755, Albino, Reality, Whatever, Leprechaun, , 
1756, Black, Nothappy Longer, Argh, , Ok, Silver 2
1757, Neon Glow, Money, Meh, , Fashion Accesory, Gold 2
1758, Brown, See Stuff, Moo, Whalehunter 2, Make Fire, 
1759, Africa Animal, Machine, Dangerous Smoke 2, , Ymca, 
1760, Red, Nothappy, Meh, Prison, Fishnet Top, 
1761, Dark Brown, Pressure, Whatever, Manbun, Wifeshirt 1, Silver 2
1762, Lady, Blocksun, Rainbow, Jesus Alive, Gentleman, 
1763, Dark Brown, Future, Buck Teeth, Prison, Praetexta, 
1764, Black, Notfunny, Say Aah, Catch Robbers, , 
1765, Africa Animal, Multilevel, Whatever, Hiiya, Make Fire, Silver 1
1766, Dark Brown, Pressure, Funny, Leprechaun, Chemist, Multiple
1767, Brown, Nothappy Longer, Whatever, Whereiswhale, Fashion Accesory, 
1768, Gotsun, Dead, Argh, Comrade, Fishnet Top, Gold 1
1769, Black, Nothappy, Nofeelingwell, , , 
1770, Dark Brown, See Stuff, Higschool, Comrade, Nofire, 
1771, Woke From Dead, Dontlook, Meh, , Hipster Shirt, 
1772, Black, Money, Yesplease, Service, Knight Armor, 
1773, Beige, Notfunny, Dangerous Smoke 1, , Nowar, 
1774, Brown, Nothappy Longer, Whatever, , Multicolor, 
1775, Blue, Puppy Dog, Meh Dangerous Smoke 2, Hat 1, Wifeshirt 2, 
1776, Nature, Pressure, Dangerous Smoke 2, Notsmart, , 
1777, Red, Blocksun, What, Cat Ears, Trash, 
1778, Dark Brown, Multilevel, Whatever, Fetish, Preshistoric, Silver 2
1779, Brown, Blocksun, Moo, Hiiya, Hipster Shirt, Gold 1
1780, Machine, Nothappy, No Teeth, , , Multiple
1781, Vector, Pressure, Whatever, , , 
1782, Dark Brown, Bed, Funny, Visor Hat, , Ear Cuff
1783, Albino, Pressure, What, Whalehunter 2, , 
1784, Candy Cane, Notfunny, Moo, Warhat 1, , Multiple
1785, Gotsun, Machine, Say Aah, Comrade, Weapon Belt, 
1786, Vector, See Stuff, Dangerous Smoke 1, Rabbit, , 
1787, Lady, Puppy Dog, What, , , 
1788, Dark Brown, Nothappy, Dangerous Smoke 3, , Vegas Dancer, Multiple
1789, Black, Dead, Now, , Great T-Shirt, 
1790, Red, Bed, Meh Dangerous Smoke 1, Fetish, Weapon Belt, 
1791, Vector, Pressure, Meh, Hat 3, Onthesea, 
1792, Dark Brown, Puppy Dog, Moo, , Blank, 
1793, Brown, Blocksun, Higschool, Headset, Hipster Shirt, 
1794, Lady, Monocle, Dangerous Smoke 2, Whereisgiraffe, Hippy, 
1795, Grey, Dontsee, Meh, Trendy W 2, Ay Sailor, 
1796, Neon Glow, Bed, Whatever, Trendy 1, Cycle, 
1797, Albino, Notfunny, Scowl, , Hipster Shirt, 
1798, Red, Pressure, What, , Onthesea, 
1799, Checkered, Money, Scowl, Mafia, Hipsterneck, Silver 2
1800, Black, Nothappy, Dangerous Smoke 2, Service, Bang Bang, 
1801, Light Brown, Reality, Meh Sounds, , Preshistoric, 
1802, Gotsun, Love, Say Aah, Small Child, Costume Old, Gold 2
1803, Grey, Bed, No Teeth, Devil, Not A Suit, 
1804, Woke From Dead, Nothappy Longer, Whatever, , Fishnet Top, 
1805, Lady, Notfunny, Scowl, Devil, Trash, Multiple
1806, Grey, Dontsee, Rainbow, Antique, Bringcash, Gold 1
1807, Beige, Machine, Meh, Whalehunter 2, Piercings, 
1808, Brown, Notfunny, Dangerous Smoke 3, Headset, Nowar, 
1809, Black, Pressure, Say Aah, Leprechaun, Hippy, Multiple
1810, Africa Animal, Round Glasses, Dangerous Smoke 2, , , Stretched
1811, Machine, Pressure, Scowl, Visor Hat, Moon, 
1812, Woke From Dead, Pirate, Whatever, Small Child, Chemist, 
1813, Lady, Money, Nofeelingwell, Hidehairs, Hippy, 
1814, Dark Brown, Dontlook, Whatever, Visor Hat, Ay Sailor, Silver 2
1815, Black, Dontsee, Meh Dangerous Smoke 2, Jesus Alive, , 
1816, Blue, Love, What, Prison, Hipsterneck, 
1817, Vector, Lazer, Knife, , Piercings, 
1818, Checkered, Notfunny, Whatever, , Costume Old, 
1819, Brown, Pew, Say Aah, , Hipsterneck, 
1820, Beige, See Stuff, Rainbow, Rabbit, Make Fire, 
1821, Light Brown, Devourer, What, Catch Robbers, Knight Armor, 
1822, Beige, See Stuff, Whatever, Hat 3, Vest, 
1823, Brown, Undead, Yesplease, , Preshistoric, 
1824, Checkered, Pressure, Blow Bubble, Headset, Gentleman, 
1825, Dark Brown, Bed, Dangerous Smoke 3, Notsmart, Great T-Shirt, 
1826, Light Brown, Puppy Dog, Meh Dangerous Smoke 2, , Multicolor, Ear Cuff
1827, Black, Round Glasses, Meh, Jesus Alive, Gentleman, Silver 1
1828, Dark Brown, Notfunny, Whatever, , Sweet Jacket, 
1829, Lady, Dontsee, Meh, Jesus Alive, Wifeshirt 1, 
1830, Machine, Future, Whatever, , Onthesea, 
1831, Albino, Dontsee, Buck Teeth, Whalehunter 1, Chemist, Silver 2
1832, Bloodbath, Bed, Say Aah, Trick Hat, , 
1833, Beige, Notfunny, Meh Dangerous Smoke 2, Notsmart, Ay Sailor, Silver 1
1834, Black, Nothappy Longer, What, , Preshistoric, 
1835, Dark Brown, Bed, Meh, Hippy Hat, Wifeshirt 2, Silver 2
1836, Candy Cane, Pressure, Moo, Whalehunter 1, , 
1837, Dark Brown, Pirate, Scowl, Trendy W 1, Ay Sailor, 
1838, Bad Machine, Nothappy Longer, Meh Blow Bubble, , Costume Old, 
1839, Lady, See Stuff, Meh, Whereiswhale, Trash, 
1840, Brown, Machine, Dangerous Smoke 2, Small Child, Cool T-Shirt, 
1841, Black, Nothappy Longer, Argh, Cook, , Multiple
1842, Lady, Bed, Dangerous Smoke 1, Whereisgiraffe, Multicolor, 
1843, Light Brown, See Stuff, Argh, , Moon, Ear Cuff
1844, Black, Nothappy Longer, Meh Dangerous Smoke 2, Trendy 1, , 
1845, Brown, Notfunny, Blow Bubble, Hiiya, Make Fire, 
1846, Beige, See Stuff, Moo, Fetish, Trench, Silver 2
1847, Machine, Puppy Dog, Whatever, Notsmart, Alcatraz, 
1848, Black, See Stuff, Argh, Whalehunter 1, Ay Sailor, 
1849, Gotsun, Nothappy, Whatever, , Hipster Shirt, 
1850, Red, Money, No Teeth, Whereiswhale, Rappers, 
1851, Light Brown, Round Glasses, Whatever, , , 
1852, Brown, Dead, Meh, Whalehunter 2, Preshistoric, 
1853, Light Brown, Money, What, Service, Trench, 
1854, Machine, Multilevel, Moo, Small Child, Overalls, 
1855, Bad Machine, See Stuff, Argh, , Hipsterneck, Silver 1
1856, Checkered, Notfunny, Whatever, Hat 3, Cool T-Shirt, 
1857, Brown, Machine, Moo, Whereisgiraffe, Not A Suit, 
1858, Light Brown, Dead, Whatever, Whalehunter 2, Cuba, 
1859, Black, Dontsee, Dangerous Smoke 2, , Piercings, 
1860, Dark Brown, Notfunny, Say Aah, , Wifeshirt 2, 
1861, Beige, See Stuff, Yesplease, Manbun, Nofire, 
1862, Brown, Pirate, No Teeth, , Hoodie Black, 
1863, Gotsun, Dontsee, Moo, Hat 2, Chemist, 
1864, Grey, Round Glasses, Whatever, Prison, Vest, Multiple
1865, Beige, Notfunny, Moo, Rabbit, Alcatraz, 
1866, No Signal, Love, Blow Bubble, Hat 2, , 
1867, Gotsun, Devourer, Argh, Whereisgiraffe, Multicolor, 
1868, Beige, Puppy Dog, Now, Prison, Praetexta, 
1869, Holo Rainbow, Notfunny, Argh, Trendy W 1, Blank, Silver 1
1870, Africa Animal, Love, Meh Dangerous Smoke 2, , Not A Suit, 
1871, Holo Rainbow, Notfunny, Dangerous Smoke 2, Whalehunter 1, Nowar, 
1872, Easter Egg, Nothappy, Moo, Hat 2, Vegas Dancer, Silver 2
1873, Gotsun, Pressure, Say Aah, , Honololu, Jesus
1874, Beige, Nothappy Longer, Whatever, Comrade, , 
1875, Dark Brown, Notfunny, Dangerous Smoke 2, Hat 1, Robinson, 
1876, Brown, Bed, Scowl, , Overalls, 
1877, Gotsun, Money, Dangerous Smoke 3, Service, Sweet 16, 
1878, Black, Round Glasses, Meh, Fetish, Onthesea, Gold 2
1879, Easter Egg, Bed, Food, , Ay Sailor, 
1880, Light Brown, Notfunny, Moo, Trendy 1, Wifeshirt 1, 
1881, Checkered, Dontsee, Whatever, Hiiya, Shirt Of Flames, 
1882, Black, Pressure, Say Aah, Catch Robbers, Gentleman, 
1883, Light Brown, Blocksun, Moo, Trick Hat, Preshistoric, Silver 1
1884, Beige, See Stuff, Whatever, Trendy 1, , 
1885, Grey, Blocksun, Dangerous Smoke 2, Punk Short, Alcatraz, 
1886, Gotsun, Love, Say Aah, Comrade, Cycle, 
1887, Brown, See Stuff, Funny, Trendy 1, Alcatraz, 
1888, Gotsun, Blocksun, Argh, , Piercings, 
1889, Lady, Nothappy Longer, No Teeth, War Helmet, Hipster Shirt, 
1890, Light Brown, Round Glasses, Argh, Hiiya, Nowar, 
1891, Beige, Dontsee, Whatever, , Vest, Silver 2
1892, Albino, Pressure, Dangerous Smoke 2, Punk Short, Hippy, Multiple
1893, Light Brown, Dontsee, Meh, Leprechaun, Honololu, 
1894, Brown, Snake, Argh, , Great T-Shirt, Silver 2
1895, Albino, Money, Whatever, , Piercings, 
1896, Black, Notfunny, Meh Dangerous Smoke 3, , Fashion Accesory, Silver 1
1897, Bad Machine, See Stuff, Moo, , Ok, 
1898, Blue, Dontlook, Meh, Trick Hat, Overalls, 
1899, Dark Brown, Multilevel, Scowl, Cook, Hirewomen, 
1900, Easter Egg, Puppy Dog, Meh Dangerous Smoke 3, , Rock, 
1901, Light Brown, Dontlook, Scowl, , Great T-Shirt, Gold 1
1902, Dark Brown, Dontsee, Moo, Small Child, Nofire, 
1903, Africa Animal, Reality, Whatever, Warhat 2, Alcatraz, 
1904, Gotsun, Dontsee, Funny, Hiiya, Cool T-Shirt, 
1905, Beige, Multilevel, Moo, Trendy 1, Fashion Accesory, 
1906, Gotsun, Pressure, Whatever, Notsmart, Vegas Dancer, 
1907, Light Brown, Dontsee, Meh, Mafia, Cuba, Multiple
1908, Brown, Not Nice, Whatever, Whalehunter 2, Nofire, 
1909, Machine, Pressure, Moo, Whereiswhale, Weapon Belt, 
1910, Gotsun, Bed, Whatever, Trendy 1, Cool T-Shirt, 
1911, Blue, Devourer, Hipster Stache, Comrade, Bang Bang, Silver 1
1912, Checkered, Puppy Dog, Yesplease, Manbun, Vest, 
1913, Gotsun, Pirate, Moo, , Weapon Belt, Silver 2
1914, Blue, Dontsee, Dangerous Smoke 2, Jesus Alive, , 
1915, Bloodbath, Pressure, Say Aah, Trendy 1, , 
1916, Blue, Round Glasses, Dangerous Smoke 2, Service, Shirt Of Flames, Gold 1
1917, Dark Brown, Notfunny, Moo, Whalehunter 1, Gentleman, 
1918, Neon Glow, Devourer, Meh, Fetish, Ok, 
1919, Grey, Nothappy Longer, Meh Dangerous Smoke 1, Jesus Alive, Wifeshirt 2, 
1920, Light Brown, Not Nice, Whatever, Visor Hat, Chemist, 
1921, Beige, Notfunny, Dangerous Smoke 3, , Rappers, Silver 2
1922, Black, Bed, Scowl, , Sweet 16, Gold 1
1923, Beige, Devourer, Say Aah, Visor Hat, Cuba, 
1924, Light Brown, Pressure, Meh, Warhat 2, Multicolor, 
1925, Brown, Devourer, No Teeth, Prison, Wifeshirt 1, 
1926, Dark Brown, Reality, Moo, , , 
1927, Bloodbath, Dontlook, Now, Prison, , 
1928, Brown, Money, Whatever, , Trash, 
1929, Woke From Dead, Dontlook, Meh, , Blank, Silver 2
1930, Blue, Multilevel, Funny, Devil, , 
1931, Vector, Dontsee, Dangerous Smoke 2, Have Fun 1, Cool T-Shirt, 
1932, Lady, Notfunny, Meh, Catch Robbers, Hirewomen, 
1933, Candy Cane, Nothappy Longer, Whatever, Whereiswhale, , Gold 2
1934, Machine, See Stuff, Dangerous Smoke 2, , , 
1935, Easter Egg, Blocksun, Argh, , Cuba, 
1936, Dark Brown, Nothappy Longer, Say Aah, Whereiswhale, Ok, 
1937, Brown, Dontsee, What, Whalehunter 2, Vegas Dancer, 
1938, Beige, Machine, Meh Dangerous Smoke 3, , Nowar, 
1939, Dark Brown, Notfunny, Whatever, Trendy 2, Blazer Black, 
1940, Light Brown, Dontsee, Scowl, Warhat 2, Ymca, 
1941, Africa Animal, Notfunny, Knife, Cat Ears, Hipsterneck, 
1942, Brown, Pirate, Meh Dangerous Smoke 2, Mafia, Cuba, 
