1943, Bad Machine, Dead, Now, , Costume Old, Gold 1
1944, Nature, Notfunny, Say Aah, Trendy 1, Rock, 
1945, Holo Rainbow, Multilevel, Argh, Comrade, , 
1946, Brown, Love, Now, Side Shave, Vegas Dancer, Silver 2
1947, Light Brown, Multilevel, Meh Dangerous Smoke 2, , Chemist, Silver 1
1948, Dark Brown, Future, Whatever, Hat 3, Blank, 
1949, Brown, Puppy Dog, What, , Honololu, Silver 1
1950, Beige, Love, Meh, Cook, , Gold 2
1951, Dark Brown, Nothappy, Whatever, , , 
1952, Beige, Notfunny, Dangerous Smoke 1, Trendy 1, Trench, Gold 2
1953, Brown, Nothappy, Meh, , Hippy, 
1954, Africa Animal, Undead, What, Visor Hat, Fashion Accesory, 
1955, No Signal, Lazer, Whatever, , , 
1956, Beige, Notfunny, Hipster Stache, Warhat 2, Shirt Of Flames, 
1957, Light Brown, Puppy Dog, Scowl, , , 
1958, Beige, Notfunny, Whatever, , Ymca, Gold 1
1959, Black, Round Glasses, Now, , Hippy, 
1960, Blue, Reality, Whatever, , Multicolor, 
1961, Dark Brown, Notfunny, Meh, Punk Short, Trash, 
1962, Easter Egg, See Stuff, Whatever, Cat Ears, Hipster Shirt, 
1963, Light Brown, Notfunny, Say Aah, Notsmart, Vest, Ear Cuff
1964, Black, Love, Meh, Mafia, , 
1965, Albino, Not Nice, Whatever, Rabbit, Not A Suit, 
1966, Dark Brown, Round Glasses, Meh Dangerous Smoke 2, Prison, Wifeshirt 1, 
1967, Grey, Money, Moo, Hat 3, Moon, 
1968, Neon Glow, Nothappy Longer, Meh, Hiiya, Alcatraz, 
1969, Gotsun, Money, Whatever, Notsmart, Great T-Shirt, 
1970, Grey, See Stuff, Dangerous Smoke 3, Comrade, Preshistoric, 
1971, Beige, Notfunny, Dangerous Smoke 2, Trendy W 2, Sweet Jacket, 
1972, Gotsun, Dontsee, Meh Dangerous Smoke 1, Prison, Cuba, Multiple
1973, Easter Egg, Bed, What, Winter Hat, Ay Sailor, Jesus
1974, Black, Pressure, Moo, Jesus Alive, Sweet Jacket, Gold 2
1975, Light Brown, Bed, Funny, Devil, Not A Suit, 
1976, Grey, Snake, Meh Dangerous Smoke 2, Punk Short, Fashion Accesory, Gold 2
1977, Candy Cane, Money, Rainbow, Trendy 1, , 
1978, Brown, Puppy Dog, Moo, , Wifeshirt 1, 
1979, Black, Blocksun, Whatever, Warhat 2, Cuba, 
1980, Nature, Nothappy, Meh Dangerous Smoke 2, , , 
1981, Light Brown, Devourer, What, Trick Hat, Blank, 
1982, Red, See Stuff, Whatever, , Cool T-Shirt, Silver 2
1983, Machine, Money, Bling, , Preshistoric, 
1984, Light Brown, Dontsee, Meh, Visor Hat, Blank, Gold 2
1985, Albino, Machine, Buck Teeth, , Moon, 
1986, Brown, Undead, Gold Bling, , Weapon Belt, 
1987, Africa Animal, Notfunny, Dangerous Smoke 2, Antique, , 
1988, Blue, See Stuff, Whatever, , Shirt Of Flames, Jesus
1989, Machine, Nothappy Longer, Meh, Hat 1, Hoodie Red, 
1990, Light Brown, See Stuff, Bling, , Vest, 
1991, Africa Animal, Bed, Now, Cook, Onthesea, Silver 1
1992, Dark Brown, Multilevel, Meh Dangerous Smoke 3, , Broken, 
1993, Vector, Notfunny, Whatever, Mafia, Gentleman, 
1994, Easter Egg, Nothappy Longer, Dangerous Smoke 1, , Blank, 
1995, Red, Notfunny, Meh, Service, Moon, 
1996, Brown, Money, What, , Overalls, 
1997, Dark Brown, Dontsee, Yesplease, Prison, Cool T-Shirt, 
1998, Black, Undead, Meh, War Helmet, Rappers, 
1999, Brown, Notfunny, What, Comrade, Great T-Shirt, 
