5941, Light Brown, Bed, Yesplease, Notsmart, Robinson, 
5942, Africa Animal, Notfunny, What, , Poncho, Jesus
5943, Brown, Nothappy, Whatever, Trendy 1, Broken, 
5944, Grey, Not Nice, Dangerous Smoke 2, , Vest, 
5945, Brown, Nothappy Longer, Moo, , , 
5946, Light Brown, Devourer, Argh, , Trench, 
5947, Black, Dontlook, Meh, Fetish, Blank, 
5948, Brown, Notfunny, No Teeth, Devil, Multicolor, 
5949, Light Brown, Puppy Dog, Dangerous Smoke 1, Jesus Alive, Ay Sailor, Multiple
5950, Albino, Undead, What, , Wifeshirt 1, 
5951, Grey, Multilevel, Yesplease, Prison, Vest, 
5952, Bloodbath, Money, Whatever, Devil, , 
5953, Brown, Pirate, Moo, Trendy 1, , 
5954, Gotsun, Snake, Meh, , Hipsterneck, Silver 1
5955, Brown, Devourer, Whatever, , Alcatraz, 
5956, Beige, Snake, Blow Bubble, Hat 3, Weapon Belt, 
5957, Neon Glow, Money, Meh Dangerous Smoke 2, Prison, Robinson, 
5958, Brown, Multilevel, Meh, , Wifeshirt 1, Gold 2
5959, Gotsun, Undead, Argh, Mafia, Hipsterneck, 
5960, Light Brown, Multilevel, Meh, War Helmet, Praetexta, 
5961, Gotsun, Nothappy Longer, Funny, Whereiswhale, Knight Armor, 
5962, Lady, Multilevel, Whatever, Leprechaun, Cool T-Shirt, 
5963, Neon Glow, Nothappy Longer, Meh, , Cycle, 
5964, Africa Animal, Notfunny, Buck Teeth, Comrade, , Silver 2
5965, Lady, Not Nice, Meh, Leprechaun, Hoodie Black, Silver 1
5966, Dark Brown, Round Glasses, Meh Blow Bubble, War Helmet, Alcatraz, Gold 1
5967, Brown, Nothappy Longer, Meh Dangerous Smoke 3, Prison, Overalls, 
5968, Albino, Machine, Whatever, Devil, Honololu, 
5969, Gotsun, Nothappy Longer, Moo, Jesus Alive, Robinson, 
5970, Albino, Notfunny, Meh Dangerous Smoke 2, , Not A Suit, Silver 1
5971, Light Brown, Dontlook, Higschool, Punk Short, Nofire, 
5972, Bloodbath, Blocksun, Whatever, Whalehunter 1, , 
5973, Color Dots, See Stuff, Meh, , Sweet Jacket, 
5974, Light Brown, Undead, No Teeth, Prison, Ay Sailor, 
5975, Machine, Notfunny, Argh, Antique, Nowar, 
5976, Checkered, Love, Meh, , Hoodie Black, Jesus
5977, Brown, Dontsee, Yesplease, Jesus Alive, Trench, Multiple
5978, Easter Egg, Pressure, Meh, Whereiswhale, Cycle, 
5979, Africa Animal, Love, Meh Dangerous Smoke 1, , Preshistoric, 
5980, Brown, Pressure, Dangerous Smoke 2, Jesus Alive, , 
5981, Light Brown, Pirate, Now, , Ay Sailor, Silver 2
5982, Blue, Nothappy Longer, Yesplease, Hat 2, Nowar, 
5983, Grey, Dontsee, Scowl, Hat 3, Praetexta, 
5984, Candy Cane, Pressure, Argh, Service, , Silver 2
5985, No Signal, Nothappy, Dangerous Smoke 2, Headset, Cuba, 
5986, Black, Blocksun, What, Prison, Knight Armor, 
5987, Neon Glow, Pew, Bling, Whalehunter 1, Vegas Dancer, 
5988, Bad Machine, Notfunny, Higschool, , Rock, Gold 2
5989, Woke From Dead, Money, Whatever, Good Idea, Honololu, 
5990, Neon Glow, Nothappy Longer, No Teeth, Whereiswhale, Preshistoric, 
5991, Dark Brown, Multilevel, Meh Dangerous Smoke 2, , , 
5992, Light Brown, Round Glasses, Say Aah, Trendy W 1, Rappers, 
5993, Brown, Love, Now, Prison, Blank, Ear Cuff
5994, Machine, Future, Scowl, Punk Short, , 
5995, Light Brown, Devourer, Meh Dangerous Smoke 3, Hat 2, Wifeshirt 1, Multiple
5996, Gotsun, Notfunny, Whatever, Side Shave, Robinson, 
5997, Black, Dontsee, Meh Dangerous Smoke 2, Visor Hat, Blank, 
5998, Gotsun, Dontlook, Say Aah, Prison, Vest, 
5999, Checkered, Pressure, Whatever, Winter Hat, , 
