5466, Brown, Notfunny, Yesplease, Winter Hat, Blazer Black, 
5467, Woke From Dead, Machine, Gold Bling, Have Fun 1, Shirt Of Flames, 
5468, Dark Brown, Future, Nofeelingwell, Trick Hat, Blank, 
5469, Black, Pirate, Dangerous Smoke 2, Cook, Ay Sailor, Silver 1
5470, Beige, Not Nice, Now, , Poncho, 
5471, Checkered, Blocksun, Whatever, Trendy 1, , 
5472, Black, Notfunny, Meh, Small Child, Praetexta, 
5473, Bloodbath, Dontsee, Moo, , , 
5474, Brown, Pressure, Dangerous Smoke 3, Whalehunter 2, Vest, Gold 2
5475, Acid, Notfunny, Argh, Whereisgiraffe, , Ear Cuff
5476, Dark Brown, Pirate, Funny, Hat 3, , 
5477, Beige, Love, Dangerous Smoke 2, Fetish, Rock, Gold 1
5478, Brown, See Stuff, Meh, Whereisgiraffe, , Silver 2
5479, Woke From Dead, Machine, Buck Teeth, , Preshistoric, 
5480, Black, See Stuff, What, , Broken, 
5481, Brown, Dead, Rainbow, Whereisgiraffe, Preshistoric, 
5482, Black, Round Glasses, Moo, , Lingerie, 
5483, Albino, Pressure, Meh, Hiiya, Overalls, 
5484, Beige, Notfunny, Meh Sounds, Trendy 1, Bang Bang, 
5485, Bloodbath, Undead, Whatever, Whalehunter 2, , 
5486, Light Brown, Notfunny, Dangerous Smoke 3, , Chemist, 
5487, Beige, Pressure, Moo, Trendy 1, Great T-Shirt, Silver 1
5488, Gotsun, Devourer, Whatever, , Nowar, 
5489, Brown, Puppy Dog, Meh, Whalehunter 1, , Multiple
5490, Beige, Undead, Dangerous Smoke 2, Devil, Onthesea, 
5491, Lady, Round Glasses, Now, Winter Hat, Trash, 
5492, Dark Brown, Puppy Dog, Say Aah, Jesus Alive, Broken, Silver 1
5493, Lady, See Stuff, Whatever, Prison, Lingerie, 
5494, Brown, Dead, Dangerous Smoke 3, , , Silver 2
5495, Dark Brown, Notfunny, Meh Dangerous Smoke 2, Good Idea, Nowar, 
5496, Black, Nothappy Longer, Funny, Whereiswhale, , Silver 2
5497, Gotsun, Bed, Meh, Leprechaun, Cuba, 
5498, Black, Notfunny, Dangerous Smoke 2, , Nofire, Multiple
5499, Dark Brown, See Stuff, Dangerous Smoke 3, , Cycle, Silver 1
5500, Light Brown, Pressure, Meh, Service, Not A Suit, 
5501, Blue, Notfunny, Dangerous Smoke 2, , Hoodie Black, Silver 1
5502, Black, Reality, Whatever, Trendy W 1, Gentleman, 
5503, Light Brown, Devourer, Dangerous Smoke 2, Small Child, Cuba, 
5504, Lady, Puppy Dog, What, Hiiya, Iced Tee, Gold 2
5505, Light Brown, Nothappy Longer, Whatever, Jesus Alive, Hipster Shirt, 
5506, Red, Dontsee, Moo, , Trench, Silver 2
5507, Dark Brown, Notfunny, Meh Dangerous Smoke 2, Hidehairs, Moon, 
5508, Red, Not Nice, Whatever, Rabbit, Wifeshirt 2, 
5509, Blue, Notfunny, What, Winter Hat, Cycle, 
5510, Brown, Machine, Rainbow, Cat Ears, Rappers, Silver 2
5511, Easter Egg, Dead, Meh, Jesus Alive, Fishnet Top, 
5512, Black, Pew, Now, , Vegas Dancer, 
5513, Light Brown, Notfunny, Say Aah, , Trash, 
5514, Beige, Nothappy Longer, Rainbow, Whereisgiraffe, Ay Sailor, Silver 2
5515, Africa Animal, Money, Now, War Helmet, Nowar, 
5516, Black, Notfunny, Meh Blow Bubble, , Weapon Belt, 
5517, Blue, Reality, Moo, Notsmart, Gentleman, 
5518, Brown, See Stuff, Dangerous Smoke 2, Rule All, Cuba, Jesus
5519, Lady, Bed, Yesplease, , Weapon Belt, 
5520, Gotsun, Notfunny, Meh, Devil, Knight Armor, Silver 2
5521, Brown, Round Glasses, Scowl, Prison, Ay Sailor, Silver 1
5522, Bad Machine, Devourer, Now, , Iced Tee, 
5523, Candy Cane, Nothappy, Dangerous Smoke 2, Trick Hat, , 
5524, Brown, Dontsee, Whatever, Have Fun 2, Fishnet Top, 
5525, Woke From Dead, Pressure, Moo, Hiiya, Wifeshirt 2, Silver 1
5526, Brown, Notfunny, Argh, Punk Short, Hipster Shirt, Gold 1
5527, Color Dots, Pressure, Scowl, Whalehunter 1, Hippy, 
5528, Beige, Money, Whatever, , Praetexta, Silver 2
5529, Lady, Notfunny, Now, Warhat 1, Bringcash, 
5530, Grey, Bed, Say Aah, Trendy W 2, Onthesea, 
5531, Dark Brown, Dontsee, Whatever, , Fashion Accesory, Stretched
5532, Blue, Money, Yesplease, , Rock, Silver 2
5533, Brown, Devourer, Higschool, Hat 3, Hipster Shirt, 
5534, Nature, Machine, Meh, , Bang Bang, 
5535, Black, Nothappy Longer, Whatever, , Ay Sailor, 
5536, Bad Machine, Multilevel, Dangerous Smoke 2, Winter Hat, , Silver 2
5537, Red, Notfunny, Say Aah, Cat Ears, Rappers, 
5538, Black, Dead, Whatever, Whalehunter 1, Fashion Accesory, Ear Cuff
5539, Candy Cane, Nothappy Longer, Knife, Whereiswhale, , 
5540, Lady, Not Nice, What, Leprechaun, Robinson, 
5541, Beige, Notfunny, Whatever, , Nowar, 
5542, Gotsun, Bed, What, , Fashion Accesory, 
5543, Brown, Snake, Nofeelingwell, Service, Nowar, 
5544, No Signal, Machine, Rainbow, Jesus Alive, Moon, Gold 2
5545, Beige, Dontsee, Meh, Whalehunter 1, Onthesea, Ear Cuff
5546, Grey, Devourer, Whatever, Trendy 1, Broken, 
5547, Checkered, Bed, Dangerous Smoke 2, , Lingerie, 
5548, Beige, Notfunny, Whatever, Cat Ears, Shirt Of Flames, 
5549, Brown, Undead, Dangerous Smoke 3, Whereisgiraffe, Preshistoric, 
5550, Light Brown, Money, Funny, Prison, Alcatraz, 
5551, Bloodbath, Blocksun, Meh, Whalehunter 2, Honololu, 
5552, Albino, Pew, Argh, Whalehunter 1, Alcatraz, 
5553, Candy Cane, Bed, Meh Dangerous Smoke 1, , , 
5554, Brown, Money, Whatever, Prison, Poncho, Multiple
5555, Light Brown, Nothappy Longer, Moo, Cook, Vegas Dancer, 
5556, Dark Brown, Reality, Meh, Whereisgiraffe, Hirewomen, 
5557, Grey, Round Glasses, Meh Sounds, Warhat 1, Wifeshirt 2, 
5558, Void, Notfunny, Argh, Whalehunter 1, , 
5559, Light Brown, Monocle, Whatever, Winter Hat, Moon, 
5560, Beige, Puppy Dog, Moo, Antique, , 
5561, Vector, Bed, No Teeth, , , Gold 1
5562, Machine, Machine, Meh Blow Bubble, , Not A Suit, 
5563, Color Dots, Reality, Dangerous Smoke 3, Prison, Nowar, Gold 1
5564, Dark Brown, Pressure, Meh, Rabbit, Wifeshirt 1, 
5565, Blue, Multilevel, Moo, Leprechaun, Make Fire, 
5566, Woke From Dead, Notfunny, Meh Knife, Punk Short, Rock, 
5567, Nature, Multilevel, Blow Bubble, Have Fun 2, Trash, 
5568, Woke From Dead, Blocksun, Funny, Whalehunter 1, Piercings, 
5569, Red, Nothappy Longer, Whatever, , Gentleman, 
5570, Africa Animal, Notfunny, Knife, , , 
5571, Light Brown, Puppy Dog, Funny, , Nofire, 
5572, Beige, Love, Argh, , Fashion Accesory, Gold 1
5573, Dark Brown, Money, Whatever, Whereiswhale, , 
5574, Brown, Pirate, Now, War Helmet, , 
5575, Dark Brown, Notfunny, Say Aah, Whalehunter 1, Make Fire, Multiple
5576, Nature, Multilevel, Scowl, Trendy 1, Praetexta, Silver 1
5577, Blue, Pressure, Hipster Stache, Mafia, Wifeshirt 2, 
5578, Dark Brown, Dontsee, Meh, Comrade, Poncho, Silver 1
5579, Light Brown, Monocle, Dangerous Smoke 3, Rabbit, , 
5580, Blue, Dontsee, What, Mafia, Poncho, 
5581, Bad Machine, Puppy Dog, Dangerous Smoke 2, Rabbit, Overalls, Ear Cuff
5582, Black, Undead, Argh, Manbun, Alcatraz, Silver 2
5583, Brown, Future, Dangerous Smoke 2, Jesus Alive, Overalls, Multiple
5584, Beige, Pressure, Whatever, Cook, Ay Sailor, 
5585, Void, Puppy Dog, Moo, Jesus Alive, , 
5586, Lady, Lazer, Rainbow, , Bang Bang, 
5587, Red, Dontsee, Moo, Catch Robbers, Ay Sailor, 
5588, Light Brown, Money, Scowl, Trendy W 1, Chemist, 
5589, Bad Machine, Not Nice, Nofeelingwell, Trick Hat, Hippy, 
5590, Grey, Nothappy, Say Aah, Warhat 1, Overalls, Silver 1
5591, Beige, Pressure, Whatever, Catch Robbers, Cool T-Shirt, 
5592, Dark Brown, Blocksun, Meh, Winter Hat, Make Fire, 
5593, Candy Cane, Dontsee, Moo, Service, , 
5594, Beige, Monocle, Whatever, Whalehunter 1, Multicolor, 
5595, Blue, Money, Moo, Hiiya, Weapon Belt, Silver 2
5596, Lady, Notfunny, Meh, Jesus Alive, Praetexta, 
5597, Beige, Undead, No Teeth, , Nowar, Gold 2
5598, Light Brown, Blocksun, Meh, , Cool T-Shirt, 
5599, No Signal, Bed, Argh, Warhat 1, , Silver 1
5600, Dark Brown, Notfunny, Meh, Prison, Vest, 
5601, Holo Rainbow, See Stuff, Whatever, Cook, Hipster Shirt, 
5602, Red, Devourer, Argh, Trendy W 2, Overalls, 
5603, Brown, Pirate, Meh Food, Hat 3, Knight Armor, 
5604, Black, Blocksun, Argh, Fetish, Ok, Silver 1
5605, Light Brown, Multilevel, Dangerous Smoke 2, Hat 1, Hipster Shirt, Gold 2
5606, Dark Brown, Undead, Argh, War Helmet, Hipsterneck, Silver 1
5607, Holo Rainbow, Pressure, Scowl, Antique, Praetexta, 
5608, Lady, Blocksun, Moo, , Make Fire, Silver 1
5609, Grey, Notfunny, Knife, Cook, Broken, 
5610, Gotsun, Undead, Argh, Winter Hat, Alcatraz, 
5611, Woke From Dead, Dead, Say Aah, Whalehunter 1, Chemist, 
5612, Black, Multilevel, Argh, Prison, Alcatraz, Silver 1
5613, Brown, Not Nice, Yesplease, Warhat 1, Fashion Accesory, 
5614, No Signal, Bed, Sounds, Notsmart, Trash, 
5615, Brown, Pressure, Hipster Stache, , , 
5616, Lady, Money, Whatever, , , 
5617, Easter Egg, Notfunny, Meh, , Wifeshirt 2, 
5618, Beige, See Stuff, Now, , Onthesea, 
5619, Brown, Notfunny, Meh Blow Bubble, Visor Hat, Piercings, 
5620, Gotsun, Bed, Whatever, , Great T-Shirt, 
5621, Bad Machine, Notfunny, Sounds, Whereisgiraffe, Fashion Accesory, 
5622, Woke From Dead, Nothappy Longer, Say Aah, , , 
5623, Blue, Round Glasses, Meh Dangerous Smoke 2, Jesus Alive, Rappers, 
5624, Albino, Future, Meh Dangerous Smoke 3, Hat 3, Gentleman, 
5625, Candy Cane, Pirate, Meh, Whalehunter 1, , 
5626, Machine, Monocle, Argh, Fetish, Robinson, Gold 2
5627, Brown, Undead, Whatever, Visor Hat, , Gold 1
5628, Light Brown, Notfunny, Moo, Cat Ears, Alcatraz, 
5629, Machine, Love, What, Service, Sweet 16, 
5630, Africa Animal, Blocksun, Say Aah, Hiiya, Piercings, Gold 1
5631, Red, Machine, Meh, , Nofire, 
5632, Blue, Notfunny, Meh Knife, , Overalls, 
5633, Red, Not Nice, Whatever, Hat 2, Ymca, 
5634, Africa Animal, Pirate, Funny, , , Silver 2
5635, Stars And Stripes, Puppy Dog, Moo, Trendy W 2, , 
5636, Black, Notfunny, Meh, Leprechaun, Sweet Jacket, 
5637, Dark Brown, Money, What, Comrade, Blank, Gold 2
5638, Brown, Pressure, Meh, Warhat 1, Broken, Jesus
5639, Easter Egg, Notfunny, Say Aah, , Sweet Jacket, 
5640, Brown, Monocle, Meh Dangerous Smoke 3, Headset, Nofire, 
5641, Easter Egg, Multilevel, Meh, , Nowar, 
5642, Brown, Pressure, Whatever, Rule All, , Gold 1
5643, Gotsun, Dontlook, Scowl, Hat 1, Bringcash, 
5644, Lady, Pressure, Whatever, , Preshistoric, 
5645, Dark Brown, Puppy Dog, Argh, Prison, Ymca, 
5646, Vector, Undead, Scowl, Jesus Alive, Piercings, 
5647, Light Brown, Machine, Whatever, , Fishnet Top, 
5648, Brown, Love, Dangerous Smoke 2, Comrade, Lingerie, Silver 2
5649, Red, Nothappy, Argh, Prison, Hipsterneck, Silver 1
5650, Bloodbath, Pirate, Dangerous Smoke 2, , , 
5651, Light Brown, Blocksun, Higschool, , Hipster Shirt, 
5652, Brown, Dontsee, Moo, , Vegas Dancer, 
5653, Grey, Multilevel, Whatever, Comrade, Weapon Belt, 
5654, Woke From Dead, Love, No Teeth, , Wifeshirt 2, 
5655, Gotsun, Bed, Whatever, , Honololu, Gold 1
5656, Brown, Future, Meh, Punk Short, Bang Bang, 
5657, Machine, Pirate, What, , Overalls, 
5658, Beige, Dontlook, Nofeelingwell, , Ymca, 
5659, Dark Brown, Notfunny, Meh, Fetish, Moon, 
5660, Africa Animal, Pressure, Meh Dangerous Smoke 2, Whalehunter 1, Sweet 16, 
5661, Brown, Lazer, Now, , Ay Sailor, 
5662, Checkered, Money, Scowl, , , Gold 2
5663, Neon Glow, Future, Say Aah, Mafia, Hippy, 
5664, Nature, Notfunny, Argh, Prison, Rappers, 
5665, Gotsun, Dontsee, Dangerous Smoke 2, , Iced Tee, 
5666, Lady, Undead, Whatever, Hat 3, Hippy, Silver 1
5667, Beige, Pressure, What, Catch Robbers, , 
5668, Albino, Bed, No Teeth, Trendy 1, , Gold 1
5669, Blue, Round Glasses, Meh Dangerous Smoke 2, Jesus Alive, Hoodie Red, Ear Cuff
5670, Beige, See Stuff, Whatever, Whalehunter 1, Blank, 
5671, Dark Brown, Monocle, What, Comrade, Ay Sailor, Gold 2
5672, Void, Notfunny, Say Aah, Hat 2, , 
5673, Brown, Dontsee, Whatever, Winter Hat, Overalls, Jesus
5674, Dark Brown, See Stuff, Moo, , , 
5675, Blue, Pressure, Argh, Whalehunter 2, Trash, 
5676, Acid, Love, What, Hat 2, , 
5677, Beige, Machine, Meh Dangerous Smoke 1, Service, Preshistoric, 
5678, Brown, Notfunny, Whatever, Devil, Cycle, 
5679, Color Dots, Pressure, Meh, , Lingerie, 
5680, Black, Bed, Nofeelingwell, Visor Hat, Hirewomen, 
5681, Neon Glow, Pressure, Argh, , , 
5682, Africa Animal, Bed, What, , Cuba, 
5683, Beige, Pressure, Dangerous Smoke 2, Notsmart, Alcatraz, 
5684, Grey, Future, Meh, , Robinson, 
5685, Gotsun, Machine, Yesplease, Hat 2, Alcatraz, 
5686, Beige, Dontsee, Argh, , Nofire, 
5687, Blue, Notfunny, Meh, Fetish, Broken, 
5688, Gotsun, Dontsee, Argh, , Bringcash, 
5689, Au, Notfunny, Meh, Hiiya, , 
5690, Light Brown, Reality, No Teeth, Trendy 1, Ay Sailor, Silver 1
5691, Woke From Dead, Multilevel, Now, Cat Ears, Cycle, 
5692, Beige, Devourer, Whatever, Hiiya, Broken, 
5693, Gotsun, Notfunny, Argh, Whereiswhale, Ay Sailor, 
5694, Beige, Money, Meh, Prison, Hipsterneck, 
5695, Light Brown, Pressure, Meh Sounds, Have Fun 1, Trash, 
5696, Brown, Puppy Dog, No Teeth, Whalehunter 1, Rappers, 
5697, Dark Brown, Love, Whatever, Hiiya, Fishnet Top, 
5698, Black, Puppy Dog, Argh, Mafia, , 
5699, Vector, Notfunny, Meh Higschool, Trendy 2, Cuba, Silver 1
5700, Light Brown, Dontsee, Whatever, Leprechaun, , 
5701, Bloodbath, Notfunny, Meh, , , 
5702, Dark Brown, Bed, Yesplease, Small Child, Cycle, Multiple
5703, Neon Glow, Money, What, Hippy Hat, Rock, 
5704, Beige, Nothappy, Argh, , Nowar, 
5705, Brown, Not Nice, Whatever, Trendy 1, Onthesea, 
5706, Light Brown, Blocksun, Say Aah, Hat 3, Moon, 
5707, Beige, Puppy Dog, Moo, Prison, Wifeshirt 2, 
5708, Dark Brown, See Stuff, Whatever, Rabbit, Make Fire, 
5709, Black, Not Nice, Meh Dangerous Smoke 2, Trendy W 2, Blank, 
5710, No Signal, Dontsee, Bling, Warhat 2, , 
5711, Albino, Notfunny, Whatever, Hat 2, Hipster Shirt, 
5712, Machine, Puppy Dog, Moo, Trendy 1, Blazer Black, Jesus
5713, Dark Brown, Machine, Whatever, Rabbit, Nofire, 
5714, Black, Puppy Dog, Meh, , Hipster Shirt, 
5715, Brown, Snake, Meh Higschool, Hat 2, Bang Bang, 
5716, Grey, Notfunny, Moo, Rabbit, , 
5717, Beige, Nothappy Longer, Whatever, Hat 2, , 
5718, Light Brown, Love, Meh, Winter Hat, Wifeshirt 2, 
5719, Checkered, Dontlook, What, Cook, Wifeshirt 1, 
5720, Grey, Bed, Whatever, Jesus Alive, Ay Sailor, 
5721, Dark Brown, Multilevel, What, Hat 2, Sweet 16, 
5722, Black, Bed, Meh, Trendy W 1, Nowar, Gold 1
5723, No Signal, Machine, Dangerous Smoke 2, Notsmart, , 
5724, Beige, Multilevel, Moo, Have Fun 1, Honololu, 
5725, Brown, Pressure, Argh, Whereiswhale, Hoodie Red, 
5726, Neon Glow, Monocle, Meh, Trendy 1, Wifeshirt 2, 
5727, Red, Pressure, Dangerous Smoke 3, Trick Hat, Piercings, Ear Cuff
5728, Beige, Blocksun, Dangerous Smoke 2, , Gentleman, 
5729, Black, Bed, Meh, Headset, Cool T-Shirt, 
5730, Brown, See Stuff, Nofeelingwell, Jesus Alive, , 
5731, Africa Animal, Love, Dangerous Smoke 3, Prison, Lingerie, Silver 1
5732, Brown, Dontsee, Say Aah, Leprechaun, Onthesea, Gold 2
5733, Bad Machine, Dead, Yesplease, , Great T-Shirt, Stretched
5734, Grey, Puppy Dog, Gold Bling, Trendy 1, Preshistoric, 
5735, Black, Money, Whatever, Headset, Hipster Shirt, 
5736, Africa Animal, Dead, Argh, Whalehunter 2, , Silver 2
5737, Albino, Notfunny, Meh Dangerous Smoke 2, Leprechaun, Not A Suit, 
5738, Light Brown, Round Glasses, Now, Cat Ears, Vegas Dancer, Gold 1
5739, Black, Multilevel, Whatever, Warhat 2, Rock, 
5740, Easter Egg, Undead, What, Service, Cuba, 
5741, Black, Love, Whatever, , Ay Sailor, 
5742, Blue, Not Nice, Meh Dangerous Smoke 2, Warhat 2, Cool T-Shirt, 
5743, Dark Brown, Dontsee, Meh, Warhat 1, Fashion Accesory, Silver 1
5744, Beige, Money, Moo, Mafia, Costume Old, 
5745, Dark Brown, Machine, Whatever, Whereiswhale, , 
5746, Color Dots, Pressure, Say Aah, Hat 1, Honololu, 
5747, Light Brown, Bed, Meh Knife, Whalehunter 2, Alcatraz, 
5748, Dark Brown, Notfunny, Yesplease, , , 
5749, Woke From Dead, Bed, Meh Dangerous Smoke 2, , , Silver 1
5750, Brown, Multilevel, Funny, , Blank, 
5751, Black, Blocksun, Rainbow, Devil, Sweet Jacket, 
5752, Blue, Pirate, Meh, , Not A Suit, 
5753, Black, Bed, Yesplease, Punk Short, , Gold 2
5754, Machine, Pressure, Argh, , Blank, 
5755, Neon Glow, Undead, Meh, Whalehunter 2, Poncho, 
5756, Black, Nothappy Longer, Whatever, Devil, Onthesea, 
5757, Vector, Pew, Meh Dangerous Smoke 1, Hiiya, , Ear Cuff
5758, Dark Brown, Notfunny, Moo, , Bang Bang, 
5759, Bloodbath, Nothappy Longer, Whatever, Have Fun 1, , 
5760, Holo Rainbow, Pirate, Moo, Prison, Hipsterneck, 
5761, Red, Notfunny, Meh, Hippy Hat, Fashion Accesory, 
5762, Grey, Dontsee, Whatever, , Onthesea, 
5763, Africa Animal, Nothappy Longer, Meh, , , 
5764, Lady, Machine, Moo, Hat 1, , 
5765, Black, Notfunny, Nofeelingwell, Devil, Wifeshirt 2, Silver 1
5766, Neon Glow, Not Nice, Meh, Warhat 1, Rappers, 
5767, Brown, Pressure, Buck Teeth, Fetish, Preshistoric, 
5768, Beige, Blocksun, Moo, Whalehunter 2, Gentleman, 
5769, Candy Cane, Notfunny, Say Aah, Prison, Vest, 
5770, Beige, Not Nice, Meh, , Wifeshirt 2, 
5771, Nature, Dontsee, Gold Bling, , Blank, 
5772, Black, Nothappy Longer, What, Trendy 1, , 
5773, Candy Cane, Pirate, Meh Dangerous Smoke 2, Warhat 1, Alcatraz, 
5774, Red, Multilevel, Say Aah, Whereisgiraffe, , 
5775, Light Brown, Dontsee, Sounds, , Onthesea, 
5776, Red, Machine, Meh, Trendy 1, Trash, 
5777, Light Brown, Pressure, Whatever, Notsmart, Wifeshirt 2, 
5778, Black, Devourer, Moo, War Helmet, , Silver 1
5779, Bad Machine, Pirate, Meh, Trendy 2, Vegas Dancer, 
5780, Color Dots, Blocksun, Dangerous Smoke 2, , Knight Armor, 
5781, Brown, Bed, What, Comrade, Not A Suit, 
5782, Easter Egg, Undead, Dangerous Smoke 1, Visor Hat, Wifeshirt 2, 
5783, Brown, Devourer, Meh Dangerous Smoke 2, , , 
5784, Dark Brown, Love, Dangerous Smoke 2, Mafia, Multicolor, Silver 1
5785, Brown, See Stuff, Scowl, Trendy 2, Weapon Belt, 
5786, Holo Rainbow, Nothappy Longer, Blow Bubble, , Fashion Accesory, 
5787, Dark Brown, Dontsee, Scowl, , Cool T-Shirt, 
5788, Black, Nothappy, Meh, , Iced Tee, 
5789, Lady, Dontsee, Hipster Stache, Mafia, Alcatraz, 
5790, No Signal, Not Nice, Sounds, Rabbit, , Gold 2
5791, Acid, Notfunny, Moo, Whalehunter 1, Iced Tee, 
5792, Candy Cane, Multilevel, Meh, Warhat 1, , 
5793, Black, Nothappy, Whatever, Punk Short, , 
5794, Albino, Notfunny, Meh, Headset, Preshistoric, 
5795, Brown, See Stuff, Bling, Mafia, , Ear Cuff
5796, Red, Dead, Meh Dangerous Smoke 2, Winter Hat, Piercings, 
5797, Light Brown, Notfunny, Buck Teeth, Have Fun 2, Not A Suit, 
5798, Brown, Dontsee, Argh, , Weapon Belt, 
5799, Lady, Pirate, Meh, , , 
5800, Dark Brown, Pressure, What, Small Child, Bringcash, 
5801, Brown, Bed, Whatever, , Blank, 
5802, Beige, Undead, Yesplease, Whalehunter 1, Nofire, 
5803, Dark Brown, Snake, Meh Dangerous Smoke 2, Whereiswhale, Trash, 
5804, Lady, Reality, Dangerous Smoke 2, Whalehunter 1, Wifeshirt 1, 
5805, Dark Brown, Bed, Dangerous Smoke 3, , Bringcash, 
5806, Machine, Round Glasses, Argh, Fetish, , 
5807, Lady, Machine, What, Manbun, Fashion Accesory, Jesus
5808, Brown, Nothappy, Dangerous Smoke 2, , Ok, Silver 1
5809, Light Brown, Puppy Dog, Gold Bling, , Preshistoric, 
5810, Brown, Not Nice, Meh, Hiiya, Blank, 
5811, Light Brown, Pirate, Argh, Cat Ears, Bringcash, 
5812, Beige, Monocle, Whatever, , Trench, 
5813, Albino, Snake, Meh, , Cool T-Shirt, 
5814, Dark Brown, Multilevel, Dangerous Smoke 3, Hiiya, Not A Suit, 
5815, Brown, Nothappy Longer, Dangerous Smoke 2, Headset, Multicolor, 
5816, Black, Bed, Blow Bubble, , , Silver 2
5817, Vector, Devourer, Meh, , Vegas Dancer, 
5818, Black, Dead, What, Have Fun 1, Alcatraz, 
5819, Light Brown, Money, Meh Dangerous Smoke 3, , Not A Suit, 
5820, Brown, Not Nice, Whatever, , Ymca, Ear Cuff
5821, Dark Brown, Dontsee, Meh, , , 
5822, Albino, Monocle, Whatever, Comrade, Onthesea, 
5823, Grey, Money, Dangerous Smoke 2, Devil, Sweet Jacket, 
5824, Dark Brown, Pressure, Meh, Leprechaun, Ay Sailor, 
5825, Color Dots, Love, Meh Blow Bubble, Have Fun 2, Overalls, 
5826, Neon Glow, Money, Yesplease, Jesus Alive, Broken, 
5827, Black, Round Glasses, What, Whereiswhale, Robinson, 
5828, Brown, Undead, Moo, Trick Hat, Iced Tee, 
5829, Black, Notfunny, Meh, Prison, Cuba, 
5830, Machine, Money, Whatever, War Helmet, Cycle, 
5831, Bloodbath, Notfunny, Meh Food, Devil, , Silver 1
5832, Dark Brown, Round Glasses, Whatever, Whalehunter 1, Nofire, 
5833, Brown, Notfunny, Higschool, Whereiswhale, Piercings, 
5834, Light Brown, Round Glasses, Whatever, Warhat 1, Robinson, 
5835, Bad Machine, Dead, Meh, Visor Hat, Trash, 
5836, Dark Brown, Monocle, What, Trendy W 1, Costume Old, Gold 1
5837, Beige, Machine, Meh, Trendy W 2, Nofire, 
5838, Black, Multilevel, Whatever, , Honololu, 
5839, Dark Brown, Future, Meh Dangerous Smoke 2, Good Idea, Multicolor, 
5840, Brown, Nothappy Longer, Meh Dangerous Smoke 1, Whereisgiraffe, Fashion Accesory, 
5841, Blue, Dontlook, Meh Sounds, , Onthesea, 
5842, Dark Brown, Multilevel, Meh, Warhat 2, Bringcash, 
5843, Candy Cane, Round Glasses, Moo, Have Fun 2, , 
5844, Brown, Pressure, Dangerous Smoke 2, Fetish, Weapon Belt, 
5845, Albino, Pirate, Meh, , Alcatraz, Silver 1
5846, Light Brown, Multilevel, Whatever, Good Idea, Multicolor, 
5847, Black, Notfunny, Argh, , Bang Bang, 
5848, Blue, Bed, Meh Dangerous Smoke 2, , Multicolor, 
5849, Machine, Love, Dangerous Smoke 2, , Hipsterneck, Silver 1
5850, Brown, See Stuff, Nofeelingwell, Whalehunter 1, Broken, 
5851, Dark Brown, Pew, Meh Sounds, Mafia, Moon, 
5852, Blue, Notfunny, What, Trick Hat, Rock, Gold 1
5853, Dark Brown, Nothappy, Whatever, , Multicolor, Silver 1
5854, Easter Egg, See Stuff, Meh, Have Fun 2, , Gold 1
5855, Candy Cane, Puppy Dog, Meh Dangerous Smoke 2, Have Fun 1, , 
5856, Black, Bed, Dangerous Smoke 3, , Hoodie Red, Gold 1
5857, Beige, Round Glasses, Meh, , Vest, 
5858, Light Brown, Devourer, Whatever, Hidehairs, Bringcash, 
5859, Black, Money, What, War Helmet, Ay Sailor, 
5860, Light Brown, Notfunny, Whatever, , Not A Suit, 
5861, Beige, Machine, Moo, Catch Robbers, Poncho, 
5862, Black, Notfunny, Funny, Service, Alcatraz, 
5863, Woke From Dead, Future, Whatever, Winter Hat, Rappers, Silver 1
5864, Red, Notfunny, Knife, , , Multiple
5865, Grey, Pressure, What, Winter Hat, Blank, 
5866, Easter Egg, Undead, Say Aah, Cat Ears, Fashion Accesory, 
5867, Dark Brown, Notfunny, Whatever, Rabbit, Trash, Silver 1
5868, Gotsun, See Stuff, Meh, Prison, Praetexta, Multiple
5869, Color Dots, Pressure, Whatever, Hat 2, , 
5870, Acid, Multilevel, Argh, Service, Nowar, 
5871, Black, See Stuff, Meh, Hiiya, Cool T-Shirt, Ear Cuff
5872, Brown, Dontsee, Hipster Stache, Trendy 1, Honololu, 
5873, Dark Brown, Notfunny, Argh, Whereiswhale, Preshistoric, 
5874, Albino, Undead, Now, , Make Fire, 
5875, Holo Rainbow, Bed, Say Aah, Whereiswhale, Vest, Silver 1
5876, Machine, Notfunny, Dangerous Smoke 2, Trick Hat, Cuba, 
5877, Black, Bed, Whatever, Warhat 2, Ymca, 
5878, Lady, Notfunny, Dangerous Smoke 1, , Ay Sailor, 
5879, Red, Devourer, Yesplease, Comrade, Trash, Silver 2
5880, Black, Dontsee, Meh Higschool, Warhat 1, Ay Sailor, 
5881, Lady, Future, Whatever, Have Fun 1, Hoodie Black, 
5882, Red, See Stuff, Dangerous Smoke 2, Whalehunter 2, Wifeshirt 2, 
5883, Brown, Dontsee, Whatever, Warhat 2, Hipsterneck, 
5884, Black, Round Glasses, Yesplease, , Hirewomen, Gold 1
5885, Albino, Nothappy Longer, Meh, Cat Ears, Cycle, 
5886, Blue, Dead, Dangerous Smoke 2, , Great T-Shirt, 
5887, Beige, Dontsee, What, Headset, Hippy, 
5888, Black, Notfunny, Meh, , Blank, Jesus
5889, Nature, Dontsee, Whatever, Service, Shirt Of Flames, 
5890, Dark Brown, Money, Scowl, Devil, Trash, 
5891, Woke From Dead, Puppy Dog, Meh, Whalehunter 2, Vest, Gold 1
5892, Dark Brown, Notfunny, Nofeelingwell, Trendy 1, Trash, 
5893, Beige, Devourer, Meh Dangerous Smoke 3, Jesus Alive, Rappers, 
5894, Light Brown, Pressure, No Teeth, Leprechaun, , 
5895, Beige, Devourer, Nofeelingwell, Whereiswhale, Fishnet Top, Silver 2
5896, Blue, Dontsee, Argh, Leprechaun, , 
5897, Dark Brown, Nothappy Longer, Meh Dangerous Smoke 1, Winter Hat, Ymca, Silver 1
5898, Checkered, Bed, Whatever, , Nofire, 
5899, Africa Animal, Notfunny, Moo, Hat 3, Ay Sailor, 
5900, Brown, Lazer, Whatever, , , Silver 2
5901, Africa Animal, Blocksun, Dangerous Smoke 2, Whalehunter 2, Cuba, 
5902, Dark Brown, Machine, Whatever, , Sweet Jacket, Gold 2
5903, Grey, Dontsee, Yesplease, Trendy W 1, Fashion Accesory, 
5904, Bloodbath, Undead, Whatever, , , Gold 2
5905, Neon Glow, Money, Gold Bling, Catch Robbers, Bringcash, 
5906, Dark Brown, Pressure, Meh Dangerous Smoke 2, Fetish, Rock, 
5907, Bad Machine, Nothappy Longer, Whatever, , Hipsterneck, 
5908, Bloodbath, Notfunny, Meh Dangerous Smoke 2, Cat Ears, Blank, 
5909, Easter Egg, Dontsee, Argh, Punk Short, Honololu, 
5910, Candy Cane, Multilevel, Funny, , , Silver 2
5911, Color Dots, Notfunny, Blow Bubble, Trendy W 1, Not A Suit, 
5912, Gotsun, See Stuff, Dangerous Smoke 3, Whalehunter 1, , 
5913, Beige, Multilevel, Argh, , Wifeshirt 2, 
5914, Red, Love, Funny, , Cool T-Shirt, 
5915, Dark Brown, Lazer, Yesplease, , Hirewomen, 
5916, Gotsun, Not Nice, Dangerous Smoke 2, , Hipsterneck, 
5917, Lady, Multilevel, Argh, , Ay Sailor, 
5918, Nature, Nothappy Longer, Meh, Whalehunter 2, Wifeshirt 2, 
5919, Vector, Multilevel, Scowl, Cook, Multicolor, Ear Cuff
5920, Nature, Puppy Dog, Meh, , Overalls, 
5921, Gotsun, Pressure, Whatever, , Piercings, Stretched
5922, Bloodbath, Multilevel, Say Aah, Devil, , Silver 1
5923, Brown, Puppy Dog, Moo, Prison, Rock, 
5924, Lady, Pressure, Say Aah, , , 
5925, Africa Animal, Dontlook, Buck Teeth, , Hoodie Red, Multiple
5926, Brown, Nothappy Longer, Whatever, Winter Hat, Wifeshirt 2, 
5927, Light Brown, Pressure, Meh, Mafia, Vegas Dancer, Multiple
5928, Gotsun, Undead, Moo, , Hoodie Red, 
5929, Black, Monocle, Meh Higschool, Hippy Hat, Cuba, 
5930, Red, Pressure, Whatever, Whalehunter 2, Multicolor, 
5931, Black, Dontlook, Argh, Have Fun 2, Preshistoric, Silver 2
5932, Dark Brown, Dontsee, Meh, Manbun, Nowar, 
5933, Gotsun, Nothappy, Bling, Prison, , 
5934, Black, Notfunny, What, , Sweet Jacket, 
5935, Light Brown, Machine, Yesplease, , Cool T-Shirt, 
5936, Brown, Love, Whatever, Good Idea, Honololu, Silver 1
5937, Lady, Multilevel, Argh, Hat 2, Ay Sailor, 
5938, Black, Notfunny, Dangerous Smoke 2, Service, Blank, 
5939, Red, Devourer, No Teeth, Prison, Nowar, 
5940, Vector, Dontsee, Moo, Fetish, Great T-Shirt, 
