id, body, eyes, mouth, hat, clothes, earring
5000, Dark Brown, See Stuff, Argh, Prison, Multicolor, 
5001, Woke From Dead, Notfunny, Meh, Whereisgiraffe, Overalls, 
5002, Checkered, Love, Scowl, Winter Hat, Lingerie, Silver 2
5003, Dark Brown, Nothappy Longer, Dangerous Smoke 1, Devil, Preshistoric, Silver 1
5004, Blue, Bed, What, Have Fun 1, Nowar, Jesus
5005, Light Brown, Multilevel, Meh, Winter Hat, Not A Suit, 
5006, Blue, Nothappy, Say Aah, Trendy W 1, Wifeshirt 1, 
5007, Gotsun, Love, Meh, , Rock, 
5008, Light Brown, Pirate, Yesplease, Jesus Alive, Ay Sailor, 
5009, Dark Brown, Dead, Argh, Cook, , 
5010, No Signal, Machine, Dangerous Smoke 2, Antique, , 
5011, Blue, Undead, Meh, Hiiya, Blank, 
5012, Red, Puppy Dog, Whatever, Headset, , 
5013, Woke From Dead, Pressure, Meh Dangerous Smoke 2, Trendy 1, Cycle, 
5014, Dark Brown, Money, Meh, War Helmet, Rock, 
5015, Vector, Pressure, Argh, , Vest, 
5016, Africa Animal, Pirate, Moo, Winter Hat, Sweet 16, Silver 2
5017, Easter Egg, Puppy Dog, Blow Bubble, Visor Hat, Not A Suit, 
5018, Dark Brown, Notfunny, Moo, , Vest, 
5019, Void, Money, Meh Dangerous Smoke 3, , , 
5020, Brown, Undead, Meh, Trendy W 1, Onthesea, 
5021, Lady, Notfunny, Nofeelingwell, , Bringcash, Silver 2
5022, No Signal, Undead, Scowl, Visor Hat, , 
5023, Color Dots, Dontsee, Meh Dangerous Smoke 2, , Multicolor, 
5024, Easter Egg, Money, Argh, Trendy 1, Onthesea, 
5025, Blue, Pressure, Meh, , Fashion Accesory, 
5026, Holo Rainbow, Multilevel, Say Aah, Prison, Lingerie, 
5027, Woke From Dead, Monocle, Whatever, Punk Short, Not A Suit, 
5028, Nature, Dontlook, Dangerous Smoke 2, Whalehunter 1, Hipsterneck, Gold 2
5029, Beige, Bed, Argh, , Hipster Shirt, 
5030, Vector, Nothappy Longer, Meh, Antique, Rappers, 
5031, Black, Bed, Buck Teeth, Warhat 1, Preshistoric, 
5032, Brown, Undead, Dangerous Smoke 1, Cat Ears, Cool T-Shirt, 
5033, Beige, Not Nice, Bling, , Overalls, 
5034, Dark Brown, Money, Sounds, , Nofire, 
5035, Light Brown, Dead, Higschool, Antique, Alcatraz, Silver 1
5036, Gotsun, Pressure, Meh, Hat 2, Onthesea, 
5037, Blue, Money, Dangerous Smoke 1, Devil, Overalls, 
5038, Dark Brown, Multilevel, Whatever, Whalehunter 2, Piercings, Ear Cuff
5039, Black, Nothappy Longer, Dangerous Smoke 2, Mafia, Bringcash, 
5040, Lady, Multilevel, Buck Teeth, Devil, Overalls, 
5041, Dark Brown, See Stuff, Whatever, , Ay Sailor, 
5042, Black, Devourer, Say Aah, , , Silver 2
5043, Holo Rainbow, Multilevel, Yesplease, , Fashion Accesory, 
5044, Africa Animal, Bed, Bling, Trendy W 2, Iced Tee, 
5045, Dark Brown, Dead, Whatever, Leprechaun, Trash, 
5046, Checkered, See Stuff, Nofeelingwell, Have Fun 1, Cuba, Ear Cuff
5047, Brown, Devourer, Dangerous Smoke 2, Prison, Poncho, 
5048, Neon Glow, Puppy Dog, Whatever, Leprechaun, Overalls, 
5049, Nature, Machine, What, Whalehunter 1, Wifeshirt 1, 
5050, Gotsun, Puppy Dog, Whatever, Jesus Alive, Vest, 
5051, Vector, Undead, Argh, Manbun, Preshistoric, 
5052, Dark Brown, Dontsee, Dangerous Smoke 1, Hat 2, , 
5053, Stars And Stripes, Bed, Meh Blow Bubble, , , 
5054, Neon Glow, Notfunny, Meh Dangerous Smoke 2, Prison, Robinson, 
5055, Nature, Not Nice, Whatever, Catch Robbers, Poncho, 
5056, Stars And Stripes, Pressure, Yesplease, Visor Hat, , Silver 2
5057, Machine, Multilevel, Rainbow, Notsmart, Sweet 16, 
5058, Light Brown, Dead, Funny, Warhat 2, Vegas Dancer, 
5059, Blue, Love, Meh, , Overalls, 
5060, Black, Blocksun, Dangerous Smoke 3, Punk Short, Wifeshirt 1, 
5061, Brown, Reality, Moo, Hat 2, Hippy, 
5062, Gotsun, Bed, Whatever, Jesus Alive, Nowar, 
5063, Checkered, Dead, Dangerous Smoke 2, War Helmet, Blank, 
5064, Beige, Machine, Meh Knife, Hat 3, Wifeshirt 2, Multiple
5065, Black, Notfunny, Say Aah, Whereiswhale, , Silver 1
5066, Dark Brown, Reality, Meh, Hat 2, Ay Sailor, 
5067, Light Brown, Dontsee, Say Aah, Rabbit, , Gold 1
5068, Neon Glow, Pressure, Whatever, Whereisgiraffe, Bang Bang, 
5069, Candy Cane, Notfunny, Meh, Whalehunter 2, , Gold 1
5070, Dark Brown, Pressure, Yesplease, Warhat 1, Vegas Dancer, 
5071, Africa Animal, See Stuff, Say Aah, , , 
5072, Blue, Multilevel, Meh Dangerous Smoke 1, Warhat 1, Wifeshirt 2, 
5073, Beige, Round Glasses, Yesplease, Prison, Cuba, 
5074, Bad Machine, Notfunny, Rainbow, Hidehairs, Multicolor, 
5075, Light Brown, Money, Dangerous Smoke 3, Trendy 1, Bang Bang, 
5076, Black, Multilevel, Meh Dangerous Smoke 2, Whereisgiraffe, Gentleman, Silver 2
5077, Bloodbath, Blocksun, Meh, Punk Short, , 
5078, Machine, See Stuff, Moo, Small Child, Trash, Multiple
5079, Dark Brown, Notfunny, No Teeth, Leprechaun, Blank, 
5080, Brown, Dontlook, Whatever, Manbun, Broken, Silver 2
5081, Black, Bed, Say Aah, Whalehunter 1, Ay Sailor, 
5082, Africa Animal, Money, Dangerous Smoke 2, Trendy 1, Hipsterneck, 
5083, Blue, Bed, Funny, Cook, Cycle, 
5084, Stars And Stripes, Round Glasses, Whatever, Prison, , 
5085, Red, Puppy Dog, Meh, Comrade, Wifeshirt 2, 
5086, Gotsun, Bed, Dangerous Smoke 2, Trendy 1, Lingerie, 
5087, Lady, Multilevel, Meh Dangerous Smoke 3, , Blank, 
5088, Red, Notfunny, Meh, Small Child, Cuba, 
5089, Holo Rainbow, Money, Blow Bubble, , Nofire, 
5090, Neon Glow, See Stuff, Meh, , Onthesea, Stretched
5091, Light Brown, Pressure, Yesplease, Devil, , 
5092, Woke From Dead, Round Glasses, What, Small Child, , Gold 1
5093, Brown, Nothappy Longer, Meh Dangerous Smoke 2, Service, , 
5094, Grey, Money, Rainbow, Hiiya, Bang Bang, 
5095, Dark Brown, Notfunny, Meh, Comrade, Nowar, 
5096, Light Brown, Multilevel, Moo, Trendy 1, Moon, 
5097, Vector, Notfunny, Meh, Antique, , 
5098, Gotsun, Nothappy Longer, Argh, , Cuba, Silver 2
5099, Candy Cane, Dead, Meh, War Helmet, Honololu, Silver 1
5100, Lady, See Stuff, Whatever, Service, Cuba, 
5101, Color Dots, Notfunny, Moo, Whalehunter 1, Fishnet Top, 
5102, Dark Brown, Pressure, Argh, Hat 3, Ymca, 
5103, Beige, See Stuff, Meh, Service, Iced Tee, 
5104, Albino, Future, Funny, Trendy W 2, , 
5105, Dark Brown, Machine, Meh, Leprechaun, , 
5106, Nature, Monocle, Dangerous Smoke 2, Small Child, Praetexta, 
5107, Red, Notfunny, Meh, Service, Lingerie, 
5108, Africa Animal, Round Glasses, Whatever, Warhat 2, Cuba, 
5109, Beige, Dontsee, Moo, , Nofire, Multiple
5110, Light Brown, Monocle, Say Aah, , Iced Tee, Silver 2
5111, Brown, Round Glasses, Whatever, Mafia, Trench, 
5112, Beige, Bed, What, Visor Hat, Vest, 
5113, Vector, Notfunny, Whatever, Whalehunter 2, Preshistoric, 
5114, Africa Animal, Pressure, Moo, Prison, Blank, 
5115, No Signal, Round Glasses, What, Whalehunter 2, , 
5116, Black, Devourer, Whatever, Hat 3, Poncho, 
5117, Red, Dontsee, Sounds, , Chemist, 
5118, Gotsun, Undead, Meh, , Piercings, Silver 2
5119, Blue, Notfunny, Dangerous Smoke 3, Devil, Ay Sailor, 
5120, Machine, Reality, Funny, Jesus Alive, Praetexta, 
5121, Blue, Machine, Meh Dangerous Smoke 3, Prison, , Gold 2
5122, Black, Dontsee, Say Aah, Punk Short, Knight Armor, 
5123, Woke From Dead, Notfunny, Whatever, , Piercings, Gold 2
5124, Grey, Round Glasses, What, , Wifeshirt 1, 
5125, Color Dots, Not Nice, Meh, , Ymca, 
5126, Light Brown, Bed, Moo, , Bringcash, 
5127, Black, Notfunny, Whatever, Service, Wifeshirt 1, 
5128, Blue, Machine, Meh, War Helmet, Piercings, 
5129, Light Brown, See Stuff, Argh, Cat Ears, Bang Bang, 
5130, Lady, Nothappy Longer, Bling, Whalehunter 2, Honololu, 
5131, Brown, Puppy Dog, Whatever, Comrade, Rock, Silver 2
5132, Gotsun, Notfunny, Hipster Stache, Trendy 1, Multicolor, Ear Cuff
5133, Stars And Stripes, Blocksun, Nofeelingwell, Leprechaun, , 
5134, Brown, Dead, Whatever, Service, Cool T-Shirt, 
5135, Color Dots, Bed, Argh, , Vest, Silver 1
5136, Lady, Notfunny, Scowl, , , Ear Cuff
5137, Color Dots, Bed, Dangerous Smoke 2, Catch Robbers, Great T-Shirt, 
5138, Africa Animal, Pressure, Buck Teeth, Leprechaun, Hirewomen, 
5139, Light Brown, Round Glasses, Dangerous Smoke 2, Whalehunter 1, Overalls, 
5140, Grey, Undead, Meh Knife, Visor Hat, Wifeshirt 2, 
5141, Blue, Nothappy, Meh, , , Silver 2
5142, Acid, Love, Dangerous Smoke 2, Trendy 1, Fashion Accesory, Gold 1
5143, Brown, See Stuff, Meh Higschool, Warhat 1, Lingerie, Gold 2
5144, Red, Round Glasses, What, Comrade, Hirewomen, 
5145, Brown, Snake, Argh, Have Fun 2, , 
5146, Light Brown, Bed, Whatever, , Wifeshirt 1, Silver 2
5147, Acid, Undead, No Teeth, , , 
5148, Dark Brown, Bed, Knife, , Honololu, 
5149, Bad Machine, Dontsee, Meh, Devil, Hipsterneck, 
5150, Beige, Machine, What, , Nofire, 
5151, Blue, Bed, Argh, Whalehunter 1, Weapon Belt, Jesus
5152, Brown, Devourer, Whatever, Trendy 1, Blank, 
5153, Dark Brown, Love, Meh Dangerous Smoke 1, Hat 3, Cool T-Shirt, 
5154, Brown, Puppy Dog, Meh, Rabbit, Blank, 
5155, Beige, Bed, Meh Dangerous Smoke 2, Prison, Bringcash, 
5156, Brown, Puppy Dog, Meh, Have Fun 1, Ymca, Silver 2
5157, Light Brown, Snake, Blow Bubble, , Wifeshirt 1, Gold 2
5158, Vector, Multilevel, Meh Dangerous Smoke 2, Trendy 2, Trench, 
5159, Black, Round Glasses, Whatever, Whalehunter 2, Sweet Jacket, 
5160, Machine, Nothappy, Argh, Trick Hat, Onthesea, 
5161, Gotsun, Puppy Dog, Whatever, Mafia, Alcatraz, 
5162, Holo Rainbow, See Stuff, Argh, Winter Hat, Cycle, Multiple
5163, Beige, Devourer, Bling, Have Fun 2, Nowar, 
5164, Neon Glow, Love, Whatever, Small Child, Hippy, 
5165, Easter Egg, Pew, Now, , Multicolor, 
5166, Machine, Dontlook, Say Aah, , Cycle, 
5167, Nature, Bed, Whatever, Hippy Hat, Nowar, Multiple
5168, Beige, Dead, Say Aah, , , 
5169, Africa Animal, Machine, Whatever, Have Fun 2, Bringcash, 
5170, Woke From Dead, Multilevel, Meh, Side Shave, Overalls, 
5171, Dark Brown, Puppy Dog, Buck Teeth, Whalehunter 2, , 
5172, Brown, Nothappy Longer, Dangerous Smoke 1, Leprechaun, Preshistoric, 
5173, Albino, Notfunny, Gold Bling, Trendy W 2, Piercings, 
5174, Light Brown, Dead, Meh, Leprechaun, , 
5175, Dark Brown, Nothappy, No Teeth, Manbun, Onthesea, 
5176, Grey, Monocle, Dangerous Smoke 2, Hidehairs, Hipsterneck, 
5177, Brown, Notfunny, Whatever, Prison, Nowar, 
5178, Dark Brown, See Stuff, Nofeelingwell, Winter Hat, Lingerie, Silver 1
5179, Beige, Undead, Moo, Have Fun 1, Nofire, 
5180, Albino, Notfunny, Whatever, Headset, Cuba, 
5181, Nature, Pirate, Say Aah, , Gentleman, 
5182, Lady, Bed, Whatever, Catch Robbers, Fashion Accesory, 
5183, Brown, Devourer, Say Aah, Whalehunter 2, Moon, Silver 1
5184, Black, Love, Meh Knife, Manbun, Weapon Belt, 
5185, Light Brown, Machine, Meh Food, Rabbit, , 
5186, Africa Animal, Puppy Dog, Whatever, Whalehunter 2, Ay Sailor, 
5187, Grey, Dontsee, Scowl, , Trash, 
5188, Beige, Monocle, Meh, Mafia, Nowar, 
5189, Brown, Nothappy Longer, Dangerous Smoke 1, , Hipsterneck, 
5190, Dark Brown, Bed, Whatever, Prison, Cycle, 
5191, Lady, Not Nice, Dangerous Smoke 1, Whalehunter 2, , 
5192, Brown, Notfunny, Meh Dangerous Smoke 1, , Ymca, Ear Cuff
5193, Neon Glow, Nothappy, Argh, Comrade, Iced Tee, 
5194, Beige, Undead, What, , Costume Old, Gold 2
5195, Lady, Bed, Argh, Rule All, Alcatraz, 
5196, Black, Round Glasses, Dangerous Smoke 2, Trendy W 2, Sweet Jacket, 
5197, Dark Brown, See Stuff, Meh, Jesus Alive, Poncho, 
5198, Blue, Love, Now, Devil, Alcatraz, 
5199, Red, Dontlook, Moo, Hiiya, Onthesea, 
5200, Dark Brown, Dontsee, Say Aah, , Poncho, Jesus
5201, Blue, Undead, Food, Catch Robbers, Shirt Of Flames, 
5202, No Signal, Nothappy Longer, Argh, Hiiya, , 
5203, Black, Pirate, What, Side Shave, Cycle, 
5204, Beige, Pressure, Sounds, Trendy 2, Blank, Silver 1
5205, Candy Cane, Dontsee, Argh, , , 
5206, Light Brown, Money, Whatever, Whalehunter 2, Multicolor, 
5207, Black, Notfunny, Meh, Small Child, Onthesea, 
5208, Brown, Dontsee, What, , Ay Sailor, Silver 1
5209, Dark Brown, Love, Meh Dangerous Smoke 3, , Hipster Shirt, 
5210, Brown, Multilevel, Argh, Winter Hat, Cycle, Silver 1
5211, Light Brown, Pressure, Nofeelingwell, Whalehunter 1, Vest, 
5212, Nature, Round Glasses, Argh, , Honololu, Gold 2
5213, Machine, Puppy Dog, Moo, Side Shave, Praetexta, 
5214, Nature, Dontsee, Now, Notsmart, Robinson, Ear Cuff
5215, Light Brown, See Stuff, Whatever, Rabbit, Broken, Silver 2
5216, Dark Brown, Bed, What, Prison, Nofire, Ear Cuff
5217, Beige, Dontlook, Argh, Side Shave, Make Fire, 
5218, Black, Puppy Dog, Meh, , Trench, 
5219, Bad Machine, Nothappy Longer, Meh Dangerous Smoke 3, Manbun, Knight Armor, 
5220, Blue, See Stuff, Argh, Whalehunter 1, Hippy, 
5221, Dark Brown, Devourer, Dangerous Smoke 2, Hat 2, Not A Suit, Ear Cuff
5222, Black, Puppy Dog, Moo, Cook, Hoodie Black, 
5223, Beige, Pressure, Meh, Devil, Onthesea, 
5224, Light Brown, See Stuff, Whatever, Cat Ears, Honololu, 
5225, Black, Notfunny, What, , Onthesea, 
5226, Albino, Undead, Meh Dangerous Smoke 3, , , 
5227, Black, Dead, Dangerous Smoke 2, Warhat 2, Trash, 
5228, Grey, See Stuff, Argh, Hat 3, Cuba, 
5229, Beige, Lazer, Scowl, , Alcatraz, 
5230, Au, Notfunny, Now, Service, Robinson, 
5231, Brown, Not Nice, Meh, , Rappers, 
5232, Woke From Dead, Puppy Dog, Dangerous Smoke 2, Whereisgiraffe, Bringcash, Multiple
5233, Brown, Love, Whatever, Mafia, Vest, 
5234, Nature, Blocksun, Argh, Whalehunter 2, Nofire, 
5235, Dark Brown, Money, Meh, Punk Short, Lingerie, 
5236, Bloodbath, Pirate, Higschool, Mafia, , 
5237, Dark Brown, Multilevel, Dangerous Smoke 2, Trendy 1, Rappers, Gold 1
5238, Color Dots, See Stuff, Moo, Jesus Alive, Weapon Belt, 
5239, Light Brown, Pressure, Meh, Comrade, Preshistoric, Multiple
5240, Lady, Machine, Whatever, , Moon, 
5241, Blue, Undead, Scowl, , Onthesea, Stretched
5242, Lady, Dontsee, Now, Jesus Alive, Hoodie Red, 
5243, Brown, Notfunny, Meh, Winter Hat, Rock, 
5244, Red, Machine, Whatever, , Hipsterneck, 
5245, Brown, Blocksun, What, Headset, Weapon Belt, 
5246, Light Brown, See Stuff, Whatever, Mafia, Ay Sailor, Gold 2
5247, No Signal, Dontsee, Yesplease, Hiiya, , 
5248, Beige, Pirate, Argh, Cat Ears, Gentleman, Gold 2
5249, Grey, Blocksun, Say Aah, Trendy 2, Vegas Dancer, Silver 2
5250, Beige, Undead, Scowl, Winter Hat, Fishnet Top, Multiple
5251, Nature, Pressure, Funny, Jesus Alive, Trench, 
5252, Brown, Notfunny, Food, Comrade, Nofire, Ear Cuff
5253, Red, Round Glasses, Moo, Hiiya, Multicolor, 
5254, Grey, Notfunny, Dangerous Smoke 2, Whalehunter 2, Preshistoric, Silver 2
5255, Gotsun, Nothappy Longer, Now, Hat 3, Nowar, 
5256, Red, Dontsee, Whatever, Catch Robbers, Blank, 
5257, Black, Notfunny, Meh, Prison, , 
5258, Albino, Machine, Whatever, , Preshistoric, 
5259, Holo Rainbow, Nothappy Longer, Meh Dangerous Smoke 2, Rabbit, Bringcash, 
5260, Neon Glow, Notfunny, Meh, Hat 3, Broken, 
5261, Albino, Multilevel, Dangerous Smoke 2, Notsmart, , 
5262, Black, Notfunny, Whatever, Whereiswhale, Robinson, Silver 1
5263, Africa Animal, Pressure, Meh Dangerous Smoke 2, Rule All, , 
5264, Red, Future, Whatever, , Ok, Ear Cuff
5265, Dark Brown, Nothappy, Meh Dangerous Smoke 2, Comrade, Fashion Accesory, 
5266, Light Brown, Blocksun, What, Prison, Cool T-Shirt, 
5267, Gotsun, Notfunny, Meh, Hiiya, Sweet Jacket, 
5268, Light Brown, Nothappy Longer, Meh Sounds, Rule All, Nofire, 
5269, Gotsun, Monocle, Say Aah, Trendy W 2, Praetexta, Silver 1
5270, Brown, Round Glasses, Whatever, , Overalls, 
5271, Black, Love, Meh, Hat 2, Nofire, Silver 1
5272, Light Brown, Notfunny, Dangerous Smoke 2, Whalehunter 2, Blazer Black, 
5273, Black, See Stuff, Moo, Trendy 1, Hipsterneck, 
5274, Beige, Notfunny, What, Service, Honololu, Gold 1
5275, Machine, Blocksun, Meh, Whereisgiraffe, , 
5276, Albino, Dontlook, Hipster Stache, , Hipster Shirt, 
5277, Dark Brown, Bed, Whatever, , Cycle, Ear Cuff
5278, Africa Animal, Notfunny, Dangerous Smoke 2, , Trash, 
5279, Beige, Money, Scowl, Service, Rappers, Silver 1
5280, Black, Notfunny, Meh, Jesus Alive, Blank, 
5281, Machine, Machine, What, Whalehunter 2, Hippy, Gold 2
5282, Woke From Dead, Notfunny, Say Aah, Whereiswhale, Wifeshirt 1, 
5283, Nature, Money, Meh, Warhat 1, , 
5284, Acid, Dontlook, Argh, , , Gold 1
5285, Dark Brown, Snake, Nofeelingwell, Jesus Alive, Great T-Shirt, Silver 2
5286, Red, See Stuff, Argh, Trendy 1, Robinson, 
5287, Beige, Notfunny, Moo, Jesus Alive, Fashion Accesory, Silver 1
5288, Black, Not Nice, Knife, Small Child, Cool T-Shirt, Multiple
5289, Gotsun, Dontlook, Meh, Comrade, Broken, 
5290, Lady, Machine, Argh, , Wifeshirt 2, 
5291, Red, Love, Buck Teeth, Warhat 2, Blank, 
5292, Dark Brown, Dontsee, Whatever, Headset, Hipster Shirt, 
5293, Woke From Dead, Undead, Moo, War Helmet, Piercings, 
5294, Holo Rainbow, Love, What, Prison, Overalls, 
5295, Dark Brown, Bed, Meh Dangerous Smoke 3, , Wifeshirt 2, 
5296, Easter Egg, Multilevel, Whatever, Hat 3, Great T-Shirt, 
5297, Dark Brown, Blocksun, Moo, Fetish, Onthesea, 
5298, Black, Notfunny, Funny, Devil, Bringcash, Gold 2
5299, Dark Brown, See Stuff, Moo, Hat 3, Gentleman, 
5300, Light Brown, Machine, Dangerous Smoke 3, Whalehunter 1, Poncho, 
5301, Bad Machine, Notfunny, Now, Prison, Not A Suit, Silver 1
5302, Stars And Stripes, Bed, Meh Dangerous Smoke 2, , , 
5303, Grey, See Stuff, What, , Preshistoric, Ear Cuff
5304, Beige, Notfunny, Whatever, , , 
5305, Woke From Dead, Dontsee, Dangerous Smoke 2, , , Silver 1
5306, Bloodbath, See Stuff, What, , , Ear Cuff
5307, Brown, Blocksun, Meh, Winter Hat, Wifeshirt 2, 
5308, Gotsun, Notfunny, Whatever, Trendy 2, Cuba, Silver 1
5309, Nature, Pressure, Sounds, Devil, Piercings, Silver 2
5310, No Signal, Puppy Dog, Say Aah, Cook, Sweet Jacket, 
5311, Africa Animal, Money, Whatever, Headset, , 
5312, Black, Devourer, Dangerous Smoke 2, Have Fun 2, Vegas Dancer, 
5313, Lady, Nothappy, Yesplease, Trendy W 1, Fashion Accesory, Multiple
5314, Dark Brown, Notfunny, Whatever, Notsmart, Preshistoric, 
5315, Gotsun, Future, Scowl, Whalehunter 1, Onthesea, 
5316, Bad Machine, Love, Argh, Visor Hat, Multicolor, Silver 1
5317, Africa Animal, Dead, Whatever, Warhat 2, Overalls, 
5318, Nature, See Stuff, Meh, Cook, Multicolor, 
5319, Beige, Bed, Argh, , Not A Suit, 
5320, Blue, Pirate, Meh, Prison, , 
5321, Albino, Pressure, What, , Vegas Dancer, Ear Cuff
5322, Red, Notfunny, Meh, Side Shave, Blank, 
5323, Dark Brown, Bed, Argh, Jesus Alive, Rappers, Silver 1
5324, Light Brown, Not Nice, Higschool, Winter Hat, Alcatraz, Multiple
5325, Easter Egg, Blocksun, Meh Dangerous Smoke 2, Fetish, Ay Sailor, 
5326, Blue, Round Glasses, Blow Bubble, Hat 2, Blank, Gold 2
5327, Candy Cane, Money, Argh, Cat Ears, , 
5328, Black, Reality, Whatever, Catch Robbers, Hipster Shirt, 
5329, Bloodbath, Bed, Moo, , , 
5330, Nature, Nothappy Longer, Say Aah, , Fashion Accesory, 
5331, Color Dots, Round Glasses, Whatever, Prison, Cycle, 
5332, Black, Dontsee, Argh, Catch Robbers, Not A Suit, 
5333, Grey, Dontlook, Whatever, Small Child, Hipsterneck, 
5334, Bad Machine, Dontsee, Moo, , Blank, 
5335, Gotsun, Blocksun, Whatever, Fetish, Broken, 
5336, Holo Rainbow, Puppy Dog, Dangerous Smoke 2, , Wifeshirt 1, 
5337, Beige, Future, Dangerous Smoke 3, Small Child, Sweet Jacket, 
5338, Dark Brown, Machine, Rainbow, Whalehunter 1, Wifeshirt 2, 
5339, Neon Glow, Pew, Moo, , Broken, Multiple
5340, Lady, Puppy Dog, Say Aah, , Trash, Gold 2
5341, Dark Brown, Nothappy, Whatever, War Helmet, Cuba, Ear Cuff
5342, Black, Notfunny, Moo, , Wifeshirt 1, 
5343, Au, See Stuff, Dangerous Smoke 1, Whalehunter 1, , 
5344, Africa Animal, Reality, Meh, Trendy 1, , Multiple
5345, Albino, Machine, Blow Bubble, , Gentleman, Silver 1
5346, Blue, Nothappy Longer, Meh, , Fishnet Top, 
5347, Gotsun, Notfunny, Yesplease, Whalehunter 2, Hipsterneck, 
5348, Light Brown, Nothappy, Argh, , , 
5349, Brown, Dontlook, Meh, Side Shave, Overalls, Multiple
5350, Checkered, Round Glasses, Yesplease, Trendy W 2, Chemist, 
5351, Dark Brown, Dontlook, Argh, , Ay Sailor, 
5352, Acid, Love, Whatever, , , 
5353, Dark Brown, Devourer, Dangerous Smoke 2, Comrade, Great T-Shirt, Multiple
5354, Beige, Notfunny, Meh Dangerous Smoke 2, , Piercings, 
5355, Bloodbath, Love, Yesplease, Leprechaun, , Silver 1
5356, Dark Brown, Pew, Buck Teeth, Comrade, Cool T-Shirt, 
5357, Gotsun, Pirate, Meh Sounds, Warhat 1, , Silver 1
5358, Candy Cane, See Stuff, What, Trendy 1, , 
5359, Dark Brown, Nothappy Longer, Whatever, , , 
5360, Black, Dontsee, Knife, Cat Ears, Knight Armor, 
5361, Gotsun, Devourer, Dangerous Smoke 2, Fetish, Cool T-Shirt, 
5362, Black, Multilevel, Yesplease, Trendy 2, Hirewomen, Silver 1
5363, Holo Rainbow, Notfunny, Meh, , , 
5364, Africa Animal, Puppy Dog, Whatever, , Honololu, 
5365, Light Brown, Pirate, Meh Blow Bubble, Leprechaun, Hipster Shirt, 
5366, Africa Animal, Bed, Whatever, Jesus Alive, Hoodie Red, 
5367, Brown, Dead, Meh Dangerous Smoke 1, Devil, Blank, Gold 1
5368, Black, Nothappy Longer, Moo, Whalehunter 2, Hirewomen, 
5369, Checkered, Nothappy, Yesplease, Warhat 2, Rappers, 
5370, No Signal, Bed, Whatever, , , 
5371, Light Brown, Blocksun, Scowl, Prison, Nofire, 
5372, No Signal, Money, Argh, Whalehunter 1, , 
5373, Bad Machine, Pirate, Whatever, , Alcatraz, 
5374, Checkered, Notfunny, Moo, Trendy W 2, , 
5375, Black, Pressure, Say Aah, Small Child, Praetexta, 
5376, Brown, Round Glasses, Meh, , Bringcash, 
5377, Black, Notfunny, Say Aah, Winter Hat, Poncho, 
5378, Dark Brown, Dontsee, Meh, Rabbit, Broken, 
5379, Holo Rainbow, Bed, Whatever, Trendy W 2, Trench, 
5380, Lady, Multilevel, Meh, Punk Short, Preshistoric, 
5381, Easter Egg, Notfunny, What, , Costume Old, Silver 2
5382, Brown, Money, Whatever, , Rock, 
5383, Vector, Nothappy Longer, Meh, , Shirt Of Flames, 
5384, Neon Glow, Future, Argh, Whalehunter 1, Honololu, 
5385, Black, See Stuff, Now, Visor Hat, Trash, 
5386, Beige, Notfunny, Meh, War Helmet, Cycle, 
5387, Grey, Nothappy, Argh, Jesus Alive, Cool T-Shirt, 
5388, Nature, Notfunny, No Teeth, Whalehunter 2, Rappers, Multiple
5389, Blue, Pressure, Meh, Fetish, Great T-Shirt, Silver 2
5390, Grey, Multilevel, Say Aah, , Nowar, Gold 1
5391, Blue, Reality, Whatever, Hippy Hat, Iced Tee, Multiple
5392, Black, Blocksun, Argh, Headset, Nowar, 
5393, Gotsun, See Stuff, Meh, Cat Ears, Cycle, 
5394, Light Brown, Undead, Whatever, Hiiya, Blank, 
5395, Dark Brown, Machine, Moo, Whereiswhale, Ay Sailor, 
5396, Woke From Dead, Round Glasses, Whatever, Prison, Poncho, Multiple
5397, Brown, Undead, Funny, Hat 2, Broken, 
5398, Dark Brown, Notfunny, Now, Jesus Alive, Wifeshirt 1, 
5399, Black, Nothappy Longer, Whatever, , Hirewomen, 
5400, Dark Brown, Blocksun, Meh Dangerous Smoke 2, Jesus Alive, Nofire, Gold 2
5401, Holo Rainbow, Love, Meh, Trendy 1, Poncho, 
5402, Black, Notfunny, Whatever, Small Child, Cycle, 
5403, Neon Glow, Puppy Dog, Dangerous Smoke 2, Leprechaun, Great T-Shirt, 
5404, Lady, Love, Argh, , Preshistoric, 
5405, Dark Brown, Pirate, Moo, , , Ear Cuff
5406, Nature, Pressure, Funny, Service, Make Fire, 
5407, Brown, Notfunny, Whatever, Trendy 1, Not A Suit, Multiple
5408, Light Brown, Undead, Moo, Service, Preshistoric, Ear Cuff
5409, Dark Brown, Pressure, Gold Bling, Cat Ears, , Silver 1
5410, Grey, Notfunny, Yesplease, , Sweet Jacket, 
5411, Neon Glow, Pressure, Whatever, Whalehunter 2, , 
5412, Woke From Dead, Multilevel, Moo, Fetish, Chemist, 
5413, Blue, Dead, Argh, Trick Hat, Onthesea, 
5414, Light Brown, Nothappy Longer, Dangerous Smoke 2, , Bringcash, Gold 1
5415, Africa Animal, Puppy Dog, Whatever, Rule All, Honololu, 
5416, Light Brown, Blocksun, Moo, , Cycle, 
5417, Color Dots, Pressure, Whatever, Hat 3, Trash, 
5418, Brown, Nothappy, Say Aah, Fetish, Make Fire, Gold 2
5419, Black, Dontsee, Whatever, , Sweet Jacket, 
5420, Beige, Puppy Dog, Say Aah, , Ay Sailor, Gold 2
5421, Dark Brown, Notfunny, Yesplease, Whereisgiraffe, Bringcash, 
5422, Light Brown, Round Glasses, Meh Sounds, Punk Short, Make Fire, Silver 1
5423, Brown, Money, Moo, Winter Hat, Trench, 
5424, Black, Notfunny, Dangerous Smoke 2, Trendy W 1, Great T-Shirt, 
5425, Grey, Round Glasses, Yesplease, Fetish, Hipsterneck, Ear Cuff
5426, Africa Animal, Notfunny, Meh, Headset, Sweet 16, 
5427, Dark Brown, Puppy Dog, Bling, , Cool T-Shirt, Gold 1
5428, Albino, Notfunny, Dangerous Smoke 1, Comrade, Rappers, 
5429, Lady, Multilevel, Whatever, , Ay Sailor, Silver 1
5430, Gotsun, Love, Meh, Headset, Vegas Dancer, 
5431, Black, Nothappy Longer, Whatever, Hiiya, , Ear Cuff
5432, Neon Glow, Notfunny, Say Aah, Notsmart, Wifeshirt 2, 
5433, Dark Brown, Money, Meh, , Sweet Jacket, 
5434, Gotsun, Blocksun, Scowl, Whereisgiraffe, Fashion Accesory, 
5435, Black, Multilevel, Say Aah, Jesus Alive, Weapon Belt, 
5436, Brown, Undead, Whatever, , Hipster Shirt, 
5437, Gotsun, Dontsee, Moo, Trendy 1, Onthesea, 
5438, Brown, Love, Argh, , Great T-Shirt, 
5439, Neon Glow, Dontsee, Say Aah, Cook, Cool T-Shirt, 
5440, Brown, Notfunny, Now, Catch Robbers, Blank, 
5441, Nature, See Stuff, Whatever, Hat 2, Trash, 
5442, Dark Brown, Nothappy, Meh, Small Child, Hirewomen, 
5443, Grey, Nothappy Longer, No Teeth, Warhat 2, Praetexta, 
5444, Blue, Pirate, Meh Dangerous Smoke 2, Hat 3, Vegas Dancer, 
5445, Brown, Notfunny, Dangerous Smoke 2, , , Multiple
5446, Gotsun, See Stuff, Whatever, Catch Robbers, , 
5447, Woke From Dead, Pressure, Moo, Fetish, , Silver 1
5448, Dark Brown, Love, Meh Dangerous Smoke 2, Devil, Hippy, 
5449, Light Brown, Pirate, Dangerous Smoke 2, Service, Hipsterneck, 
5450, Dark Brown, Machine, Whatever, Comrade, Cool T-Shirt, Ear Cuff
5451, Blue, Not Nice, Meh Dangerous Smoke 2, Whalehunter 2, Ok, 
5452, Albino, Puppy Dog, Blow Bubble, , Make Fire, 
5453, Light Brown, Notfunny, Whatever, , Wifeshirt 2, 
5454, Red, Undead, Meh, Hiiya, Hipster Shirt, 
5455, Checkered, Round Glasses, Moo, Prison, Ok, 
5456, Albino, Money, Whatever, Winter Hat, Fashion Accesory, 
5457, Red, Multilevel, Scowl, Whalehunter 2, Cuba, 
5458, Dark Brown, Not Nice, Higschool, Hat 3, Trash, 
5459, Light Brown, Pew, Meh, Service, Nowar, 
5460, Gotsun, Pressure, Whatever, Punk Short, Cycle, 
5461, Dark Brown, Undead, Argh, Whalehunter 1, Sweet 16, 
5462, Neon Glow, Pressure, Moo, Good Idea, Moon, 
5463, Beige, Dontlook, Meh, Hat 3, Gentleman, Gold 1
5464, Grey, Pressure, What, Rule All, Vest, 
5465, Machine, Devourer, Gold Bling, Trendy 1, Robinson, 
