7474, Dark Brown, Round Glasses, Meh, Hat 2, , 
7475, Black, Notfunny, What, Notsmart, Knight Armor, Multiple
7476, Au, Dead, Whatever, Trendy 2, , 
7477, Red, Pressure, Blow Bubble, , Cycle, 
7478, Africa Animal, Money, Gold Bling, Hat 3, Not A Suit, 
7479, Red, Pressure, Now, Hat 1, Multicolor, 
7480, No Signal, Bed, Higschool, Rule All, , Silver 2
7481, Grey, Blocksun, Say Aah, , Onthesea, Ear Cuff
7482, Brown, Pressure, Argh, Trendy W 2, Multicolor, 
7483, Lady, See Stuff, Now, Mafia, Nowar, 
7484, Easter Egg, Pressure, Dangerous Smoke 2, Trendy W 2, Cycle, 
7485, No Signal, Not Nice, Gold Bling, , , 
7486, Beige, Puppy Dog, What, Whereiswhale, Fishnet Top, 
7487, Grey, Money, Dangerous Smoke 1, Hidehairs, Vest, Silver 2
7488, Gotsun, Pressure, Whatever, Prison, Preshistoric, Gold 1
7489, Lady, Pirate, Dangerous Smoke 3, Manbun, Fashion Accesory, 
7490, Beige, Monocle, Whatever, , Cuba, 
7491, Dark Brown, Puppy Dog, Hipster Stache, Headset, Ymca, 
7492, Blue, Nothappy, Moo, Devil, Shirt Of Flames, 
7493, Africa Animal, Nothappy Longer, Argh, Prison, Cycle, Ear Cuff
7494, Light Brown, Dontsee, Dangerous Smoke 2, Devil, Costume Old, 
7495, Brown, Money, Whatever, Punk Short, Trash, 
7496, Stars And Stripes, Pressure, Meh, Trick Hat, , Silver 2
7497, Easter Egg, Nothappy Longer, Whatever, Cook, Hipsterneck, 
7498, Lady, Pressure, Yesplease, Rabbit, , 
7499, Woke From Dead, Money, Argh, , Hipster Shirt, 
7500, Brown, Blocksun, What, , Fishnet Top, 
7501, Checkered, Bed, Dangerous Smoke 2, Prison, Rock, 
7502, Beige, See Stuff, Meh, , Hippy, 
7503, Red, Machine, Whatever, Jesus Alive, Nowar, Silver 2
7504, Blue, Notfunny, What, Rabbit, Vegas Dancer, 
7505, Black, Undead, Scowl, Trendy 1, Praetexta, 
7506, Vector, Bed, Whatever, Whereisgiraffe, Wifeshirt 2, 
7507, Holo Rainbow, See Stuff, Meh, Mafia, Hipster Shirt, 
7508, Black, Blocksun, Buck Teeth, , Hoodie Red, 
7509, Bad Machine, Undead, Say Aah, Comrade, Sweet Jacket, 
7510, Beige, Blocksun, Rainbow, Fetish, , 
7511, Grey, Money, Meh, Whereisgiraffe, Gentleman, 
7512, Light Brown, See Stuff, Argh, Cat Ears, Cuba, 
7513, Dark Brown, Nothappy Longer, Funny, Fetish, Onthesea, 
7514, Black, Notfunny, Meh, Whereisgiraffe, Robinson, 
7515, Grey, Pirate, Dangerous Smoke 2, , Fashion Accesory, 
7516, Easter Egg, Puppy Dog, Moo, Whalehunter 1, Nofire, 
7517, Light Brown, Notfunny, Meh, , Honololu, 
7518, Albino, Reality, Buck Teeth, Prison, Fashion Accesory, 
7519, Light Brown, Money, Meh, , Hoodie Red, 
7520, Dark Brown, Devourer, What, Antique, Make Fire, 
7521, Neon Glow, Dead, Whatever, Devil, Onthesea, Gold 2
7522, Brown, Nothappy Longer, Now, Warhat 2, , 
7523, Grey, Future, Meh Dangerous Smoke 2, Whereisgiraffe, Bringcash, 
7524, Red, Devourer, Meh Higschool, , , 
7525, Grey, Notfunny, Dangerous Smoke 2, , Honololu, 
7526, Checkered, Puppy Dog, Moo, , , 
7527, Black, Pressure, Meh, Service, , 
7528, Beige, Dontsee, Buck Teeth, , , 
7529, Albino, Undead, Whatever, War Helmet, Make Fire, 
7530, Gotsun, Devourer, Meh, Hat 3, Nowar, Ear Cuff
7531, Holo Rainbow, Bed, Argh, Fetish, Cuba, 
7532, Bad Machine, Machine, Meh Dangerous Smoke 2, Punk Short, Hipster Shirt, 
7533, Gotsun, Pressure, Meh, Whereiswhale, Vest, 
7534, Light Brown, Bed, Moo, Rule All, Onthesea, 
7535, Lady, Notfunny, Nofeelingwell, , Fashion Accesory, 
7536, Brown, Bed, Argh, Whereiswhale, Cycle, 
7537, Lady, Notfunny, Moo, , Wifeshirt 2, 
7538, Dark Brown, Nothappy, Whatever, Devil, Hipsterneck, 
7539, Candy Cane, See Stuff, Moo, Prison, , 
7540, Dark Brown, Bed, Whatever, , Rock, 
7541, Machine, Nothappy Longer, Funny, , Great T-Shirt, 
7542, Lady, Machine, Moo, Leprechaun, Fishnet Top, 
7543, Grey, Multilevel, Whatever, Visor Hat, Hipsterneck, 
7544, Dark Brown, Dontsee, Argh, Cat Ears, Gentleman, Silver 1
7545, Bad Machine, Money, Dangerous Smoke 2, Hiiya, Alcatraz, 
7546, Grey, Notfunny, Argh, , Cool T-Shirt, 
7547, Albino, Dead, Buck Teeth, , Ay Sailor, Silver 2
7548, Black, Blocksun, Dangerous Smoke 2, , Poncho, 
7549, Brown, Undead, Meh, Whalehunter 1, Multicolor, 
7550, Gotsun, Puppy Dog, Whatever, Comrade, Make Fire, 
7551, Checkered, Blocksun, Funny, Rabbit, Hipster Shirt, 
7552, Beige, Dontsee, Meh Dangerous Smoke 3, Antique, Chemist, Silver 2
7553, Gotsun, Notfunny, Dangerous Smoke 2, Devil, Multicolor, 
7554, Dark Brown, See Stuff, Meh Dangerous Smoke 2, Have Fun 1, Overalls, 
7555, Black, Money, Scowl, , Cool T-Shirt, 
7556, Red, Dontlook, Say Aah, Whereiswhale, Gentleman, 
7557, Color Dots, Round Glasses, Yesplease, Jesus Alive, Chemist, 
7558, Light Brown, Dontlook, Moo, Headset, Ay Sailor, 
7559, Brown, Pressure, Dangerous Smoke 3, Cat Ears, Rock, 
7560, Black, Notfunny, Whatever, Small Child, Nofire, 
7561, Dark Brown, See Stuff, Bling, Hat 3, Not A Suit, 
7562, Grey, Machine, Argh, , , Gold 2
7563, Red, Bed, Whatever, Visor Hat, , 
7564, Light Brown, Money, Dangerous Smoke 2, Trick Hat, , Silver 2
7565, Candy Cane, Love, Meh Dangerous Smoke 2, , , 
7566, Dark Brown, Pew, Moo, Whereiswhale, Piercings, 
7567, Black, Love, Meh, Whalehunter 1, Blank, 
7568, Brown, Not Nice, Yesplease, Warhat 1, , Ear Cuff
7569, Beige, Multilevel, Whatever, Cook, Multicolor, Gold 2
7570, Light Brown, Undead, Argh, Trendy W 1, , 
7571, Machine, See Stuff, Moo, Devil, Overalls, 
7572, Color Dots, Puppy Dog, Argh, Leprechaun, Honololu, 
7573, Dark Brown, Notfunny, Whatever, Trendy 1, Preshistoric, 
7574, Beige, See Stuff, Now, Hat 2, Bringcash, Jesus
7575, Brown, Nothappy, Meh, Have Fun 1, Blank, Gold 1
7576, Africa Animal, Bed, Meh Dangerous Smoke 2, Whereisgiraffe, Sweet 16, 
7577, Woke From Dead, Love, Meh, Trendy 1, , 
7578, Beige, Bed, Whatever, Devil, Gentleman, 
7579, Brown, Notfunny, Argh, Mafia, Piercings, Ear Cuff
7580, Machine, Dontsee, Whatever, Visor Hat, , 
7581, Brown, Multilevel, Meh, Rabbit, Bang Bang, 
7582, Easter Egg, Notfunny, Yesplease, Whereisgiraffe, , Ear Cuff
7583, Beige, Not Nice, Dangerous Smoke 2, , , 
7584, Light Brown, Dontsee, Meh, , Onthesea, Silver 1
7585, Beige, Multilevel, Whatever, Prison, , 
7586, No Signal, Nothappy Longer, Funny, War Helmet, , 
7587, Dark Brown, Blocksun, Buck Teeth, Whalehunter 1, Robinson, 
7588, Lady, Dontlook, What, Winter Hat, Cool T-Shirt, 
7589, Candy Cane, Machine, Whatever, Trendy 1, , Silver 1
7590, Grey, Blocksun, Yesplease, Jesus Alive, Moon, 
7591, Bloodbath, See Stuff, What, Notsmart, , 
7592, Machine, Undead, Whatever, Cat Ears, Gentleman, Jesus
7593, Neon Glow, Pressure, Say Aah, Trendy W 1, Preshistoric, 
7594, Machine, Machine, What, Mafia, Bang Bang, 
7595, Black, Blocksun, Dangerous Smoke 2, , Ok, Silver 1
7596, Beige, Dead, Meh, Hat 3, Preshistoric, 
7597, Acid, Multilevel, Gold Bling, Comrade, , 
7598, Dark Brown, Money, Moo, Trendy 1, Onthesea, 
7599, Black, Undead, Whatever, Whereiswhale, Multicolor, Gold 2
7600, Gotsun, Pressure, Dangerous Smoke 2, Catch Robbers, Fishnet Top, 
7601, Easter Egg, Notfunny, Meh Dangerous Smoke 2, Whereiswhale, Ymca, 
7602, Woke From Dead, Dontlook, Meh, Service, , 
7603, Grey, Devourer, Moo, Winter Hat, , Gold 1
7604, Black, Multilevel, Say Aah, Hidehairs, Bringcash, 
7605, Dark Brown, Dead, Blow Bubble, Hiiya, Hippy, Jesus
7606, Beige, Pressure, Dangerous Smoke 3, , Onthesea, Silver 2
7607, Africa Animal, Not Nice, Meh, , , Gold 1
7608, Black, Dead, What, Punk Short, Bringcash, 
7609, Woke From Dead, Puppy Dog, Dangerous Smoke 1, Headset, Blank, 
7610, Checkered, Round Glasses, Argh, , , Multiple
7611, Neon Glow, Undead, Now, Prison, , Silver 2
7612, Machine, Bed, Dangerous Smoke 2, Whalehunter 1, , 
7613, Light Brown, Nothappy, Argh, , Nofire, 
7614, Bloodbath, Pressure, Dangerous Smoke 3, Punk Short, Vegas Dancer, 
7615, Light Brown, Nothappy Longer, Moo, Hat 2, Piercings, 
7616, Easter Egg, Round Glasses, Dangerous Smoke 3, , Robinson, 
7617, Dark Brown, Love, Meh, Rabbit, , 
7618, Blue, Pressure, Meh Dangerous Smoke 2, Whereisgiraffe, Rock, Silver 1
7619, Bloodbath, Nothappy Longer, Moo, Whereiswhale, , 
7620, Dark Brown, Multilevel, Yesplease, Punk Short, Ay Sailor, 
7621, Easter Egg, Money, Whatever, Whereiswhale, Hoodie Black, 
7622, Lady, Blocksun, Argh, Whereisgiraffe, , 
7623, Dark Brown, Round Glasses, Moo, , Ay Sailor, 
7624, Brown, Multilevel, Say Aah, Whereiswhale, Multicolor, Gold 2
7625, Candy Cane, Dontsee, Whatever, Headset, Not A Suit, 
7626, Dark Brown, Notfunny, Meh, Warhat 1, Overalls, 
7627, Beige, Snake, Food, Winter Hat, Cool T-Shirt, 
7628, Lady, Blocksun, Rainbow, Whereisgiraffe, Overalls, 
7629, Void, Nothappy Longer, Moo, , , 
7630, Neon Glow, Money, No Teeth, , Preshistoric, 
7631, Bloodbath, Love, Meh Blow Bubble, Leprechaun, , 
7632, Color Dots, Reality, Meh, Fetish, , 
7633, Africa Animal, Round Glasses, Rainbow, Headset, Trash, 
7634, Brown, Dontsee, Whatever, Service, Broken, Gold 2
7635, Woke From Dead, Love, Argh, Have Fun 1, Honololu, 
7636, Beige, Nothappy Longer, Whatever, Fetish, Onthesea, 
7637, Blue, Pressure, Meh, , Honololu, Gold 2
7638, Light Brown, Future, No Teeth, Whereisgiraffe, Wifeshirt 2, Silver 2
7639, Albino, Nothappy Longer, Hipster Stache, Winter Hat, Overalls, 
7640, Gotsun, Dontsee, Dangerous Smoke 3, , Bringcash, 
7641, Black, Multilevel, Whatever, Whereiswhale, Hipsterneck, 
7642, Blue, Dontsee, Meh, Trick Hat, Poncho, 
7643, Brown, Money, Yesplease, Cat Ears, Onthesea, Silver 2
7644, Light Brown, Notfunny, Whatever, Trendy W 2, Fashion Accesory, 
7645, Beige, Bed, Yesplease, Mafia, Onthesea, Multiple
7646, Brown, Blocksun, Argh, Comrade, Ay Sailor, 
7647, Void, Dead, Meh, Warhat 2, , 
7648, Gotsun, Dontsee, Whatever, Cook, , 
7649, Red, Pressure, Moo, , , 
7650, Light Brown, Devourer, Knife, Hidehairs, Alcatraz, 
7651, Dark Brown, Money, Meh, Hat 3, Vegas Dancer, 
7652, Brown, Dontsee, Sounds, , Preshistoric, 
7653, Neon Glow, Bed, Whatever, Whalehunter 2, Broken, 
7654, Woke From Dead, Money, Sounds, Devil, Nowar, 
7655, Albino, Pressure, Meh, Comrade, Hoodie Red, Silver 1
7656, Red, Dontsee, Rainbow, Trendy 1, Praetexta, 
7657, Lady, Pressure, No Teeth, Small Child, Vest, 
7658, Black, Dontlook, Moo, , Nofire, 
7659, Red, Undead, What, Hat 1, Wifeshirt 1, 
7660, Albino, See Stuff, Whatever, Whalehunter 1, Bang Bang, Ear Cuff
7661, Africa Animal, Dontsee, Argh, Punk Short, Fashion Accesory, 
7662, Albino, Snake, Meh, Cook, Shirt Of Flames, Silver 2
7663, Black, Money, Argh, Hat 1, Alcatraz, 
7664, Light Brown, Multilevel, Whatever, Warhat 2, , 
7665, Neon Glow, Nothappy, Meh, , , 
7666, Bad Machine, Bed, Dangerous Smoke 2, Notsmart, , 
7667, Brown, Multilevel, Whatever, , , Silver 2
7668, Blue, Pressure, Dangerous Smoke 3, , Honololu, 
7669, Nature, Snake, Dangerous Smoke 2, Prison, , Multiple
7670, Color Dots, Money, What, Hat 3, Blank, 
7671, Black, Pressure, Meh, , , 
7672, Light Brown, Undead, Meh Dangerous Smoke 2, Notsmart, Alcatraz, 
7673, Neon Glow, Reality, Meh, Devil, Bringcash, Silver 2
7674, Beige, Love, Funny, Prison, Chemist, 
7675, Red, Dontsee, Meh Dangerous Smoke 2, , Cycle, 
7676, Beige, Nothappy Longer, Dangerous Smoke 2, War Helmet, Alcatraz, 
7677, Dark Brown, Machine, Blow Bubble, , Bringcash, Silver 2
7678, Light Brown, Reality, Scowl, , , 
7679, Black, Bed, Whatever, , Hipsterneck, 
7680, Light Brown, Multilevel, Meh Dangerous Smoke 3, Whalehunter 2, , Silver 2
7681, Checkered, Bed, What, Whalehunter 1, Alcatraz, 
7682, Beige, Love, Meh Dangerous Smoke 2, , Costume Old, Silver 1
7683, Blue, Notfunny, Funny, Whalehunter 2, Piercings, 
7684, Beige, Round Glasses, Say Aah, Warhat 1, Wifeshirt 1, 
7685, Grey, Machine, Yesplease, Trendy W 1, Honololu, 
7686, Gotsun, Multilevel, Moo, Hiiya, Overalls, Silver 1
7687, Brown, Blocksun, Whatever, Trick Hat, Hippy, Silver 2
7688, Light Brown, Notfunny, Argh, , Piercings, 
7689, Black, Devourer, Yesplease, , Trench, 
7690, Dark Brown, Blocksun, Meh Blow Bubble, , , 
7691, Gotsun, Pressure, Now, Have Fun 1, Multicolor, 
7692, Dark Brown, Love, Dangerous Smoke 3, Trendy 1, Not A Suit, Gold 1
7693, Checkered, Multilevel, Dangerous Smoke 2, Trendy 2, Honololu, Silver 1
7694, Light Brown, Devourer, Whatever, , Robinson, Multiple
7695, Lady, See Stuff, Meh, Whalehunter 1, Make Fire, 
7696, Albino, Multilevel, Meh Higschool, Mafia, , 
7697, Woke From Dead, Nothappy Longer, Argh, Trendy 2, Hipster Shirt, Gold 1
7698, Neon Glow, Bed, Dangerous Smoke 3, Prison, Weapon Belt, Multiple
7699, Dark Brown, Machine, Whatever, Hidehairs, Ymca, 
7700, Red, Dontsee, Yesplease, Comrade, , 
7701, Grey, Dontlook, Argh, Manbun, Trench, 
7702, Dark Brown, Blocksun, Meh Food, Whereiswhale, , 
7703, Woke From Dead, Round Glasses, Say Aah, , Great T-Shirt, 
7704, Brown, Money, Whatever, Jesus Alive, , 
7705, Machine, See Stuff, Say Aah, Whalehunter 2, Fishnet Top, 
7706, Grey, Notfunny, Argh, Cat Ears, Wifeshirt 2, Ear Cuff
7707, Bad Machine, Pressure, Meh, , Onthesea, 
7708, Brown, Pirate, Dangerous Smoke 2, Catch Robbers, Rappers, 
7709, Light Brown, Nothappy, Dangerous Smoke 1, Cat Ears, Hoodie Red, 
7710, Albino, Love, Meh Dangerous Smoke 2, , Bringcash, Silver 2
7711, Machine, Bed, Whatever, Whereiswhale, Iced Tee, Multiple
7712, Brown, Nothappy Longer, Say Aah, Rabbit, Rock, 
7713, Checkered, Future, Yesplease, Comrade, Preshistoric, 
7714, Beige, Love, Food, , Hipster Shirt, 
7715, Dark Brown, Pressure, Meh, Cat Ears, Fishnet Top, 
7716, Brown, See Stuff, Whatever, Hat 2, Sweet 16, 
7717, Blue, Dead, Argh, , Onthesea, 
7718, Gotsun, Pirate, Dangerous Smoke 2, Winter Hat, Multicolor, 
7719, Black, Reality, Whatever, , , Gold 2
7720, Beige, Money, Meh, , Iced Tee, Silver 2
7721, Blue, Devourer, Argh, Winter Hat, Onthesea, 
7722, Black, Notfunny, Now, Whalehunter 1, Not A Suit, Gold 2
7723, Red, Pirate, Rainbow, Whalehunter 2, Alcatraz, 
7724, Woke From Dead, Dontlook, Meh, , Nofire, 
7725, Black, Pressure, Moo, Trendy 1, , Silver 2
7726, Light Brown, Machine, Meh, Fetish, Nowar, Ear Cuff
7727, Beige, Multilevel, Meh Sounds, , Not A Suit, Silver 2
7728, Brown, Bed, Whatever, Trendy 2, Blazer Black, 
7729, Lady, Not Nice, Moo, Devil, Nowar, 
7730, Brown, Nothappy Longer, Funny, Whalehunter 1, , Silver 1
7731, Light Brown, Notfunny, Meh, Punk Short, Honololu, Gold 1
7732, Red, Dead, Argh, Trendy 1, Rappers, 
7733, Brown, Notfunny, Whatever, Hat 1, Nofire, 
7734, Grey, Pressure, What, , Robinson, Silver 1
7735, Bloodbath, Money, Argh, Punk Short, , 
7736, Beige, Machine, Dangerous Smoke 2, Warhat 1, , Silver 2
7737, Red, Nothappy Longer, Whatever, Prison, , 
7738, Light Brown, Money, Yesplease, Trendy 1, Vegas Dancer, 
7739, Nature, Nothappy, Whatever, , Blank, 
7740, Lady, Dontsee, No Teeth, Fetish, Sweet Jacket, 
7741, Grey, Notfunny, Meh, Devil, Bang Bang, 
7742, Beige, Lazer, Whatever, , Poncho, 
7743, Black, Nothappy Longer, Say Aah, Service, Weapon Belt, Silver 1
7744, Blue, Multilevel, Whatever, Trendy 2, Ay Sailor, 
7745, Vector, Round Glasses, Meh, Visor Hat, Bringcash, 
7746, Light Brown, Not Nice, Whatever, Punk Short, Cuba, Gold 1
7747, Brown, Notfunny, Hipster Stache, Whereiswhale, Sweet Jacket, 
7748, Blue, Pressure, Whatever, Jesus Alive, Trash, 
7749, Candy Cane, See Stuff, Rainbow, , Rappers, Silver 1
7750, Beige, Notfunny, Meh, War Helmet, Nofire, 
7751, Vector, Blocksun, Higschool, Service, Make Fire, 
7752, Woke From Dead, Notfunny, Say Aah, Hiiya, Rock, 
7753, Dark Brown, See Stuff, Dangerous Smoke 2, Prison, Gentleman, 
7754, Beige, Bed, Meh Dangerous Smoke 3, Hiiya, Onthesea, 
7755, Brown, Love, Meh Dangerous Smoke 1, Prison, Make Fire, 
7756, Gotsun, Snake, Meh Dangerous Smoke 2, , , 
7757, Easter Egg, Notfunny, Argh, Whereisgiraffe, Ay Sailor, 
7758, Lady, Puppy Dog, Whatever, Service, Hipster Shirt, 
7759, Holo Rainbow, Bed, Meh, Devil, , 
7760, Lady, Money, What, Jesus Alive, Lingerie, 
7761, Brown, Dontsee, Gold Bling, , , Stretched
7762, Gotsun, Monocle, Yesplease, Service, Hipster Shirt, 
7763, Blue, Bed, Whatever, Mafia, Trash, Ear Cuff
7764, Black, See Stuff, Funny, , Hipster Shirt, 
7765, Gotsun, Future, Meh, Side Shave, Vest, 
7766, Beige, Round Glasses, Whatever, Trendy W 2, Cool T-Shirt, 
7767, Light Brown, Puppy Dog, Moo, Trendy 1, Blank, 
7768, Gotsun, Round Glasses, Dangerous Smoke 1, Whereiswhale, Sweet Jacket, 
7769, Black, Multilevel, Blow Bubble, Cook, Hipsterneck, 
7770, Dark Brown, Nothappy, Whatever, , Bringcash, Silver 1
7771, Neon Glow, Notfunny, Meh, Hiiya, , Silver 2
7772, Blue, Devourer, Buck Teeth, , , 
7773, Africa Animal, Money, Rainbow, War Helmet, Hoodie Red, 
7774, Blue, Notfunny, Moo, Trendy W 1, , 
7775, Lady, Undead, Bling, , , Jesus
7776, Brown, Notfunny, Whatever, Manbun, Cuba, 
7777, Beige, Dontsee, Bling, Notsmart, Ay Sailor, Jesus
7778, Light Brown, Not Nice, Meh, Catch Robbers, Sweet Jacket, 
7779, Candy Cane, Pressure, Meh Dangerous Smoke 2, Small Child, , 
7780, Blue, Nothappy Longer, Nofeelingwell, Hidehairs, , 
7781, Africa Animal, Blocksun, Whatever, , Preshistoric, 
7782, Dark Brown, See Stuff, Moo, Hiiya, Hipsterneck, 
7783, Brown, Money, What, Whereisgiraffe, , 
7784, Bad Machine, Nothappy, Hipster Stache, Hat 2, Wifeshirt 2, 
7785, Neon Glow, Multilevel, Meh, Hiiya, Cycle, Silver 2
7786, Dark Brown, Undead, Moo, , Great T-Shirt, 
7787, Checkered, See Stuff, Whatever, , Chemist, 
7788, Dark Brown, Reality, Nofeelingwell, , Onthesea, Multiple
7789, No Signal, Notfunny, Meh, , Vest, 
7790, Grey, Pressure, Whatever, Mafia, , Silver 2
7791, Brown, Dontsee, Meh, Hiiya, Rock, Gold 2
7792, Lady, Money, Dangerous Smoke 2, Punk Short, , Silver 1
7793, Dark Brown, Dontsee, Blow Bubble, Notsmart, Broken, 
7794, Light Brown, Notfunny, Meh, Mafia, Preshistoric, 
7795, Grey, Love, Say Aah, Hiiya, , 
7796, Gotsun, Dead, Yesplease, Warhat 1, Cuba, 
7797, Lady, Monocle, Scowl, Cat Ears, Ymca, 
7798, Nature, Pirate, Say Aah, Hidehairs, Cool T-Shirt, Multiple
7799, Light Brown, Nothappy Longer, Moo, Hat 1, Make Fire, Gold 1
7800, Gotsun, Notfunny, Scowl, , Wifeshirt 1, 
7801, Dark Brown, Multilevel, Say Aah, Trendy 1, Onthesea, 
7802, Grey, Undead, Moo, , , Ear Cuff
7803, Brown, See Stuff, Yesplease, , , 
7804, Dark Brown, Nothappy Longer, Blow Bubble, Notsmart, Nofire, 
7805, Blue, Notfunny, Meh, , Hoodie Red, 
7806, Gotsun, Round Glasses, Say Aah, Whalehunter 2, Robinson, 
7807, Dark Brown, Monocle, What, Comrade, Make Fire, 
7808, Beige, Dontsee, Nofeelingwell, Whalehunter 1, Nowar, 
7809, Dark Brown, See Stuff, Whatever, , Hipster Shirt, 
7810, Black, Dontsee, Dangerous Smoke 2, Whalehunter 1, Great T-Shirt, Silver 1
7811, Africa Animal, Round Glasses, Argh, , Not A Suit, 
7812, Easter Egg, Not Nice, Moo, , Trash, Stretched
7813, Light Brown, Notfunny, Now, Mafia, Ay Sailor, 
7814, Nature, Devourer, Blow Bubble, Jesus Alive, Nowar, Silver 2
7815, Dark Brown, Notfunny, Yesplease, Whalehunter 1, , 
7816, Lady, Bed, Argh, Hiiya, Cycle, 
7817, Light Brown, Puppy Dog, Dangerous Smoke 2, Prison, , 
7818, Gotsun, Blocksun, Whatever, , Fishnet Top, 
7819, Dark Brown, Notfunny, Say Aah, , Overalls, 
7820, Brown, Blocksun, Whatever, Devil, Not A Suit, 
7821, Dark Brown, Dontsee, Meh Sounds, Punk Short, Blank, 
7822, Holo Rainbow, Bed, Moo, Service, Weapon Belt, 
7823, Light Brown, Blocksun, Meh Dangerous Smoke 3, Trendy 1, , Silver 1
7824, Woke From Dead, See Stuff, Whatever, , Vest, 
7825, No Signal, Blocksun, Yesplease, Prison, , Silver 1
7826, Beige, Notfunny, Moo, Visor Hat, Onthesea, 
7827, Bloodbath, Nothappy Longer, Yesplease, , , 
7828, Africa Animal, Blocksun, Meh, Hat 3, Nowar, 
7829, Void, Dontlook, Higschool, , , 
7830, Red, Reality, Meh Dangerous Smoke 3, Leprechaun, Onthesea, 
7831, Dark Brown, Bed, Funny, , Trash, 
7832, Stars And Stripes, Pirate, Meh, Headset, , 
7833, Brown, Notfunny, Moo, , Multicolor, 
7834, Black, Devourer, Whatever, , Rappers, 
7835, Light Brown, Not Nice, Nofeelingwell, Jesus Alive, Bang Bang, Silver 2
7836, Brown, Money, Say Aah, Comrade, Ay Sailor, 
7837, Dark Brown, Nothappy, What, Hat 2, Hirewomen, Gold 2
7838, Bad Machine, Reality, Meh, Small Child, Not A Suit, 
7839, Blue, Undead, Whatever, , Make Fire, 
7840, Holo Rainbow, Money, Meh, , Rappers, 
7841, Gotsun, Notfunny, Whatever, Prison, , 
7842, Candy Cane, Money, Say Aah, , , 
7843, Light Brown, Pew, Whatever, , Broken, Silver 2
7844, Candy Cane, Blocksun, Meh Dangerous Smoke 2, War Helmet, , 
7845, Black, Love, Moo, Cook, Honololu, 
7846, Africa Animal, Puppy Dog, Whatever, Hat 2, Sweet Jacket, 
7847, Black, Bed, Funny, Catch Robbers, Hipsterneck, 
7848, Albino, Multilevel, Moo, Prison, Robinson, 
7849, Dark Brown, Dead, Rainbow, , Fishnet Top, 
7850, Vector, Not Nice, Meh, , Multicolor, 
7851, Neon Glow, Dontsee, Moo, Trick Hat, Honololu, 
7852, Black, Nothappy, Meh, Punk Short, Sweet 16, 
7853, Machine, Dontsee, Blow Bubble, , , 
7854, Bloodbath, Multilevel, Moo, Have Fun 2, , 
7855, Lady, Nothappy, Whatever, Prison, Ay Sailor, 
7856, Black, Bed, Meh, Trendy W 2, Bringcash, 
7857, Vector, Pressure, Whatever, , Great T-Shirt, 
7858, Gotsun, Dead, Moo, , Shirt Of Flames, Jesus
7859, Black, Notfunny, Blow Bubble, Hiiya, Hipsterneck, Silver 2
7860, Africa Animal, Bed, No Teeth, Whalehunter 1, Ymca, 
7861, Light Brown, Snake, Dangerous Smoke 1, Devil, Fashion Accesory, 
7862, Lady, See Stuff, Meh, , Wifeshirt 1, Stretched
7863, Light Brown, Nothappy Longer, No Teeth, Whalehunter 1, Blank, Silver 1
7864, Dark Brown, Dontlook, What, Notsmart, Weapon Belt, Jesus
7865, Africa Animal, Machine, Whatever, Whereiswhale, Rappers, 
7866, Nature, Round Glasses, Moo, Prison, Blazer Black, 
7867, Machine, Nothappy, Whatever, Trendy W 2, Broken, 
7868, Grey, Monocle, Meh, Hat 1, Honololu, Silver 2
7869, Machine, Money, What, Devil, Nowar, 
7870, Vector, Dontlook, Yesplease, Whereiswhale, Wifeshirt 1, 
7871, Beige, Notfunny, What, Cat Ears, Broken, Silver 2
7872, Albino, Undead, Buck Teeth, Headset, Make Fire, 
7873, Dark Brown, Blocksun, Argh, , Hipster Shirt, Gold 2
7874, Gotsun, Monocle, Whatever, Fetish, Cycle, 
7875, Black, Notfunny, Meh Dangerous Smoke 2, , Honololu, 
7876, Blue, Love, Whatever, , Cycle, Multiple
7877, Light Brown, Bed, Higschool, Warhat 2, , 
7878, Brown, Dontsee, Meh Dangerous Smoke 2, Rule All, Knight Armor, 
7879, Dark Brown, Round Glasses, Meh, Trendy 2, Wifeshirt 2, 
7880, Brown, Money, Argh, Trendy 1, Ok, 
7881, Checkered, Monocle, Dangerous Smoke 2, Fetish, , 
7882, Beige, Notfunny, Say Aah, Prison, Nowar, 
7883, Dark Brown, Bed, Gold Bling, Manbun, , Gold 2
7884, Black, Lazer, Funny, , Hipsterneck, 
7885, Easter Egg, See Stuff, Dangerous Smoke 2, , Blank, Silver 2
7886, Woke From Dead, Nothappy Longer, Scowl, Rabbit, Trash, 
7887, Black, Puppy Dog, Funny, Trick Hat, Ay Sailor, Multiple
7888, Brown, Money, Dangerous Smoke 2, Whalehunter 1, Broken, 
7889, Beige, Pressure, What, , Cool T-Shirt, 
7890, Bad Machine, Notfunny, Argh, , Broken, 
7891, Light Brown, Round Glasses, Now, , Sweet Jacket, 
7892, Beige, See Stuff, Moo, Whalehunter 1, Hipster Shirt, 
7893, Light Brown, Notfunny, Higschool, Hippy Hat, Vest, 
7894, Albino, Machine, Meh, , Hipster Shirt, 
7895, Black, See Stuff, Dangerous Smoke 2, Rabbit, Wifeshirt 1, 
7896, Lady, Dontsee, Argh, Prison, Hipsterneck, Silver 2
7897, Grey, Notfunny, Gold Bling, Hiiya, Moon, 
7898, Black, Machine, Meh, Mafia, Praetexta, 
7899, Dark Brown, Dead, Whatever, Whereiswhale, Nofire, 
7900, Black, Dontlook, Meh, Comrade, Cool T-Shirt, 
7901, Gotsun, Money, Argh, Jesus Alive, Not A Suit, Jesus
7902, Blue, Pressure, Say Aah, Warhat 1, Wifeshirt 2, 
7903, Dark Brown, Dontsee, Argh, Punk Short, , 
7904, Light Brown, See Stuff, Dangerous Smoke 3, Hat 2, Piercings, 
7905, Black, Devourer, Meh, Catch Robbers, Hipster Shirt, 
7906, Dark Brown, Notfunny, Whatever, Punk Short, Cycle, 
7907, Albino, Machine, Meh, Devil, Blank, 
7908, Dark Brown, Monocle, Meh Dangerous Smoke 2, Fetish, Hippy, 
7909, Black, Machine, Buck Teeth, Whereiswhale, Overalls, Silver 1
7910, Gotsun, Future, Say Aah, Mafia, Ay Sailor, 
7911, Black, Multilevel, Whatever, Catch Robbers, Broken, 
7912, Brown, Notfunny, Meh, Punk Short, Trash, 
7913, Lady, Dontsee, Whatever, Whalehunter 2, Knight Armor, 
7914, Light Brown, Notfunny, Rainbow, Jesus Alive, Vest, 
7915, Black, Nothappy Longer, Meh, Have Fun 1, , 
7916, Grey, Notfunny, Say Aah, Headset, Not A Suit, 
7917, Nature, Multilevel, Meh, Cook, Ay Sailor, Ear Cuff
7918, Black, Devourer, Whatever, , Ymca, 
7919, Brown, Multilevel, Meh Dangerous Smoke 2, Side Shave, Cuba, Silver 2
7920, Africa Animal, Money, Dangerous Smoke 2, Trick Hat, Rappers, 
7921, Dark Brown, Notfunny, Moo, Catch Robbers, Praetexta, 
7922, Albino, Bed, What, Comrade, , 
7923, Beige, Snake, Bling, , Hippy, 
7924, Black, Monocle, Moo, Prison, Fishnet Top, 
7925, Red, Dead, Funny, , Overalls, Silver 2
7926, Gotsun, Not Nice, Whatever, , , Silver 1
7927, Dark Brown, Round Glasses, Dangerous Smoke 2, Leprechaun, Hipsterneck, 
7928, Blue, Devourer, Whatever, Cook, Wifeshirt 1, 
7929, Machine, Notfunny, Meh, , , Gold 1
7930, Black, Reality, Whatever, Service, Bringcash, Silver 1
7931, Dark Brown, Puppy Dog, Say Aah, Visor Hat, Alcatraz, 
7932, Gotsun, Love, Yesplease, Trendy W 2, Hipster Shirt, 
7933, Beige, Notfunny, Moo, Manbun, , 
7934, Dark Brown, Not Nice, Whatever, , Broken, Gold 1
7935, Color Dots, Notfunny, Meh, Jesus Alive, , 
7936, Gotsun, Undead, No Teeth, Hiiya, Preshistoric, 
7937, Light Brown, Pirate, Blow Bubble, Visor Hat, Sweet Jacket, 
7938, Lady, Round Glasses, Moo, Whalehunter 2, Trash, 
7939, Acid, Pirate, Whatever, Leprechaun, , 
7940, Beige, Dontsee, Moo, Whereiswhale, Overalls, 
7941, Nature, Bed, Say Aah, , Cuba, 
7942, Beige, Nothappy, No Teeth, Warhat 1, Wifeshirt 2, 
7943, Red, See Stuff, Argh, Whereiswhale, Hipsterneck, 
7944, Beige, Puppy Dog, Moo, Hat 3, , Silver 1
7945, Lady, See Stuff, Funny, , Sweet Jacket, 
7946, Blue, Machine, Whatever, War Helmet, , Gold 1
7947, Brown, Dontsee, Funny, Visor Hat, Vest, 
7948, Dark Brown, Pirate, Dangerous Smoke 2, Catch Robbers, Sweet Jacket, 
7949, Color Dots, Puppy Dog, Dangerous Smoke 3, Comrade, Sweet 16, 
