id, body, eyes, mouth, hat, clothes, earring
7000, Grey, Round Glasses, Meh Dangerous Smoke 2, Good Idea, Rappers, 
7001, Gotsun, Pirate, Buck Teeth, Leprechaun, Weapon Belt, 
7002, Light Brown, Notfunny, Whatever, Winter Hat, , Gold 2
7003, Brown, Nothappy Longer, Moo, Cook, Ay Sailor, 
7004, Dark Brown, Notfunny, Scowl, Manbun, Broken, 
7005, Blue, Nothappy, Moo, Trick Hat, Fashion Accesory, 
7006, Candy Cane, Pressure, Meh, Whereiswhale, , 
7007, Albino, Dontsee, Argh, Fetish, Wifeshirt 1, 
7008, Checkered, Blocksun, Sounds, Leprechaun, Sweet Jacket, Ear Cuff
7009, Black, Pressure, Say Aah, , Onthesea, Silver 2
7010, Checkered, Bed, Meh Sounds, , Cuba, 
7011, Light Brown, Dontsee, Whatever, Cook, Multicolor, 
7012, Beige, Blocksun, Dangerous Smoke 2, Whereisgiraffe, Cycle, 
7013, Grey, Dead, Argh, Punk Short, Vest, 
7014, Beige, Notfunny, Say Aah, Winter Hat, , 
7015, Dark Brown, Dontsee, Whatever, Punk Short, , Multiple
7016, Au, Nothappy, Yesplease, Devil, , 
7017, Brown, Dontsee, What, Notsmart, Ymca, Gold 1
7018, Holo Rainbow, Money, Whatever, , , 
7019, Africa Animal, Notfunny, Meh, Leprechaun, Gentleman, Gold 1
7020, Grey, See Stuff, Now, Trendy 2, Multicolor, Silver 1
7021, Blue, Money, Whatever, Jesus Alive, , 
7022, Red, Devourer, Yesplease, Trick Hat, Poncho, Gold 1
7023, Machine, See Stuff, Say Aah, Headset, Honololu, 
7024, Black, Devourer, Argh, Rabbit, Fashion Accesory, 
7025, Bad Machine, Money, Say Aah, Whalehunter 2, Weapon Belt, 
7026, Beige, See Stuff, Scowl, Comrade, , 
7027, Black, Notfunny, Meh, Leprechaun, Great T-Shirt, Silver 2
7028, Dark Brown, Pirate, Meh Dangerous Smoke 2, Prison, Honololu, 
7029, Light Brown, Notfunny, Rainbow, Headset, Preshistoric, 
7030, Black, Bed, Dangerous Smoke 2, Prison, Iced Tee, 
7031, Beige, Pressure, What, Hat 2, Trash, 
7032, Dark Brown, Bed, Now, , Multicolor, 
7033, Light Brown, Nothappy, Argh, Trendy 1, Fashion Accesory, 
7034, Holo Rainbow, Bed, What, , Honololu, Silver 1
7035, Beige, Round Glasses, Now, Comrade, Rock, Silver 2
7036, Checkered, Blocksun, Meh Blow Bubble, Punk Short, Lingerie, 
7037, Gotsun, Notfunny, Rainbow, , Sweet Jacket, Silver 1
7038, Blue, Puppy Dog, Moo, , Chemist, Silver 2
7039, Dark Brown, Dontlook, Meh Higschool, Prison, Honololu, 
7040, Grey, Bed, Whatever, Trendy W 2, Not A Suit, 
7041, Blue, Notfunny, Meh, Trendy 2, Trash, 
7042, Gotsun, Pressure, Dangerous Smoke 2, Hiiya, Not A Suit, 
7043, Brown, Notfunny, Meh, Winter Hat, , 
7044, Neon Glow, Blocksun, Dangerous Smoke 2, Visor Hat, Not A Suit, 
7045, Gotsun, Notfunny, Whatever, Service, Wifeshirt 2, 
7046, Easter Egg, Love, What, , Not A Suit, Silver 1
7047, Light Brown, Pirate, Meh, , Iced Tee, 
7048, Albino, Notfunny, Scowl, Whereiswhale, , 
7049, Lady, Multilevel, Say Aah, Trick Hat, Cycle, 
7050, Au, Love, Argh, , , Gold 1
7051, Albino, Undead, Meh, Hat 2, Hipster Shirt, 
7052, Black, Pirate, Say Aah, , Praetexta, 
7053, Light Brown, Puppy Dog, Blow Bubble, Fetish, Cool T-Shirt, 
7054, Beige, Lazer, Sounds, , Rock, 
7055, Checkered, Blocksun, Dangerous Smoke 3, , Wifeshirt 1, 
7056, Lady, Not Nice, Meh Dangerous Smoke 3, Side Shave, Honololu, Jesus
7057, Nature, Pressure, Hipster Stache, , Cycle, Stretched
7058, Grey, See Stuff, Dangerous Smoke 2, Jesus Alive, Hoodie Red, 
7059, Checkered, Notfunny, Moo, Whalehunter 2, Ymca, Silver 2
7060, Black, Money, Argh, Hiiya, Chemist, 
7061, Woke From Dead, Puppy Dog, Whatever, , Honololu, 
7062, Black, Reality, Moo, Fetish, Nowar, 
7063, Light Brown, Notfunny, Meh, Whereiswhale, , Jesus
7064, Dark Brown, Undead, Argh, Hiiya, Sweet Jacket, 
7065, Brown, Notfunny, Whatever, Warhat 2, Ay Sailor, 
7066, Gotsun, Nothappy Longer, Meh, Prison, Trash, 
7067, Holo Rainbow, Love, Whatever, , , 
7068, Grey, Future, What, , Rappers, 
7069, Brown, Pressure, Meh, Prison, Blank, 
7070, Lady, Dontsee, Moo, , Vest, 
7071, Red, Notfunny, Whatever, Service, , 
7072, Grey, Love, Yesplease, Cat Ears, Knight Armor, 
7073, Checkered, Notfunny, Meh Dangerous Smoke 2, Punk Short, , 
7074, Dark Brown, Nothappy, Whatever, , Make Fire, 
7075, Bad Machine, Dontsee, Meh Dangerous Smoke 2, Leprechaun, Ok, 
7076, Black, See Stuff, Dangerous Smoke 2, , Preshistoric, 
7077, Neon Glow, Notfunny, Buck Teeth, Hat 2, Sweet 16, 
7078, Vector, Round Glasses, Meh, Service, , 
7079, Bloodbath, Dead, Scowl, Trendy 1, , 
7080, Grey, Blocksun, Meh, Punk Short, Praetexta, Silver 2
7081, Light Brown, Notfunny, Whatever, Warhat 1, Rappers, 
7082, Dark Brown, Dontsee, Argh, Whalehunter 2, Ok, 
7083, Black, Dontlook, Whatever, Trendy 1, Hipsterneck, Silver 2
7084, Bad Machine, Bed, Say Aah, Hat 3, Weapon Belt, 
7085, Beige, Notfunny, Meh, Hat 1, Bringcash, 
7086, Blue, See Stuff, What, Catch Robbers, Fashion Accesory, 
7087, Brown, Dontlook, Meh, Hippy Hat, Ay Sailor, 
7088, Nature, Love, Whatever, Mafia, Nofire, 
7089, Brown, Nothappy Longer, Funny, Whalehunter 1, Iced Tee, 
7090, Beige, Love, Moo, , Piercings, 
7091, Gotsun, Money, Meh, , Wifeshirt 2, 
7092, Neon Glow, Bed, Meh Dangerous Smoke 2, Hiiya, Blank, 
7093, Black, Notfunny, Meh, Leprechaun, Moon, Jesus
7094, Red, Pirate, Say Aah, Prison, Hipsterneck, 
7095, Brown, Blocksun, Meh, Devil, Rappers, 
7096, Dark Brown, Money, Rainbow, Whalehunter 1, Piercings, 
7097, Lady, Dontsee, Moo, Manbun, Vest, 
7098, Brown, Pressure, Dangerous Smoke 3, , , Gold 1
7099, Color Dots, Round Glasses, Whatever, Visor Hat, Praetexta, 
7100, Beige, Puppy Dog, No Teeth, , Piercings, 
7101, Dark Brown, Nothappy, Moo, Have Fun 2, Hirewomen, 
7102, Blue, Bed, Whatever, Warhat 1, Trench, 
7103, Brown, Money, Meh, Hiiya, Nofire, 
7104, Checkered, Dontlook, Dangerous Smoke 3, Visor Hat, Broken, 
7105, Bad Machine, Pew, Scowl, , , 
7106, Black, Nothappy, Whatever, Warhat 2, Cycle, 
7107, Dark Brown, Dead, Nofeelingwell, Warhat 1, Multicolor, 
7108, Brown, Love, What, Jesus Alive, Onthesea, 
7109, Dark Brown, Blocksun, Dangerous Smoke 3, Cat Ears, Nowar, 
7110, Grey, Devourer, Nofeelingwell, Trendy 1, Poncho, 
7111, Black, Bed, Whatever, Notsmart, , 
7112, Brown, Pressure, What, , Vegas Dancer, Silver 2
7113, Stars And Stripes, Machine, Now, Prison, , 
7114, Light Brown, Bed, Whatever, , Honololu, Ear Cuff
7115, Grey, See Stuff, Meh, Small Child, Nofire, Silver 1
7116, Dark Brown, Dontsee, Meh Blow Bubble, Trendy 2, Ay Sailor, 
7117, Blue, Multilevel, Sounds, Winter Hat, Nowar, 
7118, Neon Glow, Round Glasses, Moo, , Great T-Shirt, 
7119, Albino, Puppy Dog, Meh Dangerous Smoke 2, Prison, Honololu, 
7120, Black, Notfunny, What, Service, Wifeshirt 2, 
7121, Dark Brown, Bed, Whatever, Whalehunter 1, Robinson, 
7122, Brown, Love, Meh, , Wifeshirt 1, Silver 2
7123, No Signal, Bed, Whatever, Hippy Hat, , 
7124, Gotsun, Nothappy Longer, Meh, , , 
7125, Woke From Dead, See Stuff, Argh, , Overalls, 
7126, Red, Nothappy Longer, Meh Knife, Whalehunter 1, Onthesea, 
7127, Candy Cane, Reality, Dangerous Smoke 2, Small Child, Hipsterneck, 
7128, Black, Notfunny, Whatever, Hat 3, Cycle, Silver 1
7129, Blue, Not Nice, What, Winter Hat, Fashion Accesory, 
7130, Dark Brown, Notfunny, Meh, Punk Short, Weapon Belt, Jesus
7131, Brown, Nothappy Longer, Argh, Fetish, Praetexta, 
7132, Lady, Devourer, Say Aah, Whalehunter 2, Trash, Silver 1
7133, Black, See Stuff, Dangerous Smoke 2, , , Multiple
7134, Neon Glow, Nothappy, Whatever, , Chemist, 
7135, Color Dots, Dontlook, Dangerous Smoke 2, Whereiswhale, Hipster Shirt, 
7136, Beige, Dead, Now, Whalehunter 1, Broken, 
7137, Dark Brown, Pirate, Dangerous Smoke 2, Punk Short, Sweet 16, 
7138, Beige, Pressure, Bling, , , 
7139, Dark Brown, Puppy Dog, Nofeelingwell, Trendy 1, , 
7140, Stars And Stripes, Notfunny, Whatever, Whalehunter 2, Moon, 
7141, Grey, See Stuff, Dangerous Smoke 1, Warhat 1, Sweet 16, 
7142, Candy Cane, Bed, Meh, Devil, , Gold 1
7143, Neon Glow, Pressure, What, , Fishnet Top, 
7144, Red, Dontsee, Meh, Fetish, Nofire, 
7145, Beige, Bed, Moo, Small Child, Sweet 16, 
7146, Lady, Undead, Argh, Catch Robbers, Rock, 
7147, Brown, Notfunny, Meh, Leprechaun, Nofire, 
7148, Red, Nothappy, Whatever, Whereiswhale, Great T-Shirt, Multiple
7149, Beige, Dontsee, Dangerous Smoke 2, Punk Short, Hipsterneck, 
7150, Candy Cane, Machine, Whatever, Service, , 
7151, Lady, Pirate, Rainbow, Hat 3, Vest, 
7152, Brown, Multilevel, Whatever, Prison, Honololu, 
7153, Blue, Dontsee, Meh, Have Fun 2, Cool T-Shirt, 
7154, Light Brown, See Stuff, Whatever, Warhat 1, Honololu, 
7155, Lady, Notfunny, Yesplease, Trendy 1, Nofire, 
7156, Machine, Snake, Whatever, Whalehunter 2, Blazer Black, 
7157, Light Brown, Notfunny, Meh Dangerous Smoke 2, Trendy W 2, Hipster Shirt, 
7158, Lady, Nothappy, Whatever, Trendy 1, Preshistoric, 
7159, Gotsun, Blocksun, Meh, , , Gold 2
7160, No Signal, Notfunny, Nofeelingwell, , Trash, Silver 1
7161, Black, Bed, What, Trendy 1, Gentleman, 
7162, Brown, Not Nice, Blow Bubble, Hat 1, Praetexta, 
7163, Lady, Nothappy Longer, Scowl, Hiiya, Cycle, Multiple
7164, Brown, Money, Meh Dangerous Smoke 2, Punk Short, Robinson, 
7165, Gotsun, Dontlook, Yesplease, Side Shave, Ok, 
7166, Black, Snake, Moo, , , 
7167, Dark Brown, Bed, Meh, Prison, Cuba, 
7168, Bad Machine, Devourer, Scowl, Hiiya, Iced Tee, 
7169, Lady, Nothappy Longer, Yesplease, , Moon, 
7170, Neon Glow, Machine, Blow Bubble, Trick Hat, , 
7171, Brown, Nothappy, Meh, Prison, Multicolor, 
7172, Black, Notfunny, Argh, Whalehunter 2, Wifeshirt 1, 
7173, Holo Rainbow, Money, Meh, , , 
7174, Black, Puppy Dog, What, Punk Short, Weapon Belt, Silver 2
7175, Dark Brown, Dontsee, Dangerous Smoke 2, Cook, Hipsterneck, 
7176, Beige, Nothappy Longer, Meh, Side Shave, Multicolor, 
7177, Gotsun, Pressure, Argh, , Ay Sailor, 
7178, Albino, Bed, Moo, , Honololu, 
7179, Black, Notfunny, What, Whalehunter 1, Fashion Accesory, 
7180, Dark Brown, Blocksun, Whatever, Hat 3, Trash, 
7181, Brown, Notfunny, What, Prison, , 
7182, Nature, Monocle, Meh, Whereisgiraffe, Ay Sailor, Silver 2
7183, Black, Nothappy, What, Hidehairs, Nowar, Ear Cuff
7184, Lady, Round Glasses, Dangerous Smoke 3, Trendy W 2, Ok, 
7185, Nature, Notfunny, Whatever, Cook, , 
7186, Holo Rainbow, Pressure, What, Cat Ears, Knight Armor, 
7187, Dark Brown, Nothappy, Say Aah, Have Fun 1, Fashion Accesory, 
7188, Gotsun, Pressure, Argh, , Nofire, 
7189, Grey, Blocksun, Meh, , Moon, 
7190, Brown, Pirate, Whatever, Hiiya, Weapon Belt, 
7191, Woke From Dead, Pressure, Argh, Hat 3, Nofire, 
7192, Africa Animal, See Stuff, Meh Dangerous Smoke 2, Warhat 2, , 
7193, Black, Undead, Whatever, , Multicolor, 
7194, Lady, Round Glasses, Moo, Trendy 1, Ay Sailor, 
7195, Neon Glow, Money, Yesplease, Rabbit, Piercings, 
7196, Stars And Stripes, Lazer, Argh, , Chemist, Silver 2
7197, Brown, Pirate, Whatever, , Cuba, 
7198, Stars And Stripes, Reality, Blow Bubble, Comrade, , 
7199, Africa Animal, Multilevel, Whatever, Jesus Alive, , 
7200, Dark Brown, Nothappy Longer, What, , Onthesea, 
7201, Black, Dontlook, Scowl, Comrade, Sweet Jacket, 
7202, Africa Animal, Dontsee, Whatever, , Wifeshirt 2, 
7203, Checkered, Devourer, Meh, , Bang Bang, Gold 1
7204, Dark Brown, Dontsee, Meh Dangerous Smoke 1, Notsmart, Lingerie, 
7205, Neon Glow, Notfunny, Whatever, Catch Robbers, Gentleman, 
7206, Nature, Reality, Say Aah, Hiiya, Nowar, 
7207, Blue, Nothappy Longer, Bling, Punk Short, Make Fire, 
7208, Lady, Multilevel, Meh Dangerous Smoke 2, Service, Poncho, 
7209, Light Brown, Blocksun, Whatever, , Multicolor, 
7210, Red, Multilevel, Moo, Warhat 1, Fashion Accesory, 
7211, Vector, Notfunny, Funny, Hiiya, Rappers, 
7212, Easter Egg, Pressure, Scowl, Cook, , Jesus
7213, Grey, Pirate, Dangerous Smoke 2, Mafia, Rappers, 
7214, Blue, Machine, What, Hippy Hat, Ay Sailor, 
7215, Grey, Bed, Dangerous Smoke 1, Trendy 1, Cycle, 
7216, Black, Money, What, Mafia, , Silver 2
7217, Dark Brown, Bed, Meh, , Not A Suit, 
7218, Blue, Money, Argh, Notsmart, Wifeshirt 2, 
7219, Light Brown, Dead, Say Aah, Whalehunter 2, Wifeshirt 1, 
7220, Brown, See Stuff, Whatever, Mafia, Honololu, 
7221, Red, Notfunny, Moo, , Onthesea, Gold 2
7222, Albino, Nothappy Longer, What, Hat 2, Hippy, Gold 1
7223, No Signal, Undead, Dangerous Smoke 3, Warhat 1, , 
7224, Woke From Dead, Multilevel, Whatever, Small Child, Nowar, 
7225, Black, Bed, What, Fetish, Ay Sailor, Silver 1
7226, Woke From Dead, Love, Meh, , , Gold 1
7227, Grey, Notfunny, Argh, Side Shave, Nowar, 
7228, Africa Animal, Monocle, Meh Higschool, Whalehunter 1, Rock, 
7229, Beige, Love, Moo, Devil, Moon, Ear Cuff
7230, Dark Brown, Round Glasses, Whatever, Whereisgiraffe, Lingerie, 
7231, Grey, Pressure, Dangerous Smoke 2, , Trench, Multiple
7232, Dark Brown, Round Glasses, Whatever, Trendy W 2, Broken, 
7233, Brown, Undead, Scowl, Comrade, Weapon Belt, Silver 1
7234, Lady, Puppy Dog, Meh, Prison, Sweet 16, 
7235, Brown, Notfunny, Sounds, Mafia, Poncho, Silver 1
7236, Grey, Love, Dangerous Smoke 2, Warhat 1, Hippy, 
7237, Beige, Pressure, Whatever, Whalehunter 1, Overalls, Silver 1
7238, Dark Brown, Puppy Dog, Moo, Have Fun 1, Vest, 
7239, Woke From Dead, Snake, Say Aah, , Blank, 
7240, Black, Dontsee, What, , Fashion Accesory, 
7241, Bloodbath, Pressure, Hipster Stache, Notsmart, , 
7242, Dark Brown, Devourer, Say Aah, Hidehairs, Ay Sailor, 
7243, Light Brown, Nothappy Longer, Meh Dangerous Smoke 2, Prison, , 
7244, Holo Rainbow, Notfunny, Moo, Whalehunter 1, Praetexta, 
7245, Black, Blocksun, Whatever, Prison, , 
7246, Africa Animal, Pressure, Meh, Hidehairs, Not A Suit, 
7247, Black, Round Glasses, Bling, Catch Robbers, , 
7248, Beige, Nothappy, Moo, Warhat 1, Piercings, Gold 1
7249, Brown, Undead, Now, Whalehunter 2, Onthesea, 
7250, Black, Bed, Dangerous Smoke 2, , Ymca, 
7251, Candy Cane, Nothappy Longer, Meh, , , 
7252, Acid, Pressure, Dangerous Smoke 2, Rule All, , 
7253, Machine, Dontlook, Bling, Hat 3, Gentleman, 
7254, Nature, Monocle, Meh, , Preshistoric, Silver 2
7255, Grey, Notfunny, Meh Dangerous Smoke 1, Have Fun 1, , 
7256, Albino, Multilevel, Meh, Service, Praetexta, Ear Cuff
7257, Blue, Nothappy, Hipster Stache, War Helmet, , Silver 1
7258, Dark Brown, See Stuff, Nofeelingwell, Prison, Rappers, 
7259, Checkered, Notfunny, Whatever, Catch Robbers, Blank, 
7260, Dark Brown, Monocle, Moo, Rabbit, Vest, 
7261, Easter Egg, Money, Whatever, , Fashion Accesory, 
7262, Beige, Puppy Dog, Meh, , Nowar, 
7263, No Signal, See Stuff, Dangerous Smoke 2, , , 
7264, Gotsun, Puppy Dog, Hipster Stache, Have Fun 1, Bang Bang, Silver 1
7265, Albino, Undead, Whatever, Warhat 1, Cuba, 
7266, Black, Pirate, Meh, Service, Trash, Silver 1
7267, Machine, Nothappy Longer, Meh Dangerous Smoke 2, Leprechaun, Make Fire, 
7268, Light Brown, Love, Bling, Comrade, Sweet Jacket, 
7269, Dark Brown, Reality, Dangerous Smoke 1, Fetish, Preshistoric, 
7270, Machine, Nothappy Longer, Funny, War Helmet, Chemist, 
7271, Stars And Stripes, Bed, Scowl, Warhat 1, , 
7272, Holo Rainbow, Blocksun, Say Aah, War Helmet, Multicolor, 
7273, Brown, Round Glasses, Dangerous Smoke 2, Jesus Alive, , 
7274, Holo Rainbow, Not Nice, Now, Punk Short, Alcatraz, Gold 2
7275, Gotsun, Round Glasses, Gold Bling, Hat 3, , 
7276, Light Brown, Not Nice, Whatever, Whalehunter 2, , 
7277, Black, Dontsee, Dangerous Smoke 2, , Cycle, 
7278, Dark Brown, Notfunny, Whatever, , Piercings, Ear Cuff
7279, Brown, Dontsee, Moo, Hidehairs, Nofire, 
7280, Neon Glow, Snake, Knife, Rule All, Hipster Shirt, 
7281, Grey, Dontlook, Whatever, Whereisgiraffe, Wifeshirt 2, 
7282, Blue, Devourer, Meh, , Sweet Jacket, 
7283, Albino, Pirate, No Teeth, Catch Robbers, Praetexta, 
7284, Neon Glow, Dontsee, Meh, Prison, Not A Suit, 
7285, Grey, Nothappy, Now, Whereiswhale, Blank, Jesus
7286, Light Brown, Pressure, Whatever, Hat 3, Ay Sailor, 
7287, Brown, Dontsee, What, Hat 2, Onthesea, 
7288, Black, Pressure, Meh, Hat 1, Sweet 16, 
7289, Red, Multilevel, Meh Dangerous Smoke 2, Prison, Blank, 
7290, Checkered, Monocle, Meh, Good Idea, Bringcash, Silver 1
7291, Grey, Nothappy, Bling, Hat 3, Overalls, 
7292, Beige, Notfunny, Scowl, , Fashion Accesory, Stretched
7293, Brown, Not Nice, Meh Sounds, Whalehunter 1, Wifeshirt 1, Silver 1
7294, Woke From Dead, Blocksun, Dangerous Smoke 1, , Gentleman, 
7295, Grey, Puppy Dog, Blow Bubble, , , 
7296, Black, Dead, Dangerous Smoke 2, , Piercings, Silver 1
7297, Au, Notfunny, Whatever, Punk Short, , Gold 1
7298, Black, Multilevel, Moo, , Make Fire, 
7299, Candy Cane, Dontsee, Meh Dangerous Smoke 2, Hidehairs, Fashion Accesory, Silver 1
7300, Black, Snake, Whatever, Jesus Alive, Bang Bang, 
7301, Bloodbath, Undead, Meh, Hiiya, , 
7302, Dark Brown, Bed, Rainbow, Visor Hat, Cool T-Shirt, Gold 1
7303, Red, Pressure, Whatever, , Hipsterneck, 
7304, Neon Glow, Money, Dangerous Smoke 2, Jesus Alive, Make Fire, 
7305, Holo Rainbow, Notfunny, Meh, , Honololu, Gold 2
7306, Bad Machine, Pressure, Dangerous Smoke 2, Trendy W 1, , 
7307, Black, Monocle, Argh, Service, Blazer Black, 
7308, Color Dots, Puppy Dog, Moo, Small Child, Not A Suit, 
7309, Africa Animal, Dontsee, Argh, , Weapon Belt, 
7310, Light Brown, Snake, Whatever, Manbun, Blazer Black, 
7311, Dark Brown, Machine, What, , Nowar, 
7312, Brown, Nothappy, Dangerous Smoke 2, Trendy 1, Poncho, Silver 2
7313, Black, Nothappy Longer, Whatever, , Fashion Accesory, 
7314, Dark Brown, See Stuff, Bling, War Helmet, , Silver 1
7315, Black, Bed, Whatever, Visor Hat, Alcatraz, Silver 2
7316, Easter Egg, Pressure, Sounds, Prison, Piercings, 
7317, Void, Notfunny, What, Warhat 1, , 
7318, Candy Cane, Love, Whatever, , , Silver 1
7319, Dark Brown, Undead, Meh, Hat 3, Wifeshirt 1, 
7320, Brown, Notfunny, Buck Teeth, Devil, Fashion Accesory, 
7321, Bad Machine, Multilevel, Argh, , Cuba, 
7322, Light Brown, Round Glasses, Whatever, , Hirewomen, 
7323, Dark Brown, Pirate, Meh, , Great T-Shirt, 
7324, Bad Machine, Blocksun, Nofeelingwell, , , Silver 2
7325, Africa Animal, See Stuff, Whatever, Punk Short, , 
7326, Light Brown, Not Nice, Meh Dangerous Smoke 2, Comrade, Praetexta, 
7327, Black, Devourer, Argh, Cook, Blazer Black, 
7328, Dark Brown, Pressure, Whatever, , Ay Sailor, 
7329, Neon Glow, Money, Funny, Cook, Poncho, 
7330, Light Brown, Notfunny, Dangerous Smoke 2, Punk Short, Hipster Shirt, 
7331, Dark Brown, Pressure, Scowl, Leprechaun, Onthesea, 
7332, Light Brown, Blocksun, Yesplease, Hiiya, , 
7333, Brown, Money, Meh, , Trash, Gold 1
7334, Black, Devourer, Whatever, Jesus Alive, Weapon Belt, 
7335, Easter Egg, Pressure, Dangerous Smoke 2, , Alcatraz, 
7336, Nature, Puppy Dog, Now, Service, Multicolor, 
7337, Bloodbath, Pressure, Meh Dangerous Smoke 2, Trendy 1, , 
7338, Lady, Dead, Whatever, , Fishnet Top, 
7339, Nature, Notfunny, Yesplease, , , 
7340, Dark Brown, Love, Funny, Trendy 1, Cuba, Silver 2
7341, Grey, Pirate, Meh Dangerous Smoke 3, Hat 1, Blank, Silver 1
7342, Woke From Dead, Notfunny, Argh, Hat 2, Broken, 
7343, Blue, Multilevel, Whatever, , , 
7344, Grey, Pirate, Meh, Whereiswhale, Hipsterneck, 
7345, Black, Pressure, Meh Dangerous Smoke 1, Trendy 1, Cycle, 
7346, Brown, Love, Argh, Cat Ears, Broken, Gold 2
7347, Africa Animal, Nothappy, Now, Whalehunter 1, Cool T-Shirt, Silver 2
7348, Easter Egg, Round Glasses, Whatever, Trendy 1, Ay Sailor, 
7349, Black, Pressure, Meh Dangerous Smoke 3, Manbun, Make Fire, 
7350, Lady, Blocksun, Moo, Devil, Trench, 
7351, Albino, Reality, Now, , Multicolor, Gold 2
7352, Easter Egg, Not Nice, Whatever, Have Fun 1, Nowar, 
7353, Checkered, Nothappy Longer, Argh, , Overalls, 
7354, Black, Pirate, Now, , Cycle, Silver 1
7355, Africa Animal, Money, Dangerous Smoke 2, Rabbit, Overalls, 
7356, Beige, Multilevel, Now, Trendy 1, Nofire, Silver 1
7357, Africa Animal, Round Glasses, Argh, , Sweet Jacket, Stretched
7358, Black, Nothappy Longer, Nofeelingwell, Whalehunter 2, Overalls, 
7359, Beige, Love, Scowl, Devil, Iced Tee, 
7360, No Signal, Notfunny, Higschool, Hippy Hat, , 
7361, Grey, Reality, Meh Dangerous Smoke 3, Rule All, Make Fire, Silver 2
7362, Brown, Bed, Meh, Side Shave, Preshistoric, Ear Cuff
7363, Blue, See Stuff, What, Hidehairs, Multicolor, 
7364, Red, Undead, Yesplease, Jesus Alive, Alcatraz, 
7365, Beige, Love, Whatever, Comrade, , Gold 2
7366, No Signal, Nothappy, Meh, Rabbit, , Ear Cuff
7367, Dark Brown, Notfunny, Moo, Hat 3, Vest, Jesus
7368, Acid, Nothappy, Now, Punk Short, , 
7369, Blue, Dead, Meh, , Poncho, Jesus
7370, Red, Nothappy, Say Aah, Mafia, , 
7371, Candy Cane, Pressure, Meh, Devil, , 
7372, Red, Notfunny, Say Aah, Cook, , 
7373, Dark Brown, Nothappy Longer, Meh, Punk Short, Trash, 
7374, Light Brown, Bed, What, Warhat 1, Poncho, 
7375, Beige, Pressure, Whatever, , , 
7376, Dark Brown, Bed, Argh, , Broken, 
7377, Black, Notfunny, What, Devil, Wifeshirt 1, Multiple
7378, Brown, Bed, Dangerous Smoke 2, , Chemist, 
7379, Gotsun, Love, Meh, Comrade, Cycle, 
7380, Lady, Puppy Dog, Sounds, , Praetexta, 
7381, Albino, Love, What, Cook, Not A Suit, 
7382, Black, Not Nice, Argh, Rabbit, Blank, 
7383, Lady, Reality, Nofeelingwell, Hat 1, Piercings, Silver 2
7384, Brown, Round Glasses, Dangerous Smoke 1, Whereiswhale, Iced Tee, Gold 2
7385, Grey, Notfunny, Whatever, , Lingerie, 
7386, Bad Machine, Love, Meh, Cat Ears, Nowar, Ear Cuff
7387, Gotsun, Nothappy, Meh Blow Bubble, Prison, Sweet Jacket, 
7388, Light Brown, Notfunny, Now, Service, Honololu, Ear Cuff
7389, Beige, Devourer, Food, Jesus Alive, Cycle, 
7390, Gotsun, Round Glasses, Dangerous Smoke 1, Have Fun 2, Sweet Jacket, 
7391, Color Dots, Bed, Dangerous Smoke 2, , Honololu, Ear Cuff
7392, Woke From Dead, Notfunny, Meh, Punk Short, Multicolor, Silver 2
7393, Red, Pressure, Whatever, War Helmet, Hipsterneck, 
7394, Woke From Dead, Multilevel, Meh Dangerous Smoke 2, Notsmart, Nofire, 
7395, Black, Nothappy Longer, Argh, , Alcatraz, 
7396, Light Brown, Multilevel, Dangerous Smoke 2, , Vegas Dancer, 
7397, Grey, Love, What, Hidehairs, Preshistoric, Gold 2
7398, Light Brown, Dontsee, Meh Higschool, , Multicolor, 
7399, Holo Rainbow, Round Glasses, Argh, , Cool T-Shirt, 
7400, Bloodbath, Machine, Blow Bubble, Small Child, , Silver 2
7401, Lady, Round Glasses, Bling, Prison, Sweet Jacket, 
7402, Machine, Devourer, Dangerous Smoke 1, , Bang Bang, 
7403, Vector, Dontsee, Whatever, , Preshistoric, 
7404, Beige, Bed, Dangerous Smoke 2, Whereiswhale, Not A Suit, 
7405, Black, Machine, Argh, Small Child, , 
7406, Nature, Pressure, Buck Teeth, , Cuba, Silver 1
7407, Red, Dontsee, Dangerous Smoke 2, Whereisgiraffe, Rock, 
7408, Grey, Pirate, Meh Dangerous Smoke 2, Visor Hat, Hirewomen, 
7409, Red, Machine, Whatever, , Praetexta, Silver 1
7410, Void, Blocksun, Meh, Whalehunter 2, , 
7411, Dark Brown, Bed, Meh Dangerous Smoke 2, Hiiya, Hipsterneck, 
7412, Light Brown, See Stuff, Argh, Small Child, Iced Tee, 
7413, Albino, Pirate, Whatever, Jesus Alive, Honololu, 
7414, Neon Glow, Round Glasses, Meh, Hat 1, Preshistoric, Silver 2
7415, Black, Love, Moo, Warhat 2, Overalls, 
7416, Neon Glow, Dead, Meh Sounds, Hiiya, , 
7417, Black, Machine, Buck Teeth, Rule All, Alcatraz, 
7418, Gotsun, Pew, Whatever, , Ay Sailor, 
7419, Nature, Pressure, Meh, Prison, Hipsterneck, 
7420, Black, Dontsee, Dangerous Smoke 2, Service, Robinson, 
7421, Gotsun, Bed, Moo, Antique, Overalls, 
7422, Light Brown, Pressure, Whatever, Leprechaun, Wifeshirt 2, 
7423, Albino, Snake, Buck Teeth, Jesus Alive, , 
7424, Dark Brown, Undead, Say Aah, Winter Hat, Nofire, Jesus
7425, Checkered, Notfunny, Dangerous Smoke 2, , Vest, 
7426, Brown, Round Glasses, Funny, , Great T-Shirt, 
7427, Blue, Notfunny, Meh, Prison, , 
7428, Beige, Devourer, Meh Dangerous Smoke 2, Leprechaun, , Silver 2
7429, Brown, Bed, Whatever, , Hoodie Red, 
7430, Lady, See Stuff, Moo, Jesus Alive, Nofire, Multiple
7431, Brown, Notfunny, Meh, Warhat 2, Overalls, 
7432, Light Brown, See Stuff, Say Aah, Mafia, Sweet 16, 
7433, Gotsun, Nothappy Longer, Meh, Service, Preshistoric, 
7434, Woke From Dead, Bed, Meh Dangerous Smoke 3, Hiiya, Sweet Jacket, 
7435, Lady, Pressure, Dangerous Smoke 1, Comrade, Praetexta, 
7436, Checkered, Notfunny, Whatever, Punk Short, Overalls, 
7437, Red, Dontsee, Knife, Leprechaun, , 
7438, Bloodbath, Pressure, Whatever, Whalehunter 1, , Gold 2
7439, Dark Brown, Notfunny, Now, Notsmart, , 
7440, Gotsun, Pirate, Meh Dangerous Smoke 1, Hat 2, Cuba, 
7441, Lady, Pressure, Scowl, Winter Hat, Sweet Jacket, 
7442, Grey, See Stuff, Say Aah, , Nowar, Silver 2
7443, Red, Future, Rainbow, Prison, Cool T-Shirt, 
7444, Color Dots, Round Glasses, Meh, , Make Fire, 
7445, Bad Machine, Notfunny, Moo, Whereiswhale, Overalls, 
7446, Red, Pressure, Funny, Trendy 1, Sweet 16, Gold 2
7447, Light Brown, Dontsee, Whatever, Winter Hat, Overalls, 
7448, Red, Love, Moo, Hat 2, Hoodie Red, Gold 2
7449, Grey, Puppy Dog, Whatever, , Alcatraz, 
7450, Brown, Not Nice, Argh, Trendy 1, Wifeshirt 2, 
7451, Machine, Dead, Moo, Have Fun 2, Nofire, 
7452, Brown, Monocle, Scowl, , Hipsterneck, Silver 1
7453, Nature, Nothappy Longer, Say Aah, Catch Robbers, , 
7454, Brown, Reality, No Teeth, Trendy W 1, , 
7455, Light Brown, Pirate, Now, Trendy 1, Preshistoric, Silver 2
7456, Black, Dontsee, Yesplease, Rabbit, Hipster Shirt, 
7457, Gotsun, Pressure, Whatever, Whereiswhale, Make Fire, 
7458, Dark Brown, Round Glasses, Dangerous Smoke 1, Punk Short, Sweet Jacket, 
7459, Brown, Notfunny, Say Aah, , Hippy, 
7460, Beige, Multilevel, Meh, Whereiswhale, Cuba, 
7461, Dark Brown, Notfunny, Moo, , Fashion Accesory, 
7462, Acid, Nothappy Longer, Yesplease, Hat 1, Knight Armor, 
7463, Lady, Bed, Whatever, , Hipsterneck, Multiple
7464, Blue, Dontlook, Moo, Visor Hat, Multicolor, Gold 1
7465, Brown, Nothappy Longer, Rainbow, Hat 1, Vest, 
7466, Dark Brown, Snake, Yesplease, Rabbit, Praetexta, Gold 1
7467, Black, Notfunny, Knife, Hat 3, Iced Tee, 
7468, Grey, Nothappy Longer, Scowl, , Piercings, 
7469, Brown, Love, Whatever, Devil, Preshistoric, 
7470, Blue, Round Glasses, Funny, Rabbit, Broken, 
7471, Neon Glow, Nothappy, Rainbow, Warhat 1, Ymca, Silver 1
7472, Dark Brown, Machine, Knife, Manbun, Hippy, Silver 2
7473, Vector, Dead, Scowl, Service, Hoodie Red, Gold 1
