7950, Gotsun, Undead, Yesplease, Trick Hat, Blank, 
7951, Woke From Dead, See Stuff, Moo, Comrade, Wifeshirt 1, 
7952, Beige, Bed, Meh, Jesus Alive, Nofire, 
7953, Lady, Multilevel, Argh, Hippy Hat, Honololu, 
7954, Neon Glow, Dontsee, Meh, Whalehunter 2, Sweet Jacket, 
7955, Lady, Pressure, Say Aah, Whereiswhale, Wifeshirt 2, Multiple
7956, Black, Notfunny, Bling, Headset, Poncho, 
7957, Easter Egg, Dontsee, Rainbow, , Vegas Dancer, Gold 2
7958, Light Brown, Dontlook, Funny, Whalehunter 1, Nowar, Silver 2
7959, Brown, Future, Meh, Cat Ears, Sweet 16, 
7960, Neon Glow, Notfunny, Whatever, Have Fun 1, Cool T-Shirt, 
7961, Lady, Snake, Moo, Hat 3, Hipster Shirt, Jesus
7962, Black, Dontsee, Meh, Notsmart, Cycle, 
7963, Lady, Nothappy Longer, Dangerous Smoke 2, Trendy 2, Piercings, Jesus
7964, Woke From Dead, Dontsee, Meh, , Moon, Ear Cuff
7965, Brown, Dontlook, Nofeelingwell, , Trash, Silver 2
7966, Light Brown, Nothappy Longer, Meh, Trendy 1, Fishnet Top, 
7967, Dark Brown, Nothappy, Dangerous Smoke 2, Whereisgiraffe, Weapon Belt, 
7968, Black, Notfunny, Whatever, , Praetexta, 
7969, Blue, Bed, Dangerous Smoke 2, Whalehunter 1, Hipster Shirt, 
7970, Beige, Pressure, What, Hiiya, Bringcash, Silver 2
7971, Brown, Money, Whatever, Prison, Weapon Belt, Multiple
7972, Grey, Snake, Meh, Hidehairs, Gentleman, Silver 1
7973, Black, Pirate, Scowl, , Make Fire, 
7974, Bad Machine, Nothappy Longer, Whatever, Headset, Piercings, 
7975, Beige, Bed, Moo, Cook, Sweet Jacket, 
7976, Easter Egg, Love, Scowl, Trendy 1, , 
7977, Black, Pressure, Whatever, Small Child, Vest, 
7978, Gotsun, Dontsee, What, , Iced Tee, Silver 1
7979, Candy Cane, See Stuff, Buck Teeth, Whereiswhale, Honololu, 
7980, Africa Animal, Nothappy, Whatever, Rabbit, Moon, 
7981, Brown, Notfunny, Nofeelingwell, Prison, Overalls, 
7982, Void, Nothappy, Moo, , , 
7983, Grey, Pressure, Whatever, Have Fun 2, Overalls, 
7984, Black, Round Glasses, Meh, Winter Hat, Hirewomen, Gold 2
7985, Light Brown, See Stuff, Meh Dangerous Smoke 2, Trendy 1, Onthesea, 
7986, Brown, Pirate, Dangerous Smoke 2, Rabbit, Cuba, 
7987, Red, Nothappy Longer, Sounds, Headset, Ay Sailor, 
7988, Dark Brown, Reality, Whatever, Hat 2, Chemist, Silver 1
7989, Brown, Multilevel, Meh, Rule All, Nowar, 
7990, Black, Nothappy, Whatever, Warhat 1, Nofire, 
7991, Dark Brown, Nothappy Longer, Argh, Cat Ears, Vest, 
7992, Brown, Snake, Dangerous Smoke 2, Hat 3, , Multiple
7993, Albino, Undead, Whatever, Whereiswhale, Sweet 16, Silver 2
7994, Void, Multilevel, Meh Dangerous Smoke 2, Fetish, , 
7995, Bloodbath, Machine, Argh, Side Shave, Weapon Belt, 
7996, Light Brown, See Stuff, Whatever, Whereisgiraffe, Poncho, 
7997, Red, Money, Rainbow, , Chemist, 
7998, Black, Nothappy, Gold Bling, Punk Short, Alcatraz, 
7999, Au, Dontsee, Moo, Hat 3, , 
