9468, Bad Machine, Dontlook, Meh, Comrade, Blank, Silver 1
9469, Brown, Dontsee, Now, Hiiya, Robinson, Silver 2
9470, Gotsun, Notfunny, Scowl, Have Fun 2, Fashion Accesory, 
9471, Albino, Pressure, Whatever, Hat 1, Nowar, 
9472, Gotsun, Notfunny, Meh Blow Bubble, , Onthesea, Multiple
9473, Au, Dontsee, Funny, Devil, , 
9474, Gotsun, Pew, Dangerous Smoke 2, , Wifeshirt 1, Silver 1
9475, Light Brown, Multilevel, Whatever, , Alcatraz, 
9476, Brown, Round Glasses, Higschool, Whalehunter 2, Chemist, 
9477, Black, Bed, Meh, , Ok, Silver 1
9478, Beige, Money, Meh Dangerous Smoke 1, Trendy 2, Hipsterneck, Silver 2
9479, Black, Notfunny, Nofeelingwell, Whalehunter 1, Alcatraz, 
9480, Brown, Dontsee, Whatever, Whalehunter 2, Preshistoric, 
9481, Nature, Undead, Meh Blow Bubble, Visor Hat, Rappers, Multiple
9482, Checkered, Puppy Dog, Meh, , Piercings, Gold 2
9483, Brown, Nothappy Longer, Scowl, Warhat 1, Sweet 16, 
9484, No Signal, Money, Now, , , 
9485, Dark Brown, Puppy Dog, Meh, Service, Sweet 16, 
9486, Black, Pressure, Argh, Comrade, Trash, 
9487, Acid, Reality, Meh Sounds, , , 
9488, Black, Love, Funny, Prison, Sweet 16, Silver 1
9489, Light Brown, Dontsee, Higschool, Comrade, Onthesea, 
9490, Africa Animal, Notfunny, Gold Bling, Have Fun 1, Ay Sailor, 
9491, Albino, Reality, Whatever, Jesus Alive, , 
9492, Gotsun, Bed, Meh Dangerous Smoke 3, Have Fun 2, Vest, Silver 2
9493, Dark Brown, Round Glasses, Argh, Jesus Alive, Praetexta, 
9494, Black, Nothappy Longer, Bling, Whalehunter 2, , 
9495, Brown, Monocle, Dangerous Smoke 2, , Blank, Ear Cuff
9496, Checkered, See Stuff, Nofeelingwell, Service, Fashion Accesory, Silver 1
9497, Lady, Blocksun, Funny, Hidehairs, Weapon Belt, 
9498, Light Brown, Round Glasses, Meh Dangerous Smoke 2, Trendy 1, , 
9499, Brown, Dead, Meh, , Rappers, 
9500, Bad Machine, Devourer, What, Visor Hat, Cycle, 
9501, Holo Rainbow, Monocle, Moo, , , 
9502, Africa Animal, See Stuff, Dangerous Smoke 2, Trendy 1, Fashion Accesory, Multiple
9503, Brown, Round Glasses, Dangerous Smoke 3, Rabbit, Make Fire, 
9504, Black, Notfunny, Meh, Comrade, , 
9505, Light Brown, Money, Meh Dangerous Smoke 2, Cook, Piercings, 
9506, Black, Future, Meh, , Blank, Silver 1
9507, Albino, Notfunny, Yesplease, Warhat 2, Not A Suit, 
9508, Gotsun, Nothappy, Dangerous Smoke 2, , Cool T-Shirt, Gold 2
9509, Holo Rainbow, Dontsee, Nofeelingwell, Trendy 1, Cycle, 
9510, Machine, Notfunny, What, , Honololu, 
9511, Brown, Devourer, Yesplease, , Nowar, 
9512, Red, Puppy Dog, Gold Bling, Trendy 1, Alcatraz, 
9513, Woke From Dead, Money, Say Aah, Rabbit, Honololu, 
9514, Light Brown, Pressure, Meh, Devil, Nowar, 
9515, Blue, Money, Moo, , Lingerie, 
9516, Albino, Dontsee, Meh Dangerous Smoke 3, , Hipsterneck, Silver 1
9517, Holo Rainbow, Nothappy Longer, Meh, , , 
9518, Beige, Dead, Yesplease, Whalehunter 1, Hipsterneck, Silver 1
9519, Black, Not Nice, Meh, , Preshistoric, 
9520, Vector, Dead, Meh Dangerous Smoke 3, Whereisgiraffe, , 
9521, Machine, Notfunny, Moo, Devil, Piercings, 
9522, Beige, Bed, Meh, Fetish, Ymca, Gold 1
9523, Gotsun, Love, Argh, Whereiswhale, Trash, 
9524, Beige, Pressure, Meh, Comrade, Nowar, 
9525, Blue, Bed, Whatever, Headset, Not A Suit, 
9526, Red, Devourer, What, Hat 2, Rock, 
9527, Holo Rainbow, Nothappy, Dangerous Smoke 2, Hiiya, Ay Sailor, 
9528, Light Brown, Notfunny, Scowl, , Blank, 
9529, Nature, Nothappy Longer, Moo, Trendy 1, Alcatraz, 
9530, Gotsun, Notfunny, Scowl, Catch Robbers, Overalls, 
9531, Brown, Bed, Say Aah, Hat 3, Nofire, 
9532, Candy Cane, Nothappy Longer, Meh, Warhat 2, , 
9533, Albino, Bed, Yesplease, , Cuba, 
9534, Brown, Not Nice, Whatever, , Gentleman, Gold 2
9535, Grey, Dontlook, Dangerous Smoke 2, , Preshistoric, 
9536, Gotsun, Dontsee, Say Aah, Trendy W 2, Chemist, Gold 1
9537, Light Brown, Nothappy Longer, Dangerous Smoke 2, Hippy Hat, Ay Sailor, 
9538, Brown, Round Glasses, Meh Dangerous Smoke 2, Mafia, Nofire, Silver 1
9539, Checkered, Devourer, Meh, Leprechaun, Piercings, Gold 1
9540, Albino, Dead, Meh Dangerous Smoke 2, Trendy W 2, Cuba, 
9541, Black, Nothappy Longer, Sounds, , Ay Sailor, 
9542, Brown, Machine, Moo, Jesus Alive, Robinson, 
9543, Light Brown, Dead, Whatever, Headset, Cuba, 
9544, Black, Pressure, Argh, Trendy 1, Blazer Black, 
9545, Grey, Notfunny, What, , Lingerie, 
9546, Dark Brown, Nothappy, Whatever, , Cool T-Shirt, 
9547, Black, Money, Scowl, , Honololu, 
9548, Red, Notfunny, No Teeth, Cat Ears, Wifeshirt 2, Jesus
9549, Grey, Lazer, Whatever, , , 
9550, Gotsun, Money, Meh, , , 
9551, Beige, Not Nice, Buck Teeth, Visor Hat, Onthesea, Gold 2
9552, Light Brown, Nothappy, Meh, Trendy 1, Shirt Of Flames, 
9553, Black, Undead, Meh Dangerous Smoke 2, , Piercings, 
9554, Grey, Not Nice, Meh, , Not A Suit, Silver 2
9555, Red, Monocle, Scowl, , Nowar, 
9556, Brown, Dead, Whatever, , Overalls, 
9557, Grey, Round Glasses, Gold Bling, , Blank, 
9558, Dark Brown, Pressure, Say Aah, Whalehunter 2, Hipsterneck, 
9559, Checkered, Nothappy, Meh Food, Trick Hat, Vest, 
9560, Grey, Snake, Now, , Great T-Shirt, Silver 2
9561, Neon Glow, Dontsee, Moo, Whalehunter 1, Preshistoric, 
9562, Nature, Multilevel, Meh Knife, Whereisgiraffe, Iced Tee, 
9563, Stars And Stripes, Notfunny, Moo, Service, , 
9564, Blue, Not Nice, Whatever, Hat 3, Blank, Multiple
9565, Brown, Love, Scowl, Cat Ears, Fashion Accesory, Silver 2
9566, Woke From Dead, Nothappy Longer, Whatever, , Praetexta, 
9567, Black, Love, Meh, Mafia, Nowar, Silver 1
9568, Woke From Dead, Round Glasses, Higschool, Leprechaun, Cuba, Gold 2
9569, Color Dots, Dontsee, Whatever, Comrade, Blank, Silver 1
9570, Albino, Blocksun, Meh, , Rock, Gold 1
9571, Light Brown, Notfunny, Meh Dangerous Smoke 1, Manbun, Weapon Belt, 
9572, Africa Animal, Pressure, Funny, Prison, , 
9573, Gotsun, Nothappy Longer, Moo, Service, Hoodie Red, Silver 1
9574, Black, Bed, Dangerous Smoke 1, Whereisgiraffe, Moon, 
9575, Brown, Money, Dangerous Smoke 2, Whalehunter 1, Honololu, 
9576, No Signal, Notfunny, Argh, Prison, Piercings, Silver 2
9577, Bad Machine, Multilevel, Sounds, War Helmet, Vest, 
9578, Bloodbath, Not Nice, Meh, Rabbit, , 
9579, Grey, Pressure, Whatever, War Helmet, Onthesea, 
9580, Brown, Not Nice, Argh, Small Child, Nowar, 
9581, Red, Round Glasses, Whatever, Trendy 1, Sweet Jacket, 
9582, Light Brown, Dontsee, Meh, Have Fun 1, Hipster Shirt, 
9583, Dark Brown, Snake, Whatever, , Robinson, Gold 2
9584, Lady, Monocle, Argh, Comrade, Multicolor, 
9585, Stars And Stripes, Pirate, Whatever, Leprechaun, , 
9586, Albino, Bed, Meh, Prison, , 
9587, Light Brown, Future, Whatever, Hiiya, Preshistoric, 
9588, Dark Brown, Undead, Argh, , Robinson, 
9589, Blue, Dead, Whatever, , Praetexta, Silver 1
9590, Bloodbath, Pirate, Dangerous Smoke 1, Rule All, , 
9591, Gotsun, Blocksun, Say Aah, , , Gold 2
9592, Color Dots, Pressure, Argh, Prison, Not A Suit, 
9593, Blue, Love, Whatever, Whalehunter 2, Trash, 
9594, Easter Egg, Multilevel, Dangerous Smoke 2, Comrade, Bringcash, 
9595, Beige, Love, Meh Dangerous Smoke 2, Warhat 2, Weapon Belt, 
9596, Blue, Nothappy, Rainbow, Whalehunter 1, , 
9597, Dark Brown, Blocksun, Whatever, , Hippy, 
9598, Grey, See Stuff, Food, , , 
9599, Brown, Dontsee, Meh, Prison, Praetexta, 
9600, Light Brown, Love, Meh Dangerous Smoke 2, Visor Hat, Rappers, 
9601, Dark Brown, Pirate, Argh, Small Child, Blazer Black, Jesus
9602, Bloodbath, Notfunny, Dangerous Smoke 2, Hippy Hat, , Silver 1
9603, Red, Nothappy, Meh, Prison, Not A Suit, 
9604, Holo Rainbow, Notfunny, Whatever, Service, Vegas Dancer, Silver 2
9605, Blue, Dontsee, Meh Dangerous Smoke 1, , , 
9606, Brown, Multilevel, Meh, Visor Hat, Praetexta, 
9607, Blue, Notfunny, Say Aah, Punk Short, Bang Bang, Silver 2
9608, Dark Brown, Multilevel, Meh, , Nowar, 
9609, Beige, Pressure, Argh, Hat 1, Praetexta, 
9610, Black, Notfunny, Whatever, Rule All, Broken, 
9611, Dark Brown, Dontsee, Dangerous Smoke 2, Trendy 1, , 
9612, Gotsun, Devourer, Moo, Hiiya, Overalls, Silver 1
9613, Beige, Dontsee, Meh Dangerous Smoke 2, , Hipsterneck, 
9614, Light Brown, Notfunny, Argh, , Sweet 16, 
9615, Black, Multilevel, What, Have Fun 1, Chemist, 
9616, Africa Animal, Notfunny, Whatever, Warhat 1, Trash, 
9617, No Signal, Nothappy Longer, Meh Dangerous Smoke 2, , , Ear Cuff
9618, Gotsun, Round Glasses, Say Aah, Service, Wifeshirt 2, 
9619, Beige, Bed, Hipster Stache, Jesus Alive, Cuba, 
9620, Brown, Nothappy Longer, Nofeelingwell, , Fashion Accesory, 
9621, Dark Brown, See Stuff, Meh, Devil, Weapon Belt, 
9622, Light Brown, Nothappy Longer, Moo, Notsmart, Ay Sailor, Silver 1
9623, Beige, Dontsee, What, Whereiswhale, Cycle, 
9624, Black, Puppy Dog, Argh, Whalehunter 2, Nofire, 
9625, Easter Egg, See Stuff, Dangerous Smoke 2, Trendy W 2, Rock, 
9626, Red, Multilevel, Argh, Hiiya, Overalls, 
9627, Light Brown, Pressure, Whatever, Trendy 1, Make Fire, 
9628, Blue, Money, Funny, Have Fun 1, Honololu, 
9629, Dark Brown, Pew, What, Comrade, Overalls, Ear Cuff
9630, Light Brown, Notfunny, Now, , Poncho, 
9631, Africa Animal, Bed, Meh, , Trench, 
9632, Brown, Monocle, Whatever, Good Idea, Alcatraz, 
9633, Beige, Round Glasses, Food, , Moon, 
9634, Dark Brown, Dontlook, Moo, Have Fun 2, , Silver 1
9635, Grey, Love, Meh, Whereiswhale, Hipsterneck, 
9636, Gotsun, Future, Moo, Whalehunter 2, Multicolor, 
9637, Red, Pressure, Meh, Mafia, Sweet Jacket, 
9638, Brown, Nothappy, Say Aah, Rabbit, Cool T-Shirt, Silver 2
9639, Woke From Dead, Blocksun, Moo, Visor Hat, Hipster Shirt, 
9640, Bloodbath, Reality, Whatever, , , 
9641, Light Brown, Notfunny, Moo, Whalehunter 1, Shirt Of Flames, 
9642, Black, Blocksun, Whatever, Punk Short, Ay Sailor, Silver 1
9643, Africa Animal, See Stuff, Meh Dangerous Smoke 2, Trendy 2, Praetexta, 
9644, Black, Dontsee, Whatever, , Overalls, 
9645, Brown, Notfunny, Meh Sounds, , Ay Sailor, 
9646, Black, Bed, Meh Dangerous Smoke 2, Visor Hat, Cycle, 
9647, Gotsun, Dontlook, Moo, Have Fun 1, Sweet Jacket, 
9648, Nature, Dontsee, Dangerous Smoke 2, Cook, , 
9649, Brown, Multilevel, Hipster Stache, Trendy W 1, , Ear Cuff
9650, Easter Egg, Puppy Dog, Meh, Cat Ears, , 
9651, Woke From Dead, Notfunny, Argh, Service, Overalls, Silver 2
9652, Acid, Multilevel, Meh Dangerous Smoke 3, Rabbit, , Silver 1
9653, Beige, Notfunny, Nofeelingwell, Cook, Alcatraz, 
9654, Blue, Nothappy, Whatever, Prison, Ymca, 
9655, Beige, Machine, Meh, Hat 3, Overalls, Gold 1
9656, Albino, Bed, Argh, , Ay Sailor, 
9657, Lady, Dontlook, Meh Dangerous Smoke 2, , Hirewomen, 
9658, Beige, Puppy Dog, What, War Helmet, Multicolor, 
9659, Grey, Not Nice, Whatever, Prison, Ay Sailor, 
9660, Blue, Dontsee, Meh Dangerous Smoke 2, , , Silver 2
9661, Albino, Multilevel, What, Prison, Nofire, 
9662, Dark Brown, Dontlook, Whatever, Have Fun 1, Praetexta, 
9663, Albino, Bed, Nofeelingwell, Comrade, Hoodie Red, 
9664, Candy Cane, Love, Moo, Whalehunter 1, Gentleman, Silver 1
9665, Black, Nothappy Longer, Dangerous Smoke 2, Prison, Wifeshirt 2, 
9666, Stars And Stripes, Undead, Scowl, Notsmart, Nowar, 
9667, Brown, Love, Meh, Service, Poncho, 
9668, Color Dots, Pressure, Say Aah, Prison, Hipster Shirt, 
9669, Easter Egg, Puppy Dog, Whatever, Trendy 2, Alcatraz, 
9670, Brown, Multilevel, Yesplease, Whalehunter 1, Nowar, Gold 1
9671, Gotsun, Notfunny, Argh, Notsmart, Honololu, 
9672, Light Brown, Pressure, Rainbow, , , Jesus
9673, Lady, Dontsee, Say Aah, , Alcatraz, 
9674, Checkered, Devourer, Whatever, Hat 3, Weapon Belt, 
9675, Light Brown, Snake, What, , Vest, 
9676, Dark Brown, Bed, Rainbow, Small Child, Cool T-Shirt, 
9677, Light Brown, Monocle, Yesplease, Trendy 1, Vegas Dancer, 
9678, Africa Animal, Blocksun, Buck Teeth, Punk Short, Hipster Shirt, 
9679, Blue, Multilevel, Moo, Cook, , Silver 1
9680, Nature, Round Glasses, Scowl, Notsmart, , 
9681, Beige, Multilevel, Meh Higschool, Hat 3, Trench, 
9682, Blue, Bed, Say Aah, , Bang Bang, Silver 1
9683, Brown, Dead, Whatever, Hidehairs, , Multiple
9684, Beige, Notfunny, Dangerous Smoke 2, Headset, Weapon Belt, 
9685, Gotsun, Bed, Say Aah, Hat 3, Fishnet Top, 
9686, Light Brown, Notfunny, Whatever, Winter Hat, Ymca, Silver 2
9687, Bloodbath, Pirate, Dangerous Smoke 3, Trendy W 2, , Silver 1
9688, Brown, Bed, No Teeth, Hidehairs, , 
9689, Dark Brown, Undead, Whatever, , Cycle, 
9690, Lady, Not Nice, Meh Dangerous Smoke 2, Warhat 1, Blank, 
9691, Beige, Reality, Dangerous Smoke 2, Winter Hat, Trench, Silver 1
9692, Brown, Bed, Dangerous Smoke 3, Trendy W 2, Trash, 
9693, Light Brown, Reality, Meh, Rabbit, Honololu, Gold 2
9694, Brown, Notfunny, What, Jesus Alive, , Silver 2
9695, Color Dots, Love, Gold Bling, , Piercings, 
9696, Gotsun, Blocksun, Whatever, War Helmet, Robinson, 
9697, Dark Brown, Pressure, Say Aah, Devil, Weapon Belt, 
9698, Brown, Nothappy, Meh, Prison, Trash, Silver 1
9699, Black, Undead, Meh Dangerous Smoke 1, Hat 3, Fashion Accesory, 
9700, Dark Brown, Bed, Now, , , Gold 2
9701, Holo Rainbow, Undead, Whatever, Cat Ears, Multicolor, Silver 2
9702, Neon Glow, Notfunny, Now, Warhat 1, Vest, 
9703, Lady, Devourer, Meh, Jesus Alive, Bringcash, 
9704, Africa Animal, Bed, Whatever, Cat Ears, Iced Tee, 
9705, Dark Brown, Pressure, Dangerous Smoke 1, Trendy W 1, Make Fire, Ear Cuff
9706, Candy Cane, Devourer, Moo, Hat 2, , 
9707, Black, Undead, Whatever, Notsmart, Vegas Dancer, 
9708, Light Brown, Notfunny, Yesplease, , Chemist, 
9709, Black, Pressure, Meh Dangerous Smoke 1, , Not A Suit, 
9710, Africa Animal, Nothappy Longer, What, Trendy 2, , Multiple
9711, Gotsun, Notfunny, Meh Dangerous Smoke 3, Fetish, Hipster Shirt, 
9712, No Signal, Bed, Meh Dangerous Smoke 2, , Hipsterneck, 
9713, Blue, Love, Dangerous Smoke 2, , Wifeshirt 2, 
9714, Black, Dontsee, Whatever, , Onthesea, 
9715, Neon Glow, See Stuff, What, Whalehunter 1, Wifeshirt 1, 
9716, Dark Brown, Bed, Blow Bubble, Hidehairs, Bringcash, 
9717, Bloodbath, Pressure, Meh, Comrade, Ay Sailor, 
9718, Dark Brown, Bed, Argh, , Hipster Shirt, Silver 1
9719, Lady, Undead, Meh, Hat 3, Alcatraz, 
9720, Blue, Puppy Dog, Argh, Trendy 1, , Silver 1
9721, Africa Animal, See Stuff, Dangerous Smoke 3, Service, Honololu, Gold 1
9722, Brown, Pressure, Say Aah, Whalehunter 2, Sweet 16, 
9723, Blue, Undead, Gold Bling, , Rappers, 
9724, Nature, Multilevel, Meh Food, Trendy W 1, , Gold 2
9725, Blue, Nothappy, Meh, Prison, Bringcash, 
9726, Lady, Dontlook, Now, Jesus Alive, Honololu, 
9727, Easter Egg, Nothappy Longer, Argh, Whalehunter 1, Nofire, 
9728, Woke From Dead, Love, Funny, , Ay Sailor, Silver 2
9729, Beige, Pirate, Argh, , , 
9730, Machine, See Stuff, Dangerous Smoke 2, Punk Short, Piercings, 
9731, Black, Notfunny, Meh, Prison, , 
9732, Beige, Undead, Gold Bling, Punk Short, Chemist, 
9733, Vector, Pirate, Now, Manbun, Broken, 
9734, Bloodbath, Nothappy Longer, Meh, , , Silver 1
9735, Gotsun, Notfunny, Whatever, Hiiya, Vest, 
9736, Nature, Love, What, Notsmart, Multicolor, 
9737, Grey, Undead, Whatever, Devil, , 
9738, Red, Pressure, Meh Dangerous Smoke 2, , Bang Bang, 
9739, Holo Rainbow, See Stuff, Meh, Trick Hat, Wifeshirt 2, 
9740, Dark Brown, Pressure, No Teeth, , Hipsterneck, 
9741, Lady, Dead, Meh Dangerous Smoke 1, Hat 3, Cool T-Shirt, 
9742, Beige, Future, Whatever, Have Fun 1, Overalls, 
9743, Checkered, Notfunny, Say Aah, Whalehunter 1, , 
9744, Gotsun, Reality, Dangerous Smoke 2, Devil, Cuba, 
9745, Light Brown, Nothappy Longer, What, Hippy Hat, Onthesea, 
9746, Woke From Dead, Notfunny, Moo, Visor Hat, , 
9747, Red, Dead, Meh, Hiiya, Overalls, Silver 2
9748, Woke From Dead, Notfunny, Say Aah, , Onthesea, 
9749, Brown, Pressure, Argh, Jesus Alive, Blank, 
9750, Red, Notfunny, Hipster Stache, Cook, Multicolor, 
9751, Brown, Blocksun, Bling, Devil, Fashion Accesory, 
9752, Black, Notfunny, Whatever, Rabbit, Ay Sailor, Silver 1
9753, Brown, Undead, Say Aah, , , 
9754, Black, Nothappy, Meh, Have Fun 1, Blank, 
9755, Lady, Monocle, Meh Dangerous Smoke 2, Devil, Chemist, Silver 1
9756, Africa Animal, Nothappy Longer, Meh, , Cuba, Stretched
9757, Candy Cane, Round Glasses, What, Visor Hat, Not A Suit, 
9758, Nature, Notfunny, Whatever, , Poncho, 
9759, Albino, Nothappy Longer, Meh Dangerous Smoke 3, Trendy 2, Moon, Gold 1
9760, Light Brown, Love, What, Jesus Alive, Sweet Jacket, Silver 2
9761, Dark Brown, Bed, Now, , Weapon Belt, 
9762, Brown, Notfunny, Nofeelingwell, Warhat 2, Cool T-Shirt, 
9763, Black, Bed, Dangerous Smoke 2, Whereiswhale, Rappers, 
9764, Light Brown, Future, Moo, Warhat 1, Wifeshirt 2, 
9765, Grey, Snake, Say Aah, Devil, Cycle, 
9766, Albino, Blocksun, Gold Bling, Hiiya, Make Fire, 
9767, Dark Brown, Pressure, Say Aah, Service, Rock, 
9768, Red, Dontsee, Dangerous Smoke 2, Prison, , 
9769, Black, Pressure, Moo, Devil, Broken, 
9770, Brown, Puppy Dog, Dangerous Smoke 2, Hidehairs, Gentleman, 
9771, Beige, Notfunny, Whatever, Prison, Wifeshirt 2, 
9772, Lady, Dead, Dangerous Smoke 3, , Fashion Accesory, Gold 1
9773, Light Brown, Round Glasses, What, , Chemist, 
9774, Dark Brown, Multilevel, Argh, Fetish, Poncho, 
9775, Grey, Devourer, Blow Bubble, , Onthesea, 
9776, Dark Brown, Undead, Meh Dangerous Smoke 3, Visor Hat, Alcatraz, 
9777, Blue, Nothappy, Dangerous Smoke 2, Trendy 2, Robinson, 
9778, Dark Brown, Pirate, Meh, Rabbit, Gentleman, 
9779, Brown, Notfunny, Food, , Blank, Silver 2
9780, Red, Blocksun, Moo, Comrade, Hipsterneck, 
9781, Brown, Devourer, Whatever, Rabbit, Onthesea, 
9782, Black, Dontlook, Scowl, Hiiya, Preshistoric, 
9783, Machine, Nothappy, Moo, Notsmart, Chemist, Gold 2
9784, Brown, Bed, Say Aah, , Bringcash, 
9785, Africa Animal, Devourer, Argh, , Onthesea, 
9786, Dark Brown, Pirate, Whatever, Trendy 1, Multicolor, 
9787, Brown, Devourer, Rainbow, Fetish, , 
9788, Black, Nothappy Longer, Meh Dangerous Smoke 3, Prison, Wifeshirt 2, 
9789, Brown, Monocle, Nofeelingwell, Hiiya, Lingerie, 
9790, Lady, Dead, Dangerous Smoke 2, Whalehunter 1, Hippy, 
9791, Neon Glow, Pirate, What, Have Fun 2, Ay Sailor, Silver 1
9792, Blue, Notfunny, Meh Dangerous Smoke 2, , Onthesea, 
9793, Light Brown, Undead, Scowl, Service, Piercings, 
9794, Brown, Notfunny, Moo, Trendy 1, Fashion Accesory, 
9795, Candy Cane, Puppy Dog, Meh, , , 
9796, Stars And Stripes, Bed, Whatever, Prison, , 
9797, Lady, Multilevel, Dangerous Smoke 2, War Helmet, , 
9798, Red, Notfunny, Now, Prison, Ymca, 
9799, Gotsun, See Stuff, Say Aah, , Vest, Ear Cuff
9800, Lady, Multilevel, Whatever, Whalehunter 1, , 
9801, Nature, Pressure, Moo, Punk Short, Wifeshirt 1, Gold 2
9802, Color Dots, Puppy Dog, Meh Dangerous Smoke 2, , Cool T-Shirt, 
9803, Dark Brown, See Stuff, Say Aah, Manbun, Ok, Silver 2
9804, Grey, Notfunny, Whatever, , Make Fire, Gold 1
9805, Gotsun, Nothappy Longer, Nofeelingwell, Have Fun 2, Sweet 16, 
9806, Red, Notfunny, Dangerous Smoke 2, Devil, Blank, 
9807, Holo Rainbow, Future, Moo, Hat 3, Vest, Ear Cuff
9808, Beige, Pressure, Say Aah, Prison, Hipster Shirt, 
9809, Woke From Dead, Undead, Meh, Trendy 1, Ymca, 
9810, Dark Brown, Nothappy Longer, Hipster Stache, Service, Nowar, 
9811, Gotsun, Reality, Dangerous Smoke 1, Cook, Hipster Shirt, 
9812, Beige, Multilevel, Rainbow, Hiiya, Sweet Jacket, 
9813, Albino, Bed, Whatever, Leprechaun, Fashion Accesory, Silver 1
9814, Bloodbath, Reality, Meh, , Hoodie Red, Ear Cuff
9815, Candy Cane, Not Nice, Rainbow, Mafia, , 
9816, Blue, Round Glasses, Sounds, Hat 3, Great T-Shirt, 
9817, Au, Notfunny, Whatever, Punk Short, , 
9818, Blue, Bed, Moo, , , 
9819, Grey, Dontsee, Argh, Headset, Moon, 
9820, Dark Brown, Pressure, Dangerous Smoke 2, Rule All, Trash, Silver 1
9821, Light Brown, Bed, Now, , Trench, 
9822, Lady, Nothappy Longer, No Teeth, Hat 3, , 
9823, Dark Brown, Notfunny, Higschool, Jesus Alive, Vest, Gold 1
9824, Woke From Dead, Machine, Meh, Trendy W 2, Weapon Belt, 
9825, Gotsun, Lazer, Knife, , Hipsterneck, 
9826, Easter Egg, Pressure, Dangerous Smoke 2, Whereisgiraffe, Bringcash, 
9827, Bad Machine, Notfunny, Bling, Hat 1, , 
9828, Brown, Money, Whatever, Notsmart, Wifeshirt 2, Silver 2
9829, Red, Puppy Dog, Dangerous Smoke 3, , Poncho, Silver 1
9830, Neon Glow, Nothappy Longer, Dangerous Smoke 1, Fetish, Trash, 
9831, Dark Brown, Devourer, Moo, Jesus Alive, , 
9832, Void, Nothappy Longer, Say Aah, Winter Hat, , 
9833, Beige, Dontsee, What, Trendy 1, Fashion Accesory, 
9834, Light Brown, Nothappy Longer, Meh Dangerous Smoke 2, Trendy W 2, Blank, 
9835, Dark Brown, Money, Moo, Antique, Sweet 16, 
9836, Africa Animal, Nothappy Longer, Dangerous Smoke 2, Punk Short, Cool T-Shirt, 
9837, Color Dots, Notfunny, Whatever, Service, Rock, 
9838, Red, Dontlook, Meh, Prison, Blank, 
9839, Blue, Notfunny, Argh, Trendy W 1, Gentleman, Gold 1
9840, Dark Brown, Round Glasses, Sounds, , Trash, 
9841, Red, Snake, Now, Trendy W 2, Nowar, 
9842, Light Brown, Pew, Dangerous Smoke 2, Whalehunter 1, Poncho, 
9843, Brown, Love, Meh Dangerous Smoke 3, , Broken, 
9844, Albino, Notfunny, Meh, Hiiya, , 
9845, Beige, Bed, Funny, Trick Hat, Nofire, 
9846, Acid, Nothappy, Meh, Headset, Fashion Accesory, 
9847, Beige, Notfunny, Rainbow, Whereisgiraffe, Overalls, 
9848, Color Dots, Nothappy, Say Aah, Hippy Hat, , Jesus
9849, Gotsun, Nothappy Longer, Meh Dangerous Smoke 3, , , Stretched
9850, Blue, See Stuff, Whatever, , Onthesea, 
9851, Africa Animal, Blocksun, Meh, Visor Hat, Honololu, 
9852, Grey, Round Glasses, Nofeelingwell, , Multicolor, 
9853, Brown, Notfunny, Blow Bubble, , Ay Sailor, 
9854, Red, Pressure, Meh, Visor Hat, Onthesea, 
9855, Easter Egg, Devourer, Say Aah, Rabbit, Hipster Shirt, 
9856, Beige, Notfunny, Scowl, Trendy W 1, Make Fire, 
9857, Lady, Love, Meh, Mafia, Weapon Belt, 
9858, Africa Animal, Money, Whatever, , Hipsterneck, 
9859, Light Brown, Notfunny, Dangerous Smoke 2, Mafia, Ay Sailor, 
9860, Gotsun, Bed, Meh, Trendy W 2, Cuba, 
9861, Woke From Dead, Money, Scowl, Prison, Hipsterneck, 
9862, Blue, Pressure, Moo, , Nofire, 
9863, Stars And Stripes, See Stuff, Meh, , , Gold 2
9864, Blue, Reality, Dangerous Smoke 2, Small Child, Fashion Accesory, 
9865, Dark Brown, Notfunny, Meh Sounds, Cook, Alcatraz, Gold 1
9866, Woke From Dead, Puppy Dog, Meh Higschool, Hat 2, Overalls, 
9867, Beige, Multilevel, Food, Cook, Alcatraz, 
9868, Machine, Notfunny, Whatever, Cat Ears, Multicolor, 
9869, Holo Rainbow, Multilevel, Rainbow, , Poncho, 
9870, Lady, Pirate, Say Aah, Trendy W 1, Wifeshirt 2, 
9871, Light Brown, Machine, Meh, Have Fun 1, , 
9872, Africa Animal, Dontsee, Meh Blow Bubble, Whalehunter 1, Hirewomen, Silver 1
9873, Woke From Dead, Round Glasses, Meh, , Make Fire, 
9874, Black, Bed, Gold Bling, Devil, Hippy, 
9875, Easter Egg, Puppy Dog, Whatever, Warhat 2, Wifeshirt 2, 
9876, Blue, Dontsee, Argh, Warhat 1, Hoodie Red, 
9877, Brown, Blocksun, Whatever, Whereisgiraffe, Great T-Shirt, 
9878, Africa Animal, Puppy Dog, Meh Dangerous Smoke 2, Hiiya, Ok, 
9879, Albino, Bed, Moo, Manbun, Fashion Accesory, Silver 2
9880, Brown, Multilevel, Whatever, Cook, Hipster Shirt, Silver 1
9881, Black, Round Glasses, Argh, Trendy W 1, Blank, 
9882, Bloodbath, Notfunny, What, Small Child, , 
9883, Vector, Dontsee, Funny, Mafia, Great T-Shirt, Gold 1
9884, Brown, Notfunny, Meh, , Make Fire, 
9885, Red, Pressure, Whatever, Trick Hat, Nofire, 
9886, Brown, Notfunny, Argh, Visor Hat, Honololu, 
9887, Light Brown, Money, Whatever, Cat Ears, , Silver 1
9888, Beige, Notfunny, Meh, Jesus Alive, Hipsterneck, Gold 2
9889, Candy Cane, Nothappy Longer, What, Service, , 
9890, Lady, Pressure, Dangerous Smoke 2, Headset, Wifeshirt 1, 
9891, Black, Nothappy Longer, Argh, Whalehunter 1, Hipster Shirt, 
9892, Africa Animal, Not Nice, Meh Dangerous Smoke 3, Punk Short, Honololu, 
9893, Lady, Pressure, Whatever, , Hoodie Black, Silver 2
9894, Holo Rainbow, Nothappy Longer, Argh, , Overalls, 
9895, Vector, Pirate, What, Trendy W 2, Fashion Accesory, 
9896, Brown, Notfunny, Whatever, Visor Hat, Blank, Multiple
9897, Candy Cane, Nothappy Longer, Meh Blow Bubble, Notsmart, , 
9898, Checkered, Notfunny, Whatever, Mafia, Ay Sailor, Silver 2
9899, Black, Bed, Meh, Catch Robbers, Rappers, 
