id, body, eyes, mouth, hat, clothes, earring
9000, Gotsun, Bed, Buck Teeth, Whereiswhale, Iced Tee, Ear Cuff
9001, Checkered, Love, Whatever, Winter Hat, Preshistoric, 
9002, Light Brown, Pressure, Higschool, Whalehunter 1, Multicolor, Silver 2
9003, Grey, Notfunny, Meh Higschool, Trick Hat, Robinson, 
9004, Easter Egg, Undead, Moo, Prison, Bringcash, 
9005, Black, Notfunny, Whatever, , Multicolor, Silver 1
9006, Brown, Love, Dangerous Smoke 2, Service, Ay Sailor, 
9007, Bad Machine, Notfunny, Whatever, Trick Hat, Hipsterneck, 
9008, Light Brown, Undead, Say Aah, Whalehunter 1, Hirewomen, Gold 2
9009, Beige, Bed, Meh, , Not A Suit, 
9010, Brown, Love, Dangerous Smoke 1, Whalehunter 1, Praetexta, 
9011, Gotsun, Dontsee, Meh, , , Gold 1
9012, Beige, Pirate, Yesplease, Hiiya, Bang Bang, Ear Cuff
9013, Checkered, Pressure, Meh Dangerous Smoke 1, , Ok, 
9014, Grey, Nothappy Longer, Moo, Cook, Hipsterneck, 
9015, No Signal, Round Glasses, Whatever, Prison, , 
9016, Neon Glow, Pirate, Argh, , Chemist, 
9017, Lady, See Stuff, Now, Whalehunter 1, Sweet Jacket, Silver 1
9018, Beige, Love, Dangerous Smoke 2, War Helmet, Rock, 
9019, Woke From Dead, Pressure, What, Good Idea, Nowar, Silver 1
9020, Machine, Dontlook, Meh Dangerous Smoke 3, , Fishnet Top, Ear Cuff
9021, Grey, Puppy Dog, Dangerous Smoke 1, , Bringcash, Jesus
9022, Light Brown, Blocksun, Meh, Cook, , 
9023, Nature, Not Nice, Bling, Manbun, Multicolor, 
9024, Dark Brown, Dontlook, Scowl, Whereisgiraffe, Trench, 
9025, Brown, Notfunny, Meh, Devil, Hipsterneck, 
9026, Black, Bed, Dangerous Smoke 3, , Fashion Accesory, 
9027, Dark Brown, Money, Say Aah, Whalehunter 2, Sweet Jacket, 
9028, Void, Dontsee, Whatever, Trendy 1, , Gold 1
9029, Bad Machine, Snake, Moo, , Praetexta, Silver 1
9030, Light Brown, Pressure, Whatever, Trendy W 2, Wifeshirt 1, 
9031, Holo Rainbow, Round Glasses, Moo, Cook, Onthesea, Silver 1
9032, Light Brown, Nothappy Longer, Dangerous Smoke 2, Prison, Fashion Accesory, 
9033, Brown, Notfunny, Meh Dangerous Smoke 1, , Trash, 
9034, Dark Brown, Nothappy Longer, Scowl, Comrade, Ay Sailor, 
9035, Africa Animal, Notfunny, Moo, , Nowar, 
9036, Candy Cane, Devourer, Argh, Hat 1, Hirewomen, 
9037, Brown, Notfunny, Meh Blow Bubble, , Ymca, Stretched
9038, Candy Cane, Round Glasses, Say Aah, Trendy 1, Sweet Jacket, 
9039, Beige, See Stuff, Meh, Fetish, , 
9040, Black, Bed, Scowl, , Cuba, Gold 1
9041, Beige, Notfunny, Blow Bubble, Whalehunter 1, Honololu, 
9042, Light Brown, Money, Whatever, Hat 3, Weapon Belt, 
9043, Africa Animal, Love, Meh, Hat 2, Nofire, 
9044, Albino, Pirate, Whatever, Visor Hat, Cycle, 
9045, Woke From Dead, Money, What, Hippy Hat, Ay Sailor, 
9046, Light Brown, Notfunny, Meh, Jesus Alive, Cuba, Gold 2
9047, Neon Glow, Machine, Moo, Cat Ears, , Ear Cuff
9048, Beige, Multilevel, Meh, , Vegas Dancer, Silver 1
9049, Vector, Future, Whatever, Leprechaun, Rappers, 
9050, Candy Cane, Nothappy Longer, Dangerous Smoke 1, Trendy 1, Cuba, 
9051, Lady, Multilevel, Say Aah, , Ay Sailor, Gold 2
9052, Black, Pressure, Meh, , Robinson, 
9053, Brown, Snake, Whatever, , Blazer Black, 
9054, Bloodbath, Dontsee, Meh Dangerous Smoke 2, Comrade, , 
9055, Light Brown, Notfunny, Argh, , Cycle, 
9056, Black, Bed, Funny, Hiiya, , 
9057, Brown, Dontsee, Argh, Cook, Fashion Accesory, 
9058, Bloodbath, Nothappy, Moo, , , 
9059, Light Brown, Love, Meh, Fetish, Sweet Jacket, 
9060, Brown, Nothappy, Whatever, Prison, Ay Sailor, 
9061, Dark Brown, Bed, Scowl, , Lingerie, 
9062, Black, Notfunny, Whatever, Cat Ears, Robinson, 
9063, Beige, Dontsee, Meh, Whalehunter 1, Nofire, 
9064, Holo Rainbow, Machine, Yesplease, Warhat 1, , 
9065, Brown, Blocksun, Funny, Headset, Piercings, 
9066, Africa Animal, Dontsee, Dangerous Smoke 2, Small Child, Honololu, Gold 2
9067, Brown, Not Nice, Meh, , , 
9068, Color Dots, Dontsee, Dangerous Smoke 1, Jesus Alive, Costume Old, 
9069, Albino, Multilevel, Meh, Hiiya, Moon, 
9070, Beige, Notfunny, Meh Dangerous Smoke 2, , , Silver 1
9071, No Signal, Bed, Meh, Jesus Alive, , Ear Cuff
9072, Checkered, Dontsee, Nofeelingwell, , Alcatraz, Silver 1
9073, Vector, Undead, Moo, , Trash, 
9074, Woke From Dead, Reality, Meh, Notsmart, Onthesea, 
9075, Light Brown, Round Glasses, What, Service, Cool T-Shirt, 
9076, Grey, Nothappy Longer, Argh, , Robinson, 
9077, Dark Brown, Pew, Dangerous Smoke 2, , Vegas Dancer, 
9078, Black, Notfunny, No Teeth, , Ay Sailor, Silver 1
9079, No Signal, Dontsee, Meh Dangerous Smoke 2, Cat Ears, Cuba, Gold 1
9080, Albino, Multilevel, Meh, Jesus Alive, Overalls, Silver 2
9081, Machine, Round Glasses, Now, , Alcatraz, 
9082, Grey, Love, Rainbow, Prison, Overalls, 
9083, Nature, Notfunny, Whatever, Hiiya, Alcatraz, 
9084, Red, Round Glasses, Nofeelingwell, Headset, Cuba, 
9085, Easter Egg, Dontsee, Whatever, , , Silver 2
9086, Lady, Notfunny, Moo, Whereisgiraffe, , 
9087, Easter Egg, See Stuff, Whatever, Hat 2, Cycle, 
9088, Red, Notfunny, Meh, Rule All, Onthesea, Gold 1
9089, Neon Glow, Multilevel, Moo, Prison, , Multiple
9090, Gotsun, Machine, Whatever, , Fashion Accesory, Gold 1
9091, Beige, Love, Meh Dangerous Smoke 2, , Onthesea, 
9092, Acid, Pirate, Argh, Whalehunter 1, , 
9093, Africa Animal, Future, Now, Service, Make Fire, Ear Cuff
9094, Gotsun, Bed, Moo, Notsmart, Wifeshirt 2, 
9095, Vector, Love, Say Aah, Hat 3, Fashion Accesory, 
9096, Brown, Monocle, Whatever, Hat 1, , Gold 2
9097, Beige, Notfunny, Argh, Trendy W 1, Alcatraz, 
9098, Bloodbath, Bed, Meh, , , Stretched
9099, Checkered, Dead, Meh Knife, , Knight Armor, 
9100, Brown, Nothappy, Yesplease, Service, Moon, 
9101, Lady, Pressure, Dangerous Smoke 3, , Broken, 
9102, Dark Brown, Machine, Meh Dangerous Smoke 2, Hiiya, , 
9103, Brown, Notfunny, Meh, Devil, , 
9104, Dark Brown, Puppy Dog, Dangerous Smoke 2, Notsmart, Poncho, 
9105, Black, Pirate, Now, , Hippy, 
9106, Bloodbath, Dontsee, Dangerous Smoke 3, Devil, Moon, 
9107, Candy Cane, Blocksun, Argh, Cook, Hirewomen, 
9108, Brown, Nothappy Longer, Meh, Whalehunter 1, Honololu, 
9109, Black, Future, Say Aah, Trendy 1, Wifeshirt 2, 
9110, Lady, Nothappy, Whatever, Have Fun 2, , 
9111, Gotsun, Love, Meh, Hat 3, Rock, 
9112, Dark Brown, Undead, What, Jesus Alive, Blank, Silver 2
9113, Albino, See Stuff, Meh Dangerous Smoke 2, Comrade, Hipsterneck, 
9114, Brown, Bed, Whatever, Headset, Broken, 
9115, Dark Brown, Dontlook, Say Aah, Trick Hat, Honololu, 
9116, Grey, See Stuff, Whatever, Notsmart, Robinson, 
9117, Albino, Snake, Bling, Catch Robbers, Nofire, 
9118, Black, See Stuff, Whatever, Hiiya, Vest, 
9119, Dark Brown, Pirate, Higschool, Catch Robbers, Rock, 
9120, Light Brown, Monocle, Meh, Have Fun 1, Nowar, 
9121, Blue, Bed, Whatever, , Piercings, 
9122, Light Brown, Notfunny, Funny, , Nofire, 
9123, Blue, Love, Whatever, Hat 3, Wifeshirt 2, 
9124, Dark Brown, Multilevel, Dangerous Smoke 2, Headset, Knight Armor, 
9125, Black, Money, Whatever, , , 
9126, Africa Animal, See Stuff, Blow Bubble, , Bringcash, 
9127, Dark Brown, Dontsee, Yesplease, Hiiya, , Silver 2
9128, Light Brown, Bed, Scowl, Antique, Wifeshirt 1, 
9129, Machine, Multilevel, Now, Small Child, Onthesea, 
9130, Easter Egg, Pew, Higschool, Hiiya, , 
9131, Beige, Money, Say Aah, Hidehairs, Sweet 16, 
9132, Africa Animal, Round Glasses, Argh, Jesus Alive, Alcatraz, 
9133, Dark Brown, Notfunny, Gold Bling, Visor Hat, Blank, Silver 2
9134, Albino, Dontsee, Meh Dangerous Smoke 2, Whereisgiraffe, Overalls, 
9135, Bloodbath, Love, Meh, Punk Short, , 
9136, Grey, Notfunny, Whatever, Service, Wifeshirt 2, Ear Cuff
9137, Black, Dontsee, Now, , Praetexta, 
9138, Beige, Round Glasses, Whatever, Hat 1, Ay Sailor, 
9139, Dark Brown, Monocle, What, Leprechaun, , 
9140, Lady, Nothappy Longer, Gold Bling, Hiiya, , Gold 2
9141, Brown, Nothappy, Whatever, Trendy 1, Robinson, 
9142, Albino, Money, Yesplease, , Cycle, 
9143, Africa Animal, Dontsee, Whatever, Notsmart, Preshistoric, Multiple
9144, Brown, Snake, Meh, Prison, Hipsterneck, Gold 2
9145, Beige, Bed, Dangerous Smoke 2, Whereisgiraffe, Piercings, Ear Cuff
9146, Neon Glow, Nothappy Longer, Meh Dangerous Smoke 2, Whalehunter 1, Hippy, Multiple
9147, Beige, Multilevel, Whatever, Trendy W 2, Ay Sailor, Silver 1
9148, Holo Rainbow, Round Glasses, Meh, Warhat 2, Bringcash, 
9149, Black, Nothappy, Whatever, Comrade, Rappers, 
9150, Grey, See Stuff, Food, Trendy W 1, , Gold 2
9151, Beige, Money, Meh, Have Fun 2, Rock, 
9152, Brown, Notfunny, Argh, Whereiswhale, Vegas Dancer, 
9153, Beige, Blocksun, Blow Bubble, Hat 3, Nofire, 
9154, Dark Brown, Pressure, Whatever, Prison, Lingerie, Silver 1
9155, Beige, Notfunny, Meh Sounds, Manbun, Robinson, 
9156, Gotsun, Round Glasses, Dangerous Smoke 2, Warhat 1, Broken, 
9157, Africa Animal, Nothappy, Meh Dangerous Smoke 2, , Great T-Shirt, 
9158, Light Brown, Notfunny, Say Aah, Leprechaun, Nowar, 
9159, Beige, Undead, Dangerous Smoke 2, , Broken, 
9160, Black, Money, Food, , Overalls, 
9161, Neon Glow, Monocle, Whatever, Prison, Cuba, 
9162, Light Brown, Round Glasses, Meh, , Gentleman, Silver 1
9163, Brown, Dontsee, What, Comrade, Honololu, 
9164, Dark Brown, Nothappy Longer, Say Aah, , Multicolor, 
9165, Beige, Bed, Scowl, Whereisgiraffe, Gentleman, 
9166, Light Brown, Notfunny, Meh Dangerous Smoke 2, Trendy 1, Bringcash, 
9167, Color Dots, Pressure, Argh, Comrade, Rock, 
9168, Dark Brown, Pew, Meh, Notsmart, , 
9169, Grey, Notfunny, Whatever, Fetish, Wifeshirt 2, 
9170, Brown, Money, Meh Dangerous Smoke 3, Hippy Hat, Praetexta, Silver 2
9171, Color Dots, Love, Meh, Whereiswhale, Cycle, 
9172, Checkered, Notfunny, What, Warhat 1, Vest, 
9173, Neon Glow, Round Glasses, Dangerous Smoke 2, Side Shave, Praetexta, 
9174, Black, Undead, Moo, Antique, Onthesea, 
9175, Light Brown, Notfunny, Meh Sounds, Leprechaun, Honololu, 
9176, Red, Money, Whatever, Comrade, Shirt Of Flames, 
9177, Dark Brown, Bed, No Teeth, Hat 3, Preshistoric, Gold 2
9178, Light Brown, Nothappy, Moo, Warhat 1, Gentleman, 
9179, Holo Rainbow, See Stuff, Whatever, , Preshistoric, 
9180, Brown, Devourer, Yesplease, Mafia, Great T-Shirt, 
9181, Dark Brown, Notfunny, Argh, , Hipsterneck, 
9182, Black, Money, Meh, Catch Robbers, Preshistoric, 
9183, Gotsun, Pressure, What, Whereisgiraffe, Piercings, 
9184, Blue, See Stuff, Argh, Whereiswhale, Preshistoric, 
9185, Black, Pressure, Scowl, Fetish, Hipsterneck, 
9186, Nature, Future, Meh, Leprechaun, , 
9187, Light Brown, Dontlook, Moo, Cat Ears, , 
9188, Easter Egg, Notfunny, Dangerous Smoke 2, , Cuba, 
9189, Gotsun, Bed, Yesplease, Hat 2, Overalls, 
9190, Lady, Multilevel, Meh, Have Fun 1, Cycle, 
9191, Beige, Notfunny, Dangerous Smoke 2, Warhat 1, Overalls, 
9192, Bloodbath, Future, Meh, Whereisgiraffe, Blank, Gold 1
9193, Dark Brown, Pirate, Whatever, Jesus Alive, Chemist, 
9194, Gotsun, Nothappy, Now, Visor Hat, Honololu, Silver 1
9195, Dark Brown, Round Glasses, Meh Dangerous Smoke 2, Comrade, Nofire, Gold 2
9196, Lady, Nothappy Longer, Argh, Hat 2, Blank, 
9197, Brown, Bed, Say Aah, Hat 3, , 
9198, Machine, Notfunny, Dangerous Smoke 2, Comrade, Sweet Jacket, Gold 2
9199, Blue, Dontsee, Meh, , Praetexta, 
9200, Albino, Bed, Dangerous Smoke 2, Comrade, , Ear Cuff
9201, Dark Brown, Money, Sounds, Hiiya, Gentleman, 
9202, Africa Animal, Undead, Meh, Rabbit, , 
9203, Lady, Notfunny, Argh, Winter Hat, , 
9204, Holo Rainbow, Multilevel, Moo, Jesus Alive, Praetexta, 
9205, Acid, Notfunny, Rainbow, Service, Fashion Accesory, Gold 2
9206, Grey, See Stuff, Whatever, , Nowar, Gold 1
9207, Holo Rainbow, Dontlook, Dangerous Smoke 2, , Hoodie Red, Gold 2
9208, Brown, Pressure, Say Aah, Small Child, Multicolor, Gold 1
9209, Beige, Nothappy, What, Mafia, Gentleman, 
9210, Gotsun, Multilevel, Argh, Catch Robbers, Make Fire, 
9211, Vector, Notfunny, Whatever, Winter Hat, Ymca, 
9212, Bad Machine, Puppy Dog, Argh, Prison, , 
9213, Blue, Bed, Meh Dangerous Smoke 2, Warhat 2, Bringcash, 
9214, Dark Brown, Dontlook, Meh Higschool, , Great T-Shirt, 
9215, Beige, Reality, Meh, Fetish, Sweet Jacket, 
9216, Black, Round Glasses, Whatever, Hiiya, Poncho, 
9217, Dark Brown, Pirate, Meh Blow Bubble, Antique, Honololu, 
9218, Red, Puppy Dog, Whatever, Trendy 1, Preshistoric, Gold 1
9219, Neon Glow, Bed, Argh, Mafia, Praetexta, 
9220, Dark Brown, Dontsee, Meh, Trendy W 2, Rappers, 
9221, Red, Puppy Dog, Whatever, Whereiswhale, Robinson, 
9222, No Signal, Nothappy, Scowl, Manbun, , Silver 1
9223, Brown, Devourer, Funny, Catch Robbers, Preshistoric, 
9224, Black, Notfunny, Gold Bling, , Great T-Shirt, 
9225, Lady, Pressure, Say Aah, Hat 2, Not A Suit, 
9226, Light Brown, Notfunny, Dangerous Smoke 2, Hiiya, Wifeshirt 2, 
9227, Brown, Nothappy, Say Aah, Punk Short, Broken, 
9228, Albino, Dead, Meh, Catch Robbers, Ymca, 
9229, Lady, Puppy Dog, Moo, Hidehairs, , 
9230, Color Dots, Dontsee, Gold Bling, Trendy 1, Wifeshirt 1, Silver 2
9231, Dark Brown, Blocksun, Whatever, Trendy 2, Costume Old, 
9232, Bloodbath, Not Nice, Scowl, , , 
9233, Blue, Pressure, Meh, Prison, Iced Tee, 
9234, Brown, Blocksun, Whatever, Notsmart, Trash, Jesus
9235, Africa Animal, Notfunny, No Teeth, Trendy W 2, Make Fire, 
9236, Dark Brown, Multilevel, Meh, Trendy 1, Great T-Shirt, 
9237, Brown, Notfunny, Whatever, Whalehunter 1, Ay Sailor, 
9238, Nature, Dontlook, Moo, Warhat 2, Nowar, 
9239, Blue, Bed, Dangerous Smoke 1, Have Fun 1, Cool T-Shirt, 
9240, Easter Egg, Undead, What, , Blank, 
9241, Color Dots, Pirate, Say Aah, Whereiswhale, Not A Suit, 
9242, Lady, Multilevel, Funny, , , 
9243, Light Brown, Pressure, Dangerous Smoke 2, War Helmet, Costume Old, 
9244, Brown, Notfunny, Whatever, Winter Hat, Poncho, 
9245, Light Brown, Dontsee, Meh, Trendy 1, , 
9246, Dark Brown, Undead, Bling, Headset, Praetexta, 
9247, Light Brown, Notfunny, Meh, Whereisgiraffe, Ay Sailor, 
9248, Dark Brown, Pressure, Dangerous Smoke 2, , Bang Bang, 
9249, Beige, Devourer, Meh Blow Bubble, Small Child, Wifeshirt 1, 
9250, Red, Nothappy, Meh, Hat 2, Multicolor, 
9251, Neon Glow, Pressure, Whatever, Whalehunter 2, Vest, 
9252, Black, Round Glasses, Bling, , Lingerie, Gold 2
9253, Beige, Reality, What, Visor Hat, Poncho, Silver 1
9254, Candy Cane, Puppy Dog, Dangerous Smoke 3, Prison, , 
9255, Lady, Machine, Argh, Have Fun 1, Blank, Gold 2
9256, Dark Brown, Pressure, Whatever, Good Idea, Nofire, 
9257, Blue, Reality, What, Manbun, Broken, 
9258, Nature, Round Glasses, Funny, Winter Hat, Not A Suit, 
9259, Black, Notfunny, Whatever, Rabbit, Hipster Shirt, Silver 2
9260, Checkered, Bed, Blow Bubble, Trendy W 2, Overalls, 
9261, Grey, Multilevel, Argh, Warhat 1, Praetexta, 
9262, Brown, Dontlook, Say Aah, Trendy 1, Chemist, 
9263, Beige, Nothappy, Moo, , Vest, 
9264, Easter Egg, Dontsee, Hipster Stache, , Not A Suit, Gold 2
9265, Bad Machine, Nothappy, Meh Dangerous Smoke 2, Hat 3, Gentleman, Gold 1
9266, Brown, Pressure, Dangerous Smoke 2, , Lingerie, Gold 2
9267, Albino, Notfunny, Scowl, Mafia, Costume Old, Gold 1
9268, Checkered, Nothappy, What, Hiiya, Not A Suit, 
9269, Black, Snake, Meh Dangerous Smoke 3, Whereiswhale, Robinson, Silver 1
9270, Albino, Bed, Whatever, Hat 3, Make Fire, 
9271, Beige, Devourer, Meh, Prison, Ay Sailor, 
9272, Brown, Bed, Dangerous Smoke 3, Trendy W 2, Knight Armor, 
9273, Lady, Notfunny, What, Trendy 1, Wifeshirt 2, 
9274, Gotsun, Dontsee, Argh, Whereiswhale, Overalls, 
9275, Woke From Dead, Pirate, Meh, Devil, Vegas Dancer, 
9276, Grey, Dead, Nofeelingwell, Service, Piercings, Silver 1
9277, Albino, Notfunny, Moo, Catch Robbers, Cuba, 
9278, Brown, Dead, Dangerous Smoke 2, , Nofire, Silver 1
9279, Lady, Notfunny, Higschool, Whalehunter 1, Lingerie, 
9280, Brown, Nothappy Longer, Yesplease, , Wifeshirt 1, Gold 2
9281, Black, Monocle, Scowl, Hiiya, Sweet 16, 
9282, Easter Egg, Undead, Argh, , Make Fire, 
9283, Checkered, Nothappy Longer, Meh, Trendy 1, Hipsterneck, 
9284, Brown, Not Nice, What, , Onthesea, 
9285, Beige, Notfunny, Higschool, Hat 3, Overalls, Gold 2
9286, Blue, Multilevel, Meh, Warhat 1, Hipster Shirt, Silver 1
9287, Black, Love, Now, Hat 2, , Gold 2
9288, Lady, Puppy Dog, Yesplease, Fetish, , 
9289, Machine, Dontlook, Meh, , Alcatraz, 
9290, Light Brown, Multilevel, Moo, Hat 2, Not A Suit, 
9291, Bloodbath, Notfunny, Funny, Have Fun 2, , Gold 1
9292, Woke From Dead, Snake, Whatever, Hat 1, Wifeshirt 1, 
9293, Brown, Dontsee, What, Whereiswhale, Onthesea, 
9294, Africa Animal, Multilevel, Meh, , Weapon Belt, 
9295, Woke From Dead, Monocle, Whatever, Whalehunter 1, Piercings, 
9296, Beige, Notfunny, What, Trendy W 2, , Silver 2
9297, Dark Brown, Bed, Funny, , Iced Tee, 
9298, Woke From Dead, Dontsee, Rainbow, Prison, Broken, 
9299, Light Brown, Pressure, Nofeelingwell, Small Child, Ay Sailor, Silver 1
9300, Grey, Multilevel, Meh, Warhat 1, , 
9301, Albino, Dontsee, Argh, Headset, , 
9302, Beige, Round Glasses, Whatever, Rule All, , 
9303, Neon Glow, Notfunny, Funny, Rabbit, Praetexta, 
9304, Lady, Dontsee, Scowl, Whalehunter 2, Ay Sailor, Ear Cuff
9305, Easter Egg, Pressure, Meh, Whereisgiraffe, , Gold 2
9306, Black, Undead, Meh Dangerous Smoke 1, Comrade, Bang Bang, 
9307, Grey, Bed, Now, Service, Trench, 
9308, Candy Cane, Dontsee, Blow Bubble, Side Shave, , 
9309, Brown, Bed, Whatever, Whalehunter 1, Trench, Gold 1
9310, Bad Machine, Pirate, Meh, Hat 1, , 
9311, Light Brown, Dontsee, Whatever, War Helmet, Nowar, 
9312, Brown, Notfunny, Argh, Prison, Hipsterneck, Gold 1
9313, Grey, Undead, Bling, Whalehunter 1, , 
9314, Light Brown, Notfunny, Now, Whereisgiraffe, Nofire, 
9315, Dark Brown, Not Nice, Whatever, Cook, Lingerie, 
9316, Easter Egg, Nothappy Longer, What, Fetish, Chemist, 
9317, Beige, Undead, Whatever, Hat 3, Knight Armor, Jesus
9318, Dark Brown, Round Glasses, Moo, Rabbit, Praetexta, 
9319, Albino, Notfunny, Whatever, Cook, Cuba, Silver 1
9320, Light Brown, Money, What, , Wifeshirt 2, 
9321, Brown, Notfunny, Say Aah, Whereiswhale, Fishnet Top, 
9322, No Signal, Blocksun, Meh, Mafia, Knight Armor, Silver 2
9323, Albino, Monocle, What, Punk Short, Preshistoric, Gold 1
9324, Dark Brown, Round Glasses, Blow Bubble, Warhat 1, , 
9325, Beige, Nothappy Longer, No Teeth, Service, Trash, 
9326, Void, Multilevel, Whatever, Visor Hat, , 
9327, Neon Glow, Undead, Moo, Manbun, Preshistoric, 
9328, No Signal, Dontsee, Yesplease, Jesus Alive, , Silver 2
9329, Black, Reality, Dangerous Smoke 2, Rabbit, Great T-Shirt, 
9330, Dark Brown, Dontlook, What, , , Gold 1
9331, Nature, Round Glasses, Meh, War Helmet, Preshistoric, 
9332, Black, Notfunny, Dangerous Smoke 2, Hiiya, Onthesea, Gold 1
9333, Brown, Undead, Nofeelingwell, Trendy 1, Nofire, 
9334, Light Brown, Notfunny, Funny, Jesus Alive, Wifeshirt 1, Ear Cuff
9335, Dark Brown, Dontlook, Whatever, , Rock, 
9336, Brown, Notfunny, Scowl, Leprechaun, Hipsterneck, 
9337, Neon Glow, Pirate, Meh Dangerous Smoke 2, Comrade, Not A Suit, 
9338, Lady, Dead, Whatever, Trendy W 2, Bang Bang, Silver 2
9339, Beige, Devourer, Dangerous Smoke 2, Trendy 2, Sweet Jacket, 
9340, Dark Brown, Bed, Whatever, Whalehunter 2, Preshistoric, Silver 1
9341, Grey, Not Nice, Meh, Catch Robbers, Nofire, 
9342, Lady, Monocle, Whatever, Jesus Alive, Honololu, 
9343, Beige, Pressure, Meh, Hippy Hat, Blazer Black, 
9344, Blue, Love, Meh Dangerous Smoke 2, Fetish, Blank, 
9345, Dark Brown, Bed, Whatever, Manbun, , Ear Cuff
9346, Candy Cane, Notfunny, Dangerous Smoke 2, Hidehairs, Onthesea, 
9347, Dark Brown, Love, Whatever, Devil, Cuba, Gold 1
9348, Light Brown, Pirate, Dangerous Smoke 2, Hiiya, Robinson, 
9349, Red, Devourer, Whatever, Trendy W 2, Blank, 
9350, Grey, Lazer, Higschool, , Multicolor, 
9351, Beige, Notfunny, Dangerous Smoke 3, , , 
9352, Dark Brown, Future, Say Aah, Manbun, Honololu, 
9353, Red, Dead, Nofeelingwell, , Multicolor, 
9354, Machine, Pressure, Meh, , Onthesea, 
9355, Woke From Dead, Notfunny, Moo, Warhat 1, Broken, 
9356, Checkered, See Stuff, Yesplease, Cook, Alcatraz, 
9357, Brown, Devourer, Say Aah, Mafia, Overalls, 
9358, Africa Animal, Nothappy Longer, Whatever, Devil, , Gold 2
9359, Brown, Notfunny, Funny, Trendy 1, Blank, 
9360, Dark Brown, Bed, Meh Dangerous Smoke 2, Warhat 1, , 
9361, Machine, Notfunny, Dangerous Smoke 3, Comrade, Fashion Accesory, 
9362, Black, Nothappy, What, , Chemist, Ear Cuff
9363, Machine, See Stuff, Meh, Mafia, Piercings, 
9364, Albino, Round Glasses, Moo, Fetish, , 
9365, Brown, Bed, Say Aah, Small Child, Ymca, 
9366, Bloodbath, Machine, Meh Dangerous Smoke 1, Warhat 1, , 
9367, Lady, Notfunny, Argh, Whereisgiraffe, Honololu, 
9368, Bloodbath, Multilevel, What, , Nofire, Silver 1
9369, Red, Undead, Buck Teeth, , Vest, Stretched
9370, Machine, Nothappy Longer, Meh, Jesus Alive, Overalls, 
9371, Gotsun, Notfunny, Whatever, Warhat 2, Preshistoric, 
9372, Candy Cane, Puppy Dog, Funny, Whereisgiraffe, , 
9373, Red, Future, What, Prison, Ay Sailor, Gold 2
9374, Dark Brown, Bed, Say Aah, Mafia, Hipsterneck, 
9375, Grey, Notfunny, Meh Dangerous Smoke 2, , Fashion Accesory, 
9376, Holo Rainbow, Money, Whatever, , Sweet Jacket, 
9377, Beige, Machine, Moo, Rabbit, Overalls, 
9378, Africa Animal, See Stuff, Whatever, Trick Hat, Bringcash, 
9379, Dark Brown, Love, Moo, , Ymca, 
9380, Holo Rainbow, Nothappy Longer, Meh, , Weapon Belt, 
9381, Easter Egg, Money, Higschool, Small Child, Vest, Ear Cuff
9382, Color Dots, Bed, Yesplease, Whalehunter 2, Multicolor, Silver 2
9383, Dark Brown, Puppy Dog, Dangerous Smoke 2, Punk Short, Knight Armor, 
9384, Neon Glow, Dontlook, Say Aah, Leprechaun, Bringcash, 
9385, Grey, Bed, Meh, Whereiswhale, Honololu, 
9386, Bloodbath, Pressure, Meh Dangerous Smoke 2, , , 
9387, Brown, Devourer, Meh, War Helmet, Hippy, 
9388, Nature, Undead, Dangerous Smoke 1, Trendy 1, , 
9389, Beige, Pressure, Now, War Helmet, Bringcash, Ear Cuff
9390, Red, Dontsee, Meh, Whereiswhale, , 
9391, Beige, Bed, Argh, Rabbit, Sweet Jacket, 
9392, Brown, Lazer, Higschool, , Preshistoric, Silver 1
9393, Lady, Dontsee, Say Aah, Trendy 1, Cuba, Silver 2
9394, Bad Machine, Nothappy Longer, Blow Bubble, Hat 1, , 
9395, Black, Pirate, Meh Dangerous Smoke 1, Service, Ay Sailor, Ear Cuff
9396, Neon Glow, Bed, Meh, , Cuba, Gold 1
9397, Machine, Notfunny, Whatever, , Sweet 16, 
9398, Neon Glow, See Stuff, No Teeth, Hat 2, Chemist, 
9399, Dark Brown, Blocksun, Argh, Mafia, , Silver 1
9400, Candy Cane, Future, Dangerous Smoke 2, , , Gold 1
9401, Lady, Machine, Higschool, Comrade, Preshistoric, 
9402, Checkered, Puppy Dog, What, Mafia, Knight Armor, Silver 1
9403, Albino, Nothappy Longer, Now, , Cool T-Shirt, 
9404, Bloodbath, Puppy Dog, What, Visor Hat, , 
9405, Dark Brown, Round Glasses, Scowl, Whalehunter 1, Weapon Belt, Multiple
9406, Light Brown, Nothappy Longer, Whatever, Visor Hat, Honololu, 
9407, Machine, Machine, Moo, Jesus Alive, Bringcash, Jesus
9408, Holo Rainbow, Dead, Blow Bubble, Hat 2, Make Fire, 
9409, Color Dots, Reality, Sounds, Warhat 2, Nofire, 
9410, Dark Brown, Pressure, Whatever, Comrade, Broken, 
9411, Blue, Machine, Scowl, Prison, Fashion Accesory, 
9412, Holo Rainbow, Notfunny, Meh Blow Bubble, Antique, Hoodie Red, 
9413, Dark Brown, Undead, Nofeelingwell, Catch Robbers, Sweet 16, 
9414, Bloodbath, Pirate, Whatever, Comrade, , 
9415, Black, Machine, Dangerous Smoke 2, Fetish, Ay Sailor, 
9416, No Signal, Notfunny, Meh Dangerous Smoke 1, , , 
9417, Candy Cane, Devourer, Moo, Prison, , 
9418, Light Brown, Pirate, Meh Knife, Trendy W 2, Wifeshirt 1, Gold 2
9419, Lady, Undead, Meh, Warhat 2, Iced Tee, 
9420, Holo Rainbow, Nothappy, Argh, Small Child, Bringcash, 
9421, Dark Brown, Notfunny, Meh, Whalehunter 2, , 
9422, Light Brown, Round Glasses, Argh, Manbun, Ymca, 
9423, Easter Egg, See Stuff, Whatever, , Multicolor, 
9424, Africa Animal, Bed, Dangerous Smoke 1, Headset, Robinson, 
9425, Easter Egg, Notfunny, Whatever, Cook, Broken, Silver 1
9426, Beige, Snake, What, Whereiswhale, Shirt Of Flames, 
9427, Light Brown, Nothappy Longer, Whatever, Catch Robbers, Trash, 
9428, Brown, Pressure, No Teeth, Whalehunter 2, Onthesea, 
9429, Black, Bed, Meh, Prison, Bringcash, 
9430, Bloodbath, Reality, Rainbow, , Bang Bang, 
9431, Blue, Pressure, Meh, Prison, , 
9432, Black, Monocle, What, Trick Hat, Wifeshirt 2, Silver 2
9433, Dark Brown, Nothappy, Say Aah, Cook, Chemist, 
9434, Checkered, Multilevel, Meh, Hat 1, Broken, 
9435, Light Brown, Undead, Argh, Fetish, Hipster Shirt, 
9436, Neon Glow, Bed, Whatever, Notsmart, Piercings, Silver 2
9437, Brown, Blocksun, Meh, Whalehunter 1, Fishnet Top, 
9438, Neon Glow, Not Nice, Whatever, Visor Hat, Cool T-Shirt, Silver 1
9439, Black, Love, Argh, Comrade, Piercings, 
9440, Easter Egg, Devourer, Funny, Devil, Chemist, 
9441, Neon Glow, Bed, Dangerous Smoke 1, Whereiswhale, Alcatraz, Gold 2
9442, Red, See Stuff, Meh Dangerous Smoke 2, Notsmart, Trench, 
9443, Brown, Dead, Meh, Trendy W 2, Alcatraz, 
9444, Bloodbath, Pressure, Say Aah, Whalehunter 2, , Gold 2
9445, Africa Animal, Notfunny, Buck Teeth, Hat 3, Preshistoric, 
9446, Black, Multilevel, Dangerous Smoke 2, Trendy 1, Hippy, 
9447, Dark Brown, Money, No Teeth, , Sweet Jacket, 
9448, Brown, Multilevel, Meh, Whereiswhale, Wifeshirt 1, Jesus
9449, Light Brown, Nothappy, Buck Teeth, Headset, Honololu, 
9450, Black, Puppy Dog, Say Aah, Hat 2, Blank, 
9451, Brown, Bed, Meh Blow Bubble, Hat 3, Overalls, 
9452, Blue, Dontsee, Gold Bling, Notsmart, , Silver 1
9453, Stars And Stripes, Dontlook, Scowl, Winter Hat, , 
9454, Brown, Notfunny, Moo, Whalehunter 1, Hipsterneck, Silver 2
9455, Black, Puppy Dog, Meh, , Ymca, 
9456, Neon Glow, Love, Now, , Fishnet Top, 
9457, Gotsun, Nothappy, Whatever, , Ymca, 
9458, Brown, Monocle, Dangerous Smoke 2, Service, , Silver 2
9459, Easter Egg, Pressure, Whatever, Cook, Ay Sailor, 
9460, Dark Brown, Notfunny, Dangerous Smoke 2, , Hippy, 
9461, Machine, Money, Meh, , Overalls, 
9462, Blue, Dontsee, Moo, , Knight Armor, 
9463, Africa Animal, Multilevel, Say Aah, Hat 2, Cool T-Shirt, Gold 1
9464, Blue, Bed, Meh, Whereiswhale, , 
9465, Light Brown, Monocle, Moo, Mafia, Nowar, 
9466, Brown, Love, Dangerous Smoke 2, Service, Multicolor, 
9467, Gotsun, Notfunny, Bling, Rule All, Cuba, 
